,abstract,web_url,snippet,lead_paragraph,source,multimedia,keywords,pub_date,document_type,news_desk,section_name,subsection_name,type_of_material,_id,word_count,uri,headline_main,headline_kicker,headline_content_kicker,headline_print_headline,headline_name,headline_seo,headline_sub,byline_original,byline_person,byline_organization,print_section,print_page
0,"Junior Johnson, the former moonshiner turned hard-charging race car driver who won 50 NASCAR races before becoming a team owner, has died at the age of 88, NASCAR said on Friday.",https://www.nytimes.com/reuters/2019/12/20/sports/autoracing/20reuters-people-junior-johnson.html,"Junior Johnson, the former moonshiner turned hard-charging race car driver who won 50 NASCAR races before becoming a team owner, has died at the age of 88, NASCAR said on Friday.","LOS ANGELES — Junior Johnson, the former moonshiner turned hard-charging race car driver who won 50 NASCAR races before becoming a team owner, has died at the age of 88, NASCAR said on Friday.",Reuters,[],[],2019-12-21T00:48:57+0000,article,None,Sports,Auto Racing,News,nyt://article/0eba075c-5c5e-56b7-af18-7f1bd4398982,82,nyt://article/0eba075c-5c5e-56b7-af18-7f1bd4398982,"Nascar Hall-Of-Fame Driver, Team Owner Junior Johnson Dies at 88",,,"Nascar Hall-Of-Fame Driver, Team Owner Junior Johnson Dies at 88",,,,By Reuters,[],Reuters,,
1,"Earlier this week the United States Navy banned the social media app TikTok from government-issued mobile devices, saying the popular short video app represented a ""cybersecurity threat.""",https://www.nytimes.com/reuters/2019/12/20/world/asia/20reuters-usa-tiktok-navy.html,"Earlier this week the United States Navy banned the social media app TikTok from government-issued mobile devices, saying the popular short video app represented a ""cybersecurity threat.""","(Reuters) - Earlier this week the United States Navy banned the social media app TikTok from government-issued mobile devices, saying the popular short video app represented a ""cybersecurity threat.""",Reuters,[],[],2019-12-21T00:48:54+0000,article,None,World,Asia Pacific,News,nyt://article/ffcbdf2e-39d7-5aa6-9518-ddc73a4880e7,297,nyt://article/ffcbdf2e-39d7-5aa6-9518-ddc73a4880e7,U.S. Navy Bans TikTok From Government-Issued Mobile Devices,,,U.S. Navy Bans TikTok From Government-Issued Mobile Devices,,,,By Reuters,[],Reuters,,
2,"Armilla Yanti was returning from her regular Sunday trip to the market in this Indonesian city when a towering tsunami wave crashed ashore. She and her parents survived, but her two sisters were killed on that fateful day on Dec. 26, 2004.Fifteen years on, she frequently relives the traumatic events when recounting her story to visitors at the Aceh Tsunami Museum, where she works as a guide.",https://www.nytimes.com/reuters/2019/12/20/world/asia/20reuters-indianocean-tsunami-indonesia-tour-guide.html,"Armilla Yanti was returning from her regular Sunday trip to the market in this Indonesian city when a towering tsunami wave crashed ashore. She and her parents survived, but her two sisters were killed on that fateful day on Dec. 26, 2004.Fifteen ...","BANDA ACEH, Indonesia — Armilla Yanti was returning from her regular Sunday trip to the market in this Indonesian city when a towering tsunami wave crashed ashore. She and her parents survived, but her two sisters were killed on that fateful day on Dec. 26, 2004.Fifteen years on, she frequently relives the traumatic events when recounting her story to visitors at the Aceh Tsunami Museum, where she works as a guide.",Reuters,[],[],2019-12-21T00:42:54+0000,article,None,World,Asia Pacific,News,nyt://article/1b8277b4-b789-5e0e-96c0-859e5599424b,398,nyt://article/1b8277b4-b789-5e0e-96c0-859e5599424b,Aceh Tsunami Survivor Hopes Next Generation Will Learn Lessons,,,Aceh Tsunami Survivor Hopes Next Generation Will Learn Lessons,,,,By Reuters,[],Reuters,,
3,"Boeing Co's stunted Friday debut of its astronaut capsule threatens to dent the U.S. aerospace incumbent's self-declared competitive advantage of mission reliability against the price and innovation strengths of ""new space"" players like Elon Musk's SpaceX.",https://www.nytimes.com/reuters/2019/12/20/business/20reuters-space-exploration-boeing-reputation-analysis.html,"Boeing Co's stunted Friday debut of its astronaut capsule threatens to dent the U.S. aerospace incumbent's self-declared competitive advantage of mission reliability against the price and innovation strengths of ""new space"" players like Elon Musk'...","SEATTLE/CAPE CANAVERAL — Boeing Co's stunted Friday debut of its astronaut capsule threatens to dent the U.S. aerospace incumbent's self-declared competitive advantage of mission reliability against the price and innovation strengths of ""new space"" players like Elon Musk's SpaceX.",Reuters,[],[],2019-12-21T00:42:50+0000,article,None,Business Day,,News,nyt://article/e1e6fe4d-649b-5df8-a8a3-d41a283a6d0d,661,nyt://article/e1e6fe4d-649b-5df8-a8a3-d41a283a6d0d,Boeing's Failed Starliner Mission Strains 'Reliability' Pitch,,,Boeing's Failed Starliner Mission Strains 'Reliability' Pitch,,,,By Reuters,[],Reuters,,
