,abstract,web_url,snippet,lead_paragraph,source,multimedia,keywords,pub_date,document_type,news_desk,section_name,type_of_material,_id,word_count,uri,headline_main,headline_kicker,headline_content_kicker,headline_print_headline,headline_name,headline_seo,headline_sub,byline_original,byline_person,byline_organization,subsection_name,print_section,print_page
6,"As protests and arrests have become routine in the city, online groups have formed to document arrests and police action during protests and at other times.",https://www.nytimes.com/interactive/2019/12/22/world/asia/hong-kong-protests-arrests-telegram.html,"As protests and arrests have become routine in the city, online groups have formed to document arrests and police action during protests and at other times.","As protests and arrests have become routine in the city, online groups have formed to document arrests and police action during protests and at other times.",The New York Times,[],"[{'name': 'subject', 'value': 'Hong Kong Protests (2019)', 'rank': 1, 'major': 'N'}, {'name': 'subject', 'value': 'Video Recordings, Downloads and Streaming', 'rank': 2, 'major': 'N'}, {'name': 'subject', 'value': 'Police Brutality, Misconduct and Shootings', 'rank': 3, 'major': 'N'}, {'name': 'glocations', 'value': 'Hong Kong', 'rank': 4, 'major': 'N'}]",2019-12-23T00:07:30+0000,multimedia,World,World,Interactive Feature,nyt://interactive/2c5471ff-4a91-5b10-a184-93a395140149,0,nyt://interactive/2c5471ff-4a91-5b10-a184-93a395140149,"In Hong Kong, a Vast Citizens’ Network Keeps Watch on the Police",,,,,,,By K.K. Rebecca Lai,"[{'firstname': 'K.', 'middlename': 'K.', 'lastname': 'Rebecca', 'qualifier': None, 'title': None, 'role': 'reported', 'organization': '', 'rank': 1}]",,Asia Pacific,,
7,"Quincy McKnight scored 25 points, made all nine of his free throw attempts and had four steals and Seton Hall erupted in the second half for a 75-55 win over Prairie View A&M on Sunday.",https://www.nytimes.com/aponline/2019/12/22/sports/ncaabasketball/bc-bkc-prairie-view-am-seton-hall.html,"Quincy McKnight scored 25 points, made all nine of his free throw attempts and had four steals and Seton Hall erupted in the second half for a 75-55 win over Prairie View A&M on Sunday.","SOUTH ORANGE, N.J. — Quincy McKnight scored 25 points, made all nine of his free throw attempts and had four steals and Seton Hall erupted in the second half for a 75-55 win over Prairie View A&M on Sunday.",AP,[],[],2019-12-23T00:06:26+0000,article,None,Sports,News,nyt://article/ac6cc9ee-5682-52b3-a46b-7feee6d3fcc3,145,nyt://article/ac6cc9ee-5682-52b3-a46b-7feee6d3fcc3,"Seton Hall Turns It Around, Downs Prairie View A&M by 20 PTs",,,"Seton Hall Turns It Around, Downs Prairie View A&M by 20 PTs",,,,By The Associated Press,[],The Associated Press,College Basketball,,
8,"Cle'von Greene came off the bench to score 19 points, hitting a career-high four 3-pointers, lifting Radford to a 73-58 upset win over Richmond in the D.C. Holiday Hoopfest on Sunday.",https://www.nytimes.com/aponline/2019/12/22/sports/ncaabasketball/bc-bkc-radford-richmond.html,"Cle'von Greene came off the bench to score 19 points, hitting a career-high four 3-pointers, lifting Radford to a 73-58 upset win over Richmond in the D.C. Holiday Hoopfest on Sunday.","WASHINGTON — Cle'von Greene came off the bench to score 19 points, hitting a career-high four 3-pointers, lifting Radford to a 73-58 upset win over Richmond in the D.C. Holiday Hoopfest on Sunday.",AP,[],[],2019-12-23T00:03:36+0000,article,None,Sports,News,nyt://article/49352c8e-96f2-51a8-9e34-132fc82c6739,179,nyt://article/49352c8e-96f2-51a8-9e34-132fc82c6739,"Greene Scores 19 Off Bench, Radford Topples Richmond 73-58",,,"Greene Scores 19 Off Bench, Radford Topples Richmond 73-58",,,,By The Associated Press,[],The Associated Press,College Basketball,,
9,"Members of Congress should not be allowed to buy and sell stocks, or to serve on corporate boards.",https://www.nytimes.com/2019/12/22/opinion/congress-insider-trading.html,"Members of Congress should not be allowed to buy and sell stocks, or to serve on corporate boards.","The case of Chris Collins, the New York Republican who resigned from Congress and pleaded guilty to insider trading earlier this fall, was a rare victory in the long-running battle to ensure that members of Congress do not take improper advantage of their privileged positions.",The New York Times,"[{'rank': 0, 'subtype': 'xlarge', 'caption': None, 'credit': None, 'type': 'image', 'url': 'images/2019/12/10/opinion/10insidertrading/10insidertrading-articleLarge.jpg', 'height': 600, 'width': 600, 'legacy': {'xlarge': 'images/2019/12/10/opinion/10insidertrading/10insidertrading-articleLarge.jpg', 'xlargewidth': 600, 'xlargeheight': 600}, 'subType': 'xlarge', 'crop_name': 'articleLarge'}, {'rank': 0, 'subtype': 'popup', 'caption': None, 'credit': None, 'type': 'image', 'url': 'images/2019/12/10/opinion/10insidertrading/10insidertrading-popup.jpg', 'height': 500, 'width': 500, 'legacy': {}, 'subType': 'popup', 'crop_name': 'popup'}, {'rank': 0, 'subtype': 'blog480', 'caption': None, 'credit': None, 'type': 'image', 'url': 'images/2019/12/10/opinion/10insidertrading/10insidertrading-blog480.jpg', 'height': 480, 'width': 480, 'legacy': {}, 'subType': 'blog480', 'crop_name': 'blog480'}, {'rank': 0, 'subtype': 'blog533', 'caption': None, 'credit': None, 'type': 'image', 'url': 'images/2019/12/10/opinion/10insidertrading/10insidertrading-blog533.jpg', 'height': 533, 'width': 533, 'legacy': {}, 'subType': 'blog533', 'crop_name': 'blog533'}, {'rank': 0, 'subtype': 'blog427', 'caption': None, 'credit': None, 'type': 'image', 'url': 'images/2019/12/10/opinion/10insidertrading/10insidertrading-blog427.jpg', 'height': 427, 'width': 427, 'legacy': {}, 'subType': 'blog427', 'crop_name': 'blog427'}, {'rank': 0, 'subtype': 'tmagSF', 'caption': None, 'credit': None, 'type': 'image', 'url': 'images/2019/12/10/opinion/10insidertrading/10insidertrading-tmagSF.jpg', 'height': 362, 'width': 362, 'legacy': {}, 'subType': 'tmagSF', 'crop_name': 'tmagSF'}, {'rank': 0, 'subtype': 'tmagArticle', 'caption': None, 'credit': None, 'type': 'image', 'url': 'images/2019/12/10/opinion/10insidertrading/10insidertrading-tmagArticle.jpg', 'height': 592, 'width': 592, 'legacy': {}, 'subType': 'tmagArticle', 'crop_name': 'tmagArticle'}, {'rank': 0, 'subtype': 'slide', 'caption': None, 'credit': None, 'type': 'image', 'url': 'images/2019/12/10/opinion/10insidertrading/10insidertrading-slide.jpg', 'height': 500, 'width': 500, 'legacy': {}, 'subType': 'slide', 'crop_name': 'slide'}, {'rank': 0, 'subtype': 'jumbo', 'caption': None, 'credit': None, 'type': 'image', 'url': 'images/2019/12/10/opinion/10insidertrading/10insidertrading-jumbo.jpg', 'height': 1024, 'width': 1024, 'legacy': {}, 'subType': 'jumbo', 'crop_name': 'jumbo'}, {'rank': 0, 'subtype': 'superJumbo', 'caption': None, 'credit': None, 'type': 'image', 'url': 'images/2019/12/10/opinion/10insidertrading/10insidertrading-superJumbo.jpg', 'height': 1948, 'width': 1948, 'legacy': {}, 'subType': 'superJumbo', 'crop_name': 'superJumbo'}, {'rank': 0, 'subtype': 'blog225', 'caption': None, 'credit': None, 'type': 'image', 'url': 'images/2019/12/10/opinion/10insidertrading/10insidertrading-blog225.jpg', 'height': 225, 'width': 225, 'legacy': {}, 'subType': 'blog225', 'crop_name': 'blog225'}, {'rank': 0, 'subtype': 'master1050', 'caption': None, 'credit': None, 'type': 'image', 'url': 'images/2019/12/10/opinion/10insidertrading/10insidertrading-master1050.jpg', 'height': 1050, 'width': 1050, 'legacy': {}, 'subType': 'master1050', 'crop_name': 'master1050'}, {'rank': 0, 'subtype': 'master675', 'caption': None, 'credit': None, 'type': 'image', 'url': 'images/2019/12/10/opinion/10insidertrading/10insidertrading-master675.jpg', 'height': 675, 'width': 675, 'legacy': {}, 'subType': 'master675', 'crop_name': 'master675'}, {'rank': 0, 'subtype': 'master495', 'caption': None, 'credit': None, 'type': 'image', 'url': 'images/2019/12/10/opinion/10insidertrading/10insidertrading-master495.jpg', 'height': 495, 'width': 495, 'legacy': {}, 'subType': 'master495', 'crop_name': 'master495'}, {'rank': 0, 'subtype': 'master180', 'caption': None, 'credit': None, 'type': 'image', 'url': 'images/2019/12/10/opinion/10insidertrading/10insidertrading-master180.jpg', 'height': 180, 'width': 180, 'legacy': {}, 'subType': 'master180', 'crop_name': 'master180'}, {'rank': 0, 'subtype': 'master315', 'caption': None, 'credit': None, 'type': 'image', 'url': 'images/2019/12/10/opinion/10insidertrading/10insidertrading-master315.jpg', 'height': 315, 'width': 315, 'legacy': {}, 'subType': 'master315', 'crop_name': 'master315'}, {'rank': 0, 'subtype': 'master768', 'caption': None, 'credit': None, 'type': 'image', 'url': 'images/2019/12/10/opinion/10insidertrading/10insidertrading-master768.jpg', 'height': 768, 'width': 768, 'legacy': {}, 'subType': 'master768', 'crop_name': 'master768'}, {'rank': 0, 'subtype': 'thumbnail', 'caption': None, 'credit': None, 'type': 'image', 'url': 'images/2019/12/10/opinion/10insidertrading/10insidertrading-thumbStandard.jpg', 'height': 75, 'width': 75, 'legacy': {'thumbnail': 'images/2019/12/10/opinion/10insidertrading/10insidertrading-thumbStandard.jpg', 'thumbnailwidth': 75, 'thumbnailheight': 75}, 'subType': 'thumbnail', 'crop_name': 'thumbStandard'}, {'rank': 0, 'subtype': 'blogSmallThumb', 'caption': None, 'credit': None, 'type': 'image', 'url': 'images/2019/12/10/opinion/10insidertrading/10insidertrading-blogSmallThumb.jpg', 'height': 50, 'width': 50, 'legacy': {}, 'subType': 'blogSmallThumb', 'crop_name': 'blogSmallThumb'}, {'rank': 0, 'subtype': 'thumbLarge', 'caption': None, 'credit': None, 'type': 'image', 'url': 'images/2019/12/10/opinion/10insidertrading/10insidertrading-thumbLarge.jpg', 'height': 150, 'width': 150, 'legacy': {}, 'subType': 'thumbLarge', 'crop_name': 'thumbLarge'}, {'rank': 0, 'subtype': 'smallSquare168', 'caption': None, 'credit': None, 'type': 'image', 'url': 'images/2019/12/10/opinion/10insidertrading/10insidertrading-smallSquare168.jpg', 'height': 168, 'width': 168, 'legacy': {}, 'subType': 'smallSquare168', 'crop_name': 'smallSquare168'}, {'rank': 0, 'subtype': 'smallSquare252', 'caption': None, 'credit': None, 'type': 'image', 'url': 'images/2019/12/10/opinion/10insidertrading/10insidertrading-smallSquare252.jpg', 'height': 252, 'width': 252, 'legacy': {}, 'subType': 'smallSquare252', 'crop_name': 'smallSquare252'}, {'rank': 0, 'subtype': 'square320', 'caption': None, 'credit': None, 'type': 'image', 'url': 'images/2019/12/10/opinion/10insidertrading/10insidertrading-square320.jpg', 'height': 320, 'width': 320, 'legacy': {}, 'subType': 'square320', 'crop_name': 'square320'}, {'rank': 0, 'subtype': 'moth', 'caption': None, 'credit': None, 'type': 'image', 'url': 'images/2019/12/10/opinion/10insidertrading/10insidertrading-moth.jpg', 'height': 151, 'width': 151, 'legacy': {}, 'subType': 'moth', 'crop_name': 'moth'}, {'rank': 0, 'subtype': 'filmstrip', 'caption': None, 'credit': None, 'type': 'image', 'url': 'images/2019/12/10/opinion/10insidertrading/10insidertrading-filmstrip.jpg', 'height': 190, 'width': 190, 'legacy': {}, 'subType': 'filmstrip', 'crop_name': 'filmstrip'}, {'rank': 0, 'subtype': 'square640', 'caption': None, 'credit': None, 'type': 'image', 'url': 'images/2019/12/10/opinion/10insidertrading/10insidertrading-square640.jpg', 'height': 640, 'width': 640, 'legacy': {}, 'subType': 'square640', 'crop_name': 'square640'}, {'rank': 0, 'subtype': 'mediumSquare149', 'caption': None, 'credit': None, 'type': 'image', 'url': 'images/2019/12/10/opinion/10insidertrading/10insidertrading-mediumSquare149.jpg', 'height': 149, 'width': 149, 'legacy': {}, 'subType': 'mediumSquare149', 'crop_name': 'mediumSquare149'}, {'rank': 0, 'subtype': 'sfSpan', 'caption': None, 'credit': None, 'type': 'image', 'url': 'images/2019/12/10/opinion/10insidertrading/10insidertrading-sfSpan.jpg', 'height': 263, 'width': 395, 'legacy': {}, 'subType': 'sfSpan', 'crop_name': 'sfSpan'}, {'rank': 0, 'subtype': 'largeHorizontal375', 'caption': None, 'credit': None, 'type': 'image', 'url': 'images/2019/12/10/opinion/10insidertrading/10insidertrading-largeHorizontal375.jpg', 'height': 250, 'width': 375, 'legacy': {}, 'subType': 'largeHorizontal375', 'crop_name': 'largeHorizontal375'}, {'rank': 0, 'subtype': 'largeHorizontalJumbo', 'caption': None, 'credit': None, 'type': 'image', 'url': 'images/2019/12/10/opinion/10insidertrading/10insidertrading-largeHorizontalJumbo.jpg', 'height': 683, 'width': 1024, 'legacy': {}, 'subType': 'largeHorizontalJumbo', 'crop_name': 'largeHorizontalJumbo'}, {'rank': 0, 'subtype': 'horizontalMediumAt2X', 'caption': None, 'credit': None, 'type': 'image', 'url': 'images/2019/12/10/opinion/10insidertrading/10insidertrading-horizontalMediumAt2X.jpg', 'height': 1299, 'width': 1948, 'legacy': {}, 'subType': 'horizontalMediumAt2X', 'crop_name': 'horizontalMediumAt2X'}, {'rank': 0, 'subtype': 'hpLarge', 'caption': None, 'credit': None, 'type': 'image', 'url': 'images/2019/12/10/opinion/10insidertrading/10insidertrading-hpLarge.jpg', 'height': 288, 'width': 511, 'legacy': {}, 'subType': 'hpLarge', 'crop_name': 'hpLarge'}, {'rank': 0, 'subtype': 'largeWidescreen573', 'caption': None, 'credit': None, 'type': 'image', 'url': 'images/2019/12/10/opinion/10insidertrading/10insidertrading-largeWidescreen573.jpg', 'height': 322, 'width': 573, 'legacy': {}, 'subType': 'largeWidescreen573', 'crop_name': 'largeWidescreen573'}, {'rank': 0, 'subtype': 'largeWidescreen1050', 'caption': None, 'credit': None, 'type': 'image', 'url': 'images/2019/12/10/opinion/10insidertrading/10insidertrading-largeWidescreen1050.jpg', 'height': 591, 'width': 1050, 'legacy': {}, 'subType': 'largeWidescreen1050', 'crop_name': 'largeWidescreen1050'}, {'rank': 0, 'subtype': 'wide', 'caption': None, 'credit': None, 'type': 'image', 'url': 'images/2019/12/10/opinion/10insidertrading/10insidertrading-thumbWide.jpg', 'height': 126, 'width': 190, 'legacy': {'widewidth': 190, 'wideheight': 126, 'wide': 'images/2019/12/10/opinion/10insidertrading/10insidertrading-thumbWide.jpg'}, 'subType': 'wide', 'crop_name': 'thumbWide'}, {'rank': 0, 'subtype': 'videoThumb', 'caption': None, 'credit': None, 'type': 'image', 'url': 'images/2019/12/10/opinion/10insidertrading/10insidertrading-videoThumb.jpg', 'height': 50, 'width': 75, 'legacy': {}, 'subType': 'videoThumb', 'crop_name': 'videoThumb'}, {'rank': 0, 'subtype': 'videoLarge', 'caption': None, 'credit': None, 'type': 'image', 'url': 'images/2019/12/10/opinion/10insidertrading/10insidertrading-videoLarge.jpg', 'height': 507, 'width': 768, 'legacy': {}, 'subType': 'videoLarge', 'crop_name': 'videoLarge'}, {'rank': 0, 'subtype': 'mediumThreeByTwo210', 'caption': None, 'credit': None, 'type': 'image', 'url': 'images/2019/12/10/opinion/10insidertrading/10insidertrading-mediumThreeByTwo210.jpg', 'height': 140, 'width': 210, 'legacy': {}, 'subType': 'mediumThreeByTwo210', 'crop_name': 'mediumThreeByTwo210'}, {'rank': 0, 'subtype': 'mediumThreeByTwo225', 'caption': None, 'credit': None, 'type': 'image', 'url': 'images/2019/12/10/opinion/10insidertrading/10insidertrading-mediumThreeByTwo225.jpg', 'height': 150, 'width': 225, 'legacy': {}, 'subType': 'mediumThreeByTwo225', 'crop_name': 'mediumThreeByTwo225'}, {'rank': 0, 'subtype': 'mediumThreeByTwo440', 'caption': None, 'credit': None, 'type': 'image', 'url': 'images/2019/12/10/opinion/10insidertrading/10insidertrading-mediumThreeByTwo440.jpg', 'height': 293, 'width': 440, 'legacy': {}, 'subType': 'mediumThreeByTwo440', 'crop_name': 'mediumThreeByTwo440'}, {'rank': 0, 'subtype': 'mediumThreeByTwo252', 'caption': None, 'credit': None, 'type': 'image', 'url': 'images/2019/12/10/opinion/10insidertrading/10insidertrading-mediumThreeByTwo252.jpg', 'height': 168, 'width': 252, 'legacy': {}, 'subType': 'mediumThreeByTwo252', 'crop_name': 'mediumThreeByTwo252'}, {'rank': 0, 'subtype': 'mediumThreeByTwo378', 'caption': None, 'credit': None, 'type': 'image', 'url': 'images/2019/12/10/opinion/10insidertrading/10insidertrading-mediumThreeByTwo378.jpg', 'height': 252, 'width': 378, 'legacy': {}, 'subType': 'mediumThreeByTwo378', 'crop_name': 'mediumThreeByTwo378'}, {'rank': 0, 'subtype': 'threeByTwoLargeAt2X', 'caption': None, 'credit': None, 'type': 'image', 'url': 'images/2019/12/10/opinion/10insidertrading/10insidertrading-threeByTwoLargeAt2X.jpg', 'height': 1299, 'width': 1948, 'legacy': {}, 'subType': 'threeByTwoLargeAt2X', 'crop_name': 'threeByTwoLargeAt2X'}, {'rank': 0, 'subtype': 'threeByTwoMediumAt2X', 'caption': None, 'credit': None, 'type': 'image', 'url': 'images/2019/12/10/opinion/10insidertrading/10insidertrading-threeByTwoMediumAt2X.jpg', 'height': 1000, 'width': 1500, 'legacy': {}, 'subType': 'threeByTwoMediumAt2X', 'crop_name': 'threeByTwoMediumAt2X'}, {'rank': 0, 'subtype': 'threeByTwoSmallAt2X', 'caption': None, 'credit': None, 'type': 'image', 'url': 'images/2019/12/10/opinion/10insidertrading/10insidertrading-threeByTwoSmallAt2X.jpg', 'height': 400, 'width': 600, 'legacy': {}, 'subType': 'threeByTwoSmallAt2X', 'crop_name': 'threeByTwoSmallAt2X'}, {'rank': 0, 'subtype': 'articleInline', 'caption': None, 'credit': None, 'type': 'image', 'url': 'images/2019/12/10/opinion/10insidertrading/10insidertrading-articleInline.jpg', 'height': 190, 'width': 190, 'legacy': {}, 'subType': 'articleInline', 'crop_name': 'articleInline'}, {'rank': 0, 'subtype': 'hpSmall', 'caption': None, 'credit': None, 'type': 'image', 'url': 'images/2019/12/10/opinion/10insidertrading/10insidertrading-hpSmall.jpg', 'height': 163, 'width': 163, 'legacy': {}, 'subType': 'hpSmall', 'crop_name': 'hpSmall'}, {'rank': 0, 'subtype': 'blogSmallInline', 'caption': None, 'credit': None, 'type': 'image', 'url': 'images/2019/12/10/opinion/10insidertrading/10insidertrading-blogSmallInline.jpg', 'height': 151, 'width': 151, 'legacy': {}, 'subType': 'blogSmallInline', 'crop_name': 'blogSmallInline'}, {'rank': 0, 'subtype': 'mediumFlexible177', 'caption': None, 'credit': None, 'type': 'image', 'url': 'images/2019/12/10/opinion/10insidertrading/10insidertrading-mediumFlexible177.jpg', 'height': 177, 'width': 177, 'legacy': {}, 'subType': 'mediumFlexible177', 'crop_name': 'mediumFlexible177'}, {'rank': 0, 'subtype': 'videoSmall', 'caption': None, 'credit': None, 'type': 'image', 'url': 'images/2019/12/10/opinion/10insidertrading/10insidertrading-videoSmall.jpg', 'height': 281, 'width': 500, 'legacy': {}, 'subType': 'videoSmall', 'crop_name': 'videoSmall'}, {'rank': 0, 'subtype': 'videoHpMedium', 'caption': None, 'credit': None, 'type': 'image', 'url': 'images/2019/12/10/opinion/10insidertrading/10insidertrading-videoHpMedium.jpg', 'height': 211, 'width': 375, 'legacy': {}, 'subType': 'videoHpMedium', 'crop_name': 'videoHpMedium'}, {'rank': 0, 'subtype': 'videoSixteenByNine600', 'caption': None, 'credit': None, 'type': 'image', 'url': 'images/2019/12/10/opinion/10insidertrading/10insidertrading-videoSixteenByNine600.jpg', 'height': 338, 'width': 600, 'legacy': {}, 'subType': 'videoSixteenByNine600', 'crop_name': 'videoSixteenByNine600'}, {'rank': 0, 'subtype': 'videoSixteenByNine540', 'caption': None, 'credit': None, 'type': 'image', 'url': 'images/2019/12/10/opinion/10insidertrading/10insidertrading-videoSixteenByNine540.jpg', 'height': 304, 'width': 540, 'legacy': {}, 'subType': 'videoSixteenByNine540', 'crop_name': 'videoSixteenByNine540'}, {'rank': 0, 'subtype': 'videoSixteenByNine495', 'caption': None, 'credit': None, 'type': 'image', 'url': 'images/2019/12/10/opinion/10insidertrading/10insidertrading-videoSixteenByNine495.jpg', 'height': 278, 'width': 495, 'legacy': {}, 'subType': 'videoSixteenByNine495', 'crop_name': 'videoSixteenByNine495'}, {'rank': 0, 'subtype': 'videoSixteenByNine390', 'caption': None, 'credit': None, 'type': 'image', 'url': 'images/2019/12/10/opinion/10insidertrading/10insidertrading-videoSixteenByNine390.jpg', 'height': 219, 'width': 390, 'legacy': {}, 'subType': 'videoSixteenByNine390', 'crop_name': 'videoSixteenByNine390'}, {'rank': 0, 'subtype': 'videoSixteenByNine1050', 'caption': None, 'credit': None, 'type': 'image', 'url': 'images/2019/12/10/opinion/10insidertrading/10insidertrading-videoSixteenByNine1050.jpg', 'height': 591, 'width': 1050, 'legacy': {}, 'subType': 'videoSixteenByNine1050', 'crop_name': 'videoSixteenByNine1050'}, {'rank': 0, 'subtype': 'videoSixteenByNine480', 'caption': None, 'credit': None, 'type': 'image', 'url': 'images/2019/12/10/opinion/10insidertrading/10insidertrading-videoSixteenByNine480.jpg', 'height': 270, 'width': 480, 'legacy': {}, 'subType': 'videoSixteenByNine480', 'crop_name': 'videoSixteenByNine480'}, {'rank': 0, 'subtype': 'videoSixteenByNine310', 'caption': None, 'credit': None, 'type': 'image', 'url': 'images/2019/12/10/opinion/10insidertrading/10insidertrading-videoSixteenByNine310.jpg', 'height': 174, 'width': 310, 'legacy': {}, 'subType': 'videoSixteenByNine310', 'crop_name': 'videoSixteenByNine310'}, {'rank': 0, 'subtype': 'videoSixteenByNine225', 'caption': None, 'credit': None, 'type': 'image', 'url': 'images/2019/12/10/opinion/10insidertrading/10insidertrading-videoSixteenByNine225.jpg', 'height': 126, 'width': 225, 'legacy': {}, 'subType': 'videoSixteenByNine225', 'crop_name': 'videoSixteenByNine225'}, {'rank': 0, 'subtype': 'videoSixteenByNine96', 'caption': None, 'credit': None, 'type': 'image', 'url': 'images/2019/12/10/opinion/10insidertrading/10insidertrading-videoSixteenByNine96.jpg', 'height': 54, 'width': 96, 'legacy': {}, 'subType': 'videoSixteenByNine96', 'crop_name': 'videoSixteenByNine96'}, {'rank': 0, 'subtype': 'videoSixteenByNine768', 'caption': None, 'credit': None, 'type': 'image', 'url': 'images/2019/12/10/opinion/10insidertrading/10insidertrading-videoSixteenByNine768.jpg', 'height': 432, 'width': 768, 'legacy': {}, 'subType': 'videoSixteenByNine768', 'crop_name': 'videoSixteenByNine768'}, {'rank': 0, 'subtype': 'videoSixteenByNine150', 'caption': None, 'credit': None, 'type': 'image', 'url': 'images/2019/12/10/opinion/10insidertrading/10insidertrading-videoSixteenByNine150.jpg', 'height': 84, 'width': 150, 'legacy': {}, 'subType': 'videoSixteenByNine150', 'crop_name': 'videoSixteenByNine150'}, {'rank': 0, 'subtype': 'videoSixteenByNineJumbo1600', 'caption': None, 'credit': None, 'type': 'image', 'url': 'images/2019/12/10/opinion/10insidertrading/10insidertrading-videoSixteenByNineJumbo1600.jpg', 'height': 900, 'width': 1600, 'legacy': {}, 'subType': 'videoSixteenByNineJumbo1600', 'crop_name': 'videoSixteenByNineJumbo1600'}, {'rank': 0, 'subtype': 'miniMoth', 'caption': None, 'credit': None, 'type': 'image', 'url': 'images/2019/12/10/opinion/10insidertrading/10insidertrading-miniMoth.jpg', 'height': 70, 'width': 151, 'legacy': {}, 'subType': 'miniMoth', 'crop_name': 'miniMoth'}, {'rank': 0, 'subtype': 'windowsTile336H', 'caption': None, 'credit': None, 'type': 'image', 'url': 'images/2019/12/10/opinion/10insidertrading/10insidertrading-windowsTile336H.jpg', 'height': 336, 'width': 694, 'legacy': {}, 'subType': 'windowsTile336H', 'crop_name': 'windowsTile336H'}, {'rank': 0, 'subtype': 'videoFifteenBySeven1305', 'caption': None, 'credit': None, 'type': 'image', 'url': 'images/2019/12/10/opinion/10insidertrading/10insidertrading-videoFifteenBySeven1305.jpg', 'height': 609, 'width': 1305, 'legacy': {}, 'subType': 'videoFifteenBySeven1305', 'crop_name': 'videoFifteenBySeven1305'}, {'rank': 0, 'subtype': 'facebookJumbo', 'caption': None, 'credit': None, 'type': 'image', 'url': 'images/2019/12/10/opinion/10insidertrading/10insidertrading-facebookJumbo.jpg', 'height': 550, 'width': 1050, 'legacy': {}, 'subType': 'facebookJumbo', 'crop_name': 'facebookJumbo'}, {'rank': 0, 'subtype': 'watch308', 'caption': None, 'credit': None, 'type': 'image', 'url': 'images/2019/12/10/opinion/10insidertrading/10insidertrading-watch308.jpg', 'height': 348, 'width': 312, 'legacy': {}, 'subType': 'watch308', 'crop_name': 'watch308'}, {'rank': 0, 'subtype': 'watch268', 'caption': None, 'credit': None, 'type': 'image', 'url': 'images/2019/12/10/opinion/10insidertrading/10insidertrading-watch268.jpg', 'height': 303, 'width': 272, 'legacy': {}, 'subType': 'watch268', 'crop_name': 'watch268'}, {'rank': 0, 'subtype': 'verticalTwoByThree735', 'caption': None, 'credit': None, 'type': 'image', 'url': 'images/2019/12/10/opinion/10insidertrading/10insidertrading-verticalTwoByThree735.jpg', 'height': 1102, 'width': 735, 'legacy': {}, 'subType': 'verticalTwoByThree735', 'crop_name': 'verticalTwoByThree735'}, {'rank': 0, 'subtype': 'mobileMasterAt3x', 'caption': None, 'credit': None, 'type': 'image', 'url': 'images/2019/12/10/opinion/10insidertrading/10insidertrading-mobileMasterAt3x.jpg', 'height': 1800, 'width': 1800, 'legacy': {}, 'subType': 'mobileMasterAt3x', 'crop_name': 'mobileMasterAt3x'}]","[{'name': 'subject', 'value': 'United States Politics and Government', 'rank': 1, 'major': 'N'}, {'name': 'subject', 'value': 'Insider Trading', 'rank': 2, 'major': 'N'}, {'name': 'organizations', 'value': 'House of Representatives', 'rank': 3, 'major': 'N'}, {'name': 'organizations', 'value': 'Senate', 'rank': 4, 'major': 'N'}, {'name': 'persons', 'value': 'Collins, Christopher C', 'rank': 5, 'major': 'N'}, {'name': 'persons', 'value': 'Brown, Sherrod', 'rank': 6, 'major': 'N'}, {'name': 'persons', 'value': 'Merkley, Jeffrey A (1956- )', 'rank': 7, 'major': 'N'}, {'name': 'persons', 'value': 'Inhofe, James M', 'rank': 8, 'major': 'N'}, {'name': 'subject', 'value': 'Law and Legislation', 'rank': 9, 'major': 'N'}]",2019-12-23T00:00:06+0000,article,Editorial,Opinion,Editorial,nyt://article/5c0ae8da-69c1-553f-b05f-69ab37c8b405,857,nyt://article/5c0ae8da-69c1-553f-b05f-69ab37c8b405,"Make Laws, Not Money",,,"Make Laws, Not Money",,,,By The Editorial Board,[],The Editorial Board,,A,22
