,abstract,web_url,snippet,lead_paragraph,source,multimedia,keywords,pub_date,document_type,news_desk,section_name,type_of_material,_id,word_count,uri,headline_main,headline_kicker,headline_content_kicker,headline_print_headline,headline_name,headline_seo,headline_sub,byline_original,byline_person,byline_organization,subsection_name,print_section,print_page
0,Toshiba Corp said on Monday it would extend the period of its tender offer for chip equipment unit NuFlare Technology Inc until Jan. 16.,https://www.nytimes.com/reuters/2019/12/22/technology/22reuters-toshiba-m-a-hoya.html,Toshiba Corp said on Monday it would extend the period of its tender offer for chip equipment unit NuFlare Technology Inc until Jan. 16.,TOKYO — Toshiba Corp said on Monday it would extend the period of its tender offer for chip equipment unit NuFlare Technology Inc until Jan. 16.,Reuters,[],[],2019-12-23T00:33:29+0000,article,None,Technology,News,nyt://article/37e2edf0-5f42-5ea7-a232-7b42d95af825,194,nyt://article/37e2edf0-5f42-5ea7-a232-7b42d95af825,Toshiba to Extend Tender Offer Period for NuFlare Until Jan. 16,,,Toshiba to Extend Tender Offer Period for NuFlare Until Jan. 16,,,,By Reuters,[],Reuters,,,
1,Derek Carr and the Oakland Raiders will go into the final week of the season still having a chance for the playoffs after Sunday's 24-17 victory over the Los Angeles Chargers snapped a four-game losing streak.,https://www.nytimes.com/aponline/2019/12/22/sports/football/bc-fbn-raiders-chargers.html,Derek Carr and the Oakland Raiders will go into the final week of the season still having a chance for the playoffs after Sunday's 24-17 victory over the Los Angeles Chargers snapped a four-game losing streak.,"CARSON, Calif. — Derek Carr and the Oakland Raiders will go into the final week of the season still having a chance for the playoffs after Sunday's 24-17 victory over the Los Angeles Chargers snapped a four-game losing streak.",AP,[],[],2019-12-23T00:27:28+0000,article,None,Sports,News,nyt://article/5a5ef7cd-7b2b-55dd-a9af-77fb56fdb1eb,885,nyt://article/5a5ef7cd-7b2b-55dd-a9af-77fb56fdb1eb,Raiders Keep Playoff Hopes Alive With Victory Over Chargers,,,Raiders Keep Playoff Hopes Alive With Victory Over Chargers,,,,By The Associated Press,[],The Associated Press,Pro Football,,
2,It’s easy to forget those left behind in a strong economy.,https://www.nytimes.com/2019/12/22/opinion/us-poverty.html,It’s easy to forget those left behind in a strong economy.,"In the weeks leading up to Christmas in 1975, my mother made a hard choice: Her marriage was dead and it was time to leave it.",The New York Times,"[{'rank': 0, 'subtype': 'xlarge', 'caption': None, 'credit': None, 'type': 'image', 'url': 'images/2019/12/22/opinion/22Blow/22Blow-articleLarge.jpg', 'height': 401, 'width': 600, 'legacy': {'xlarge': 'images/2019/12/22/opinion/22Blow/22Blow-articleLarge.jpg', 'xlargewidth': 600, 'xlargeheight': 401}, 'subType': 'xlarge', 'crop_name': 'articleLarge'}, {'rank': 0, 'subtype': 'popup', 'caption': None, 'credit': None, 'type': 'image', 'url': 'images/2019/12/22/opinion/22Blow/22Blow-popup.jpg', 'height': 434, 'width': 650, 'legacy': {}, 'subType': 'popup', 'crop_name': 'popup'}, {'rank': 0, 'subtype': 'blog480', 'caption': None, 'credit': None, 'type': 'image', 'url': 'images/2019/12/22/opinion/22Blow/22Blow-blog480.jpg', 'height': 320, 'width': 480, 'legacy': {}, 'subType': 'blog480', 'crop_name': 'blog480'}, {'rank': 0, 'subtype': 'blog533', 'caption': None, 'credit': None, 'type': 'image', 'url': 'images/2019/12/22/opinion/22Blow/22Blow-blog533.jpg', 'height': 356, 'width': 533, 'legacy': {}, 'subType': 'blog533', 'crop_name': 'blog533'}, {'rank': 0, 'subtype': 'blog427', 'caption': None, 'credit': None, 'type': 'image', 'url': 'images/2019/12/22/opinion/22Blow/22Blow-blog427.jpg', 'height': 285, 'width': 427, 'legacy': {}, 'subType': 'blog427', 'crop_name': 'blog427'}, {'rank': 0, 'subtype': 'tmagSF', 'caption': None, 'credit': None, 'type': 'image', 'url': 'images/2019/12/22/opinion/22Blow/22Blow-tmagSF.jpg', 'height': 242, 'width': 362, 'legacy': {}, 'subType': 'tmagSF', 'crop_name': 'tmagSF'}, {'rank': 0, 'subtype': 'tmagArticle', 'caption': None, 'credit': None, 'type': 'image', 'url': 'images/2019/12/22/opinion/22Blow/22Blow-tmagArticle.jpg', 'height': 395, 'width': 592, 'legacy': {}, 'subType': 'tmagArticle', 'crop_name': 'tmagArticle'}, {'rank': 0, 'subtype': 'slide', 'caption': None, 'credit': None, 'type': 'image', 'url': 'images/2019/12/22/opinion/22Blow/22Blow-slide.jpg', 'height': 401, 'width': 600, 'legacy': {}, 'subType': 'slide', 'crop_name': 'slide'}, {'rank': 0, 'subtype': 'jumbo', 'caption': None, 'credit': None, 'type': 'image', 'url': 'images/2019/12/22/opinion/22Blow/22Blow-jumbo.jpg', 'height': 684, 'width': 1024, 'legacy': {}, 'subType': 'jumbo', 'crop_name': 'jumbo'}, {'rank': 0, 'subtype': 'superJumbo', 'caption': None, 'credit': None, 'type': 'image', 'url': 'images/2019/12/22/opinion/22Blow/22Blow-superJumbo.jpg', 'height': 1367, 'width': 2048, 'legacy': {}, 'subType': 'superJumbo', 'crop_name': 'superJumbo'}, {'rank': 0, 'subtype': 'blog225', 'caption': None, 'credit': None, 'type': 'image', 'url': 'images/2019/12/22/opinion/22Blow/22Blow-blog225.jpg', 'height': 150, 'width': 225, 'legacy': {}, 'subType': 'blog225', 'crop_name': 'blog225'}, {'rank': 0, 'subtype': 'master1050', 'caption': None, 'credit': None, 'type': 'image', 'url': 'images/2019/12/22/opinion/22Blow/22Blow-master1050.jpg', 'height': 701, 'width': 1050, 'legacy': {}, 'subType': 'master1050', 'crop_name': 'master1050'}, {'rank': 0, 'subtype': 'master675', 'caption': None, 'credit': None, 'type': 'image', 'url': 'images/2019/12/22/opinion/22Blow/22Blow-master675.jpg', 'height': 451, 'width': 675, 'legacy': {}, 'subType': 'master675', 'crop_name': 'master675'}, {'rank': 0, 'subtype': 'master495', 'caption': None, 'credit': None, 'type': 'image', 'url': 'images/2019/12/22/opinion/22Blow/22Blow-master495.jpg', 'height': 330, 'width': 495, 'legacy': {}, 'subType': 'master495', 'crop_name': 'master495'}, {'rank': 0, 'subtype': 'master180', 'caption': None, 'credit': None, 'type': 'image', 'url': 'images/2019/12/22/opinion/22Blow/22Blow-master180.jpg', 'height': 120, 'width': 180, 'legacy': {}, 'subType': 'master180', 'crop_name': 'master180'}, {'rank': 0, 'subtype': 'master315', 'caption': None, 'credit': None, 'type': 'image', 'url': 'images/2019/12/22/opinion/22Blow/22Blow-master315.jpg', 'height': 210, 'width': 315, 'legacy': {}, 'subType': 'master315', 'crop_name': 'master315'}, {'rank': 0, 'subtype': 'master768', 'caption': None, 'credit': None, 'type': 'image', 'url': 'images/2019/12/22/opinion/22Blow/22Blow-master768.jpg', 'height': 513, 'width': 768, 'legacy': {}, 'subType': 'master768', 'crop_name': 'master768'}, {'rank': 0, 'subtype': 'thumbnail', 'caption': None, 'credit': None, 'type': 'image', 'url': 'images/2019/12/22/opinion/22Blow/22Blow-thumbStandard.jpg', 'height': 75, 'width': 75, 'legacy': {'thumbnail': 'images/2019/12/22/opinion/22Blow/22Blow-thumbStandard.jpg', 'thumbnailwidth': 75, 'thumbnailheight': 75}, 'subType': 'thumbnail', 'crop_name': 'thumbStandard'}, {'rank': 0, 'subtype': 'blogSmallThumb', 'caption': None, 'credit': None, 'type': 'image', 'url': 'images/2019/12/22/opinion/22Blow/22Blow-blogSmallThumb.jpg', 'height': 50, 'width': 50, 'legacy': {}, 'subType': 'blogSmallThumb', 'crop_name': 'blogSmallThumb'}, {'rank': 0, 'subtype': 'thumbLarge', 'caption': None, 'credit': None, 'type': 'image', 'url': 'images/2019/12/22/opinion/22Blow/22Blow-thumbLarge.jpg', 'height': 150, 'width': 150, 'legacy': {}, 'subType': 'thumbLarge', 'crop_name': 'thumbLarge'}, {'rank': 0, 'subtype': 'smallSquare168', 'caption': None, 'credit': None, 'type': 'image', 'url': 'images/2019/12/22/opinion/22Blow/22Blow-smallSquare168.jpg', 'height': 168, 'width': 168, 'legacy': {}, 'subType': 'smallSquare168', 'crop_name': 'smallSquare168'}, {'rank': 0, 'subtype': 'smallSquare252', 'caption': None, 'credit': None, 'type': 'image', 'url': 'images/2019/12/22/opinion/22Blow/22Blow-smallSquare252.jpg', 'height': 252, 'width': 252, 'legacy': {}, 'subType': 'smallSquare252', 'crop_name': 'smallSquare252'}, {'rank': 0, 'subtype': 'square320', 'caption': None, 'credit': None, 'type': 'image', 'url': 'images/2019/12/22/opinion/22Blow/22Blow-square320.jpg', 'height': 320, 'width': 320, 'legacy': {}, 'subType': 'square320', 'crop_name': 'square320'}, {'rank': 0, 'subtype': 'moth', 'caption': None, 'credit': None, 'type': 'image', 'url': 'images/2019/12/22/opinion/22Blow/22Blow-moth.jpg', 'height': 151, 'width': 151, 'legacy': {}, 'subType': 'moth', 'crop_name': 'moth'}, {'rank': 0, 'subtype': 'filmstrip', 'caption': None, 'credit': None, 'type': 'image', 'url': 'images/2019/12/22/opinion/22Blow/22Blow-filmstrip.jpg', 'height': 190, 'width': 190, 'legacy': {}, 'subType': 'filmstrip', 'crop_name': 'filmstrip'}, {'rank': 0, 'subtype': 'square640', 'caption': None, 'credit': None, 'type': 'image', 'url': 'images/2019/12/22/opinion/22Blow/22Blow-square640.jpg', 'height': 640, 'width': 640, 'legacy': {}, 'subType': 'square640', 'crop_name': 'square640'}, {'rank': 0, 'subtype': 'mediumSquare149', 'caption': None, 'credit': None, 'type': 'image', 'url': 'images/2019/12/22/opinion/22Blow/22Blow-mediumSquare149.jpg', 'height': 149, 'width': 149, 'legacy': {}, 'subType': 'mediumSquare149', 'crop_name': 'mediumSquare149'}, {'rank': 0, 'subtype': 'sfSpan', 'caption': None, 'credit': None, 'type': 'image', 'url': 'images/2019/12/22/opinion/22Blow/22Blow-sfSpan.jpg', 'height': 263, 'width': 395, 'legacy': {}, 'subType': 'sfSpan', 'crop_name': 'sfSpan'}, {'rank': 0, 'subtype': 'largeHorizontal375', 'caption': None, 'credit': None, 'type': 'image', 'url': 'images/2019/12/22/opinion/22Blow/22Blow-largeHorizontal375.jpg', 'height': 250, 'width': 375, 'legacy': {}, 'subType': 'largeHorizontal375', 'crop_name': 'largeHorizontal375'}, {'rank': 0, 'subtype': 'largeHorizontalJumbo', 'caption': None, 'credit': None, 'type': 'image', 'url': 'images/2019/12/22/opinion/22Blow/22Blow-largeHorizontalJumbo.jpg', 'height': 683, 'width': 1024, 'legacy': {}, 'subType': 'largeHorizontalJumbo', 'crop_name': 'largeHorizontalJumbo'}, {'rank': 0, 'subtype': 'horizontalMediumAt2X', 'caption': None, 'credit': None, 'type': 'image', 'url': 'images/2019/12/22/opinion/22Blow/22Blow-horizontalMediumAt2X.jpg', 'height': 4010, 'width': 6016, 'legacy': {}, 'subType': 'horizontalMediumAt2X', 'crop_name': 'horizontalMediumAt2X'}, {'rank': 0, 'subtype': 'hpLarge', 'caption': None, 'credit': None, 'type': 'image', 'url': 'images/2019/12/22/opinion/22Blow/22Blow-hpLarge.jpg', 'height': 287, 'width': 511, 'legacy': {}, 'subType': 'hpLarge', 'crop_name': 'hpLarge'}, {'rank': 0, 'subtype': 'largeWidescreen573', 'caption': None, 'credit': None, 'type': 'image', 'url': 'images/2019/12/22/opinion/22Blow/22Blow-largeWidescreen573.jpg', 'height': 322, 'width': 573, 'legacy': {}, 'subType': 'largeWidescreen573', 'crop_name': 'largeWidescreen573'}, {'rank': 0, 'subtype': 'largeWidescreen1050', 'caption': None, 'credit': None, 'type': 'image', 'url': 'images/2019/12/22/opinion/22Blow/22Blow-largeWidescreen1050.jpg', 'height': 591, 'width': 1050, 'legacy': {}, 'subType': 'largeWidescreen1050', 'crop_name': 'largeWidescreen1050'}, {'rank': 0, 'subtype': 'wide', 'caption': None, 'credit': None, 'type': 'image', 'url': 'images/2019/12/22/opinion/22Blow/22Blow-thumbWide.jpg', 'height': 126, 'width': 190, 'legacy': {'widewidth': 190, 'wideheight': 126, 'wide': 'images/2019/12/22/opinion/22Blow/22Blow-thumbWide.jpg'}, 'subType': 'wide', 'crop_name': 'thumbWide'}, {'rank': 0, 'subtype': 'videoThumb', 'caption': None, 'credit': None, 'type': 'image', 'url': 'images/2019/12/22/opinion/22Blow/22Blow-videoThumb.jpg', 'height': 50, 'width': 75, 'legacy': {}, 'subType': 'videoThumb', 'crop_name': 'videoThumb'}, {'rank': 0, 'subtype': 'videoLarge', 'caption': None, 'credit': None, 'type': 'image', 'url': 'images/2019/12/22/opinion/22Blow/22Blow-videoLarge.jpg', 'height': 507, 'width': 768, 'legacy': {}, 'subType': 'videoLarge', 'crop_name': 'videoLarge'}, {'rank': 0, 'subtype': 'mediumThreeByTwo210', 'caption': None, 'credit': None, 'type': 'image', 'url': 'images/2019/12/22/opinion/22Blow/22Blow-mediumThreeByTwo210.jpg', 'height': 140, 'width': 210, 'legacy': {}, 'subType': 'mediumThreeByTwo210', 'crop_name': 'mediumThreeByTwo210'}, {'rank': 0, 'subtype': 'mediumThreeByTwo225', 'caption': None, 'credit': None, 'type': 'image', 'url': 'images/2019/12/22/opinion/22Blow/22Blow-mediumThreeByTwo225.jpg', 'height': 150, 'width': 225, 'legacy': {}, 'subType': 'mediumThreeByTwo225', 'crop_name': 'mediumThreeByTwo225'}, {'rank': 0, 'subtype': 'mediumThreeByTwo440', 'caption': None, 'credit': None, 'type': 'image', 'url': 'images/2019/12/22/opinion/22Blow/22Blow-mediumThreeByTwo440.jpg', 'height': 293, 'width': 440, 'legacy': {}, 'subType': 'mediumThreeByTwo440', 'crop_name': 'mediumThreeByTwo440'}, {'rank': 0, 'subtype': 'mediumThreeByTwo252', 'caption': None, 'credit': None, 'type': 'image', 'url': 'images/2019/12/22/opinion/22Blow/22Blow-mediumThreeByTwo252.jpg', 'height': 168, 'width': 252, 'legacy': {}, 'subType': 'mediumThreeByTwo252', 'crop_name': 'mediumThreeByTwo252'}, {'rank': 0, 'subtype': 'mediumThreeByTwo378', 'caption': None, 'credit': None, 'type': 'image', 'url': 'images/2019/12/22/opinion/22Blow/22Blow-mediumThreeByTwo378.jpg', 'height': 252, 'width': 378, 'legacy': {}, 'subType': 'mediumThreeByTwo378', 'crop_name': 'mediumThreeByTwo378'}, {'rank': 0, 'subtype': 'threeByTwoLargeAt2X', 'caption': None, 'credit': None, 'type': 'image', 'url': 'images/2019/12/22/opinion/22Blow/22Blow-threeByTwoLargeAt2X.jpg', 'height': 4010, 'width': 6016, 'legacy': {}, 'subType': 'threeByTwoLargeAt2X', 'crop_name': 'threeByTwoLargeAt2X'}, {'rank': 0, 'subtype': 'threeByTwoMediumAt2X', 'caption': None, 'credit': None, 'type': 'image', 'url': 'images/2019/12/22/opinion/22Blow/22Blow-threeByTwoMediumAt2X.jpg', 'height': 1000, 'width': 1500, 'legacy': {}, 'subType': 'threeByTwoMediumAt2X', 'crop_name': 'threeByTwoMediumAt2X'}, {'rank': 0, 'subtype': 'threeByTwoSmallAt2X', 'caption': None, 'credit': None, 'type': 'image', 'url': 'images/2019/12/22/opinion/22Blow/22Blow-threeByTwoSmallAt2X.jpg', 'height': 400, 'width': 600, 'legacy': {}, 'subType': 'threeByTwoSmallAt2X', 'crop_name': 'threeByTwoSmallAt2X'}, {'rank': 0, 'subtype': 'articleInline', 'caption': None, 'credit': None, 'type': 'image', 'url': 'images/2019/12/22/opinion/22Blow/22Blow-articleInline.jpg', 'height': 127, 'width': 190, 'legacy': {}, 'subType': 'articleInline', 'crop_name': 'articleInline'}, {'rank': 0, 'subtype': 'hpSmall', 'caption': None, 'credit': None, 'type': 'image', 'url': 'images/2019/12/22/opinion/22Blow/22Blow-hpSmall.jpg', 'height': 109, 'width': 163, 'legacy': {}, 'subType': 'hpSmall', 'crop_name': 'hpSmall'}, {'rank': 0, 'subtype': 'blogSmallInline', 'caption': None, 'credit': None, 'type': 'image', 'url': 'images/2019/12/22/opinion/22Blow/22Blow-blogSmallInline.jpg', 'height': 101, 'width': 151, 'legacy': {}, 'subType': 'blogSmallInline', 'crop_name': 'blogSmallInline'}, {'rank': 0, 'subtype': 'mediumFlexible177', 'caption': None, 'credit': None, 'type': 'image', 'url': 'images/2019/12/22/opinion/22Blow/22Blow-mediumFlexible177.jpg', 'height': 118, 'width': 177, 'legacy': {}, 'subType': 'mediumFlexible177', 'crop_name': 'mediumFlexible177'}, {'rank': 0, 'subtype': 'videoSmall', 'caption': None, 'credit': None, 'type': 'image', 'url': 'images/2019/12/22/opinion/22Blow/22Blow-videoSmall.jpg', 'height': 281, 'width': 500, 'legacy': {}, 'subType': 'videoSmall', 'crop_name': 'videoSmall'}, {'rank': 0, 'subtype': 'videoHpMedium', 'caption': None, 'credit': None, 'type': 'image', 'url': 'images/2019/12/22/opinion/22Blow/22Blow-videoHpMedium.jpg', 'height': 211, 'width': 375, 'legacy': {}, 'subType': 'videoHpMedium', 'crop_name': 'videoHpMedium'}, {'rank': 0, 'subtype': 'videoSixteenByNine600', 'caption': None, 'credit': None, 'type': 'image', 'url': 'images/2019/12/22/opinion/22Blow/22Blow-videoSixteenByNine600.jpg', 'height': 338, 'width': 600, 'legacy': {}, 'subType': 'videoSixteenByNine600', 'crop_name': 'videoSixteenByNine600'}, {'rank': 0, 'subtype': 'videoSixteenByNine540', 'caption': None, 'credit': None, 'type': 'image', 'url': 'images/2019/12/22/opinion/22Blow/22Blow-videoSixteenByNine540.jpg', 'height': 304, 'width': 540, 'legacy': {}, 'subType': 'videoSixteenByNine540', 'crop_name': 'videoSixteenByNine540'}, {'rank': 0, 'subtype': 'videoSixteenByNine495', 'caption': None, 'credit': None, 'type': 'image', 'url': 'images/2019/12/22/opinion/22Blow/22Blow-videoSixteenByNine495.jpg', 'height': 278, 'width': 495, 'legacy': {}, 'subType': 'videoSixteenByNine495', 'crop_name': 'videoSixteenByNine495'}, {'rank': 0, 'subtype': 'videoSixteenByNine390', 'caption': None, 'credit': None, 'type': 'image', 'url': 'images/2019/12/22/opinion/22Blow/22Blow-videoSixteenByNine390.jpg', 'height': 219, 'width': 390, 'legacy': {}, 'subType': 'videoSixteenByNine390', 'crop_name': 'videoSixteenByNine390'}, {'rank': 0, 'subtype': 'videoSixteenByNine1050', 'caption': None, 'credit': None, 'type': 'image', 'url': 'images/2019/12/22/opinion/22Blow/22Blow-videoSixteenByNine1050.jpg', 'height': 591, 'width': 1050, 'legacy': {}, 'subType': 'videoSixteenByNine1050', 'crop_name': 'videoSixteenByNine1050'}, {'rank': 0, 'subtype': 'videoSixteenByNine480', 'caption': None, 'credit': None, 'type': 'image', 'url': 'images/2019/12/22/opinion/22Blow/22Blow-videoSixteenByNine480.jpg', 'height': 270, 'width': 480, 'legacy': {}, 'subType': 'videoSixteenByNine480', 'crop_name': 'videoSixteenByNine480'}, {'rank': 0, 'subtype': 'videoSixteenByNine310', 'caption': None, 'credit': None, 'type': 'image', 'url': 'images/2019/12/22/opinion/22Blow/22Blow-videoSixteenByNine310.jpg', 'height': 174, 'width': 310, 'legacy': {}, 'subType': 'videoSixteenByNine310', 'crop_name': 'videoSixteenByNine310'}, {'rank': 0, 'subtype': 'videoSixteenByNine225', 'caption': None, 'credit': None, 'type': 'image', 'url': 'images/2019/12/22/opinion/22Blow/22Blow-videoSixteenByNine225.jpg', 'height': 126, 'width': 225, 'legacy': {}, 'subType': 'videoSixteenByNine225', 'crop_name': 'videoSixteenByNine225'}, {'rank': 0, 'subtype': 'videoSixteenByNine96', 'caption': None, 'credit': None, 'type': 'image', 'url': 'images/2019/12/22/opinion/22Blow/22Blow-videoSixteenByNine96.jpg', 'height': 54, 'width': 96, 'legacy': {}, 'subType': 'videoSixteenByNine96', 'crop_name': 'videoSixteenByNine96'}, {'rank': 0, 'subtype': 'videoSixteenByNine3000', 'caption': None, 'credit': None, 'type': 'image', 'url': 'images/2019/12/22/opinion/22Blow/22Blow-videoSixteenByNine3000.jpg', 'height': 1688, 'width': 3000, 'legacy': {}, 'subType': 'videoSixteenByNine3000', 'crop_name': 'videoSixteenByNine3000'}, {'rank': 0, 'subtype': 'videoSixteenByNine768', 'caption': None, 'credit': None, 'type': 'image', 'url': 'images/2019/12/22/opinion/22Blow/22Blow-videoSixteenByNine768.jpg', 'height': 432, 'width': 768, 'legacy': {}, 'subType': 'videoSixteenByNine768', 'crop_name': 'videoSixteenByNine768'}, {'rank': 0, 'subtype': 'videoSixteenByNine150', 'caption': None, 'credit': None, 'type': 'image', 'url': 'images/2019/12/22/opinion/22Blow/22Blow-videoSixteenByNine150.jpg', 'height': 84, 'width': 150, 'legacy': {}, 'subType': 'videoSixteenByNine150', 'crop_name': 'videoSixteenByNine150'}, {'rank': 0, 'subtype': 'videoSixteenByNineJumbo1600', 'caption': None, 'credit': None, 'type': 'image', 'url': 'images/2019/12/22/opinion/22Blow/22Blow-videoSixteenByNineJumbo1600.jpg', 'height': 900, 'width': 1600, 'legacy': {}, 'subType': 'videoSixteenByNineJumbo1600', 'crop_name': 'videoSixteenByNineJumbo1600'}, {'rank': 0, 'subtype': 'miniMoth', 'caption': None, 'credit': None, 'type': 'image', 'url': 'images/2019/12/22/opinion/22Blow/22Blow-miniMoth.jpg', 'height': 70, 'width': 151, 'legacy': {}, 'subType': 'miniMoth', 'crop_name': 'miniMoth'}, {'rank': 0, 'subtype': 'windowsTile336H', 'caption': None, 'credit': None, 'type': 'image', 'url': 'images/2019/12/22/opinion/22Blow/22Blow-windowsTile336H.jpg', 'height': 336, 'width': 694, 'legacy': {}, 'subType': 'windowsTile336H', 'crop_name': 'windowsTile336H'}, {'rank': 0, 'subtype': 'videoFifteenBySeven1305', 'caption': None, 'credit': None, 'type': 'image', 'url': 'images/2019/12/22/opinion/22Blow/22Blow-videoFifteenBySeven1305.jpg', 'height': 609, 'width': 1305, 'legacy': {}, 'subType': 'videoFifteenBySeven1305', 'crop_name': 'videoFifteenBySeven1305'}, {'rank': 0, 'subtype': 'videoFifteenBySeven2610', 'caption': None, 'credit': None, 'type': 'image', 'url': 'images/2019/12/22/opinion/22Blow/22Blow-videoFifteenBySeven2610.jpg', 'height': 1218, 'width': 2610, 'legacy': {}, 'subType': 'videoFifteenBySeven2610', 'crop_name': 'videoFifteenBySeven2610'}, {'rank': 0, 'subtype': 'facebookJumbo', 'caption': None, 'credit': None, 'type': 'image', 'url': 'images/2019/12/22/opinion/22Blow/22Blow-facebookJumbo.jpg', 'height': 549, 'width': 1050, 'legacy': {}, 'subType': 'facebookJumbo', 'crop_name': 'facebookJumbo'}, {'rank': 0, 'subtype': 'watch308', 'caption': None, 'credit': None, 'type': 'image', 'url': 'images/2019/12/22/opinion/22Blow/22Blow-watch308.jpg', 'height': 348, 'width': 312, 'legacy': {}, 'subType': 'watch308', 'crop_name': 'watch308'}, {'rank': 0, 'subtype': 'watch268', 'caption': None, 'credit': None, 'type': 'image', 'url': 'images/2019/12/22/opinion/22Blow/22Blow-watch268.jpg', 'height': 303, 'width': 272, 'legacy': {}, 'subType': 'watch268', 'crop_name': 'watch268'}, {'rank': 0, 'subtype': 'verticalTwoByThree735', 'caption': None, 'credit': None, 'type': 'image', 'url': 'images/2019/12/22/opinion/22Blow/22Blow-verticalTwoByThree735.jpg', 'height': 1102, 'width': 735, 'legacy': {}, 'subType': 'verticalTwoByThree735', 'crop_name': 'verticalTwoByThree735'}, {'rank': 0, 'subtype': 'mobileMasterAt3x', 'caption': None, 'credit': None, 'type': 'image', 'url': 'images/2019/12/22/opinion/22Blow/22Blow-mobileMasterAt3x.jpg', 'height': 1202, 'width': 1800, 'legacy': {}, 'subType': 'mobileMasterAt3x', 'crop_name': 'mobileMasterAt3x'}]","[{'name': 'subject', 'value': 'Poverty', 'rank': 1, 'major': 'N'}, {'name': 'subject', 'value': 'Christmas', 'rank': 2, 'major': 'N'}, {'name': 'subject', 'value': 'United States Economy', 'rank': 3, 'major': 'N'}, {'name': 'glocations', 'value': 'United States', 'rank': 4, 'major': 'N'}, {'name': 'organizations', 'value': 'Census Bureau', 'rank': 5, 'major': 'N'}]",2019-12-23T00:24:27+0000,article,OpEd,Opinion,Op-Ed,nyt://article/47b2e37f-7d10-57f0-85a6-cf3c69bf6a02,818,nyt://article/47b2e37f-7d10-57f0-85a6-cf3c69bf6a02,Remembering the Poor on Christmas,,,Remembering The Poor On Christmas,,,,By Charles M. Blow,"[{'firstname': 'Charles', 'middlename': None, 'lastname': None, 'qualifier': None, 'title': None, 'role': 'reported', 'organization': '', 'rank': 1}]",,,A,23
3,Matt Freeman tossed in a career-high 21 points on 7-of-10 shooting and UC Santa Barbara rolled to a 68-50 victory over Merrimack on Sunday.,https://www.nytimes.com/aponline/2019/12/22/sports/ncaabasketball/bc-bkc-merrimack-uc-santa-barbara.html,Matt Freeman tossed in a career-high 21 points on 7-of-10 shooting and UC Santa Barbara rolled to a 68-50 victory over Merrimack on Sunday.,"SANTA BARBARA, Calif. — Matt Freeman tossed in a career-high 21 points on 7-of-10 shooting and UC Santa Barbara rolled to a 68-50 victory over Merrimack on Sunday.",AP,[],[],2019-12-23T00:21:30+0000,article,None,Sports,News,nyt://article/ab09a8ce-0939-5b7c-9ead-43695ea2b3b0,108,nyt://article/ab09a8ce-0939-5b7c-9ead-43695ea2b3b0,Freeman Propels UCSB Past Merrimack 68-50,,,Freeman Propels UCSB Past Merrimack 68-50,,,,By The Associated Press,[],The Associated Press,College Basketball,,
4,"Xavier coach Travis Steele likes to say his defense travels, and it certainly made the trip for Sunday’s finale of the Big East-Big 12 Battle.",https://www.nytimes.com/aponline/2019/12/22/sports/ncaabasketball/bc-bkc-xavier-tcu.html,"Xavier coach Travis Steele likes to say his defense travels, and it certainly made the trip for Sunday’s finale of the Big East-Big 12 Battle.","FORT WORTH, Texas — Xavier coach Travis Steele likes to say his defense travels, and it certainly made the trip for Sunday’s finale of the Big East-Big 12 Battle.",AP,[],[],2019-12-23T00:18:30+0000,article,None,Sports,News,nyt://article/9acf4c1c-837d-50fe-abb0-de64c4145d1a,549,nyt://article/9acf4c1c-837d-50fe-abb0-de64c4145d1a,'D' Leads Xavier Past TCU 67-59 in Big East-Big 12 Finale,,,'D' Leads Xavier Past TCU 67-59 in Big East-Big 12 Finale,,,,By The Associated Press,[],The Associated Press,College Basketball,,
5,"By his own critique, Drew Lock's celebratory shuffle dance was shaky at best. ",https://www.nytimes.com/aponline/2019/12/22/sports/football/bc-fbn-lions-broncos.html,"By his own critique, Drew Lock's celebratory shuffle dance was shaky at best. ","DENVER — By his own critique, Drew Lock's celebratory shuffle dance was shaky at best. ",AP,[],[],2019-12-23T00:18:28+0000,article,None,Sports,News,nyt://article/902ce7b2-862b-5cbd-831a-d977a4297953,824,nyt://article/902ce7b2-862b-5cbd-831a-d977a4297953,"Lock, Lindsay Lead Broncos to 27-17 Win Over Reeling Lions",,,"Lock, Lindsay Lead Broncos to 27-17 Win Over Reeling Lions",,,,By The Associated Press,[],The Associated Press,Pro Football,,
