,abstract,web_url,snippet,lead_paragraph,source,multimedia,keywords,pub_date,document_type,news_desk,section_name,subsection_name,type_of_material,_id,word_count,uri,headline_main,headline_kicker,headline_content_kicker,headline_print_headline,headline_name,headline_seo,headline_sub,byline_original,byline_person,byline_organization,print_section,print_page
0,"Abbas Ali spends most of his free time camped out in Tahrir Square — the epicenter of Iraq's anti-government protests — going home only at 3 a.m. to catch few hours of sleep, change his clothes and check on his family. He is determined to stay in the square until the end, whatever that may be.",https://www.nytimes.com/aponline/2019/12/17/world/middleeast/ap-ml-mideast-the-long-haul-1st-ld-writethru.html,"Abbas Ali spends most of his free time camped out in Tahrir Square — the epicenter of Iraq's anti-government protests — going home only at 3 a.m. to catch few hours of sleep, change his clothes and check on his family. He is determined to stay in ...","BAGHDAD — Abbas Ali spends most of his free time camped out in Tahrir Square — the epicenter of Iraq's anti-government protests — going home only at 3 a.m. to catch few hours of sleep, change his clothes and check on his family. He is determined to stay in the square until the end, whatever that may be.",AP,[],[],2019-12-17T05:48:29+0000,article,None,World,Middle East,News,nyt://article/8b896245-6b78-54e5-8f99-ce1c0a82bb92,1045,nyt://article/8b896245-6b78-54e5-8f99-ce1c0a82bb92,Protesters in Arab World's Newest Uprisings Face a Long Haul,,,Protesters in Arab World's Newest Uprisings Face a Long Haul,,,,By The Associated Press,[],The Associated Press,,
1,"A federal judge on Tuesday sentenced former Trump campaign official Rick Gates to 45 days in jail despite what she said was “extraordinary"" cooperation with special counsel Robert Mueller's Russia probe and other Justice Department investigations.",https://www.nytimes.com/aponline/2019/12/17/us/politics/ap-us-trump-russia-probe-gates-1st-ld-writethru.html,"A federal judge on Tuesday sentenced former Trump campaign official Rick Gates to 45 days in jail despite what she said was “extraordinary"" cooperation with special counsel Robert Mueller's Russia probe and other Justice Department investigations.","WASHINGTON — A federal judge on Tuesday sentenced former Trump campaign official Rick Gates to 45 days in jail despite what she said was “extraordinary"" cooperation with special counsel Robert Mueller's Russia probe and other Justice Department investigations.",AP,[],[],2019-12-17T05:45:41+0000,article,None,U.S.,Politics,News,nyt://article/a7c7b003-53e4-5c9a-82e5-7c6363f28f7d,788,nyt://article/a7c7b003-53e4-5c9a-82e5-7c6363f28f7d,Ex-Trump Campaign Official Rick Gates Gets 45 Days in Jail,,,Ex-Trump Campaign Official Rick Gates Gets 45 Days in Jail,,,,By The Associated Press,[],The Associated Press,,
2,"Fewer than 30 people were executed in the United States and under 50 new death sentences were imposed for the fifth straight year, part of a continuing decline in capital punishment that saw only a few states carry out executions, a new report issued Tuesday said.",https://www.nytimes.com/aponline/2019/12/17/us/politics/ap-us-death-penalty-1st-ld-writethru.html,"Fewer than 30 people were executed in the United States and under 50 new death sentences were imposed for the fifth straight year, part of a continuing decline in capital punishment that saw only a few states carry out executions, a new report iss...","WASHINGTON — Fewer than 30 people were executed in the United States and under 50 new death sentences were imposed for the fifth straight year, part of a continuing decline in capital punishment that saw only a few states carry out executions, a new report issued Tuesday said.",AP,[],[],2019-12-17T05:27:27+0000,article,None,U.S.,Politics,News,nyt://article/5ebf26a8-2240-579e-bc98-ff28ce15373d,693,nyt://article/5ebf26a8-2240-579e-bc98-ff28ce15373d,Report: 5th Straight Year With Under 30 Executions in US,,,Report: 5th Straight Year With Under 30 Executions in US,,,,By The Associated Press,[],The Associated Press,,
3,"A party-switching congressman drew praise Tuesday from President Donald Trump and condemnation from Democrats, underscoring how his political fate could hinge on how forcefully he is backed by the president whose impeachment he is refusing to support. ",https://www.nytimes.com/aponline/2019/12/17/us/politics/ap-us-trump-impeachment-party-switcher.html,"A party-switching congressman drew praise Tuesday from President Donald Trump and condemnation from Democrats, underscoring how his political fate could hinge on how forcefully he is backed by the president whose impeachment he is refusing to supp...","WASHINGTON — A party-switching congressman drew praise Tuesday from President Donald Trump and condemnation from Democrats, underscoring how his political fate could hinge on how forcefully he is backed by the president whose impeachment he is refusing to support. ",AP,[],[],2019-12-17T05:24:29+0000,article,None,U.S.,Politics,News,nyt://article/e5b04fef-2207-5800-a69f-02c207e894ed,1071,nyt://article/e5b04fef-2207-5800-a69f-02c207e894ed,"Party-Swapping Congressman Gets Trump Praise, Democratic Ire",,,"Party-Swapping Congressman Gets Trump Praise, Democratic Ire",,,,By The Associated Press,[],The Associated Press,,
4,"On the eve of almost-certain impeachment, President Donald Trump fired off a furious letter Tuesday to House Speaker Nancy Pelosi denouncing the ""vicious crusade” against him, while Democrats amassed the votes they needed and Republicans looked ahead, vowing to defend Trump at next month's Senate trial.",https://www.nytimes.com/aponline/2019/12/17/us/politics/ap-us-trump-impeachment.html,"On the eve of almost-certain impeachment, President Donald Trump fired off a furious letter Tuesday to House Speaker Nancy Pelosi denouncing the ""vicious crusade” against him, while Democrats amassed the votes they needed and Republicans looked ah...","WASHINGTON — On the eve of almost-certain impeachment, President Donald Trump fired off a furious letter Tuesday to House Speaker Nancy Pelosi denouncing the ""vicious crusade” against him, while Democrats amassed the votes they needed and Republicans looked ahead, vowing to defend Trump at next month's Senate trial.",AP,[],[],2019-12-17T05:21:31+0000,article,None,U.S.,Politics,News,nyt://article/64bf05a3-5198-5179-90f7-b1134ced96fa,1255,nyt://article/64bf05a3-5198-5179-90f7-b1134ced96fa,House Nears Impeachment as Trump Decries 'Vicious Crusade',,,House Nears Impeachment as Trump Decries 'Vicious Crusade',,,,By The Associated Press,[],The Associated Press,,
5,"The Democratic-controlled House voted Tuesday to pass a $1.4 trillion government spending package, handing President Donald Trump a victory on his U.S.-Mexico border fence while giving Democrats spending increases across a swath of domestic programs.",https://www.nytimes.com/aponline/2019/12/17/us/politics/ap-us-congress-budget-battle.html,"The Democratic-controlled House voted Tuesday to pass a $1.4 trillion government spending package, handing President Donald Trump a victory on his U.S.-Mexico border fence while giving Democrats spending increases across a swath of domestic progra...","WASHINGTON — The Democratic-controlled House voted Tuesday to pass a $1.4 trillion government spending package, handing President Donald Trump a victory on his U.S.-Mexico border fence while giving Democrats spending increases across a swath of domestic programs.",AP,[],[],2019-12-17T05:21:29+0000,article,None,U.S.,Politics,News,nyt://article/e8c567d0-e4d3-55a2-81dc-232e775e1811,1307,nyt://article/e8c567d0-e4d3-55a2-81dc-232e775e1811,House Passes $1.4T Government Spending Bill Amid Impeachment,,,House Passes $1.4T Government Spending Bill Amid Impeachment,,,,By The Associated Press,[],The Associated Press,,
6,"As Boeing prepares to shutter much of a huge factory near Seattle that builds the grounded 737 Max jet, the economic hit is reverberating across the United States in places such as Wichita, Kansas, Stamford, Connecticut, and Cincinnati.",https://www.nytimes.com/aponline/2019/12/17/business/ap-us-boeing-737-max-production.html,"As Boeing prepares to shutter much of a huge factory near Seattle that builds the grounded 737 Max jet, the economic hit is reverberating across the United States in places such as Wichita, Kansas, Stamford, Connecticut, and Cincinnati.","As Boeing prepares to shutter much of a huge factory near Seattle that builds the grounded 737 Max jet, the economic hit is reverberating across the United States in places such as Wichita, Kansas, Stamford, Connecticut, and Cincinnati.",AP,[],[],2019-12-17T05:03:38+0000,article,None,Business Day,,News,nyt://article/db9ebff3-89ec-5e37-96dd-1feaa76df708,932,nyt://article/db9ebff3-89ec-5e37-96dd-1feaa76df708,"Halting 737 Max Production Will Hit Suppliers, Airlines",,,"Halting 737 Max Production Will Hit Suppliers, Airlines",,,,By The Associated Press,[],The Associated Press,,
