,abstract,web_url,snippet,lead_paragraph,source,multimedia,keywords,pub_date,document_type,news_desk,section_name,type_of_material,_id,word_count,uri,headline_main,headline_kicker,headline_content_kicker,headline_print_headline,headline_name,headline_seo,headline_sub,byline_original,byline_person,byline_organization,subsection_name,print_section,print_page
0,The United States and Mexico moved quickly Monday to defuse a dispute over President Donald Trump’s revamped North American trade pact.,https://www.nytimes.com/aponline/2019/12/16/business/bc-us-us-mexico-trade.html,The United States and Mexico moved quickly Monday to defuse a dispute over President Donald Trump’s revamped North American trade pact.,WASHINGTON — The United States and Mexico moved quickly Monday to defuse a dispute over President Donald Trump’s revamped North American trade pact.,AP,[],[],2019-12-16T22:00:33+0000,article,None,Business Day,News,nyt://article/230b723c-2397-50ff-b9e4-fc7fd0bbfa89,528,nyt://article/230b723c-2397-50ff-b9e4-fc7fd0bbfa89,"US, Mexico Quickly Mend Rift Over North American Trade Deal",,,"US, Mexico Quickly Mend Rift Over North American Trade Deal",,,,By The Associated Press,[],The Associated Press,,,
1,"Democratic Representative Elissa Slotkin, co-author of a column that helped launch the impeachment inquiry of President Donald Trump, ended months of uncertainty on Monday by telling voters at a noisy town hall meeting that she will vote for impeachment.",https://www.nytimes.com/reuters/2019/12/16/world/europe/16reuters-usa-trump-impeachment-democrats.html,"Democratic Representative Elissa Slotkin, co-author of a column that helped launch the impeachment inquiry of President Donald Trump, ended months of uncertainty on Monday by telling voters at a noisy town hall meeting that she will vote for impea...","ROCHESTER, Mich. — Democratic Representative Elissa Slotkin, co-author of a column that helped launch the impeachment inquiry of President Donald Trump, ended months of uncertainty on Monday by telling voters at a noisy town hall meeting that she will vote for impeachment.",Reuters,[],[],2019-12-16T21:30:40+0000,article,None,World,News,nyt://article/9fbd6352-c8dd-58d7-9b30-384626cd7060,720,nyt://article/9fbd6352-c8dd-58d7-9b30-384626cd7060,"At Noisy Town Hall, a Vulnerable U.S. Democrat Says 'Yes' to Impeaching Trump",,,"At Noisy Town Hall, a Vulnerable U.S. Democrat Says 'Yes' to Impeaching Trump",,,,By Reuters,[],Reuters,Europe,,
