,abstract,web_url,snippet,lead_paragraph,source,multimedia,keywords,pub_date,document_type,news_desk,section_name,subsection_name,type_of_material,_id,word_count,uri,headline_main,headline_kicker,headline_content_kicker,headline_print_headline,headline_name,headline_seo,headline_sub,byline_original,byline_person,byline_organization,print_section,print_page
0,"President Donald Trump will sign an executive order on Wednesday targeting antisemitism on college campuses, the White House said.",https://www.nytimes.com/aponline/2019/12/10/us/politics/ap-us-trump-anti-semitism-1st-ld-writethru.html,"President Donald Trump will sign an executive order on Wednesday targeting antisemitism on college campuses, the White House said.","WASHINGTON — President Donald Trump will sign an executive order on Wednesday targeting antisemitism on college campuses, the White House said.",AP,[],[],2019-12-11T00:27:28+0000,article,None,U.S.,Politics,News,nyt://article/4b9b9ea2-2b11-5cdf-af4b-b8e5ddf9afa3,574,nyt://article/4b9b9ea2-2b11-5cdf-af4b-b8e5ddf9afa3,Trump to Sign Order Targeting Anti-Semitism at Colleges,,,Trump to Sign Order Targeting Anti-Semitism at Colleges,,,,By The Associated Press,[],The Associated Press,,
1," For the House progressives:  a pair of impeachment articles against President Donald Trump. For the vulnerable Democratic freshmen: charges that are narrowly focused on Ukraine. And for the whole House Democratic majority — and, however backhandedly, Trump himself: a sweeping new trade deal.",https://www.nytimes.com/aponline/2019/12/10/us/politics/ap-us-trump-impeachment-pelosi.html,"For the House progressives:  a pair of impeachment articles against President Donald Trump. For the vulnerable Democratic freshmen: charges that are narrowly focused on Ukraine. And for the whole House Democratic majority — and, however backhanded...","WASHINGTON — For the House progressives: a pair of impeachment articles against President Donald Trump. For the vulnerable Democratic freshmen: charges that are narrowly focused on Ukraine. And for the whole House Democratic majority — and, however backhandedly, Trump himself: a sweeping new trade deal.",AP,[],[],2019-12-11T00:03:36+0000,article,None,U.S.,Politics,News,nyt://article/f7dbbcc1-5b6c-577c-89b2-3439fd6edb75,800,nyt://article/f7dbbcc1-5b6c-577c-89b2-3439fd6edb75,Pelosi Offers Some Trade Policy With That Impeachment,,,Pelosi Offers Some Trade Policy With That Impeachment,,,,By The Associated Press,[],The Associated Press,,
