,abstract,web_url,snippet,lead_paragraph,source,multimedia,keywords,pub_date,document_type,news_desk,section_name,type_of_material,_id,word_count,uri,headline_main,headline_kicker,headline_content_kicker,headline_print_headline,headline_name,headline_seo,headline_sub,byline_original,byline_person,byline_organization,subsection_name,print_section,print_page
0,"Novartis AG has secured Medicaid coverage for a pricey new sickle cell disease therapy in two U.S. states just weeks after winning U.S. approval, following an early campaign to convince local officials of its value, according to a company executive and a Reuters review of public filings. ",https://www.nytimes.com/reuters/2019/12/20/business/20reuters-novartis-adakveo-medicaid-focus.html,"Novartis AG has secured Medicaid coverage for a pricey new sickle cell disease therapy in two U.S. states just weeks after winning U.S. approval, following an early campaign to convince local officials of its value, according to a company executiv...","(Reuters) - Novartis AG has secured Medicaid coverage for a pricey new sickle cell disease therapy in two U.S. states just weeks after winning U.S. approval, following an early campaign to convince local officials of its value, according to a company executive and a Reuters review of public filings. ",Reuters,[],[],2019-12-20T15:10:08+0000,article,None,Business Day,News,nyt://article/d651de7e-ed42-51c3-ad29-ef93b848f2ae,715,nyt://article/d651de7e-ed42-51c3-ad29-ef93b848f2ae,Novartis Wins Medicaid Approval for New Sickle Cell Drug in Key U.S. States,,,Novartis Wins Medicaid Approval for New Sickle Cell Drug in Key U.S. States,,,,By Reuters,[],Reuters,,,
1,"The Irish High Court will rule on Monday Dec. 23 on whether Ryanair can prevent its operations chief Peter Bellew from joining arch-rival easyJet until 2021, a court official said on Friday. ",https://www.nytimes.com/reuters/2019/12/20/business/20reuters-ryanair-court.html,"The Irish High Court will rule on Monday Dec. 23 on whether Ryanair can prevent its operations chief Peter Bellew from joining arch-rival easyJet until 2021, a court official said on Friday. ","DUBLIN — The Irish High Court will rule on Monday Dec. 23 on whether Ryanair can prevent its operations chief Peter Bellew from joining arch-rival easyJet until 2021, a court official said on Friday. ",Reuters,[],[],2019-12-20T15:10:06+0000,article,None,Business Day,News,nyt://article/a80b23c0-0205-5be8-9407-69af4f55734d,104,nyt://article/a80b23c0-0205-5be8-9407-69af4f55734d,Ruling on Ryanair Bid to Delay COO's easyJet Move Set for December 23,,,Ruling on Ryanair Bid to Delay COO's easyJet Move Set for December 23,,,,By Reuters,[],Reuters,,,
2,"Hungary's government has taken over six privately owned fertility clinics and boosted funding to make treatments accessible to many more couples in a bid to reverse a population decline, the government said.",https://www.nytimes.com/reuters/2019/12/20/world/europe/20reuters-hungary-orban-babies.html,"Hungary's government has taken over six privately owned fertility clinics and boosted funding to make treatments accessible to many more couples in a bid to reverse a population decline, the government said.","BUDAPEST — Hungary's government has taken over six privately owned fertility clinics and boosted funding to make treatments accessible to many more couples in a bid to reverse a population decline, the government said.",Reuters,[],[],2019-12-20T15:06:55+0000,article,None,World,News,nyt://article/01e4bb34-11d9-554f-a993-2a84531de65b,385,nyt://article/01e4bb34-11d9-554f-a993-2a84531de65b,Hungarian Government Takes Over Fertility Clinics to Boost Birth Rate,,,Hungarian Government Takes Over Fertility Clinics to Boost Birth Rate,,,,By Reuters,[],Reuters,Europe,,
3,"Americans increased their spending in November at the fastest pace in four months, and income growth rebounded to its strongest gain since August.",https://www.nytimes.com/aponline/2019/12/20/business/ap-us-consumer-spending.html,"Americans increased their spending in November at the fastest pace in four months, and income growth rebounded to its strongest gain since August.","WASHINGTON — Americans increased their spending in November at the fastest pace in four months, and income growth rebounded to its strongest gain since August.",AP,[],[],2019-12-20T15:06:36+0000,article,None,Business Day,News,nyt://article/9d3ffc77-c35e-53f7-95c5-9b9899017b00,291,nyt://article/9d3ffc77-c35e-53f7-95c5-9b9899017b00,"US Consumer Spending Up 0.4% in November, Best Since July",,,"US Consumer Spending Up 0.4% in November, Best Since July",,,,By The Associated Press,[],The Associated Press,,,
4,"Weeks after U.S. authorities brought a spying case against three Saudi nationals for digging up dissidents' personal data at Twitter, the company suspended tens of thousands of accounts that appear to be linked to one suspect's company.    ",https://www.nytimes.com/reuters/2019/12/20/technology/20reuters-twitter-saudi.html,"Weeks after U.S. authorities brought a spying case against three Saudi nationals for digging up dissidents' personal data at Twitter, the company suspended tens of thousands of accounts that appear to be linked to one suspect's company.    ","SAN FRANCISCO — Weeks after U.S. authorities brought a spying case against three Saudi nationals for digging up dissidents' personal data at Twitter, the company suspended tens of thousands of accounts that appear to be linked to one suspect's company. ",Reuters,[],[],2019-12-20T15:04:17+0000,article,None,Technology,News,nyt://article/a95a3fff-ff9b-53db-9e2d-d57a1e3b00cd,706,nyt://article/a95a3fff-ff9b-53db-9e2d-d57a1e3b00cd,Twitter Suspends Accounts Linked to Saudi Spying Case,,,Twitter Suspends Accounts Linked to Saudi Spying Case,,,,By Reuters,[],Reuters,,,
5,"Pakistani Islamist militant Hafiz Saeed, the alleged mastermind of deadly 2008 attacks in Mumbai, pleaded not guilty on Friday in a second case on charges of financing terrorism, a government prosecutor and a defense lawyer said.",https://www.nytimes.com/reuters/2019/12/20/world/asia/20reuters-pakistan-militant.html,"Pakistani Islamist militant Hafiz Saeed, the alleged mastermind of deadly 2008 attacks in Mumbai, pleaded not guilty on Friday in a second case on charges of financing terrorism, a government prosecutor and a defense lawyer said.","LAHORE, Pakistan — Pakistani Islamist militant Hafiz Saeed, the alleged mastermind of deadly 2008 attacks in Mumbai, pleaded not guilty on Friday in a second case on charges of financing terrorism, a government prosecutor and a defense lawyer said.",Reuters,[],[],2019-12-20T15:04:14+0000,article,None,World,News,nyt://article/af60e831-d0ef-5c9e-ba12-f2a3912f9539,280,nyt://article/af60e831-d0ef-5c9e-ba12-f2a3912f9539,Pakistani Islamist Leader Pleads Not Guilty on Terrorism Financing Charges,,,Pakistani Islamist Leader Pleads Not Guilty on Terrorism Financing Charges,,,,By Reuters,[],Reuters,Asia Pacific,,
6,"President Tayyip Erdogan said on Friday that Turkey will not stay silent over Russian-backed mercenaries supporting Khalifa Haftar in Libya, as Moscow voiced concerns over possible Turkish military deployment to Libya in support of Haftar's enemies.",https://www.nytimes.com/reuters/2019/12/20/world/europe/20reuters-libya-turkey-russia.html,"President Tayyip Erdogan said on Friday that Turkey will not stay silent over Russian-backed mercenaries supporting Khalifa Haftar in Libya, as Moscow voiced concerns over possible Turkish military deployment to Libya in support of Haftar's enemie...","MOSCOW/ANKARA — President Tayyip Erdogan said on Friday that Turkey will not stay silent over Russian-backed mercenaries supporting Khalifa Haftar in Libya, as Moscow voiced concerns over possible Turkish military deployment to Libya in support of Haftar's enemies.",Reuters,[],[],2019-12-20T15:04:13+0000,article,None,World,News,nyt://article/416e201a-365a-5628-9457-a1e7d4d4a8a0,386,nyt://article/416e201a-365a-5628-9457-a1e7d4d4a8a0,Erdogan Says Turkey Won't Be Silent Over Mercenaries in Libya,,,Erdogan Says Turkey Won't Be Silent Over Mercenaries in Libya,,,,By Reuters,[],Reuters,Europe,,
7,Lebanon's new prime minister designate Hassan Diab said in an interview with Deutsche Welle he will work on forming a government within six weeks to help pull the country out of a deepening economic and political crisis.,https://www.nytimes.com/reuters/2019/12/20/world/middleeast/20reuters-lebanon-protests-primeminster.html,Lebanon's new prime minister designate Hassan Diab said in an interview with Deutsche Welle he will work on forming a government within six weeks to help pull the country out of a deepening economic and political crisis.,BEIRUT — Lebanon's new prime minister designate Hassan Diab said in an interview with Deutsche Welle he will work on forming a government within six weeks to help pull the country out of a deepening economic and political crisis.,Reuters,[],[],2019-12-20T15:04:09+0000,article,None,World,News,nyt://article/d20c766a-49fa-57c5-9bff-8df222eb57f6,249,nyt://article/d20c766a-49fa-57c5-9bff-8df222eb57f6,Lebanon's New PM Aims to Form Government Within Six Weeks: Deutsche Welle Interview,,,Lebanon's New PM Aims to Form Government Within Six Weeks: Deutsche Welle Interview,,,,By Reuters,[],Reuters,Middle East,,
8,"Poland's lower house of parliament approved the latest reform of the judiciary on Friday, despite the European Commission calling it to hold off adopting a law which it says would imperil the rule of law.",https://www.nytimes.com/reuters/2019/12/20/world/europe/20reuters-poland-eu-judges.html,"Poland's lower house of parliament approved the latest reform of the judiciary on Friday, despite the European Commission calling it to hold off adopting a law which it says would imperil the rule of law.","WARSAW/BRUSSELS — Poland's lower house of parliament approved the latest reform of the judiciary on Friday, despite the European Commission calling it to hold off adopting a law which it says would imperil the rule of law.",Reuters,[],[],2019-12-20T15:04:02+0000,article,None,World,News,nyt://article/c6bc4125-da68-5b54-bf5d-53b86fab292d,364,nyt://article/c6bc4125-da68-5b54-bf5d-53b86fab292d,Poland Lower House Adopts Judiciary Reform Despite EU Concerns,,,Poland Lower House Adopts Judiciary Reform Despite EU Concerns,,,,By Reuters,[],Reuters,Europe,,
