,abstract,web_url,snippet,lead_paragraph,source,multimedia,keywords,pub_date,document_type,news_desk,section_name,subsection_name,type_of_material,_id,word_count,uri,headline_main,headline_kicker,headline_content_kicker,headline_print_headline,headline_name,headline_seo,headline_sub,byline_original,byline_person,byline_organization,print_section,print_page
4,"Turkey cannot handle a fresh wave of migrants from Syria, President Tayyip Erdogan said on Sunday, warning that European countries will feel the impact of such an influx if violence in Syria's northwest is not stopped.",https://www.nytimes.com/reuters/2019/12/22/world/europe/22reuters-syria-security-turkey-migrants.html,"Turkey cannot handle a fresh wave of migrants from Syria, President Tayyip Erdogan said on Sunday, warning that European countries will feel the impact of such an influx if violence in Syria's northwest is not stopped.","ANKARA — Turkey cannot handle a fresh wave of migrants from Syria, President Tayyip Erdogan said on Sunday, warning that European countries will feel the impact of such an influx if violence in Syria's northwest is not stopped.",Reuters,[],[],2019-12-22T09:15:31+0000,article,None,World,Europe,News,nyt://article/418cf76c-af9d-5f25-bb73-88c89fcfc235,534,nyt://article/418cf76c-af9d-5f25-bb73-88c89fcfc235,"Erdogan Says Turkey Cannot Handle New Migrant Wave From Syria, Warns Europe",,,"Erdogan Says Turkey Cannot Handle New Migrant Wave From Syria, Warns Europe",,,,By Reuters,[],Reuters,,
5,The lucky holders of ticket number 26590 struck it rich in Spain on Sunday when they won the top prize in the nation’s bumper Christmas lottery.,https://www.nytimes.com/aponline/2019/12/22/world/europe/ap-eu-spain-christmas-lottery.html,The lucky holders of ticket number 26590 struck it rich in Spain on Sunday when they won the top prize in the nation’s bumper Christmas lottery.,"BARCELONA, Spain — The lucky holders of ticket number 26590 struck it rich in Spain on Sunday when they won the top prize in the nation’s bumper Christmas lottery.",AP,[],[],2019-12-22T08:18:25+0000,article,None,World,Europe,News,nyt://article/00ff704f-3844-513b-8b70-b7aa1b0994a4,296,nyt://article/00ff704f-3844-513b-8b70-b7aa1b0994a4,Spain Dishes Out $2.43 Billion in Bumper Christmas Lottery,,,Spain Dishes Out $2.43 Billion in Bumper Christmas Lottery,,,,By The Associated Press,[],The Associated Press,,
6,"Murphy, who helped keep ‘S.N.L.’ alive in the ’80s, hosted for the first time in 35 years, with help from his old characters and a ton of special guests.",https://www.nytimes.com/2019/12/22/arts/television/eddie-murphy-saturday-night-live-lizzo.html,"Murphy, who helped keep ‘S.N.L.’ alive in the ’80s, hosted for the first time in 35 years, with help from his old characters and a ton of special guests.","It took 35 years, but Eddie Murphy came back to host “Saturday Night Live.”",The New York Times,"[{'rank': 0, 'subtype': 'xlarge', 'caption': None, 'credit': None, 'type': 'image', 'url': 'images/2019/12/22/arts/22snl/22snl-articleLarge-v2.png', 'height': 341, 'width': 600, 'legacy': {'xlarge': 'images/2019/12/22/arts/22snl/22snl-articleLarge-v2.png', 'xlargewidth': 600, 'xlargeheight': 341}, 'subType': 'xlarge', 'crop_name': 'articleLarge'}, {'rank': 0, 'subtype': 'popup', 'caption': None, 'credit': None, 'type': 'image', 'url': 'images/2019/12/22/arts/22snl/22snl-popup-v2.png', 'height': 370, 'width': 650, 'legacy': {}, 'subType': 'popup', 'crop_name': 'popup'}, {'rank': 0, 'subtype': 'blog480', 'caption': None, 'credit': None, 'type': 'image', 'url': 'images/2019/12/22/arts/22snl/22snl-blog480-v2.png', 'height': 273, 'width': 480, 'legacy': {}, 'subType': 'blog480', 'crop_name': 'blog480'}, {'rank': 0, 'subtype': 'blog533', 'caption': None, 'credit': None, 'type': 'image', 'url': 'images/2019/12/22/arts/22snl/22snl-blog533-v2.png', 'height': 303, 'width': 533, 'legacy': {}, 'subType': 'blog533', 'crop_name': 'blog533'}, {'rank': 0, 'subtype': 'blog427', 'caption': None, 'credit': None, 'type': 'image', 'url': 'images/2019/12/22/arts/22snl/22snl-blog427-v2.png', 'height': 243, 'width': 427, 'legacy': {}, 'subType': 'blog427', 'crop_name': 'blog427'}, {'rank': 0, 'subtype': 'tmagSF', 'caption': None, 'credit': None, 'type': 'image', 'url': 'images/2019/12/22/arts/22snl/22snl-tmagSF-v2.png', 'height': 206, 'width': 362, 'legacy': {}, 'subType': 'tmagSF', 'crop_name': 'tmagSF'}, {'rank': 0, 'subtype': 'tmagArticle', 'caption': None, 'credit': None, 'type': 'image', 'url': 'images/2019/12/22/arts/22snl/22snl-tmagArticle-v2.png', 'height': 337, 'width': 592, 'legacy': {}, 'subType': 'tmagArticle', 'crop_name': 'tmagArticle'}, {'rank': 0, 'subtype': 'slide', 'caption': None, 'credit': None, 'type': 'image', 'url': 'images/2019/12/22/arts/22snl/22snl-slide-v2.png', 'height': 341, 'width': 600, 'legacy': {}, 'subType': 'slide', 'crop_name': 'slide'}, {'rank': 0, 'subtype': 'jumbo', 'caption': None, 'credit': None, 'type': 'image', 'url': 'images/2019/12/22/arts/22snl/22snl-jumbo-v2.png', 'height': 582, 'width': 1024, 'legacy': {}, 'subType': 'jumbo', 'crop_name': 'jumbo'}, {'rank': 0, 'subtype': 'superJumbo', 'caption': None, 'credit': None, 'type': 'image', 'url': 'images/2019/12/22/arts/22snl/22snl-superJumbo-v2.png', 'height': 1165, 'width': 2048, 'legacy': {}, 'subType': 'superJumbo', 'crop_name': 'superJumbo'}, {'rank': 0, 'subtype': 'blog225', 'caption': None, 'credit': None, 'type': 'image', 'url': 'images/2019/12/22/arts/22snl/22snl-blog225-v2.png', 'height': 128, 'width': 225, 'legacy': {}, 'subType': 'blog225', 'crop_name': 'blog225'}, {'rank': 0, 'subtype': 'master1050', 'caption': None, 'credit': None, 'type': 'image', 'url': 'images/2019/12/22/arts/22snl/22snl-master1050-v2.png', 'height': 597, 'width': 1050, 'legacy': {}, 'subType': 'master1050', 'crop_name': 'master1050'}, {'rank': 0, 'subtype': 'master675', 'caption': None, 'credit': None, 'type': 'image', 'url': 'images/2019/12/22/arts/22snl/22snl-master675-v2.png', 'height': 384, 'width': 675, 'legacy': {}, 'subType': 'master675', 'crop_name': 'master675'}, {'rank': 0, 'subtype': 'master495', 'caption': None, 'credit': None, 'type': 'image', 'url': 'images/2019/12/22/arts/22snl/22snl-master495-v2.png', 'height': 282, 'width': 495, 'legacy': {}, 'subType': 'master495', 'crop_name': 'master495'}, {'rank': 0, 'subtype': 'master180', 'caption': None, 'credit': None, 'type': 'image', 'url': 'images/2019/12/22/arts/22snl/22snl-master180-v2.png', 'height': 102, 'width': 180, 'legacy': {}, 'subType': 'master180', 'crop_name': 'master180'}, {'rank': 0, 'subtype': 'master315', 'caption': None, 'credit': None, 'type': 'image', 'url': 'images/2019/12/22/arts/22snl/22snl-master315-v2.png', 'height': 179, 'width': 315, 'legacy': {}, 'subType': 'master315', 'crop_name': 'master315'}, {'rank': 0, 'subtype': 'master768', 'caption': None, 'credit': None, 'type': 'image', 'url': 'images/2019/12/22/arts/22snl/22snl-master768-v2.png', 'height': 437, 'width': 768, 'legacy': {}, 'subType': 'master768', 'crop_name': 'master768'}, {'rank': 0, 'subtype': 'thumbnail', 'caption': None, 'credit': None, 'type': 'image', 'url': 'images/2019/12/22/arts/22snl/22snl-thumbStandard-v2.png', 'height': 75, 'width': 75, 'legacy': {'thumbnail': 'images/2019/12/22/arts/22snl/22snl-thumbStandard-v2.png', 'thumbnailwidth': 75, 'thumbnailheight': 75}, 'subType': 'thumbnail', 'crop_name': 'thumbStandard'}, {'rank': 0, 'subtype': 'blogSmallThumb', 'caption': None, 'credit': None, 'type': 'image', 'url': 'images/2019/12/22/arts/22snl/22snl-blogSmallThumb-v2.png', 'height': 50, 'width': 50, 'legacy': {}, 'subType': 'blogSmallThumb', 'crop_name': 'blogSmallThumb'}, {'rank': 0, 'subtype': 'thumbLarge', 'caption': None, 'credit': None, 'type': 'image', 'url': 'images/2019/12/22/arts/22snl/22snl-thumbLarge-v2.png', 'height': 150, 'width': 150, 'legacy': {}, 'subType': 'thumbLarge', 'crop_name': 'thumbLarge'}, {'rank': 0, 'subtype': 'smallSquare168', 'caption': None, 'credit': None, 'type': 'image', 'url': 'images/2019/12/22/arts/22snl/22snl-smallSquare168-v2.png', 'height': 168, 'width': 168, 'legacy': {}, 'subType': 'smallSquare168', 'crop_name': 'smallSquare168'}, {'rank': 0, 'subtype': 'smallSquare252', 'caption': None, 'credit': None, 'type': 'image', 'url': 'images/2019/12/22/arts/22snl/22snl-smallSquare252-v2.png', 'height': 252, 'width': 252, 'legacy': {}, 'subType': 'smallSquare252', 'crop_name': 'smallSquare252'}, {'rank': 0, 'subtype': 'square320', 'caption': None, 'credit': None, 'type': 'image', 'url': 'images/2019/12/22/arts/22snl/22snl-square320-v3.png', 'height': 320, 'width': 320, 'legacy': {}, 'subType': 'square320', 'crop_name': 'square320'}, {'rank': 0, 'subtype': 'moth', 'caption': None, 'credit': None, 'type': 'image', 'url': 'images/2019/12/22/arts/22snl/22snl-moth-v3.png', 'height': 151, 'width': 151, 'legacy': {}, 'subType': 'moth', 'crop_name': 'moth'}, {'rank': 0, 'subtype': 'filmstrip', 'caption': None, 'credit': None, 'type': 'image', 'url': 'images/2019/12/22/arts/22snl/22snl-filmstrip-v3.png', 'height': 190, 'width': 190, 'legacy': {}, 'subType': 'filmstrip', 'crop_name': 'filmstrip'}, {'rank': 0, 'subtype': 'square640', 'caption': None, 'credit': None, 'type': 'image', 'url': 'images/2019/12/22/arts/22snl/22snl-square640-v3.png', 'height': 640, 'width': 640, 'legacy': {}, 'subType': 'square640', 'crop_name': 'square640'}, {'rank': 0, 'subtype': 'mediumSquare149', 'caption': None, 'credit': None, 'type': 'image', 'url': 'images/2019/12/22/arts/22snl/22snl-mediumSquare149-v3.png', 'height': 149, 'width': 149, 'legacy': {}, 'subType': 'mediumSquare149', 'crop_name': 'mediumSquare149'}, {'rank': 0, 'subtype': 'sfSpan', 'caption': None, 'credit': None, 'type': 'image', 'url': 'images/2019/12/22/arts/22snl/22snl-sfSpan-v2.png', 'height': 263, 'width': 395, 'legacy': {}, 'subType': 'sfSpan', 'crop_name': 'sfSpan'}, {'rank': 0, 'subtype': 'largeHorizontal375', 'caption': None, 'credit': None, 'type': 'image', 'url': 'images/2019/12/22/arts/22snl/22snl-largeHorizontal375-v2.png', 'height': 250, 'width': 375, 'legacy': {}, 'subType': 'largeHorizontal375', 'crop_name': 'largeHorizontal375'}, {'rank': 0, 'subtype': 'largeHorizontalJumbo', 'caption': None, 'credit': None, 'type': 'image', 'url': 'images/2019/12/22/arts/22snl/22snl-largeHorizontalJumbo-v2.png', 'height': 683, 'width': 1024, 'legacy': {}, 'subType': 'largeHorizontalJumbo', 'crop_name': 'largeHorizontalJumbo'}, {'rank': 0, 'subtype': 'horizontalMediumAt2X', 'caption': None, 'credit': None, 'type': 'image', 'url': 'images/2019/12/22/arts/22snl/22snl-horizontalMediumAt2X-v2.png', 'height': 1144, 'width': 1715, 'legacy': {}, 'subType': 'horizontalMediumAt2X', 'crop_name': 'horizontalMediumAt2X'}, {'rank': 0, 'subtype': 'hpLarge', 'caption': None, 'credit': None, 'type': 'image', 'url': 'images/2019/12/22/arts/22snl/22snl-hpLarge-v2.png', 'height': 288, 'width': 511, 'legacy': {}, 'subType': 'hpLarge', 'crop_name': 'hpLarge'}, {'rank': 0, 'subtype': 'largeWidescreen573', 'caption': None, 'credit': None, 'type': 'image', 'url': 'images/2019/12/22/arts/22snl/22snl-largeWidescreen573-v2.png', 'height': 323, 'width': 573, 'legacy': {}, 'subType': 'largeWidescreen573', 'crop_name': 'largeWidescreen573'}, {'rank': 0, 'subtype': 'largeWidescreen1050', 'caption': None, 'credit': None, 'type': 'image', 'url': 'images/2019/12/22/arts/22snl/22snl-largeWidescreen1050-v2.png', 'height': 591, 'width': 1050, 'legacy': {}, 'subType': 'largeWidescreen1050', 'crop_name': 'largeWidescreen1050'}, {'rank': 0, 'subtype': 'wide', 'caption': None, 'credit': None, 'type': 'image', 'url': 'images/2019/12/22/arts/22snl/22snl-thumbWide-v3.png', 'height': 126, 'width': 190, 'legacy': {'widewidth': 190, 'wideheight': 126, 'wide': 'images/2019/12/22/arts/22snl/22snl-thumbWide-v3.png'}, 'subType': 'wide', 'crop_name': 'thumbWide'}, {'rank': 0, 'subtype': 'videoThumb', 'caption': None, 'credit': None, 'type': 'image', 'url': 'images/2019/12/22/arts/22snl/22snl-videoThumb-v3.png', 'height': 50, 'width': 75, 'legacy': {}, 'subType': 'videoThumb', 'crop_name': 'videoThumb'}, {'rank': 0, 'subtype': 'videoLarge', 'caption': None, 'credit': None, 'type': 'image', 'url': 'images/2019/12/22/arts/22snl/22snl-videoLarge-v3.png', 'height': 507, 'width': 768, 'legacy': {}, 'subType': 'videoLarge', 'crop_name': 'videoLarge'}, {'rank': 0, 'subtype': 'mediumThreeByTwo210', 'caption': None, 'credit': None, 'type': 'image', 'url': 'images/2019/12/22/arts/22snl/22snl-mediumThreeByTwo210-v3.png', 'height': 140, 'width': 210, 'legacy': {}, 'subType': 'mediumThreeByTwo210', 'crop_name': 'mediumThreeByTwo210'}, {'rank': 0, 'subtype': 'mediumThreeByTwo225', 'caption': None, 'credit': None, 'type': 'image', 'url': 'images/2019/12/22/arts/22snl/22snl-mediumThreeByTwo225-v3.png', 'height': 150, 'width': 225, 'legacy': {}, 'subType': 'mediumThreeByTwo225', 'crop_name': 'mediumThreeByTwo225'}, {'rank': 0, 'subtype': 'mediumThreeByTwo440', 'caption': None, 'credit': None, 'type': 'image', 'url': 'images/2019/12/22/arts/22snl/22snl-mediumThreeByTwo440-v3.png', 'height': 293, 'width': 440, 'legacy': {}, 'subType': 'mediumThreeByTwo440', 'crop_name': 'mediumThreeByTwo440'}, {'rank': 0, 'subtype': 'mediumThreeByTwo252', 'caption': None, 'credit': None, 'type': 'image', 'url': 'images/2019/12/22/arts/22snl/22snl-mediumThreeByTwo252-v3.png', 'height': 168, 'width': 252, 'legacy': {}, 'subType': 'mediumThreeByTwo252', 'crop_name': 'mediumThreeByTwo252'}, {'rank': 0, 'subtype': 'mediumThreeByTwo378', 'caption': None, 'credit': None, 'type': 'image', 'url': 'images/2019/12/22/arts/22snl/22snl-mediumThreeByTwo378-v3.png', 'height': 252, 'width': 378, 'legacy': {}, 'subType': 'mediumThreeByTwo378', 'crop_name': 'mediumThreeByTwo378'}, {'rank': 0, 'subtype': 'threeByTwoLargeAt2X', 'caption': None, 'credit': None, 'type': 'image', 'url': 'images/2019/12/22/arts/22snl/22snl-threeByTwoLargeAt2X-v3.png', 'height': 1135, 'width': 1700, 'legacy': {}, 'subType': 'threeByTwoLargeAt2X', 'crop_name': 'threeByTwoLargeAt2X'}, {'rank': 0, 'subtype': 'threeByTwoMediumAt2X', 'caption': None, 'credit': None, 'type': 'image', 'url': 'images/2019/12/22/arts/22snl/22snl-threeByTwoMediumAt2X-v3.png', 'height': 1001, 'width': 1500, 'legacy': {}, 'subType': 'threeByTwoMediumAt2X', 'crop_name': 'threeByTwoMediumAt2X'}, {'rank': 0, 'subtype': 'threeByTwoSmallAt2X', 'caption': None, 'credit': None, 'type': 'image', 'url': 'images/2019/12/22/arts/22snl/22snl-threeByTwoSmallAt2X-v3.png', 'height': 401, 'width': 600, 'legacy': {}, 'subType': 'threeByTwoSmallAt2X', 'crop_name': 'threeByTwoSmallAt2X'}, {'rank': 0, 'subtype': 'articleInline', 'caption': None, 'credit': None, 'type': 'image', 'url': 'images/2019/12/22/arts/22snl/22snl-articleInline-v2.png', 'height': 108, 'width': 190, 'legacy': {}, 'subType': 'articleInline', 'crop_name': 'articleInline'}, {'rank': 0, 'subtype': 'hpSmall', 'caption': None, 'credit': None, 'type': 'image', 'url': 'images/2019/12/22/arts/22snl/22snl-hpSmall-v2.png', 'height': 93, 'width': 163, 'legacy': {}, 'subType': 'hpSmall', 'crop_name': 'hpSmall'}, {'rank': 0, 'subtype': 'blogSmallInline', 'caption': None, 'credit': None, 'type': 'image', 'url': 'images/2019/12/22/arts/22snl/22snl-blogSmallInline-v2.png', 'height': 86, 'width': 151, 'legacy': {}, 'subType': 'blogSmallInline', 'crop_name': 'blogSmallInline'}, {'rank': 0, 'subtype': 'mediumFlexible177', 'caption': None, 'credit': None, 'type': 'image', 'url': 'images/2019/12/22/arts/22snl/22snl-mediumFlexible177-v2.png', 'height': 101, 'width': 177, 'legacy': {}, 'subType': 'mediumFlexible177', 'crop_name': 'mediumFlexible177'}, {'rank': 0, 'subtype': 'videoSmall', 'caption': None, 'credit': None, 'type': 'image', 'url': 'images/2019/12/22/arts/22snl/22snl-videoSmall-v2.png', 'height': 281, 'width': 500, 'legacy': {}, 'subType': 'videoSmall', 'crop_name': 'videoSmall'}, {'rank': 0, 'subtype': 'videoHpMedium', 'caption': None, 'credit': None, 'type': 'image', 'url': 'images/2019/12/22/arts/22snl/22snl-videoHpMedium-v2.png', 'height': 211, 'width': 375, 'legacy': {}, 'subType': 'videoHpMedium', 'crop_name': 'videoHpMedium'}, {'rank': 0, 'subtype': 'videoSixteenByNine600', 'caption': None, 'credit': None, 'type': 'image', 'url': 'images/2019/12/22/arts/22snl/22snl-videoSixteenByNine600-v2.png', 'height': 338, 'width': 600, 'legacy': {}, 'subType': 'videoSixteenByNine600', 'crop_name': 'videoSixteenByNine600'}, {'rank': 0, 'subtype': 'videoSixteenByNine540', 'caption': None, 'credit': None, 'type': 'image', 'url': 'images/2019/12/22/arts/22snl/22snl-videoSixteenByNine540-v2.png', 'height': 304, 'width': 540, 'legacy': {}, 'subType': 'videoSixteenByNine540', 'crop_name': 'videoSixteenByNine540'}, {'rank': 0, 'subtype': 'videoSixteenByNine495', 'caption': None, 'credit': None, 'type': 'image', 'url': 'images/2019/12/22/arts/22snl/22snl-videoSixteenByNine495-v2.png', 'height': 278, 'width': 495, 'legacy': {}, 'subType': 'videoSixteenByNine495', 'crop_name': 'videoSixteenByNine495'}, {'rank': 0, 'subtype': 'videoSixteenByNine390', 'caption': None, 'credit': None, 'type': 'image', 'url': 'images/2019/12/22/arts/22snl/22snl-videoSixteenByNine390-v2.png', 'height': 219, 'width': 390, 'legacy': {}, 'subType': 'videoSixteenByNine390', 'crop_name': 'videoSixteenByNine390'}, {'rank': 0, 'subtype': 'videoSixteenByNine1050', 'caption': None, 'credit': None, 'type': 'image', 'url': 'images/2019/12/22/arts/22snl/22snl-videoSixteenByNine1050-v2.png', 'height': 591, 'width': 1050, 'legacy': {}, 'subType': 'videoSixteenByNine1050', 'crop_name': 'videoSixteenByNine1050'}, {'rank': 0, 'subtype': 'videoSixteenByNine480', 'caption': None, 'credit': None, 'type': 'image', 'url': 'images/2019/12/22/arts/22snl/22snl-videoSixteenByNine480-v2.png', 'height': 270, 'width': 480, 'legacy': {}, 'subType': 'videoSixteenByNine480', 'crop_name': 'videoSixteenByNine480'}, {'rank': 0, 'subtype': 'videoSixteenByNine310', 'caption': None, 'credit': None, 'type': 'image', 'url': 'images/2019/12/22/arts/22snl/22snl-videoSixteenByNine310-v2.png', 'height': 174, 'width': 310, 'legacy': {}, 'subType': 'videoSixteenByNine310', 'crop_name': 'videoSixteenByNine310'}, {'rank': 0, 'subtype': 'videoSixteenByNine225', 'caption': None, 'credit': None, 'type': 'image', 'url': 'images/2019/12/22/arts/22snl/22snl-videoSixteenByNine225-v2.png', 'height': 126, 'width': 225, 'legacy': {}, 'subType': 'videoSixteenByNine225', 'crop_name': 'videoSixteenByNine225'}, {'rank': 0, 'subtype': 'videoSixteenByNine96', 'caption': None, 'credit': None, 'type': 'image', 'url': 'images/2019/12/22/arts/22snl/22snl-videoSixteenByNine96-v2.png', 'height': 54, 'width': 96, 'legacy': {}, 'subType': 'videoSixteenByNine96', 'crop_name': 'videoSixteenByNine96'}, {'rank': 0, 'subtype': 'videoSixteenByNine768', 'caption': None, 'credit': None, 'type': 'image', 'url': 'images/2019/12/22/arts/22snl/22snl-videoSixteenByNine768-v2.png', 'height': 432, 'width': 768, 'legacy': {}, 'subType': 'videoSixteenByNine768', 'crop_name': 'videoSixteenByNine768'}, {'rank': 0, 'subtype': 'videoSixteenByNine150', 'caption': None, 'credit': None, 'type': 'image', 'url': 'images/2019/12/22/arts/22snl/22snl-videoSixteenByNine150-v2.png', 'height': 84, 'width': 150, 'legacy': {}, 'subType': 'videoSixteenByNine150', 'crop_name': 'videoSixteenByNine150'}, {'rank': 0, 'subtype': 'videoSixteenByNineJumbo1600', 'caption': None, 'credit': None, 'type': 'image', 'url': 'images/2019/12/22/arts/22snl/22snl-videoSixteenByNineJumbo1600-v2.png', 'height': 901, 'width': 1600, 'legacy': {}, 'subType': 'videoSixteenByNineJumbo1600', 'crop_name': 'videoSixteenByNineJumbo1600'}, {'rank': 0, 'subtype': 'miniMoth', 'caption': None, 'credit': None, 'type': 'image', 'url': 'images/2019/12/22/arts/22snl/22snl-miniMoth-v2.png', 'height': 70, 'width': 151, 'legacy': {}, 'subType': 'miniMoth', 'crop_name': 'miniMoth'}, {'rank': 0, 'subtype': 'windowsTile336H', 'caption': None, 'credit': None, 'type': 'image', 'url': 'images/2019/12/22/arts/22snl/22snl-windowsTile336H-v2.png', 'height': 336, 'width': 694, 'legacy': {}, 'subType': 'windowsTile336H', 'crop_name': 'windowsTile336H'}, {'rank': 0, 'subtype': 'videoFifteenBySeven1305', 'caption': None, 'credit': None, 'type': 'image', 'url': 'images/2019/12/22/arts/22snl/22snl-videoFifteenBySeven1305-v2.png', 'height': 609, 'width': 1305, 'legacy': {}, 'subType': 'videoFifteenBySeven1305', 'crop_name': 'videoFifteenBySeven1305'}, {'rank': 0, 'subtype': 'facebookJumbo', 'caption': None, 'credit': None, 'type': 'image', 'url': 'images/2019/12/22/arts/22snl/22snl-facebookJumbo-v2.png', 'height': 550, 'width': 1050, 'legacy': {}, 'subType': 'facebookJumbo', 'crop_name': 'facebookJumbo'}, {'rank': 0, 'subtype': 'watch308', 'caption': None, 'credit': None, 'type': 'image', 'url': 'images/2019/12/22/arts/22snl/22snl-watch308-v2.png', 'height': 348, 'width': 312, 'legacy': {}, 'subType': 'watch308', 'crop_name': 'watch308'}, {'rank': 0, 'subtype': 'watch268', 'caption': None, 'credit': None, 'type': 'image', 'url': 'images/2019/12/22/arts/22snl/22snl-watch268-v2.png', 'height': 304, 'width': 272, 'legacy': {}, 'subType': 'watch268', 'crop_name': 'watch268'}, {'rank': 0, 'subtype': 'verticalTwoByThree735', 'caption': None, 'credit': None, 'type': 'image', 'url': 'images/2019/12/22/arts/22snl/22snl-verticalTwoByThree735-v2.png', 'height': 1103, 'width': 735, 'legacy': {}, 'subType': 'verticalTwoByThree735', 'crop_name': 'verticalTwoByThree735'}, {'rank': 0, 'subtype': 'mobileMasterAt3x', 'caption': None, 'credit': None, 'type': 'image', 'url': 'images/2019/12/22/arts/22snl/22snl-mobileMasterAt3x-v2.png', 'height': 1024, 'width': 1800, 'legacy': {}, 'subType': 'mobileMasterAt3x', 'crop_name': 'mobileMasterAt3x'}]","[{'name': 'subject', 'value': 'Television', 'rank': 1, 'major': 'N'}, {'name': 'persons', 'value': 'Murphy, Eddie', 'rank': 2, 'major': 'N'}, {'name': 'persons', 'value': 'Chappelle, Dave', 'rank': 3, 'major': 'N'}, {'name': 'persons', 'value': 'Rock, Chris', 'rank': 4, 'major': 'N'}, {'name': 'creative_works', 'value': 'Saturday Night Live (TV Program)', 'rank': 5, 'major': 'N'}]",2019-12-22T08:18:22+0000,article,Culture,Arts,Television,News,nyt://article/7d29330b-b330-5000-a8f8-7051106cdd9f,1199,nyt://article/7d29330b-b330-5000-a8f8-7051106cdd9f,Eddie Murphy Returns to ‘Saturday Night Live’,,,Eddie Murphy Returns to ‘Saturday Night Live’,,,,By Dave Itzkoff,"[{'firstname': 'Dave', 'middlename': None, 'lastname': 'Itzkoff', 'qualifier': None, 'title': None, 'role': 'reported', 'organization': '', 'rank': 1}]",,C,6
7,Malik Fitts and Jordan Ford combined to score 31 of their 44 points in the second half and Saint Mary's used a late 12-2 run to beat Nevada 68-63 on Saturday night at the Al Attles Classic. ,https://www.nytimes.com/aponline/2019/12/22/sports/ncaabasketball/bc-bkc-nevada-saint-marys.html,Malik Fitts and Jordan Ford combined to score 31 of their 44 points in the second half and Saint Mary's used a late 12-2 run to beat Nevada 68-63 on Saturday night at the Al Attles Classic. ,SAN FRANCISCO — Malik Fitts and Jordan Ford combined to score 31 of their 44 points in the second half and Saint Mary's used a late 12-2 run to beat Nevada 68-63 on Saturday night at the Al Attles Classic. ,AP,[],[],2019-12-22T08:00:28+0000,article,None,Sports,College Basketball,News,nyt://article/3721995b-88ab-59cf-a833-0034b54d8c49,177,nyt://article/3721995b-88ab-59cf-a833-0034b54d8c49,"Fitts, Ford Lead Saint Mary's to 68-63 Win Over Nevada",,,"Fitts, Ford Lead Saint Mary's to 68-63 Win Over Nevada",,,,By The Associated Press,[],The Associated Press,,
