,abstract,web_url,snippet,lead_paragraph,source,multimedia,keywords,pub_date,document_type,news_desk,section_name,subsection_name,type_of_material,_id,word_count,uri,headline_main,headline_kicker,headline_content_kicker,headline_print_headline,headline_name,headline_seo,headline_sub,byline_original,byline_person,byline_organization,print_section,print_page
0,Jermaine Samuels hit the game-winning 3-pointer with 20.5 seconds remaining to lift No. 18 Villanova past No. 1 Kansas 56-55 on Saturday in Philadelphia.,https://www.nytimes.com/reuters/2019/12/22/sports/basketball/22reuters-basketball-ncaa-roundup.html,Jermaine Samuels hit the game-winning 3-pointer with 20.5 seconds remaining to lift No. 18 Villanova past No. 1 Kansas 56-55 on Saturday in Philadelphia.,Jermaine Samuels hit the game-winning 3-pointer with 20.5 seconds remaining to lift No. 18 Villanova past No. 1 Kansas 56-55 on Saturday in Philadelphia.,Reuters,[],[],2019-12-22T09:51:34+0000,article,None,Sports,Pro Basketball,News,nyt://article/d9944e71-d8dc-5d35-9bd5-f48f44c56bbb,1778,nyt://article/d9944e71-d8dc-5d35-9bd5-f48f44c56bbb,Top 25 Roundup: No. 18 Villanova Knocks Off No. 1 Kansas,,,Top 25 Roundup: No. 18 Villanova Knocks Off No. 1 Kansas,,,,By Reuters,[],Reuters,,
1,"Hong Kong is gearing up for demonstrations over Christmas week with protesters planning events in districts across the city, including in prime shopping malls, the latest in more than six months of unrest.",https://www.nytimes.com/reuters/2019/12/22/world/asia/22reuters-hongkong-protests.html,"Hong Kong is gearing up for demonstrations over Christmas week with protesters planning events in districts across the city, including in prime shopping malls, the latest in more than six months of unrest.","HONG KONG — Hong Kong is gearing up for demonstrations over Christmas week with protesters planning events in districts across the city, including in prime shopping malls, the latest in more than six months of unrest.",Reuters,[],[],2019-12-22T09:36:34+0000,article,None,World,Asia Pacific,News,nyt://article/9d4591ba-07de-527b-8f73-49202b0747c8,403,nyt://article/9d4591ba-07de-527b-8f73-49202b0747c8,Hong Kong Braces for Protests Over Christmas Holidays,,,Hong Kong Braces for Protests Over Christmas Holidays,,,,By Reuters,[],Reuters,,
2,"Turkey's parliament approved on Saturday a security and military cooperation deal signed with Libya's internationally recognised government last month, state media reported, an agreement that could pave the way for military help from Ankara.",https://www.nytimes.com/reuters/2019/12/22/world/europe/22reuters-turkey-libya-military.html,"Turkey's parliament approved on Saturday a security and military cooperation deal signed with Libya's internationally recognised government last month, state media reported, an agreement that could pave the way for military help from Ankara.","ANKARA — Turkey's parliament approved on Saturday a security and military cooperation deal signed with Libya's internationally recognised government last month, state media reported, an agreement that could pave the way for military help from Ankara.",Reuters,[],[],2019-12-22T09:36:32+0000,article,None,World,Europe,News,nyt://article/bc1c4a6f-5bc2-5b66-9d30-43c2c32e9dee,434,nyt://article/bc1c4a6f-5bc2-5b66-9d30-43c2c32e9dee,Turkey's Parliament Ratifies Security Accord With Libya-Report,,,Turkey's Parliament Ratifies Security Accord With Libya-Report,,,,By Reuters,[],Reuters,,
3,"The American-born Lady Astor was the first woman to take a seat in the British Parliament. A century later, her legacy is still being debated.",https://www.nytimes.com/2019/12/22/world/europe/nancy-astor-parliament.html,"The American-born Lady Astor was the first woman to take a seat in the British Parliament. A century later, her legacy is still being debated.","PLYMOUTH, England — When women finally won the right in 1918 to enter Britain’s Parliament, many expected the first female lawmaker to sit there to come from the ranks of the suffragists, the activists who had fought, often at huge personal cost, for the vote.",The New York Times,"[{'rank': 0, 'subtype': 'xlarge', 'caption': None, 'credit': None, 'type': 'image', 'url': 'images/2019/12/04/world/00astor/merlin_165426885_596dd233-2335-4b7c-939d-af7ed52c08c5-articleLarge.jpg', 'height': 810, 'width': 600, 'legacy': {'xlarge': 'images/2019/12/04/world/00astor/merlin_165426885_596dd233-2335-4b7c-939d-af7ed52c08c5-articleLarge.jpg', 'xlargewidth': 600, 'xlargeheight': 810}, 'subType': 'xlarge', 'crop_name': 'articleLarge'}, {'rank': 0, 'subtype': 'popup', 'caption': None, 'credit': None, 'type': 'image', 'url': 'images/2019/12/04/world/00astor/merlin_165426885_596dd233-2335-4b7c-939d-af7ed52c08c5-popup.jpg', 'height': 500, 'width': 371, 'legacy': {}, 'subType': 'popup', 'crop_name': 'popup'}, {'rank': 0, 'subtype': 'blog480', 'caption': None, 'credit': None, 'type': 'image', 'url': 'images/2019/12/04/world/00astor/merlin_165426885_596dd233-2335-4b7c-939d-af7ed52c08c5-blog480.jpg', 'height': 648, 'width': 480, 'legacy': {}, 'subType': 'blog480', 'crop_name': 'blog480'}, {'rank': 0, 'subtype': 'blog533', 'caption': None, 'credit': None, 'type': 'image', 'url': 'images/2019/12/04/world/00astor/merlin_165426885_596dd233-2335-4b7c-939d-af7ed52c08c5-blog533.jpg', 'height': 719, 'width': 533, 'legacy': {}, 'subType': 'blog533', 'crop_name': 'blog533'}, {'rank': 0, 'subtype': 'blog427', 'caption': None, 'credit': None, 'type': 'image', 'url': 'images/2019/12/04/world/00astor/merlin_165426885_596dd233-2335-4b7c-939d-af7ed52c08c5-blog427.jpg', 'height': 576, 'width': 427, 'legacy': {}, 'subType': 'blog427', 'crop_name': 'blog427'}, {'rank': 0, 'subtype': 'tmagSF', 'caption': None, 'credit': None, 'type': 'image', 'url': 'images/2019/12/04/world/00astor/merlin_165426885_596dd233-2335-4b7c-939d-af7ed52c08c5-tmagSF.jpg', 'height': 488, 'width': 362, 'legacy': {}, 'subType': 'tmagSF', 'crop_name': 'tmagSF'}, {'rank': 0, 'subtype': 'tmagArticle', 'caption': None, 'credit': None, 'type': 'image', 'url': 'images/2019/12/04/world/00astor/merlin_165426885_596dd233-2335-4b7c-939d-af7ed52c08c5-tmagArticle.jpg', 'height': 799, 'width': 592, 'legacy': {}, 'subType': 'tmagArticle', 'crop_name': 'tmagArticle'}, {'rank': 0, 'subtype': 'slide', 'caption': None, 'credit': None, 'type': 'image', 'url': 'images/2019/12/04/world/00astor/merlin_165426885_596dd233-2335-4b7c-939d-af7ed52c08c5-slide.jpg', 'height': 500, 'width': 371, 'legacy': {}, 'subType': 'slide', 'crop_name': 'slide'}, {'rank': 0, 'subtype': 'jumbo', 'caption': None, 'credit': None, 'type': 'image', 'url': 'images/2019/12/04/world/00astor/merlin_165426885_596dd233-2335-4b7c-939d-af7ed52c08c5-jumbo.jpg', 'height': 1024, 'width': 759, 'legacy': {}, 'subType': 'jumbo', 'crop_name': 'jumbo'}, {'rank': 0, 'subtype': 'superJumbo', 'caption': None, 'credit': None, 'type': 'image', 'url': 'images/2019/12/04/world/00astor/merlin_165426885_596dd233-2335-4b7c-939d-af7ed52c08c5-superJumbo.jpg', 'height': 2048, 'width': 1518, 'legacy': {}, 'subType': 'superJumbo', 'crop_name': 'superJumbo'}, {'rank': 0, 'subtype': 'blog225', 'caption': None, 'credit': None, 'type': 'image', 'url': 'images/2019/12/04/world/00astor/merlin_165426885_596dd233-2335-4b7c-939d-af7ed52c08c5-blog225.jpg', 'height': 304, 'width': 225, 'legacy': {}, 'subType': 'blog225', 'crop_name': 'blog225'}, {'rank': 0, 'subtype': 'master1050', 'caption': None, 'credit': None, 'type': 'image', 'url': 'images/2019/12/04/world/00astor/merlin_165426885_596dd233-2335-4b7c-939d-af7ed52c08c5-master1050.jpg', 'height': 1417, 'width': 1050, 'legacy': {}, 'subType': 'master1050', 'crop_name': 'master1050'}, {'rank': 0, 'subtype': 'master675', 'caption': None, 'credit': None, 'type': 'image', 'url': 'images/2019/12/04/world/00astor/merlin_165426885_596dd233-2335-4b7c-939d-af7ed52c08c5-master675.jpg', 'height': 911, 'width': 675, 'legacy': {}, 'subType': 'master675', 'crop_name': 'master675'}, {'rank': 0, 'subtype': 'master495', 'caption': None, 'credit': None, 'type': 'image', 'url': 'images/2019/12/04/world/00astor/merlin_165426885_596dd233-2335-4b7c-939d-af7ed52c08c5-master495.jpg', 'height': 668, 'width': 495, 'legacy': {}, 'subType': 'master495', 'crop_name': 'master495'}, {'rank': 0, 'subtype': 'master180', 'caption': None, 'credit': None, 'type': 'image', 'url': 'images/2019/12/04/world/00astor/merlin_165426885_596dd233-2335-4b7c-939d-af7ed52c08c5-master180.jpg', 'height': 243, 'width': 180, 'legacy': {}, 'subType': 'master180', 'crop_name': 'master180'}, {'rank': 0, 'subtype': 'master315', 'caption': None, 'credit': None, 'type': 'image', 'url': 'images/2019/12/04/world/00astor/merlin_165426885_596dd233-2335-4b7c-939d-af7ed52c08c5-master315.jpg', 'height': 425, 'width': 315, 'legacy': {}, 'subType': 'master315', 'crop_name': 'master315'}, {'rank': 0, 'subtype': 'master768', 'caption': None, 'credit': None, 'type': 'image', 'url': 'images/2019/12/04/world/00astor/merlin_165426885_596dd233-2335-4b7c-939d-af7ed52c08c5-master768.jpg', 'height': 1036, 'width': 768, 'legacy': {}, 'subType': 'master768', 'crop_name': 'master768'}, {'rank': 0, 'subtype': 'thumbnail', 'caption': None, 'credit': None, 'type': 'image', 'url': 'images/2019/12/04/world/00astor/00astor-thumbStandard.jpg', 'height': 75, 'width': 75, 'legacy': {'thumbnail': 'images/2019/12/04/world/00astor/00astor-thumbStandard.jpg', 'thumbnailwidth': 75, 'thumbnailheight': 75}, 'subType': 'thumbnail', 'crop_name': 'thumbStandard'}, {'rank': 0, 'subtype': 'blogSmallThumb', 'caption': None, 'credit': None, 'type': 'image', 'url': 'images/2019/12/04/world/00astor/00astor-blogSmallThumb.jpg', 'height': 50, 'width': 50, 'legacy': {}, 'subType': 'blogSmallThumb', 'crop_name': 'blogSmallThumb'}, {'rank': 0, 'subtype': 'thumbLarge', 'caption': None, 'credit': None, 'type': 'image', 'url': 'images/2019/12/04/world/00astor/00astor-thumbLarge.jpg', 'height': 150, 'width': 150, 'legacy': {}, 'subType': 'thumbLarge', 'crop_name': 'thumbLarge'}, {'rank': 0, 'subtype': 'smallSquare168', 'caption': None, 'credit': None, 'type': 'image', 'url': 'images/2019/12/04/world/00astor/00astor-smallSquare168.jpg', 'height': 168, 'width': 168, 'legacy': {}, 'subType': 'smallSquare168', 'crop_name': 'smallSquare168'}, {'rank': 0, 'subtype': 'smallSquare252', 'caption': None, 'credit': None, 'type': 'image', 'url': 'images/2019/12/04/world/00astor/00astor-smallSquare252.jpg', 'height': 252, 'width': 252, 'legacy': {}, 'subType': 'smallSquare252', 'crop_name': 'smallSquare252'}, {'rank': 0, 'subtype': 'square320', 'caption': None, 'credit': None, 'type': 'image', 'url': 'images/2019/12/04/world/00astor/00astor-square320.jpg', 'height': 320, 'width': 320, 'legacy': {}, 'subType': 'square320', 'crop_name': 'square320'}, {'rank': 0, 'subtype': 'moth', 'caption': None, 'credit': None, 'type': 'image', 'url': 'images/2019/12/04/world/00astor/00astor-moth.jpg', 'height': 151, 'width': 151, 'legacy': {}, 'subType': 'moth', 'crop_name': 'moth'}, {'rank': 0, 'subtype': 'filmstrip', 'caption': None, 'credit': None, 'type': 'image', 'url': 'images/2019/12/04/world/00astor/00astor-filmstrip.jpg', 'height': 190, 'width': 190, 'legacy': {}, 'subType': 'filmstrip', 'crop_name': 'filmstrip'}, {'rank': 0, 'subtype': 'square640', 'caption': None, 'credit': None, 'type': 'image', 'url': 'images/2019/12/04/world/00astor/00astor-square640.jpg', 'height': 640, 'width': 640, 'legacy': {}, 'subType': 'square640', 'crop_name': 'square640'}, {'rank': 0, 'subtype': 'mediumSquare149', 'caption': None, 'credit': None, 'type': 'image', 'url': 'images/2019/12/04/world/00astor/00astor-mediumSquare149.jpg', 'height': 149, 'width': 149, 'legacy': {}, 'subType': 'mediumSquare149', 'crop_name': 'mediumSquare149'}, {'rank': 0, 'subtype': 'sfSpan', 'caption': None, 'credit': None, 'type': 'image', 'url': 'images/2019/12/04/world/00astor/00astor-sfSpan.jpg', 'height': 263, 'width': 395, 'legacy': {}, 'subType': 'sfSpan', 'crop_name': 'sfSpan'}, {'rank': 0, 'subtype': 'largeHorizontal375', 'caption': None, 'credit': None, 'type': 'image', 'url': 'images/2019/12/04/world/00astor/00astor-largeHorizontal375.jpg', 'height': 250, 'width': 375, 'legacy': {}, 'subType': 'largeHorizontal375', 'crop_name': 'largeHorizontal375'}, {'rank': 0, 'subtype': 'largeHorizontalJumbo', 'caption': None, 'credit': None, 'type': 'image', 'url': 'images/2019/12/04/world/00astor/00astor-largeHorizontalJumbo.jpg', 'height': 683, 'width': 1024, 'legacy': {}, 'subType': 'largeHorizontalJumbo', 'crop_name': 'largeHorizontalJumbo'}, {'rank': 0, 'subtype': 'horizontalMediumAt2X', 'caption': None, 'credit': None, 'type': 'image', 'url': 'images/2019/12/04/world/00astor/00astor-horizontalMediumAt2X.jpg', 'height': 1771, 'width': 2656, 'legacy': {}, 'subType': 'horizontalMediumAt2X', 'crop_name': 'horizontalMediumAt2X'}, {'rank': 0, 'subtype': 'hpLarge', 'caption': None, 'credit': None, 'type': 'image', 'url': 'images/2019/12/04/world/00astor/00astor-hpLarge.jpg', 'height': 287, 'width': 511, 'legacy': {}, 'subType': 'hpLarge', 'crop_name': 'hpLarge'}, {'rank': 0, 'subtype': 'largeWidescreen573', 'caption': None, 'credit': None, 'type': 'image', 'url': 'images/2019/12/04/world/00astor/00astor-largeWidescreen573.jpg', 'height': 322, 'width': 573, 'legacy': {}, 'subType': 'largeWidescreen573', 'crop_name': 'largeWidescreen573'}, {'rank': 0, 'subtype': 'largeWidescreen1050', 'caption': None, 'credit': None, 'type': 'image', 'url': 'images/2019/12/04/world/00astor/00astor-largeWidescreen1050.jpg', 'height': 591, 'width': 1050, 'legacy': {}, 'subType': 'largeWidescreen1050', 'crop_name': 'largeWidescreen1050'}, {'rank': 0, 'subtype': 'wide', 'caption': None, 'credit': None, 'type': 'image', 'url': 'images/2019/12/04/world/00astor/00astor-thumbWide.jpg', 'height': 126, 'width': 190, 'legacy': {'widewidth': 190, 'wideheight': 126, 'wide': 'images/2019/12/04/world/00astor/00astor-thumbWide.jpg'}, 'subType': 'wide', 'crop_name': 'thumbWide'}, {'rank': 0, 'subtype': 'videoThumb', 'caption': None, 'credit': None, 'type': 'image', 'url': 'images/2019/12/04/world/00astor/00astor-videoThumb.jpg', 'height': 50, 'width': 75, 'legacy': {}, 'subType': 'videoThumb', 'crop_name': 'videoThumb'}, {'rank': 0, 'subtype': 'videoLarge', 'caption': None, 'credit': None, 'type': 'image', 'url': 'images/2019/12/04/world/00astor/00astor-videoLarge.jpg', 'height': 507, 'width': 768, 'legacy': {}, 'subType': 'videoLarge', 'crop_name': 'videoLarge'}, {'rank': 0, 'subtype': 'mediumThreeByTwo210', 'caption': None, 'credit': None, 'type': 'image', 'url': 'images/2019/12/04/world/00astor/00astor-mediumThreeByTwo210.jpg', 'height': 140, 'width': 210, 'legacy': {}, 'subType': 'mediumThreeByTwo210', 'crop_name': 'mediumThreeByTwo210'}, {'rank': 0, 'subtype': 'mediumThreeByTwo225', 'caption': None, 'credit': None, 'type': 'image', 'url': 'images/2019/12/04/world/00astor/00astor-mediumThreeByTwo225.jpg', 'height': 150, 'width': 225, 'legacy': {}, 'subType': 'mediumThreeByTwo225', 'crop_name': 'mediumThreeByTwo225'}, {'rank': 0, 'subtype': 'mediumThreeByTwo440', 'caption': None, 'credit': None, 'type': 'image', 'url': 'images/2019/12/04/world/00astor/00astor-mediumThreeByTwo440.jpg', 'height': 293, 'width': 440, 'legacy': {}, 'subType': 'mediumThreeByTwo440', 'crop_name': 'mediumThreeByTwo440'}, {'rank': 0, 'subtype': 'mediumThreeByTwo252', 'caption': None, 'credit': None, 'type': 'image', 'url': 'images/2019/12/04/world/00astor/00astor-mediumThreeByTwo252.jpg', 'height': 168, 'width': 252, 'legacy': {}, 'subType': 'mediumThreeByTwo252', 'crop_name': 'mediumThreeByTwo252'}, {'rank': 0, 'subtype': 'mediumThreeByTwo378', 'caption': None, 'credit': None, 'type': 'image', 'url': 'images/2019/12/04/world/00astor/00astor-mediumThreeByTwo378.jpg', 'height': 252, 'width': 378, 'legacy': {}, 'subType': 'mediumThreeByTwo378', 'crop_name': 'mediumThreeByTwo378'}, {'rank': 0, 'subtype': 'threeByTwoLargeAt2X', 'caption': None, 'credit': None, 'type': 'image', 'url': 'images/2019/12/04/world/00astor/00astor-threeByTwoLargeAt2X.jpg', 'height': 1771, 'width': 2656, 'legacy': {}, 'subType': 'threeByTwoLargeAt2X', 'crop_name': 'threeByTwoLargeAt2X'}, {'rank': 0, 'subtype': 'threeByTwoMediumAt2X', 'caption': None, 'credit': None, 'type': 'image', 'url': 'images/2019/12/04/world/00astor/00astor-threeByTwoMediumAt2X.jpg', 'height': 1000, 'width': 1500, 'legacy': {}, 'subType': 'threeByTwoMediumAt2X', 'crop_name': 'threeByTwoMediumAt2X'}, {'rank': 0, 'subtype': 'threeByTwoSmallAt2X', 'caption': None, 'credit': None, 'type': 'image', 'url': 'images/2019/12/04/world/00astor/00astor-threeByTwoSmallAt2X.jpg', 'height': 400, 'width': 600, 'legacy': {}, 'subType': 'threeByTwoSmallAt2X', 'crop_name': 'threeByTwoSmallAt2X'}, {'rank': 0, 'subtype': 'articleInline', 'caption': None, 'credit': None, 'type': 'image', 'url': 'images/2019/12/04/world/00astor/merlin_165426885_596dd233-2335-4b7c-939d-af7ed52c08c5-articleInline.jpg', 'height': 256, 'width': 190, 'legacy': {}, 'subType': 'articleInline', 'crop_name': 'articleInline'}, {'rank': 0, 'subtype': 'hpSmall', 'caption': None, 'credit': None, 'type': 'image', 'url': 'images/2019/12/04/world/00astor/merlin_165426885_596dd233-2335-4b7c-939d-af7ed52c08c5-hpSmall.jpg', 'height': 220, 'width': 163, 'legacy': {}, 'subType': 'hpSmall', 'crop_name': 'hpSmall'}, {'rank': 0, 'subtype': 'blogSmallInline', 'caption': None, 'credit': None, 'type': 'image', 'url': 'images/2019/12/04/world/00astor/merlin_165426885_596dd233-2335-4b7c-939d-af7ed52c08c5-blogSmallInline.jpg', 'height': 204, 'width': 151, 'legacy': {}, 'subType': 'blogSmallInline', 'crop_name': 'blogSmallInline'}, {'rank': 0, 'subtype': 'mediumFlexible177', 'caption': None, 'credit': None, 'type': 'image', 'url': 'images/2019/12/04/world/00astor/merlin_165426885_596dd233-2335-4b7c-939d-af7ed52c08c5-mediumFlexible177.jpg', 'height': 239, 'width': 177, 'legacy': {}, 'subType': 'mediumFlexible177', 'crop_name': 'mediumFlexible177'}, {'rank': 0, 'subtype': 'videoSmall', 'caption': None, 'credit': None, 'type': 'image', 'url': 'images/2019/12/04/world/00astor/00astor-videoSmall.jpg', 'height': 281, 'width': 500, 'legacy': {}, 'subType': 'videoSmall', 'crop_name': 'videoSmall'}, {'rank': 0, 'subtype': 'videoHpMedium', 'caption': None, 'credit': None, 'type': 'image', 'url': 'images/2019/12/04/world/00astor/00astor-videoHpMedium.jpg', 'height': 211, 'width': 375, 'legacy': {}, 'subType': 'videoHpMedium', 'crop_name': 'videoHpMedium'}, {'rank': 0, 'subtype': 'videoSixteenByNine600', 'caption': None, 'credit': None, 'type': 'image', 'url': 'images/2019/12/04/world/00astor/00astor-videoSixteenByNine600.jpg', 'height': 338, 'width': 600, 'legacy': {}, 'subType': 'videoSixteenByNine600', 'crop_name': 'videoSixteenByNine600'}, {'rank': 0, 'subtype': 'videoSixteenByNine540', 'caption': None, 'credit': None, 'type': 'image', 'url': 'images/2019/12/04/world/00astor/00astor-videoSixteenByNine540.jpg', 'height': 304, 'width': 540, 'legacy': {}, 'subType': 'videoSixteenByNine540', 'crop_name': 'videoSixteenByNine540'}, {'rank': 0, 'subtype': 'videoSixteenByNine495', 'caption': None, 'credit': None, 'type': 'image', 'url': 'images/2019/12/04/world/00astor/00astor-videoSixteenByNine495.jpg', 'height': 278, 'width': 495, 'legacy': {}, 'subType': 'videoSixteenByNine495', 'crop_name': 'videoSixteenByNine495'}, {'rank': 0, 'subtype': 'videoSixteenByNine390', 'caption': None, 'credit': None, 'type': 'image', 'url': 'images/2019/12/04/world/00astor/00astor-videoSixteenByNine390.jpg', 'height': 219, 'width': 390, 'legacy': {}, 'subType': 'videoSixteenByNine390', 'crop_name': 'videoSixteenByNine390'}, {'rank': 0, 'subtype': 'videoSixteenByNine1050', 'caption': None, 'credit': None, 'type': 'image', 'url': 'images/2019/12/04/world/00astor/00astor-videoSixteenByNine1050.jpg', 'height': 591, 'width': 1050, 'legacy': {}, 'subType': 'videoSixteenByNine1050', 'crop_name': 'videoSixteenByNine1050'}, {'rank': 0, 'subtype': 'videoSixteenByNine480', 'caption': None, 'credit': None, 'type': 'image', 'url': 'images/2019/12/04/world/00astor/00astor-videoSixteenByNine480.jpg', 'height': 270, 'width': 480, 'legacy': {}, 'subType': 'videoSixteenByNine480', 'crop_name': 'videoSixteenByNine480'}, {'rank': 0, 'subtype': 'videoSixteenByNine310', 'caption': None, 'credit': None, 'type': 'image', 'url': 'images/2019/12/04/world/00astor/00astor-videoSixteenByNine310.jpg', 'height': 174, 'width': 310, 'legacy': {}, 'subType': 'videoSixteenByNine310', 'crop_name': 'videoSixteenByNine310'}, {'rank': 0, 'subtype': 'videoSixteenByNine225', 'caption': None, 'credit': None, 'type': 'image', 'url': 'images/2019/12/04/world/00astor/00astor-videoSixteenByNine225.jpg', 'height': 126, 'width': 225, 'legacy': {}, 'subType': 'videoSixteenByNine225', 'crop_name': 'videoSixteenByNine225'}, {'rank': 0, 'subtype': 'videoSixteenByNine96', 'caption': None, 'credit': None, 'type': 'image', 'url': 'images/2019/12/04/world/00astor/00astor-videoSixteenByNine96.jpg', 'height': 54, 'width': 96, 'legacy': {}, 'subType': 'videoSixteenByNine96', 'crop_name': 'videoSixteenByNine96'}, {'rank': 0, 'subtype': 'videoSixteenByNine768', 'caption': None, 'credit': None, 'type': 'image', 'url': 'images/2019/12/04/world/00astor/00astor-videoSixteenByNine768.jpg', 'height': 432, 'width': 768, 'legacy': {}, 'subType': 'videoSixteenByNine768', 'crop_name': 'videoSixteenByNine768'}, {'rank': 0, 'subtype': 'videoSixteenByNine150', 'caption': None, 'credit': None, 'type': 'image', 'url': 'images/2019/12/04/world/00astor/00astor-videoSixteenByNine150.jpg', 'height': 84, 'width': 150, 'legacy': {}, 'subType': 'videoSixteenByNine150', 'crop_name': 'videoSixteenByNine150'}, {'rank': 0, 'subtype': 'videoSixteenByNineJumbo1600', 'caption': None, 'credit': None, 'type': 'image', 'url': 'images/2019/12/04/world/00astor/00astor-videoSixteenByNineJumbo1600.jpg', 'height': 900, 'width': 1600, 'legacy': {}, 'subType': 'videoSixteenByNineJumbo1600', 'crop_name': 'videoSixteenByNineJumbo1600'}, {'rank': 0, 'subtype': 'miniMoth', 'caption': None, 'credit': None, 'type': 'image', 'url': 'images/2019/12/04/world/00astor/00astor-miniMoth.jpg', 'height': 70, 'width': 151, 'legacy': {}, 'subType': 'miniMoth', 'crop_name': 'miniMoth'}, {'rank': 0, 'subtype': 'windowsTile336H', 'caption': None, 'credit': None, 'type': 'image', 'url': 'images/2019/12/04/world/00astor/00astor-windowsTile336H.jpg', 'height': 336, 'width': 694, 'legacy': {}, 'subType': 'windowsTile336H', 'crop_name': 'windowsTile336H'}, {'rank': 0, 'subtype': 'videoFifteenBySeven1305', 'caption': None, 'credit': None, 'type': 'image', 'url': 'images/2019/12/04/world/00astor/00astor-videoFifteenBySeven1305.jpg', 'height': 609, 'width': 1305, 'legacy': {}, 'subType': 'videoFifteenBySeven1305', 'crop_name': 'videoFifteenBySeven1305'}, {'rank': 0, 'subtype': 'videoFifteenBySeven2610', 'caption': None, 'credit': None, 'type': 'image', 'url': 'images/2019/12/04/world/00astor/00astor-videoFifteenBySeven2610.jpg', 'height': 1218, 'width': 2610, 'legacy': {}, 'subType': 'videoFifteenBySeven2610', 'crop_name': 'videoFifteenBySeven2610'}, {'rank': 0, 'subtype': 'facebookJumbo', 'caption': None, 'credit': None, 'type': 'image', 'url': 'images/2019/12/04/world/00astor/00astor-facebookJumbo.jpg', 'height': 550, 'width': 1050, 'legacy': {}, 'subType': 'facebookJumbo', 'crop_name': 'facebookJumbo'}, {'rank': 0, 'subtype': 'watch308', 'caption': None, 'credit': None, 'type': 'image', 'url': 'images/2019/12/04/world/00astor/00astor-watch308.jpg', 'height': 348, 'width': 312, 'legacy': {}, 'subType': 'watch308', 'crop_name': 'watch308'}, {'rank': 0, 'subtype': 'watch268', 'caption': None, 'credit': None, 'type': 'image', 'url': 'images/2019/12/04/world/00astor/00astor-watch268.jpg', 'height': 303, 'width': 272, 'legacy': {}, 'subType': 'watch268', 'crop_name': 'watch268'}, {'rank': 0, 'subtype': 'verticalTwoByThree735', 'caption': None, 'credit': None, 'type': 'image', 'url': 'images/2019/12/04/world/00astor/00astor-verticalTwoByThree735.jpg', 'height': 1103, 'width': 735, 'legacy': {}, 'subType': 'verticalTwoByThree735', 'crop_name': 'verticalTwoByThree735'}, {'rank': 0, 'subtype': 'mobileMasterAt3x', 'caption': None, 'credit': None, 'type': 'image', 'url': 'images/2019/12/04/world/00astor/merlin_165426885_596dd233-2335-4b7c-939d-af7ed52c08c5-mobileMasterAt3x.jpg', 'height': 2429, 'width': 1800, 'legacy': {}, 'subType': 'mobileMasterAt3x', 'crop_name': 'mobileMasterAt3x'}]","[{'name': 'subject', 'value': 'ANTI-SEMITISM', 'rank': 1, 'major': 'N'}, {'name': 'subject', 'value': 'Legislatures and Parliaments', 'rank': 2, 'major': 'N'}, {'name': 'subject', 'value': 'Women and Girls', 'rank': 3, 'major': 'N'}, {'name': 'organizations', 'value': 'Cliveden House & Pavilion Spa (Berkshire, England, Hotel)', 'rank': 4, 'major': 'N'}, {'name': 'organizations', 'value': 'Conservative Party (Great Britain)', 'rank': 5, 'major': 'N'}, {'name': 'organizations', 'value': 'House of Commons (Great Britain)', 'rank': 6, 'major': 'N'}, {'name': 'persons', 'value': 'Churchill, Winston Leonard Spencer', 'rank': 7, 'major': 'N'}, {'name': 'persons', 'value': 'ASTOR, NANCY', 'rank': 8, 'major': 'N'}, {'name': 'persons', 'value': 'Astor, Waldorf', 'rank': 9, 'major': 'N'}]",2019-12-22T09:32:50+0000,article,Foreign,World,Europe,News,nyt://article/48c92693-3193-5ea1-84f3-4794b1362b2a,1363,nyt://article/48c92693-3193-5ea1-84f3-4794b1362b2a,"U.K. Honors a Flawed Feminist Trailblazer, Nancy Astor",,,Britain Honors a Flawed Feminist Pioneer,,,,By Stephen Castle,"[{'firstname': 'Stephen', 'middlename': None, 'lastname': 'Castle', 'qualifier': None, 'title': None, 'role': 'reported', 'organization': '', 'rank': 1}]",,A,8
