,abstract,web_url,snippet,lead_paragraph,source,multimedia,keywords,pub_date,document_type,news_desk,section_name,subsection_name,type_of_material,_id,word_count,uri,headline_main,headline_kicker,headline_content_kicker,headline_print_headline,headline_name,headline_seo,headline_sub,byline_original,byline_person,byline_organization,print_section,print_page
0,"Markquis Nowell had a season-high 33 points, including three 3-pointers in the final 35 seconds, as Arkansas-Little Rock edged Louisiana-Monroe 73-72 in a Sun Belt Conference opener on Thursday night.",https://www.nytimes.com/aponline/2019/12/19/sports/ncaabasketball/bc-bkc-ualr-louisiana-monroe.html,"Markquis Nowell had a season-high 33 points, including three 3-pointers in the final 35 seconds, as Arkansas-Little Rock edged Louisiana-Monroe 73-72 in a Sun Belt Conference opener on Thursday night.","MONROE, La. — Markquis Nowell had a season-high 33 points, including three 3-pointers in the final 35 seconds, as Arkansas-Little Rock edged Louisiana-Monroe 73-72 in a Sun Belt Conference opener on Thursday night.",AP,[],[],2019-12-20T04:09:32+0000,article,None,Sports,College Basketball,News,nyt://article/8bc51889-47c2-5c8f-ade7-b8bdd09758d2,191,nyt://article/8bc51889-47c2-5c8f-ade7-b8bdd09758d2,"Nowell Leads UALR's Comeback Win Over UL-Monroe, 73-72",,,"Nowell Leads UALR's Comeback Win Over UL-Monroe, 73-72",,,,By The Associated Press,[],The Associated Press,,
1,Karibeeran Parameshvaran and his wife Choodamani contemplated suicide after losing three children to giant waves triggered by a 9.1-magnitude quake fifteen years ago.,https://www.nytimes.com/reuters/2019/12/19/world/asia/19reuters-indianocean-tsunami-india-couple.html,Karibeeran Parameshvaran and his wife Choodamani contemplated suicide after losing three children to giant waves triggered by a 9.1-magnitude quake fifteen years ago.,"NAGAPATTINAM, India — Karibeeran Parameshvaran and his wife Choodamani contemplated suicide after losing three children to giant waves triggered by a 9.1-magnitude quake fifteen years ago.",Reuters,[],[],2019-12-20T04:06:38+0000,article,None,World,Asia Pacific,News,nyt://article/34a84558-d6fc-5bae-825b-0d36935d8ca8,320,nyt://article/34a84558-d6fc-5bae-825b-0d36935d8ca8,An Orphanage Called Hope: Indian Couple Rebuilds Lives After Losing Own Children to Tsunami,,,An Orphanage Called Hope: Indian Couple Rebuilds Lives After Losing Own Children to Tsunami,,,,By Reuters,[],Reuters,,
2,"Malaysian teenage Scrabble protege Tengku Ariff Shah can spell more English words than most adults in the Western world, but he doesn't always know what they mean. ",https://www.nytimes.com/reuters/2019/12/19/world/europe/19reuters-asia-scrabble.html,"Malaysian teenage Scrabble protege Tengku Ariff Shah can spell more English words than most adults in the Western world, but he doesn't always know what they mean. ","KUALA LUMPUR — Malaysian teenage Scrabble protege Tengku Ariff Shah can spell more English words than most adults in the Western world, but he doesn't always know what they mean. ",Reuters,[],[],2019-12-20T04:06:36+0000,article,None,World,Europe,News,nyt://article/d711b615-d2c8-535e-9744-8ec4824ba8fc,497,nyt://article/d711b615-d2c8-535e-9744-8ec4824ba8fc,Scrabble Casts Spell Over Asia With Welsh Hugs and Mustard Seeds,,,Scrabble Casts Spell Over Asia With Welsh Hugs and Mustard Seeds,,,,By Reuters,[],Reuters,,
3,Patrick Kane was glad the Chicago Blackhawks kept their cool.,https://www.nytimes.com/aponline/2019/12/19/sports/hockey/bc-hkn-blackhawks-jets.html,Patrick Kane was glad the Chicago Blackhawks kept their cool.,"WINNIPEG, Manitoba — Patrick Kane was glad the Chicago Blackhawks kept their cool.",AP,[],[],2019-12-20T04:06:28+0000,article,None,Sports,Hockey,News,nyt://article/c2c1dd04-2d0e-53e0-ad52-d3e26831de56,449,nyt://article/c2c1dd04-2d0e-53e0-ad52-d3e26831de56,"Kane Has Goal, 3 Assists in Blackhawks' 4-1 Win Over Jets",,,"Kane Has Goal, 3 Assists in Blackhawks' 4-1 Win Over Jets",,,,By The Associated Press,[],The Associated Press,,
4,"Evan Battey made a point of going to the basket, taking high-percentage shots and drawing fouls in the process.",https://www.nytimes.com/aponline/2019/12/19/sports/ncaabasketball/bc-bkc-prairie-view-am-colorado.html,"Evan Battey made a point of going to the basket, taking high-percentage shots and drawing fouls in the process.","BOULDER, Colo. — Evan Battey made a point of going to the basket, taking high-percentage shots and drawing fouls in the process.",AP,[],[],2019-12-20T04:00:33+0000,article,None,Sports,College Basketball,News,nyt://article/4fc38316-cdb0-552f-972f-382628c3e5af,572,nyt://article/4fc38316-cdb0-552f-972f-382628c3e5af,"Battey Scores 20, Colorado Beats Prairie View A&M 83-64",,,"Battey Scores 20, Colorado Beats Prairie View A&M 83-64",,,,By The Associated Press,[],The Associated Press,,
5,Giannis Antetokounmpo looked over at LeBron James and Anthony Davis and thought about his past.,https://www.nytimes.com/aponline/2019/12/19/sports/basketball/bc-bkn-lakers-bucks.html,Giannis Antetokounmpo looked over at LeBron James and Anthony Davis and thought about his past.,MILWAUKEE — Giannis Antetokounmpo looked over at LeBron James and Anthony Davis and thought about his past.,AP,[],[],2019-12-20T04:00:32+0000,article,None,Sports,Pro Basketball,News,nyt://article/1c23f228-97f9-5f13-b3ce-cb0f27a6be6e,560,nyt://article/1c23f228-97f9-5f13-b3ce-cb0f27a6be6e,"Antetokounmpo, Bucks Beat Davis-Led Lakers 111-104",,,"Antetokounmpo, Bucks Beat Davis-Led Lakers 111-104",,,,By The Associated Press,[],The Associated Press,,
