,abstract,web_url,snippet,lead_paragraph,source,multimedia,keywords,pub_date,document_type,news_desk,section_name,type_of_material,_id,word_count,uri,headline_main,headline_kicker,headline_content_kicker,headline_print_headline,headline_name,headline_seo,headline_sub,byline_original,byline_person,byline_organization,subsection_name,print_section,print_page
0,"U.S. fuel card company FleetCor Technologies Inc charged customers hundreds of millions of dollars in hidden fees after promising to help them spend less on fuel, the Federal Trade Commission said on Friday.",https://www.nytimes.com/reuters/2019/12/20/technology/20reuters-usa-fleetcor-ftc.html,"U.S. fuel card company FleetCor Technologies Inc charged customers hundreds of millions of dollars in hidden fees after promising to help them spend less on fuel, the Federal Trade Commission said on Friday.","WASHINGTON — U.S. fuel card company FleetCor Technologies Inc charged customers hundreds of millions of dollars in hidden fees after promising to help them spend less on fuel, the Federal Trade Commission said on Friday.",Reuters,[],[],2019-12-20T19:58:21+0000,article,None,Technology,News,nyt://article/9b652a63-680e-5f78-856b-0043ca6d9ff0,234,nyt://article/9b652a63-680e-5f78-856b-0043ca6d9ff0,U.S. Accuses FleetCor of Charging Hundreds of Millions of Dollars in Hidden Fees,,,U.S. Accuses FleetCor of Charging Hundreds of Millions of Dollars in Hidden Fees,,,,By Reuters,[],Reuters,,,
1,"The European Union will insist on guarantees of a level-playing field in any agreement on future ties with Britain after Brexit, the chairman of EU leaders said on Friday.",https://www.nytimes.com/reuters/2019/12/20/world/europe/20reuters-britain-eu-michel.html,"The European Union will insist on guarantees of a level-playing field in any agreement on future ties with Britain after Brexit, the chairman of EU leaders said on Friday.","BRUSSELS — The European Union will insist on guarantees of a level-playing field in any agreement on future ties with Britain after Brexit, the chairman of EU leaders said on Friday.",Reuters,[],[],2019-12-20T19:58:12+0000,article,None,World,News,nyt://article/f96218bc-6e68-5158-b3b5-ac526a602156,77,nyt://article/f96218bc-6e68-5158-b3b5-ac526a602156,Level Playing Field a Must for Future EU-UK Ties-EU's Michel,,,Level Playing Field a Must for Future EU-UK Ties-EU's Michel,,,,By Reuters,[],Reuters,Europe,,
2,"Minnesota Sen. Amy Klobuchar has argued for weeks that Pete Buttigieg, the mayor of a small Indiana city, doesn't have enough experience to be a serious contender for the Democratic nomination for president. As she heads into a 27-county tour  of Iowa, the lead-off caucus state, s he's seeing some payoff for bringing those frustrations  fully into public view. ",https://www.nytimes.com/aponline/2019/12/20/us/politics/ap-us-election-2020-klobuchar-buttigieg.html,"Minnesota Sen. Amy Klobuchar has argued for weeks that Pete Buttigieg, the mayor of a small Indiana city, doesn't have enough experience to be a serious contender for the Democratic nomination for president. As she heads into a 27-county tour  of ...","CENTERVILLE, Iowa — Minnesota Sen. Amy Klobuchar has argued for weeks that Pete Buttigieg, the mayor of a small Indiana city, doesn't have enough experience to be a serious contender for the Democratic nomination for president. As she heads into a 27-county tour of Iowa, the lead-off caucus state, s he's seeing some payoff for bringing those frustrations fully into public view. ",AP,[],[],2019-12-20T19:57:33+0000,article,None,U.S.,News,nyt://article/a502b7b6-8b88-5bea-8fb2-c2d92742db68,881,nyt://article/a502b7b6-8b88-5bea-8fb2-c2d92742db68,Klobuchar Steps Up Hits on Buttigieg With Iowa Vote Looming,,,Klobuchar Steps Up Hits on Buttigieg With Iowa Vote Looming,,,,By The Associated Press,[],The Associated Press,Politics,,
