,abstract,web_url,snippet,lead_paragraph,source,multimedia,keywords,pub_date,document_type,news_desk,section_name,type_of_material,_id,word_count,uri,headline_main,headline_kicker,headline_content_kicker,headline_print_headline,headline_name,headline_seo,headline_sub,byline_original,byline_person,byline_organization,subsection_name,print_section,print_page
0,"President Donald Trump on Saturday said the United States and China would ""very shortly"" sign their so-called Phase One trade pact.",https://www.nytimes.com/reuters/2019/12/22/business/22reuters-usa-trump-trade.html,"President Donald Trump on Saturday said the United States and China would ""very shortly"" sign their so-called Phase One trade pact.","WEST PALM BEACH, Fla. — President Donald Trump on Saturday said the United States and China would ""very shortly"" sign their so-called Phase One trade pact.",Reuters,[],[],2019-12-22T06:15:31+0000,article,None,Business Day,News,nyt://article/291e1c38-debc-503d-a279-1b13475ab00d,150,nyt://article/291e1c38-debc-503d-a279-1b13475ab00d,Trump Says Trade Deal With China to Be Signed 'Very Shortly',,,Trump Says Trade Deal With China to Be Signed 'Very Shortly',,,,By Reuters,[],Reuters,,,
1,"U.S. President Donald Trump has invited British Prime Minister Boris Johnson to visit him in the White House in the new year, British media reported on Sunday.",https://www.nytimes.com/reuters/2019/12/22/world/europe/22reuters-britain-eu-usa-trump.html,"U.S. President Donald Trump has invited British Prime Minister Boris Johnson to visit him in the White House in the new year, British media reported on Sunday.","(Reuters) - U.S. President Donald Trump has invited British Prime Minister Boris Johnson to visit him in the White House in the new year, British media reported on Sunday.",Reuters,[],[],2019-12-22T05:54:29+0000,article,None,World,News,nyt://article/cdee8863-27cb-542f-a2fc-23e062db88c0,390,nyt://article/cdee8863-27cb-542f-a2fc-23e062db88c0,Trump Invites UK's Johnson to White House in New Year: British Media,,,Trump Invites UK's Johnson to White House in New Year: British Media,,,,By Reuters,[],Reuters,Europe,,
2,"North Korean leader Kim Jong Un held a meeting of top military officials to discuss boosting the country's military capability, state news agency reported on Sunday amid heightened concern the North may be about to return to confrontation with Washington.",https://www.nytimes.com/reuters/2019/12/22/world/asia/22reuters-northkorea-missiles.html,"North Korean leader Kim Jong Un held a meeting of top military officials to discuss boosting the country's military capability, state news agency reported on Sunday amid heightened concern the North may be about to return to confrontation with Was...","SEOUL — North Korean leader Kim Jong Un held a meeting of top military officials to discuss boosting the country's military capability, state news agency reported on Sunday amid heightened concern the North may be about to return to confrontation with Washington.",Reuters,[],[],2019-12-22T05:51:32+0000,article,None,World,News,nyt://article/2b6368ad-995f-599c-b877-5553989e9c8a,364,nyt://article/2b6368ad-995f-599c-b877-5553989e9c8a,North Korea's Kim Holds Military Meeting as Tension Rises Under Looming Deadline,,,North Korea's Kim Holds Military Meeting as Tension Rises Under Looming Deadline,,,,By Reuters,[],Reuters,Asia Pacific,,
3,"U.S. President Donald Trump spoke on Saturday with Japanese Prime Minister Shinzo Abe about developments related to North Korea, Iran, and trade, a White House spokesman said.",https://www.nytimes.com/reuters/2019/12/21/world/asia/21reuters-trump-japan-trade.html,"U.S. President Donald Trump spoke on Saturday with Japanese Prime Minister Shinzo Abe about developments related to North Korea, Iran, and trade, a White House spokesman said.","WASHINGTON — U.S. President Donald Trump spoke on Saturday with Japanese Prime Minister Shinzo Abe about developments related to North Korea, Iran, and trade, a White House spokesman said.",Reuters,[],[],2019-12-22T03:27:35+0000,article,None,World,News,nyt://article/f8762f06-f61f-5e63-8c09-f47d65437a74,104,nyt://article/f8762f06-f61f-5e63-8c09-f47d65437a74,Trump and Japan's Abe Spoke About North Korea: White House Spokesman,,,Trump and Japan's Abe Spoke About North Korea: White House Spokesman,,,,By Reuters,[],Reuters,Asia Pacific,,
4,North Korea said Sunday leader Kim Jong Un has convened a key ruling party meeting to decide on steps to bolster the country’s military capability.,https://www.nytimes.com/aponline/2019/12/21/world/asia/ap-as-north-korea-us.html,North Korea said Sunday leader Kim Jong Un has convened a key ruling party meeting to decide on steps to bolster the country’s military capability.,"SEOUL, South Korea — North Korea said Sunday leader Kim Jong Un has convened a key ruling party meeting to decide on steps to bolster the country’s military capability.",AP,[],[],2019-12-22T03:18:28+0000,article,None,World,News,nyt://article/e9affdaa-b112-56a9-8efa-c4d00a1c1c1e,354,nyt://article/e9affdaa-b112-56a9-8efa-c4d00a1c1c1e,N Korean Leader Holds Party Meeting to Bolster Military,,,N Korean Leader Holds Party Meeting to Bolster Military,,,,By The Associated Press,[],The Associated Press,Asia Pacific,,
5,"U.S. President Donald Trump has invited British Prime Minister Boris Johnson to visit him in the White House in the new year, Britain's Sunday Times newspaper reported.",https://www.nytimes.com/reuters/2019/12/21/world/europe/21reuters-britain-eu-usa-trump.html,"U.S. President Donald Trump has invited British Prime Minister Boris Johnson to visit him in the White House in the new year, Britain's Sunday Times newspaper reported.","(Reuters) - U.S. President Donald Trump has invited British Prime Minister Boris Johnson to visit him in the White House in the new year, Britain's Sunday Times newspaper reported.",Reuters,[],[],2019-12-22T02:42:33+0000,article,None,World,News,nyt://article/21432c0f-fc7a-5848-8b0d-695c5cc2dc89,248,nyt://article/21432c0f-fc7a-5848-8b0d-695c5cc2dc89,Trump Invites Britain's Johnson to the White House in New Year: Sunday Times,,,Trump Invites Britain's Johnson to the White House in New Year: Sunday Times,,,,By Reuters,[],Reuters,Europe,,
6,"The spectre of new confrontation between Pyongyang and Washington hangs over meetings between China, Japan and South Korea this week, with growing risks North Korean actions could end an uneasy detente and upend recent diplomatic efforts.",https://www.nytimes.com/reuters/2019/12/21/world/asia/21reuters-china-japan-southkorea.html,"The spectre of new confrontation between Pyongyang and Washington hangs over meetings between China, Japan and South Korea this week, with growing risks North Korean actions could end an uneasy detente and upend recent diplomatic efforts.","BEIJING — The spectre of new confrontation between Pyongyang and Washington hangs over meetings between China, Japan and South Korea this week, with growing risks North Korean actions could end an uneasy detente and upend recent diplomatic efforts.",Reuters,[],[],2019-12-22T02:39:31+0000,article,None,World,News,nyt://article/328f33fc-5055-5e48-aec9-aa67f3c1eff8,474,nyt://article/328f33fc-5055-5e48-aec9-aa67f3c1eff8,"North Korea Threat Looms as China, Japan, South Korea Leaders Meet",,,"North Korea Threat Looms as China, Japan, South Korea Leaders Meet",,,,By Reuters,[],Reuters,Asia Pacific,,
7,"You protest, they watch.",https://www.nytimes.com/interactive/2019/12/21/opinion/location-data-democracy-protests.html,"You protest, they watch.","You protest, they watch.",The New York Times,[],"[{'name': 'subject', 'value': 'Hong Kong Protests (2019)', 'rank': 1, 'major': 'N'}, {'name': 'subject', 'value': 'Surveillance of Citizens by Government', 'rank': 2, 'major': 'N'}, {'name': 'subject', 'value': 'United States Politics and Government', 'rank': 3, 'major': 'N'}, {'name': 'subject', 'value': 'Presidential Election of 2020', 'rank': 4, 'major': 'N'}, {'name': 'subject', 'value': 'Data-Mining and Database Marketing', 'rank': 5, 'major': 'N'}, {'name': 'subject', 'value': 'Privacy', 'rank': 6, 'major': 'N'}, {'name': 'persons', 'value': 'Trump, Donald J', 'rank': 7, 'major': 'N'}]",2019-12-22T02:05:40+0000,multimedia,Opinion,Opinion,Interactive Feature,nyt://interactive/3a8de738-b3a4-5ba2-bd12-c379013d81e1,0,nyt://interactive/3a8de738-b3a4-5ba2-bd12-c379013d81e1,How Your Phone Betrays Democracy,,,,,,,By Charlie Warzel and Stuart A. Thompson,"[{'firstname': 'Charlie', 'middlename': None, 'lastname': 'Warzel', 'qualifier': None, 'title': None, 'role': 'reported', 'organization': '', 'rank': 1}, {'firstname': 'Stuart', 'middlename': 'A.', 'lastname': 'Thompson', 'qualifier': None, 'title': None, 'role': 'reported', 'organization': '', 'rank': 2}]",,,,
