,abstract,web_url,snippet,lead_paragraph,source,multimedia,keywords,pub_date,document_type,news_desk,section_name,type_of_material,_id,word_count,uri,headline_main,headline_kicker,headline_content_kicker,headline_print_headline,headline_name,headline_seo,headline_sub,byline_original,byline_person,byline_organization,subsection_name,print_section,print_page
0,"The Trump administration plans to stick with its proposed 2020 biofuel blending requirements, the White House said on Wednesday, despite anger among farmers that the plan does too little for corn growers.",https://www.nytimes.com/reuters/2019/12/18/business/18reuters-usa-biofuels-exclusive.html,"The Trump administration plans to stick with its proposed 2020 biofuel blending requirements, the White House said on Wednesday, despite anger among farmers that the plan does too little for corn growers.","NEW YORK — The Trump administration plans to stick with its proposed 2020 biofuel blending requirements, the White House said on Wednesday, despite anger among farmers that the plan does too little for corn growers.",Reuters,[],[],2019-12-18T16:24:39+0000,article,None,Business Day,News,nyt://article/b405c1a0-ea8d-5fa7-ac07-f5a9f4131ce2,550,nyt://article/b405c1a0-ea8d-5fa7-ac07-f5a9f4131ce2,"White House Says It Is Sticking With 2020 Biofuel Plan, Despite Farmer Objections",,,"White House Says It Is Sticking With 2020 Biofuel Plan, Despite Farmer Objections",,,,By Reuters,[],Reuters,,,
1,"The U.S. Senate Foreign Relations Committee approved legislation on Wednesday that would impose sanctions on Russia, but there was no indication of when the full Senate might vote on the measure that one sponsor called the sanctions bill ""from hell.""",https://www.nytimes.com/reuters/2019/12/18/world/europe/18reuters-usa-russia-sanctions.html,"The U.S. Senate Foreign Relations Committee approved legislation on Wednesday that would impose sanctions on Russia, but there was no indication of when the full Senate might vote on the measure that one sponsor called the sanctions bill ""from hel...","WASHINGTON — The U.S. Senate Foreign Relations Committee approved legislation on Wednesday that would impose sanctions on Russia, but there was no indication of when the full Senate might vote on the measure that one sponsor called the sanctions bill ""from hell.""",Reuters,[],[],2019-12-18T16:21:51+0000,article,None,World,News,nyt://article/b527bfb0-19f4-5c9f-b9fc-6b0911cc628c,409,nyt://article/b527bfb0-19f4-5c9f-b9fc-6b0911cc628c,Senate Panel Advances Russia Sanctions Bill 'From Hell',,,Senate Panel Advances Russia Sanctions Bill 'From Hell',,,,By Reuters,[],Reuters,Europe,,
2,"The United States and India agreed on Wednesday to expand defense, science and technology cooperation as Secretary of State Mike Pompeo said impeachment would not distract the Trump administration on national security matters",https://www.nytimes.com/aponline/2019/12/18/us/politics/ap-us-united-states-india.html,"The United States and India agreed on Wednesday to expand defense, science and technology cooperation as Secretary of State Mike Pompeo said impeachment would not distract the Trump administration on national security matters","WASHINGTON — The United States and India agreed on Wednesday to expand defense, science and technology cooperation as Secretary of State Mike Pompeo said impeachment would not distract the Trump administration on national security matters",AP,[],[],2019-12-18T16:21:39+0000,article,None,U.S.,News,nyt://article/ee42a682-46c3-5ef1-b52f-33209bbef604,665,nyt://article/ee42a682-46c3-5ef1-b52f-33209bbef604,US and India Pledge Cooperation as Domestic Crises Play Out,,,US and India Pledge Cooperation as Domestic Crises Play Out,,,,By The Associated Press,[],The Associated Press,Politics,,
