,abstract,web_url,snippet,lead_paragraph,source,multimedia,keywords,pub_date,document_type,news_desk,section_name,type_of_material,_id,word_count,uri,headline_main,headline_kicker,headline_content_kicker,headline_print_headline,headline_name,headline_seo,headline_sub,byline_original,byline_person,byline_organization,subsection_name,print_section,print_page
4,"A lawyer for a Ukrainian oligarch on Wednesday said he had lent $1 million to Lev Parnas, an associate of U.S. President Donald Trump's personal lawyer Rudy Giuliani, and Parnas' wife in order for them to buy a home in Florida.",https://www.nytimes.com/reuters/2019/12/18/us/politics/18reuters-usa-trump-giuliani-parnas.html,"A lawyer for a Ukrainian oligarch on Wednesday said he had lent $1 million to Lev Parnas, an associate of U.S. President Donald Trump's personal lawyer Rudy Giuliani, and Parnas' wife in order for them to buy a home in Florida.","DUBAI — A lawyer for a Ukrainian oligarch on Wednesday said he had lent $1 million to Lev Parnas, an associate of U.S. President Donald Trump's personal lawyer Rudy Giuliani, and Parnas' wife in order for them to buy a home in Florida.",Reuters,[],[],2019-12-18T15:24:57+0000,article,None,U.S.,News,nyt://article/06e93365-dc45-562d-9bbc-578e91e8830a,401,nyt://article/06e93365-dc45-562d-9bbc-578e91e8830a,Exclusive: Ukrainian Tycoon's Lawyer Says He Lent Money to Giuliani Associate,,,Exclusive: Ukrainian Tycoon's Lawyer Says He Lent Money to Giuliani Associate,,,,By Reuters,[],Reuters,Politics,,
5,"The Democratic-controlled U.S. House of Representatives will vote on Wednesday to formally charge President Donald Trump, a Republican, with ""high crimes and misdemeanors,"" making him only the third U.S. president in history to be impeached. ",https://www.nytimes.com/reuters/2019/12/18/world/europe/18reuters-usa-trump-impeachment-case-explainer.html,"The Democratic-controlled U.S. House of Representatives will vote on Wednesday to formally charge President Donald Trump, a Republican, with ""high crimes and misdemeanors,"" making him only the third U.S. president in history to be impeached. ","WASHINGTON — The Democratic-controlled U.S. House of Representatives will vote on Wednesday to formally charge President Donald Trump, a Republican, with ""high crimes and misdemeanors,"" making him only the third U.S. president in history to be impeached. ",Reuters,[],[],2019-12-18T15:22:00+0000,article,None,World,News,nyt://article/b1be4401-22ba-5fc0-9391-54b384004d7a,736,nyt://article/b1be4401-22ba-5fc0-9391-54b384004d7a,Explainer: The Case for Trump's Impeachment-And the Case Against It,,,Explainer: The Case for Trump's Impeachment-And the Case Against It,,,,By Reuters,[],Reuters,Europe,,
6,The decision was a setback to efforts by a district attorney to ensure Mr. Manafort would still face prison time if President Trump pardoned him.,https://www.nytimes.com/2019/12/18/nyregion/paul-manafort-ny-fraud-charges.html,The decision was a setback to efforts by a district attorney to ensure Mr. Manafort would still face prison time if President Trump pardoned him.,"A New York judge on Wednesday threw out state fraud charges against Paul J. Manafort, President Trump’s former campaign chairman, dealing a setback to efforts by the Manhattan district attorney to ensure Mr. Manafort would still face prosecution should Mr. Trump pardon him for his federal crimes.",The New York Times,"[{'rank': 0, 'subtype': 'xlarge', 'caption': None, 'credit': None, 'type': 'image', 'url': 'images/2019/12/18/nyregion/18nymanafort/18nymanafort-articleLarge.jpg', 'height': 400, 'width': 600, 'legacy': {'xlarge': 'images/2019/12/18/nyregion/18nymanafort/18nymanafort-articleLarge.jpg', 'xlargewidth': 600, 'xlargeheight': 400}, 'subType': 'xlarge', 'crop_name': 'articleLarge'}, {'rank': 0, 'subtype': 'popup', 'caption': None, 'credit': None, 'type': 'image', 'url': 'images/2019/12/18/nyregion/18nymanafort/18nymanafort-popup.jpg', 'height': 433, 'width': 650, 'legacy': {}, 'subType': 'popup', 'crop_name': 'popup'}, {'rank': 0, 'subtype': 'blog480', 'caption': None, 'credit': None, 'type': 'image', 'url': 'images/2019/12/18/nyregion/18nymanafort/18nymanafort-blog480.jpg', 'height': 320, 'width': 480, 'legacy': {}, 'subType': 'blog480', 'crop_name': 'blog480'}, {'rank': 0, 'subtype': 'blog533', 'caption': None, 'credit': None, 'type': 'image', 'url': 'images/2019/12/18/nyregion/18nymanafort/18nymanafort-blog533.jpg', 'height': 355, 'width': 533, 'legacy': {}, 'subType': 'blog533', 'crop_name': 'blog533'}, {'rank': 0, 'subtype': 'blog427', 'caption': None, 'credit': None, 'type': 'image', 'url': 'images/2019/12/18/nyregion/18nymanafort/18nymanafort-blog427.jpg', 'height': 285, 'width': 427, 'legacy': {}, 'subType': 'blog427', 'crop_name': 'blog427'}, {'rank': 0, 'subtype': 'tmagSF', 'caption': None, 'credit': None, 'type': 'image', 'url': 'images/2019/12/18/nyregion/18nymanafort/18nymanafort-tmagSF.jpg', 'height': 241, 'width': 362, 'legacy': {}, 'subType': 'tmagSF', 'crop_name': 'tmagSF'}, {'rank': 0, 'subtype': 'tmagArticle', 'caption': None, 'credit': None, 'type': 'image', 'url': 'images/2019/12/18/nyregion/18nymanafort/18nymanafort-tmagArticle.jpg', 'height': 395, 'width': 592, 'legacy': {}, 'subType': 'tmagArticle', 'crop_name': 'tmagArticle'}, {'rank': 0, 'subtype': 'slide', 'caption': None, 'credit': None, 'type': 'image', 'url': 'images/2019/12/18/nyregion/18nymanafort/18nymanafort-slide.jpg', 'height': 400, 'width': 600, 'legacy': {}, 'subType': 'slide', 'crop_name': 'slide'}, {'rank': 0, 'subtype': 'jumbo', 'caption': None, 'credit': None, 'type': 'image', 'url': 'images/2019/12/18/nyregion/18nymanafort/18nymanafort-jumbo.jpg', 'height': 683, 'width': 1024, 'legacy': {}, 'subType': 'jumbo', 'crop_name': 'jumbo'}, {'rank': 0, 'subtype': 'superJumbo', 'caption': None, 'credit': None, 'type': 'image', 'url': 'images/2019/12/18/nyregion/18nymanafort/18nymanafort-superJumbo.jpg', 'height': 1365, 'width': 2048, 'legacy': {}, 'subType': 'superJumbo', 'crop_name': 'superJumbo'}, {'rank': 0, 'subtype': 'blog225', 'caption': None, 'credit': None, 'type': 'image', 'url': 'images/2019/12/18/nyregion/18nymanafort/18nymanafort-blog225.jpg', 'height': 150, 'width': 225, 'legacy': {}, 'subType': 'blog225', 'crop_name': 'blog225'}, {'rank': 0, 'subtype': 'master1050', 'caption': None, 'credit': None, 'type': 'image', 'url': 'images/2019/12/18/nyregion/18nymanafort/18nymanafort-master1050.jpg', 'height': 700, 'width': 1050, 'legacy': {}, 'subType': 'master1050', 'crop_name': 'master1050'}, {'rank': 0, 'subtype': 'master675', 'caption': None, 'credit': None, 'type': 'image', 'url': 'images/2019/12/18/nyregion/18nymanafort/18nymanafort-master675.jpg', 'height': 450, 'width': 675, 'legacy': {}, 'subType': 'master675', 'crop_name': 'master675'}, {'rank': 0, 'subtype': 'master495', 'caption': None, 'credit': None, 'type': 'image', 'url': 'images/2019/12/18/nyregion/18nymanafort/18nymanafort-master495.jpg', 'height': 330, 'width': 495, 'legacy': {}, 'subType': 'master495', 'crop_name': 'master495'}, {'rank': 0, 'subtype': 'master180', 'caption': None, 'credit': None, 'type': 'image', 'url': 'images/2019/12/18/nyregion/18nymanafort/18nymanafort-master180.jpg', 'height': 120, 'width': 180, 'legacy': {}, 'subType': 'master180', 'crop_name': 'master180'}, {'rank': 0, 'subtype': 'master315', 'caption': None, 'credit': None, 'type': 'image', 'url': 'images/2019/12/18/nyregion/18nymanafort/18nymanafort-master315.jpg', 'height': 210, 'width': 315, 'legacy': {}, 'subType': 'master315', 'crop_name': 'master315'}, {'rank': 0, 'subtype': 'master768', 'caption': None, 'credit': None, 'type': 'image', 'url': 'images/2019/12/18/nyregion/18nymanafort/18nymanafort-master768.jpg', 'height': 512, 'width': 768, 'legacy': {}, 'subType': 'master768', 'crop_name': 'master768'}, {'rank': 0, 'subtype': 'thumbnail', 'caption': None, 'credit': None, 'type': 'image', 'url': 'images/2019/12/18/nyregion/18nymanafort/18nymanafort-thumbStandard.jpg', 'height': 75, 'width': 75, 'legacy': {'thumbnail': 'images/2019/12/18/nyregion/18nymanafort/18nymanafort-thumbStandard.jpg', 'thumbnailwidth': 75, 'thumbnailheight': 75}, 'subType': 'thumbnail', 'crop_name': 'thumbStandard'}, {'rank': 0, 'subtype': 'blogSmallThumb', 'caption': None, 'credit': None, 'type': 'image', 'url': 'images/2019/12/18/nyregion/18nymanafort/18nymanafort-blogSmallThumb.jpg', 'height': 50, 'width': 50, 'legacy': {}, 'subType': 'blogSmallThumb', 'crop_name': 'blogSmallThumb'}, {'rank': 0, 'subtype': 'thumbLarge', 'caption': None, 'credit': None, 'type': 'image', 'url': 'images/2019/12/18/nyregion/18nymanafort/18nymanafort-thumbLarge.jpg', 'height': 150, 'width': 150, 'legacy': {}, 'subType': 'thumbLarge', 'crop_name': 'thumbLarge'}, {'rank': 0, 'subtype': 'smallSquare168', 'caption': None, 'credit': None, 'type': 'image', 'url': 'images/2019/12/18/nyregion/18nymanafort/18nymanafort-smallSquare168.jpg', 'height': 168, 'width': 168, 'legacy': {}, 'subType': 'smallSquare168', 'crop_name': 'smallSquare168'}, {'rank': 0, 'subtype': 'smallSquare252', 'caption': None, 'credit': None, 'type': 'image', 'url': 'images/2019/12/18/nyregion/18nymanafort/18nymanafort-smallSquare252.jpg', 'height': 252, 'width': 252, 'legacy': {}, 'subType': 'smallSquare252', 'crop_name': 'smallSquare252'}, {'rank': 0, 'subtype': 'square320', 'caption': None, 'credit': None, 'type': 'image', 'url': 'images/2019/12/18/nyregion/18nymanafort/18nymanafort-square320.jpg', 'height': 320, 'width': 320, 'legacy': {}, 'subType': 'square320', 'crop_name': 'square320'}, {'rank': 0, 'subtype': 'moth', 'caption': None, 'credit': None, 'type': 'image', 'url': 'images/2019/12/18/nyregion/18nymanafort/18nymanafort-moth.jpg', 'height': 151, 'width': 151, 'legacy': {}, 'subType': 'moth', 'crop_name': 'moth'}, {'rank': 0, 'subtype': 'filmstrip', 'caption': None, 'credit': None, 'type': 'image', 'url': 'images/2019/12/18/nyregion/18nymanafort/18nymanafort-filmstrip.jpg', 'height': 190, 'width': 190, 'legacy': {}, 'subType': 'filmstrip', 'crop_name': 'filmstrip'}, {'rank': 0, 'subtype': 'square640', 'caption': None, 'credit': None, 'type': 'image', 'url': 'images/2019/12/18/nyregion/18nymanafort/18nymanafort-square640.jpg', 'height': 640, 'width': 640, 'legacy': {}, 'subType': 'square640', 'crop_name': 'square640'}, {'rank': 0, 'subtype': 'mediumSquare149', 'caption': None, 'credit': None, 'type': 'image', 'url': 'images/2019/12/18/nyregion/18nymanafort/18nymanafort-mediumSquare149.jpg', 'height': 149, 'width': 149, 'legacy': {}, 'subType': 'mediumSquare149', 'crop_name': 'mediumSquare149'}, {'rank': 0, 'subtype': 'sfSpan', 'caption': None, 'credit': None, 'type': 'image', 'url': 'images/2019/12/18/nyregion/18nymanafort/18nymanafort-sfSpan.jpg', 'height': 263, 'width': 395, 'legacy': {}, 'subType': 'sfSpan', 'crop_name': 'sfSpan'}, {'rank': 0, 'subtype': 'largeHorizontal375', 'caption': None, 'credit': None, 'type': 'image', 'url': 'images/2019/12/18/nyregion/18nymanafort/18nymanafort-largeHorizontal375.jpg', 'height': 250, 'width': 375, 'legacy': {}, 'subType': 'largeHorizontal375', 'crop_name': 'largeHorizontal375'}, {'rank': 0, 'subtype': 'largeHorizontalJumbo', 'caption': None, 'credit': None, 'type': 'image', 'url': 'images/2019/12/18/nyregion/18nymanafort/18nymanafort-largeHorizontalJumbo.jpg', 'height': 683, 'width': 1024, 'legacy': {}, 'subType': 'largeHorizontalJumbo', 'crop_name': 'largeHorizontalJumbo'}, {'rank': 0, 'subtype': 'horizontalMediumAt2X', 'caption': None, 'credit': None, 'type': 'image', 'url': 'images/2019/12/18/nyregion/18nymanafort/18nymanafort-horizontalMediumAt2X.jpg', 'height': 2010, 'width': 3015, 'legacy': {}, 'subType': 'horizontalMediumAt2X', 'crop_name': 'horizontalMediumAt2X'}, {'rank': 0, 'subtype': 'hpLarge', 'caption': None, 'credit': None, 'type': 'image', 'url': 'images/2019/12/18/nyregion/18nymanafort/18nymanafort-hpLarge.jpg', 'height': 287, 'width': 511, 'legacy': {}, 'subType': 'hpLarge', 'crop_name': 'hpLarge'}, {'rank': 0, 'subtype': 'largeWidescreen573', 'caption': None, 'credit': None, 'type': 'image', 'url': 'images/2019/12/18/nyregion/18nymanafort/18nymanafort-largeWidescreen573.jpg', 'height': 322, 'width': 573, 'legacy': {}, 'subType': 'largeWidescreen573', 'crop_name': 'largeWidescreen573'}, {'rank': 0, 'subtype': 'largeWidescreen1050', 'caption': None, 'credit': None, 'type': 'image', 'url': 'images/2019/12/18/nyregion/18nymanafort/18nymanafort-largeWidescreen1050.jpg', 'height': 591, 'width': 1050, 'legacy': {}, 'subType': 'largeWidescreen1050', 'crop_name': 'largeWidescreen1050'}, {'rank': 0, 'subtype': 'wide', 'caption': None, 'credit': None, 'type': 'image', 'url': 'images/2019/12/18/nyregion/18nymanafort/18nymanafort-thumbWide.jpg', 'height': 126, 'width': 190, 'legacy': {'widewidth': 190, 'wideheight': 126, 'wide': 'images/2019/12/18/nyregion/18nymanafort/18nymanafort-thumbWide.jpg'}, 'subType': 'wide', 'crop_name': 'thumbWide'}, {'rank': 0, 'subtype': 'videoThumb', 'caption': None, 'credit': None, 'type': 'image', 'url': 'images/2019/12/18/nyregion/18nymanafort/18nymanafort-videoThumb.jpg', 'height': 50, 'width': 75, 'legacy': {}, 'subType': 'videoThumb', 'crop_name': 'videoThumb'}, {'rank': 0, 'subtype': 'videoLarge', 'caption': None, 'credit': None, 'type': 'image', 'url': 'images/2019/12/18/nyregion/18nymanafort/18nymanafort-videoLarge.jpg', 'height': 507, 'width': 768, 'legacy': {}, 'subType': 'videoLarge', 'crop_name': 'videoLarge'}, {'rank': 0, 'subtype': 'mediumThreeByTwo210', 'caption': None, 'credit': None, 'type': 'image', 'url': 'images/2019/12/18/nyregion/18nymanafort/18nymanafort-mediumThreeByTwo210.jpg', 'height': 140, 'width': 210, 'legacy': {}, 'subType': 'mediumThreeByTwo210', 'crop_name': 'mediumThreeByTwo210'}, {'rank': 0, 'subtype': 'mediumThreeByTwo225', 'caption': None, 'credit': None, 'type': 'image', 'url': 'images/2019/12/18/nyregion/18nymanafort/18nymanafort-mediumThreeByTwo225.jpg', 'height': 150, 'width': 225, 'legacy': {}, 'subType': 'mediumThreeByTwo225', 'crop_name': 'mediumThreeByTwo225'}, {'rank': 0, 'subtype': 'mediumThreeByTwo440', 'caption': None, 'credit': None, 'type': 'image', 'url': 'images/2019/12/18/nyregion/18nymanafort/18nymanafort-mediumThreeByTwo440.jpg', 'height': 293, 'width': 440, 'legacy': {}, 'subType': 'mediumThreeByTwo440', 'crop_name': 'mediumThreeByTwo440'}, {'rank': 0, 'subtype': 'mediumThreeByTwo252', 'caption': None, 'credit': None, 'type': 'image', 'url': 'images/2019/12/18/nyregion/18nymanafort/18nymanafort-mediumThreeByTwo252.jpg', 'height': 168, 'width': 252, 'legacy': {}, 'subType': 'mediumThreeByTwo252', 'crop_name': 'mediumThreeByTwo252'}, {'rank': 0, 'subtype': 'mediumThreeByTwo378', 'caption': None, 'credit': None, 'type': 'image', 'url': 'images/2019/12/18/nyregion/18nymanafort/18nymanafort-mediumThreeByTwo378.jpg', 'height': 252, 'width': 378, 'legacy': {}, 'subType': 'mediumThreeByTwo378', 'crop_name': 'mediumThreeByTwo378'}, {'rank': 0, 'subtype': 'threeByTwoLargeAt2X', 'caption': None, 'credit': None, 'type': 'image', 'url': 'images/2019/12/18/nyregion/18nymanafort/18nymanafort-threeByTwoLargeAt2X.jpg', 'height': 2010, 'width': 3015, 'legacy': {}, 'subType': 'threeByTwoLargeAt2X', 'crop_name': 'threeByTwoLargeAt2X'}, {'rank': 0, 'subtype': 'threeByTwoMediumAt2X', 'caption': None, 'credit': None, 'type': 'image', 'url': 'images/2019/12/18/nyregion/18nymanafort/18nymanafort-threeByTwoMediumAt2X.jpg', 'height': 1000, 'width': 1500, 'legacy': {}, 'subType': 'threeByTwoMediumAt2X', 'crop_name': 'threeByTwoMediumAt2X'}, {'rank': 0, 'subtype': 'threeByTwoSmallAt2X', 'caption': None, 'credit': None, 'type': 'image', 'url': 'images/2019/12/18/nyregion/18nymanafort/18nymanafort-threeByTwoSmallAt2X.jpg', 'height': 400, 'width': 600, 'legacy': {}, 'subType': 'threeByTwoSmallAt2X', 'crop_name': 'threeByTwoSmallAt2X'}, {'rank': 0, 'subtype': 'articleInline', 'caption': None, 'credit': None, 'type': 'image', 'url': 'images/2019/12/18/nyregion/18nymanafort/18nymanafort-articleInline.jpg', 'height': 127, 'width': 190, 'legacy': {}, 'subType': 'articleInline', 'crop_name': 'articleInline'}, {'rank': 0, 'subtype': 'hpSmall', 'caption': None, 'credit': None, 'type': 'image', 'url': 'images/2019/12/18/nyregion/18nymanafort/18nymanafort-hpSmall.jpg', 'height': 109, 'width': 163, 'legacy': {}, 'subType': 'hpSmall', 'crop_name': 'hpSmall'}, {'rank': 0, 'subtype': 'blogSmallInline', 'caption': None, 'credit': None, 'type': 'image', 'url': 'images/2019/12/18/nyregion/18nymanafort/18nymanafort-blogSmallInline.jpg', 'height': 101, 'width': 151, 'legacy': {}, 'subType': 'blogSmallInline', 'crop_name': 'blogSmallInline'}, {'rank': 0, 'subtype': 'mediumFlexible177', 'caption': None, 'credit': None, 'type': 'image', 'url': 'images/2019/12/18/nyregion/18nymanafort/18nymanafort-mediumFlexible177.jpg', 'height': 118, 'width': 177, 'legacy': {}, 'subType': 'mediumFlexible177', 'crop_name': 'mediumFlexible177'}, {'rank': 0, 'subtype': 'videoSmall', 'caption': None, 'credit': None, 'type': 'image', 'url': 'images/2019/12/18/nyregion/18nymanafort/18nymanafort-videoSmall.jpg', 'height': 281, 'width': 500, 'legacy': {}, 'subType': 'videoSmall', 'crop_name': 'videoSmall'}, {'rank': 0, 'subtype': 'videoHpMedium', 'caption': None, 'credit': None, 'type': 'image', 'url': 'images/2019/12/18/nyregion/18nymanafort/18nymanafort-videoHpMedium.jpg', 'height': 211, 'width': 375, 'legacy': {}, 'subType': 'videoHpMedium', 'crop_name': 'videoHpMedium'}, {'rank': 0, 'subtype': 'videoSixteenByNine600', 'caption': None, 'credit': None, 'type': 'image', 'url': 'images/2019/12/18/nyregion/18nymanafort/18nymanafort-videoSixteenByNine600.jpg', 'height': 338, 'width': 600, 'legacy': {}, 'subType': 'videoSixteenByNine600', 'crop_name': 'videoSixteenByNine600'}, {'rank': 0, 'subtype': 'videoSixteenByNine540', 'caption': None, 'credit': None, 'type': 'image', 'url': 'images/2019/12/18/nyregion/18nymanafort/18nymanafort-videoSixteenByNine540.jpg', 'height': 304, 'width': 540, 'legacy': {}, 'subType': 'videoSixteenByNine540', 'crop_name': 'videoSixteenByNine540'}, {'rank': 0, 'subtype': 'videoSixteenByNine495', 'caption': None, 'credit': None, 'type': 'image', 'url': 'images/2019/12/18/nyregion/18nymanafort/18nymanafort-videoSixteenByNine495.jpg', 'height': 278, 'width': 495, 'legacy': {}, 'subType': 'videoSixteenByNine495', 'crop_name': 'videoSixteenByNine495'}, {'rank': 0, 'subtype': 'videoSixteenByNine390', 'caption': None, 'credit': None, 'type': 'image', 'url': 'images/2019/12/18/nyregion/18nymanafort/18nymanafort-videoSixteenByNine390.jpg', 'height': 219, 'width': 390, 'legacy': {}, 'subType': 'videoSixteenByNine390', 'crop_name': 'videoSixteenByNine390'}, {'rank': 0, 'subtype': 'videoSixteenByNine1050', 'caption': None, 'credit': None, 'type': 'image', 'url': 'images/2019/12/18/nyregion/18nymanafort/18nymanafort-videoSixteenByNine1050.jpg', 'height': 591, 'width': 1050, 'legacy': {}, 'subType': 'videoSixteenByNine1050', 'crop_name': 'videoSixteenByNine1050'}, {'rank': 0, 'subtype': 'videoSixteenByNine480', 'caption': None, 'credit': None, 'type': 'image', 'url': 'images/2019/12/18/nyregion/18nymanafort/18nymanafort-videoSixteenByNine480.jpg', 'height': 270, 'width': 480, 'legacy': {}, 'subType': 'videoSixteenByNine480', 'crop_name': 'videoSixteenByNine480'}, {'rank': 0, 'subtype': 'videoSixteenByNine310', 'caption': None, 'credit': None, 'type': 'image', 'url': 'images/2019/12/18/nyregion/18nymanafort/18nymanafort-videoSixteenByNine310.jpg', 'height': 174, 'width': 310, 'legacy': {}, 'subType': 'videoSixteenByNine310', 'crop_name': 'videoSixteenByNine310'}, {'rank': 0, 'subtype': 'videoSixteenByNine225', 'caption': None, 'credit': None, 'type': 'image', 'url': 'images/2019/12/18/nyregion/18nymanafort/18nymanafort-videoSixteenByNine225.jpg', 'height': 126, 'width': 225, 'legacy': {}, 'subType': 'videoSixteenByNine225', 'crop_name': 'videoSixteenByNine225'}, {'rank': 0, 'subtype': 'videoSixteenByNine96', 'caption': None, 'credit': None, 'type': 'image', 'url': 'images/2019/12/18/nyregion/18nymanafort/18nymanafort-videoSixteenByNine96.jpg', 'height': 54, 'width': 96, 'legacy': {}, 'subType': 'videoSixteenByNine96', 'crop_name': 'videoSixteenByNine96'}, {'rank': 0, 'subtype': 'videoSixteenByNine3000', 'caption': None, 'credit': None, 'type': 'image', 'url': 'images/2019/12/18/nyregion/18nymanafort/18nymanafort-videoSixteenByNine3000.jpg', 'height': 1688, 'width': 3000, 'legacy': {}, 'subType': 'videoSixteenByNine3000', 'crop_name': 'videoSixteenByNine3000'}, {'rank': 0, 'subtype': 'videoSixteenByNine768', 'caption': None, 'credit': None, 'type': 'image', 'url': 'images/2019/12/18/nyregion/18nymanafort/18nymanafort-videoSixteenByNine768.jpg', 'height': 432, 'width': 768, 'legacy': {}, 'subType': 'videoSixteenByNine768', 'crop_name': 'videoSixteenByNine768'}, {'rank': 0, 'subtype': 'videoSixteenByNine150', 'caption': None, 'credit': None, 'type': 'image', 'url': 'images/2019/12/18/nyregion/18nymanafort/18nymanafort-videoSixteenByNine150.jpg', 'height': 84, 'width': 150, 'legacy': {}, 'subType': 'videoSixteenByNine150', 'crop_name': 'videoSixteenByNine150'}, {'rank': 0, 'subtype': 'videoSixteenByNineJumbo1600', 'caption': None, 'credit': None, 'type': 'image', 'url': 'images/2019/12/18/nyregion/18nymanafort/18nymanafort-videoSixteenByNineJumbo1600.jpg', 'height': 900, 'width': 1600, 'legacy': {}, 'subType': 'videoSixteenByNineJumbo1600', 'crop_name': 'videoSixteenByNineJumbo1600'}, {'rank': 0, 'subtype': 'miniMoth', 'caption': None, 'credit': None, 'type': 'image', 'url': 'images/2019/12/18/nyregion/18nymanafort/18nymanafort-miniMoth.jpg', 'height': 70, 'width': 151, 'legacy': {}, 'subType': 'miniMoth', 'crop_name': 'miniMoth'}, {'rank': 0, 'subtype': 'windowsTile336H', 'caption': None, 'credit': None, 'type': 'image', 'url': 'images/2019/12/18/nyregion/18nymanafort/18nymanafort-windowsTile336H.jpg', 'height': 336, 'width': 694, 'legacy': {}, 'subType': 'windowsTile336H', 'crop_name': 'windowsTile336H'}, {'rank': 0, 'subtype': 'videoFifteenBySeven1305', 'caption': None, 'credit': None, 'type': 'image', 'url': 'images/2019/12/18/nyregion/18nymanafort/18nymanafort-videoFifteenBySeven1305.jpg', 'height': 609, 'width': 1305, 'legacy': {}, 'subType': 'videoFifteenBySeven1305', 'crop_name': 'videoFifteenBySeven1305'}, {'rank': 0, 'subtype': 'videoFifteenBySeven2610', 'caption': None, 'credit': None, 'type': 'image', 'url': 'images/2019/12/18/nyregion/18nymanafort/18nymanafort-videoFifteenBySeven2610.jpg', 'height': 1218, 'width': 2610, 'legacy': {}, 'subType': 'videoFifteenBySeven2610', 'crop_name': 'videoFifteenBySeven2610'}, {'rank': 0, 'subtype': 'facebookJumbo', 'caption': None, 'credit': None, 'type': 'image', 'url': 'images/2019/12/18/nyregion/18nymanafort/18nymanafort-facebookJumbo.jpg', 'height': 549, 'width': 1050, 'legacy': {}, 'subType': 'facebookJumbo', 'crop_name': 'facebookJumbo'}, {'rank': 0, 'subtype': 'watch308', 'caption': None, 'credit': None, 'type': 'image', 'url': 'images/2019/12/18/nyregion/18nymanafort/18nymanafort-watch308.jpg', 'height': 348, 'width': 312, 'legacy': {}, 'subType': 'watch308', 'crop_name': 'watch308'}, {'rank': 0, 'subtype': 'watch268', 'caption': None, 'credit': None, 'type': 'image', 'url': 'images/2019/12/18/nyregion/18nymanafort/18nymanafort-watch268.jpg', 'height': 303, 'width': 272, 'legacy': {}, 'subType': 'watch268', 'crop_name': 'watch268'}, {'rank': 0, 'subtype': 'verticalTwoByThree735', 'caption': None, 'credit': None, 'type': 'image', 'url': 'images/2019/12/18/nyregion/18nymanafort/18nymanafort-verticalTwoByThree735.jpg', 'height': 1103, 'width': 735, 'legacy': {}, 'subType': 'verticalTwoByThree735', 'crop_name': 'verticalTwoByThree735'}, {'rank': 0, 'subtype': 'mobileMasterAt3x', 'caption': None, 'credit': None, 'type': 'image', 'url': 'images/2019/12/18/nyregion/18nymanafort/18nymanafort-mobileMasterAt3x.jpg', 'height': 1200, 'width': 1800, 'legacy': {}, 'subType': 'mobileMasterAt3x', 'crop_name': 'mobileMasterAt3x'}]","[{'name': 'persons', 'value': 'Manafort, Paul J', 'rank': 1, 'major': 'N'}, {'name': 'subject', 'value': 'Frauds and Swindling', 'rank': 2, 'major': 'N'}, {'name': 'subject', 'value': 'Double Jeopardy', 'rank': 3, 'major': 'N'}, {'name': 'persons', 'value': 'Wiley, Maxwell', 'rank': 4, 'major': 'N'}, {'name': 'persons', 'value': 'Vance, Cyrus R Jr', 'rank': 5, 'major': 'N'}, {'name': 'subject', 'value': 'Decisions and Verdicts', 'rank': 6, 'major': 'N'}, {'name': 'glocations', 'value': 'New York State', 'rank': 7, 'major': 'N'}, {'name': 'persons', 'value': 'Trump, Donald J', 'rank': 8, 'major': 'N'}, {'name': 'subject', 'value': 'United States Politics and Government', 'rank': 9, 'major': 'N'}]",2019-12-18T15:14:19+0000,article,Metro,New York,News,nyt://article/743402fa-1fcd-5da7-9247-9f7f0abbc736,1008,nyt://article/743402fa-1fcd-5da7-9247-9f7f0abbc736,State Charges Against Manafort Dismissed by Judge in New York,,,Double Jeopardy Law  Ends Manafort Case,,,,By Jan Ransom,"[{'firstname': 'Jan', 'middlename': None, 'lastname': 'Ransom', 'qualifier': None, 'title': None, 'role': 'reported', 'organization': '', 'rank': 1}]",,,A,26
