,abstract,web_url,snippet,lead_paragraph,source,multimedia,keywords,pub_date,document_type,news_desk,section_name,subsection_name,type_of_material,_id,word_count,uri,headline_main,headline_kicker,headline_content_kicker,headline_print_headline,headline_name,headline_seo,headline_sub,byline_original,byline_person,byline_organization,print_section,print_page
0,A bitterly divided U.S. House of Representatives engaged in an impeachment debate before historic votes on two charges accusing President Donald Trump of abusing his power and obstructing Congress.,https://www.nytimes.com/reuters/2019/12/18/us/politics/18reuters-usa-trump-impeachment-quotes.html,A bitterly divided U.S. House of Representatives engaged in an impeachment debate before historic votes on two charges accusing President Donald Trump of abusing his power and obstructing Congress.,WASHINGTON — A bitterly divided U.S. House of Representatives engaged in an impeachment debate before historic votes on two charges accusing President Donald Trump of abusing his power and obstructing Congress.,Reuters,[],[],2019-12-18T18:15:37+0000,article,None,U.S.,Politics,News,nyt://article/3890da59-fe03-5188-a0dd-e37c023d9157,490,nyt://article/3890da59-fe03-5188-a0dd-e37c023d9157,'Civics Lesson' or 'Sham Trial?' Key Moments in the House Impeachment Debate,,,'Civics Lesson' or 'Sham Trial?' Key Moments in the House Impeachment Debate,,,,By Reuters,[],Reuters,,
1,"With the UK election results giving some certainty to the Brexit process, a U.S.-China trade deal all but signed and the Federal Reserve signaling that it will stand steady for the foreseeable future, there are three fewer hurdles standing in the way of global equities extending their record run into 2020.  ",https://www.nytimes.com/reuters/2019/12/18/business/18reuters-usa-investors-risks-analysis.html,"With the UK election results giving some certainty to the Brexit process, a U.S.-China trade deal all but signed and the Federal Reserve signaling that it will stand steady for the foreseeable future, there are three fewer hurdles standing in the ...","NEW YORK — With the UK election results giving some certainty to the Brexit process, a U.S.-China trade deal all but signed and the Federal Reserve signaling that it will stand steady for the foreseeable future, there are three fewer hurdles standing in the way of global equities extending their record run into 2020. ",Reuters,[],[],2019-12-18T18:09:36+0000,article,None,Business Day,,News,nyt://article/39d663b6-5571-5ba1-9062-61e068678146,736,nyt://article/39d663b6-5571-5ba1-9062-61e068678146,Where's the Risk? U.S. Fund Managers Bet on Bull Run in 2020,,,Where's the Risk? U.S. Fund Managers Bet on Bull Run in 2020,,,,By Reuters,[],Reuters,,
2,Democrats never gave Bill Clinton a free pass. Why are Republicans giving one to Donald Trump?,https://www.nytimes.com/2019/12/18/opinion/trump-impeachment-clinton.html,Democrats never gave Bill Clinton a free pass. Why are Republicans giving one to Donald Trump?,"Update: On Wednesday, the House of Representatives voted to impeach President Trump for abuse of power and obstruction of Congress.",The New York Times,"[{'rank': 0, 'subtype': 'xlarge', 'caption': None, 'credit': None, 'type': 'image', 'url': 'images/2019/12/18/opinion/18Lockhart/merlin_88586980_8d2c31bd-bf5a-4ebb-b8b7-e12633345ce1-articleLarge.jpg', 'height': 458, 'width': 600, 'legacy': {'xlarge': 'images/2019/12/18/opinion/18Lockhart/merlin_88586980_8d2c31bd-bf5a-4ebb-b8b7-e12633345ce1-articleLarge.jpg', 'xlargewidth': 600, 'xlargeheight': 458}, 'subType': 'xlarge', 'crop_name': 'articleLarge'}, {'rank': 0, 'subtype': 'popup', 'caption': None, 'credit': None, 'type': 'image', 'url': 'images/2019/12/18/opinion/18Lockhart/merlin_88586980_8d2c31bd-bf5a-4ebb-b8b7-e12633345ce1-popup.jpg', 'height': 496, 'width': 650, 'legacy': {}, 'subType': 'popup', 'crop_name': 'popup'}, {'rank': 0, 'subtype': 'blog480', 'caption': None, 'credit': None, 'type': 'image', 'url': 'images/2019/12/18/opinion/18Lockhart/merlin_88586980_8d2c31bd-bf5a-4ebb-b8b7-e12633345ce1-blog480.jpg', 'height': 366, 'width': 480, 'legacy': {}, 'subType': 'blog480', 'crop_name': 'blog480'}, {'rank': 0, 'subtype': 'blog533', 'caption': None, 'credit': None, 'type': 'image', 'url': 'images/2019/12/18/opinion/18Lockhart/merlin_88586980_8d2c31bd-bf5a-4ebb-b8b7-e12633345ce1-blog533.jpg', 'height': 406, 'width': 533, 'legacy': {}, 'subType': 'blog533', 'crop_name': 'blog533'}, {'rank': 0, 'subtype': 'blog427', 'caption': None, 'credit': None, 'type': 'image', 'url': 'images/2019/12/18/opinion/18Lockhart/merlin_88586980_8d2c31bd-bf5a-4ebb-b8b7-e12633345ce1-blog427.jpg', 'height': 326, 'width': 427, 'legacy': {}, 'subType': 'blog427', 'crop_name': 'blog427'}, {'rank': 0, 'subtype': 'tmagSF', 'caption': None, 'credit': None, 'type': 'image', 'url': 'images/2019/12/18/opinion/18Lockhart/merlin_88586980_8d2c31bd-bf5a-4ebb-b8b7-e12633345ce1-tmagSF.jpg', 'height': 276, 'width': 362, 'legacy': {}, 'subType': 'tmagSF', 'crop_name': 'tmagSF'}, {'rank': 0, 'subtype': 'tmagArticle', 'caption': None, 'credit': None, 'type': 'image', 'url': 'images/2019/12/18/opinion/18Lockhart/merlin_88586980_8d2c31bd-bf5a-4ebb-b8b7-e12633345ce1-tmagArticle.jpg', 'height': 451, 'width': 592, 'legacy': {}, 'subType': 'tmagArticle', 'crop_name': 'tmagArticle'}, {'rank': 0, 'subtype': 'slide', 'caption': None, 'credit': None, 'type': 'image', 'url': 'images/2019/12/18/opinion/18Lockhart/merlin_88586980_8d2c31bd-bf5a-4ebb-b8b7-e12633345ce1-slide.jpg', 'height': 458, 'width': 600, 'legacy': {}, 'subType': 'slide', 'crop_name': 'slide'}, {'rank': 0, 'subtype': 'jumbo', 'caption': None, 'credit': None, 'type': 'image', 'url': 'images/2019/12/18/opinion/18Lockhart/merlin_88586980_8d2c31bd-bf5a-4ebb-b8b7-e12633345ce1-jumbo.jpg', 'height': 781, 'width': 1024, 'legacy': {}, 'subType': 'jumbo', 'crop_name': 'jumbo'}, {'rank': 0, 'subtype': 'superJumbo', 'caption': None, 'credit': None, 'type': 'image', 'url': 'images/2019/12/18/opinion/18Lockhart/merlin_88586980_8d2c31bd-bf5a-4ebb-b8b7-e12633345ce1-superJumbo.jpg', 'height': 1388, 'width': 1820, 'legacy': {}, 'subType': 'superJumbo', 'crop_name': 'superJumbo'}, {'rank': 0, 'subtype': 'blog225', 'caption': None, 'credit': None, 'type': 'image', 'url': 'images/2019/12/18/opinion/18Lockhart/merlin_88586980_8d2c31bd-bf5a-4ebb-b8b7-e12633345ce1-blog225.jpg', 'height': 172, 'width': 225, 'legacy': {}, 'subType': 'blog225', 'crop_name': 'blog225'}, {'rank': 0, 'subtype': 'master1050', 'caption': None, 'credit': None, 'type': 'image', 'url': 'images/2019/12/18/opinion/18Lockhart/merlin_88586980_8d2c31bd-bf5a-4ebb-b8b7-e12633345ce1-master1050.jpg', 'height': 801, 'width': 1050, 'legacy': {}, 'subType': 'master1050', 'crop_name': 'master1050'}, {'rank': 0, 'subtype': 'master675', 'caption': None, 'credit': None, 'type': 'image', 'url': 'images/2019/12/18/opinion/18Lockhart/merlin_88586980_8d2c31bd-bf5a-4ebb-b8b7-e12633345ce1-master675.jpg', 'height': 515, 'width': 675, 'legacy': {}, 'subType': 'master675', 'crop_name': 'master675'}, {'rank': 0, 'subtype': 'master495', 'caption': None, 'credit': None, 'type': 'image', 'url': 'images/2019/12/18/opinion/18Lockhart/merlin_88586980_8d2c31bd-bf5a-4ebb-b8b7-e12633345ce1-master495.jpg', 'height': 378, 'width': 495, 'legacy': {}, 'subType': 'master495', 'crop_name': 'master495'}, {'rank': 0, 'subtype': 'master180', 'caption': None, 'credit': None, 'type': 'image', 'url': 'images/2019/12/18/opinion/18Lockhart/merlin_88586980_8d2c31bd-bf5a-4ebb-b8b7-e12633345ce1-master180.jpg', 'height': 137, 'width': 180, 'legacy': {}, 'subType': 'master180', 'crop_name': 'master180'}, {'rank': 0, 'subtype': 'master315', 'caption': None, 'credit': None, 'type': 'image', 'url': 'images/2019/12/18/opinion/18Lockhart/merlin_88586980_8d2c31bd-bf5a-4ebb-b8b7-e12633345ce1-master315.jpg', 'height': 240, 'width': 315, 'legacy': {}, 'subType': 'master315', 'crop_name': 'master315'}, {'rank': 0, 'subtype': 'master768', 'caption': None, 'credit': None, 'type': 'image', 'url': 'images/2019/12/18/opinion/18Lockhart/merlin_88586980_8d2c31bd-bf5a-4ebb-b8b7-e12633345ce1-master768.jpg', 'height': 586, 'width': 768, 'legacy': {}, 'subType': 'master768', 'crop_name': 'master768'}, {'rank': 0, 'subtype': 'thumbnail', 'caption': None, 'credit': None, 'type': 'image', 'url': 'images/2019/12/18/opinion/18Lockhart/merlin_88586980_8d2c31bd-bf5a-4ebb-b8b7-e12633345ce1-thumbStandard.jpg', 'height': 75, 'width': 75, 'legacy': {'thumbnail': 'images/2019/12/18/opinion/18Lockhart/merlin_88586980_8d2c31bd-bf5a-4ebb-b8b7-e12633345ce1-thumbStandard.jpg', 'thumbnailwidth': 75, 'thumbnailheight': 75}, 'subType': 'thumbnail', 'crop_name': 'thumbStandard'}, {'rank': 0, 'subtype': 'blogSmallThumb', 'caption': None, 'credit': None, 'type': 'image', 'url': 'images/2019/12/18/opinion/18Lockhart/merlin_88586980_8d2c31bd-bf5a-4ebb-b8b7-e12633345ce1-blogSmallThumb.jpg', 'height': 50, 'width': 50, 'legacy': {}, 'subType': 'blogSmallThumb', 'crop_name': 'blogSmallThumb'}, {'rank': 0, 'subtype': 'thumbLarge', 'caption': None, 'credit': None, 'type': 'image', 'url': 'images/2019/12/18/opinion/18Lockhart/merlin_88586980_8d2c31bd-bf5a-4ebb-b8b7-e12633345ce1-thumbLarge.jpg', 'height': 150, 'width': 150, 'legacy': {}, 'subType': 'thumbLarge', 'crop_name': 'thumbLarge'}, {'rank': 0, 'subtype': 'smallSquare168', 'caption': None, 'credit': None, 'type': 'image', 'url': 'images/2019/12/18/opinion/18Lockhart/merlin_88586980_8d2c31bd-bf5a-4ebb-b8b7-e12633345ce1-smallSquare168.jpg', 'height': 168, 'width': 168, 'legacy': {}, 'subType': 'smallSquare168', 'crop_name': 'smallSquare168'}, {'rank': 0, 'subtype': 'smallSquare252', 'caption': None, 'credit': None, 'type': 'image', 'url': 'images/2019/12/18/opinion/18Lockhart/merlin_88586980_8d2c31bd-bf5a-4ebb-b8b7-e12633345ce1-smallSquare252.jpg', 'height': 252, 'width': 252, 'legacy': {}, 'subType': 'smallSquare252', 'crop_name': 'smallSquare252'}, {'rank': 0, 'subtype': 'square320', 'caption': None, 'credit': None, 'type': 'image', 'url': 'images/2019/12/18/opinion/18Lockhart/merlin_88586980_8d2c31bd-bf5a-4ebb-b8b7-e12633345ce1-square320.jpg', 'height': 320, 'width': 320, 'legacy': {}, 'subType': 'square320', 'crop_name': 'square320'}, {'rank': 0, 'subtype': 'moth', 'caption': None, 'credit': None, 'type': 'image', 'url': 'images/2019/12/18/opinion/18Lockhart/merlin_88586980_8d2c31bd-bf5a-4ebb-b8b7-e12633345ce1-moth.jpg', 'height': 151, 'width': 151, 'legacy': {}, 'subType': 'moth', 'crop_name': 'moth'}, {'rank': 0, 'subtype': 'filmstrip', 'caption': None, 'credit': None, 'type': 'image', 'url': 'images/2019/12/18/opinion/18Lockhart/merlin_88586980_8d2c31bd-bf5a-4ebb-b8b7-e12633345ce1-filmstrip.jpg', 'height': 190, 'width': 190, 'legacy': {}, 'subType': 'filmstrip', 'crop_name': 'filmstrip'}, {'rank': 0, 'subtype': 'square640', 'caption': None, 'credit': None, 'type': 'image', 'url': 'images/2019/12/18/opinion/18Lockhart/merlin_88586980_8d2c31bd-bf5a-4ebb-b8b7-e12633345ce1-square640.jpg', 'height': 640, 'width': 640, 'legacy': {}, 'subType': 'square640', 'crop_name': 'square640'}, {'rank': 0, 'subtype': 'mediumSquare149', 'caption': None, 'credit': None, 'type': 'image', 'url': 'images/2019/12/18/opinion/18Lockhart/merlin_88586980_8d2c31bd-bf5a-4ebb-b8b7-e12633345ce1-mediumSquare149.jpg', 'height': 149, 'width': 149, 'legacy': {}, 'subType': 'mediumSquare149', 'crop_name': 'mediumSquare149'}, {'rank': 0, 'subtype': 'sfSpan', 'caption': None, 'credit': None, 'type': 'image', 'url': 'images/2019/12/18/opinion/18Lockhart/18Lockhart-sfSpan.jpg', 'height': 263, 'width': 395, 'legacy': {}, 'subType': 'sfSpan', 'crop_name': 'sfSpan'}, {'rank': 0, 'subtype': 'largeHorizontal375', 'caption': None, 'credit': None, 'type': 'image', 'url': 'images/2019/12/18/opinion/18Lockhart/18Lockhart-largeHorizontal375.jpg', 'height': 250, 'width': 375, 'legacy': {}, 'subType': 'largeHorizontal375', 'crop_name': 'largeHorizontal375'}, {'rank': 0, 'subtype': 'largeHorizontalJumbo', 'caption': None, 'credit': None, 'type': 'image', 'url': 'images/2019/12/18/opinion/18Lockhart/18Lockhart-largeHorizontalJumbo.jpg', 'height': 683, 'width': 1024, 'legacy': {}, 'subType': 'largeHorizontalJumbo', 'crop_name': 'largeHorizontalJumbo'}, {'rank': 0, 'subtype': 'horizontalMediumAt2X', 'caption': None, 'credit': None, 'type': 'image', 'url': 'images/2019/12/18/opinion/18Lockhart/18Lockhart-horizontalMediumAt2X.jpg', 'height': 1214, 'width': 1820, 'legacy': {}, 'subType': 'horizontalMediumAt2X', 'crop_name': 'horizontalMediumAt2X'}, {'rank': 0, 'subtype': 'hpLarge', 'caption': None, 'credit': None, 'type': 'image', 'url': 'images/2019/12/18/opinion/18Lockhart/18Lockhart-hpLarge.jpg', 'height': 288, 'width': 511, 'legacy': {}, 'subType': 'hpLarge', 'crop_name': 'hpLarge'}, {'rank': 0, 'subtype': 'largeWidescreen573', 'caption': None, 'credit': None, 'type': 'image', 'url': 'images/2019/12/18/opinion/18Lockhart/18Lockhart-largeWidescreen573.jpg', 'height': 322, 'width': 573, 'legacy': {}, 'subType': 'largeWidescreen573', 'crop_name': 'largeWidescreen573'}, {'rank': 0, 'subtype': 'largeWidescreen1050', 'caption': None, 'credit': None, 'type': 'image', 'url': 'images/2019/12/18/opinion/18Lockhart/18Lockhart-largeWidescreen1050.jpg', 'height': 591, 'width': 1050, 'legacy': {}, 'subType': 'largeWidescreen1050', 'crop_name': 'largeWidescreen1050'}, {'rank': 0, 'subtype': 'wide', 'caption': None, 'credit': None, 'type': 'image', 'url': 'images/2019/12/18/opinion/18Lockhart/18Lockhart-thumbWide.jpg', 'height': 126, 'width': 190, 'legacy': {'widewidth': 190, 'wideheight': 126, 'wide': 'images/2019/12/18/opinion/18Lockhart/18Lockhart-thumbWide.jpg'}, 'subType': 'wide', 'crop_name': 'thumbWide'}, {'rank': 0, 'subtype': 'videoThumb', 'caption': None, 'credit': None, 'type': 'image', 'url': 'images/2019/12/18/opinion/18Lockhart/18Lockhart-videoThumb.jpg', 'height': 50, 'width': 75, 'legacy': {}, 'subType': 'videoThumb', 'crop_name': 'videoThumb'}, {'rank': 0, 'subtype': 'videoLarge', 'caption': None, 'credit': None, 'type': 'image', 'url': 'images/2019/12/18/opinion/18Lockhart/18Lockhart-videoLarge.jpg', 'height': 507, 'width': 768, 'legacy': {}, 'subType': 'videoLarge', 'crop_name': 'videoLarge'}, {'rank': 0, 'subtype': 'mediumThreeByTwo210', 'caption': None, 'credit': None, 'type': 'image', 'url': 'images/2019/12/18/opinion/18Lockhart/18Lockhart-mediumThreeByTwo210.jpg', 'height': 140, 'width': 210, 'legacy': {}, 'subType': 'mediumThreeByTwo210', 'crop_name': 'mediumThreeByTwo210'}, {'rank': 0, 'subtype': 'mediumThreeByTwo225', 'caption': None, 'credit': None, 'type': 'image', 'url': 'images/2019/12/18/opinion/18Lockhart/18Lockhart-mediumThreeByTwo225.jpg', 'height': 150, 'width': 225, 'legacy': {}, 'subType': 'mediumThreeByTwo225', 'crop_name': 'mediumThreeByTwo225'}, {'rank': 0, 'subtype': 'mediumThreeByTwo440', 'caption': None, 'credit': None, 'type': 'image', 'url': 'images/2019/12/18/opinion/18Lockhart/18Lockhart-mediumThreeByTwo440.jpg', 'height': 293, 'width': 440, 'legacy': {}, 'subType': 'mediumThreeByTwo440', 'crop_name': 'mediumThreeByTwo440'}, {'rank': 0, 'subtype': 'mediumThreeByTwo252', 'caption': None, 'credit': None, 'type': 'image', 'url': 'images/2019/12/18/opinion/18Lockhart/18Lockhart-mediumThreeByTwo252.jpg', 'height': 168, 'width': 252, 'legacy': {}, 'subType': 'mediumThreeByTwo252', 'crop_name': 'mediumThreeByTwo252'}, {'rank': 0, 'subtype': 'mediumThreeByTwo378', 'caption': None, 'credit': None, 'type': 'image', 'url': 'images/2019/12/18/opinion/18Lockhart/18Lockhart-mediumThreeByTwo378.jpg', 'height': 252, 'width': 378, 'legacy': {}, 'subType': 'mediumThreeByTwo378', 'crop_name': 'mediumThreeByTwo378'}, {'rank': 0, 'subtype': 'threeByTwoLargeAt2X', 'caption': None, 'credit': None, 'type': 'image', 'url': 'images/2019/12/18/opinion/18Lockhart/18Lockhart-threeByTwoLargeAt2X.jpg', 'height': 1214, 'width': 1820, 'legacy': {}, 'subType': 'threeByTwoLargeAt2X', 'crop_name': 'threeByTwoLargeAt2X'}, {'rank': 0, 'subtype': 'threeByTwoMediumAt2X', 'caption': None, 'credit': None, 'type': 'image', 'url': 'images/2019/12/18/opinion/18Lockhart/18Lockhart-threeByTwoMediumAt2X.jpg', 'height': 1001, 'width': 1500, 'legacy': {}, 'subType': 'threeByTwoMediumAt2X', 'crop_name': 'threeByTwoMediumAt2X'}, {'rank': 0, 'subtype': 'threeByTwoSmallAt2X', 'caption': None, 'credit': None, 'type': 'image', 'url': 'images/2019/12/18/opinion/18Lockhart/18Lockhart-threeByTwoSmallAt2X.jpg', 'height': 400, 'width': 600, 'legacy': {}, 'subType': 'threeByTwoSmallAt2X', 'crop_name': 'threeByTwoSmallAt2X'}, {'rank': 0, 'subtype': 'articleInline', 'caption': None, 'credit': None, 'type': 'image', 'url': 'images/2019/12/18/opinion/18Lockhart/merlin_88586980_8d2c31bd-bf5a-4ebb-b8b7-e12633345ce1-articleInline.jpg', 'height': 145, 'width': 190, 'legacy': {}, 'subType': 'articleInline', 'crop_name': 'articleInline'}, {'rank': 0, 'subtype': 'hpSmall', 'caption': None, 'credit': None, 'type': 'image', 'url': 'images/2019/12/18/opinion/18Lockhart/merlin_88586980_8d2c31bd-bf5a-4ebb-b8b7-e12633345ce1-hpSmall.jpg', 'height': 124, 'width': 163, 'legacy': {}, 'subType': 'hpSmall', 'crop_name': 'hpSmall'}, {'rank': 0, 'subtype': 'blogSmallInline', 'caption': None, 'credit': None, 'type': 'image', 'url': 'images/2019/12/18/opinion/18Lockhart/merlin_88586980_8d2c31bd-bf5a-4ebb-b8b7-e12633345ce1-blogSmallInline.jpg', 'height': 115, 'width': 151, 'legacy': {}, 'subType': 'blogSmallInline', 'crop_name': 'blogSmallInline'}, {'rank': 0, 'subtype': 'mediumFlexible177', 'caption': None, 'credit': None, 'type': 'image', 'url': 'images/2019/12/18/opinion/18Lockhart/merlin_88586980_8d2c31bd-bf5a-4ebb-b8b7-e12633345ce1-mediumFlexible177.jpg', 'height': 135, 'width': 177, 'legacy': {}, 'subType': 'mediumFlexible177', 'crop_name': 'mediumFlexible177'}, {'rank': 0, 'subtype': 'videoSmall', 'caption': None, 'credit': None, 'type': 'image', 'url': 'images/2019/12/18/opinion/18Lockhart/18Lockhart-videoSmall.jpg', 'height': 281, 'width': 500, 'legacy': {}, 'subType': 'videoSmall', 'crop_name': 'videoSmall'}, {'rank': 0, 'subtype': 'videoHpMedium', 'caption': None, 'credit': None, 'type': 'image', 'url': 'images/2019/12/18/opinion/18Lockhart/18Lockhart-videoHpMedium.jpg', 'height': 211, 'width': 375, 'legacy': {}, 'subType': 'videoHpMedium', 'crop_name': 'videoHpMedium'}, {'rank': 0, 'subtype': 'videoSixteenByNine600', 'caption': None, 'credit': None, 'type': 'image', 'url': 'images/2019/12/18/opinion/18Lockhart/18Lockhart-videoSixteenByNine600.jpg', 'height': 338, 'width': 600, 'legacy': {}, 'subType': 'videoSixteenByNine600', 'crop_name': 'videoSixteenByNine600'}, {'rank': 0, 'subtype': 'videoSixteenByNine540', 'caption': None, 'credit': None, 'type': 'image', 'url': 'images/2019/12/18/opinion/18Lockhart/18Lockhart-videoSixteenByNine540.jpg', 'height': 304, 'width': 540, 'legacy': {}, 'subType': 'videoSixteenByNine540', 'crop_name': 'videoSixteenByNine540'}, {'rank': 0, 'subtype': 'videoSixteenByNine495', 'caption': None, 'credit': None, 'type': 'image', 'url': 'images/2019/12/18/opinion/18Lockhart/18Lockhart-videoSixteenByNine495.jpg', 'height': 278, 'width': 495, 'legacy': {}, 'subType': 'videoSixteenByNine495', 'crop_name': 'videoSixteenByNine495'}, {'rank': 0, 'subtype': 'videoSixteenByNine390', 'caption': None, 'credit': None, 'type': 'image', 'url': 'images/2019/12/18/opinion/18Lockhart/18Lockhart-videoSixteenByNine390.jpg', 'height': 219, 'width': 390, 'legacy': {}, 'subType': 'videoSixteenByNine390', 'crop_name': 'videoSixteenByNine390'}, {'rank': 0, 'subtype': 'videoSixteenByNine1050', 'caption': None, 'credit': None, 'type': 'image', 'url': 'images/2019/12/18/opinion/18Lockhart/18Lockhart-videoSixteenByNine1050.jpg', 'height': 591, 'width': 1050, 'legacy': {}, 'subType': 'videoSixteenByNine1050', 'crop_name': 'videoSixteenByNine1050'}, {'rank': 0, 'subtype': 'videoSixteenByNine480', 'caption': None, 'credit': None, 'type': 'image', 'url': 'images/2019/12/18/opinion/18Lockhart/18Lockhart-videoSixteenByNine480.jpg', 'height': 270, 'width': 480, 'legacy': {}, 'subType': 'videoSixteenByNine480', 'crop_name': 'videoSixteenByNine480'}, {'rank': 0, 'subtype': 'videoSixteenByNine310', 'caption': None, 'credit': None, 'type': 'image', 'url': 'images/2019/12/18/opinion/18Lockhart/18Lockhart-videoSixteenByNine310.jpg', 'height': 174, 'width': 310, 'legacy': {}, 'subType': 'videoSixteenByNine310', 'crop_name': 'videoSixteenByNine310'}, {'rank': 0, 'subtype': 'videoSixteenByNine225', 'caption': None, 'credit': None, 'type': 'image', 'url': 'images/2019/12/18/opinion/18Lockhart/18Lockhart-videoSixteenByNine225.jpg', 'height': 126, 'width': 225, 'legacy': {}, 'subType': 'videoSixteenByNine225', 'crop_name': 'videoSixteenByNine225'}, {'rank': 0, 'subtype': 'videoSixteenByNine96', 'caption': None, 'credit': None, 'type': 'image', 'url': 'images/2019/12/18/opinion/18Lockhart/18Lockhart-videoSixteenByNine96.jpg', 'height': 54, 'width': 96, 'legacy': {}, 'subType': 'videoSixteenByNine96', 'crop_name': 'videoSixteenByNine96'}, {'rank': 0, 'subtype': 'videoSixteenByNine768', 'caption': None, 'credit': None, 'type': 'image', 'url': 'images/2019/12/18/opinion/18Lockhart/18Lockhart-videoSixteenByNine768.jpg', 'height': 432, 'width': 768, 'legacy': {}, 'subType': 'videoSixteenByNine768', 'crop_name': 'videoSixteenByNine768'}, {'rank': 0, 'subtype': 'videoSixteenByNine150', 'caption': None, 'credit': None, 'type': 'image', 'url': 'images/2019/12/18/opinion/18Lockhart/18Lockhart-videoSixteenByNine150.jpg', 'height': 84, 'width': 150, 'legacy': {}, 'subType': 'videoSixteenByNine150', 'crop_name': 'videoSixteenByNine150'}, {'rank': 0, 'subtype': 'videoSixteenByNineJumbo1600', 'caption': None, 'credit': None, 'type': 'image', 'url': 'images/2019/12/18/opinion/18Lockhart/18Lockhart-videoSixteenByNineJumbo1600.jpg', 'height': 900, 'width': 1600, 'legacy': {}, 'subType': 'videoSixteenByNineJumbo1600', 'crop_name': 'videoSixteenByNineJumbo1600'}, {'rank': 0, 'subtype': 'miniMoth', 'caption': None, 'credit': None, 'type': 'image', 'url': 'images/2019/12/18/opinion/18Lockhart/18Lockhart-miniMoth.jpg', 'height': 70, 'width': 151, 'legacy': {}, 'subType': 'miniMoth', 'crop_name': 'miniMoth'}, {'rank': 0, 'subtype': 'windowsTile336H', 'caption': None, 'credit': None, 'type': 'image', 'url': 'images/2019/12/18/opinion/18Lockhart/18Lockhart-windowsTile336H.jpg', 'height': 336, 'width': 694, 'legacy': {}, 'subType': 'windowsTile336H', 'crop_name': 'windowsTile336H'}, {'rank': 0, 'subtype': 'videoFifteenBySeven1305', 'caption': None, 'credit': None, 'type': 'image', 'url': 'images/2019/12/18/opinion/18Lockhart/18Lockhart-videoFifteenBySeven1305.jpg', 'height': 609, 'width': 1305, 'legacy': {}, 'subType': 'videoFifteenBySeven1305', 'crop_name': 'videoFifteenBySeven1305'}, {'rank': 0, 'subtype': 'facebookJumbo', 'caption': None, 'credit': None, 'type': 'image', 'url': 'images/2019/12/18/opinion/18Lockhart/18Lockhart-facebookJumbo.jpg', 'height': 550, 'width': 1050, 'legacy': {}, 'subType': 'facebookJumbo', 'crop_name': 'facebookJumbo'}, {'rank': 0, 'subtype': 'watch308', 'caption': None, 'credit': None, 'type': 'image', 'url': 'images/2019/12/18/opinion/18Lockhart/merlin_88586980_8d2c31bd-bf5a-4ebb-b8b7-e12633345ce1-watch308.jpg', 'height': 348, 'width': 312, 'legacy': {}, 'subType': 'watch308', 'crop_name': 'watch308'}, {'rank': 0, 'subtype': 'watch268', 'caption': None, 'credit': None, 'type': 'image', 'url': 'images/2019/12/18/opinion/18Lockhart/merlin_88586980_8d2c31bd-bf5a-4ebb-b8b7-e12633345ce1-watch268.jpg', 'height': 303, 'width': 272, 'legacy': {}, 'subType': 'watch268', 'crop_name': 'watch268'}, {'rank': 0, 'subtype': 'verticalTwoByThree735', 'caption': None, 'credit': None, 'type': 'image', 'url': 'images/2019/12/18/opinion/18Lockhart/merlin_88586980_8d2c31bd-bf5a-4ebb-b8b7-e12633345ce1-verticalTwoByThree735.jpg', 'height': 1102, 'width': 735, 'legacy': {}, 'subType': 'verticalTwoByThree735', 'crop_name': 'verticalTwoByThree735'}, {'rank': 0, 'subtype': 'mobileMasterAt3x', 'caption': None, 'credit': None, 'type': 'image', 'url': 'images/2019/12/18/opinion/18Lockhart/merlin_88586980_8d2c31bd-bf5a-4ebb-b8b7-e12633345ce1-mobileMasterAt3x.jpg', 'height': 1373, 'width': 1800, 'legacy': {}, 'subType': 'mobileMasterAt3x', 'crop_name': 'mobileMasterAt3x'}]","[{'name': 'subject', 'value': 'United States Politics and Government', 'rank': 1, 'major': 'N'}, {'name': 'subject', 'value': 'Trump-Ukraine Whistle-blower Complaint and Impeachment Inquiry', 'rank': 2, 'major': 'N'}, {'name': 'subject', 'value': 'Impeachment', 'rank': 3, 'major': 'N'}, {'name': 'organizations', 'value': 'Democratic Party', 'rank': 4, 'major': 'N'}, {'name': 'organizations', 'value': 'Republican Party', 'rank': 5, 'major': 'N'}, {'name': 'persons', 'value': 'Clinton, Bill', 'rank': 6, 'major': 'N'}, {'name': 'persons', 'value': 'Trump, Donald J', 'rank': 7, 'major': 'N'}]",2019-12-18T17:58:36+0000,article,OpEd,Opinion,,Op-Ed,nyt://article/c08a8775-52e0-5813-abf8-ddb178c0aa39,1197,nyt://article/c08a8775-52e0-5813-abf8-ddb178c0aa39,The Republican Party Is Completely Behind President Trump,,,,,,,By Joe Lockhart,"[{'firstname': 'Joe', 'middlename': None, 'lastname': 'Lockhart', 'qualifier': None, 'title': None, 'role': 'reported', 'organization': '', 'rank': 1}]",,,
