,abstract,web_url,snippet,lead_paragraph,source,multimedia,keywords,pub_date,document_type,news_desk,section_name,subsection_name,type_of_material,_id,word_count,uri,headline_main,headline_kicker,headline_content_kicker,headline_print_headline,headline_name,headline_seo,headline_sub,byline_original,byline_person,byline_organization,print_section,print_page
0,"The Trump administration on Wednesday said it is proposing a rule to allow states to import prescription drugs from Canada, advancing a plan announced in July that the president has said will bring cheaper prescription drugs to Americans.",https://www.nytimes.com/reuters/2019/12/18/us/politics/18reuters-usa-healthcare-drugpricing.html,"The Trump administration on Wednesday said it is proposing a rule to allow states to import prescription drugs from Canada, advancing a plan announced in July that the president has said will bring cheaper prescription drugs to Americans.","NEW YORK — The Trump administration on Wednesday said it is proposing a rule to allow states to import prescription drugs from Canada, advancing a plan announced in July that the president has said will bring cheaper prescription drugs to Americans.",Reuters,[],[],2019-12-18T14:49:17+0000,article,None,U.S.,Politics,News,nyt://article/b53735b1-31c1-57d0-8a9a-1672033a6afc,801,nyt://article/b53735b1-31c1-57d0-8a9a-1672033a6afc,Trump Proposes Rule for Importing Drugs From Canada; Industry Says It Won't Cut Costs,,,Trump Proposes Rule for Importing Drugs From Canada; Industry Says It Won't Cut Costs,,,,By Reuters,[],Reuters,,
1,"Myanmar leader Aung San Suu Kyi on Wednesday thanked supporters who staged large rallies on her behalf as she defended the country against genocide charges at The Hague, speaking to the nation for the first time since she returned on Sunday.",https://www.nytimes.com/reuters/2019/12/18/world/asia/18reuters-myanmar-rohingya-worldcourt.html,"Myanmar leader Aung San Suu Kyi on Wednesday thanked supporters who staged large rallies on her behalf as she defended the country against genocide charges at The Hague, speaking to the nation for the first time since she returned on Sunday.","YANGON AND DHAKA — Myanmar leader Aung San Suu Kyi on Wednesday thanked supporters who staged large rallies on her behalf as she defended the country against genocide charges at The Hague, speaking to the nation for the first time since she returned on Sunday.",Reuters,[],[],2019-12-18T14:46:19+0000,article,None,World,Asia Pacific,News,nyt://article/98ced74c-2e0c-5e73-b9c2-d64213948f5e,541,nyt://article/98ced74c-2e0c-5e73-b9c2-d64213948f5e,Myanmar's Suu Kyi Says Supporters a 'Source of Strength' During Genocide Hearings,,,Myanmar's Suu Kyi Says Supporters a 'Source of Strength' During Genocide Hearings,,,,By Reuters,[],Reuters,,
2,By Maggie Fick,https://www.nytimes.com/reuters/2019/12/18/world/africa/18reuters-ethiopia-politics-surveillance-insight.html,By Maggie Fick,By Maggie Fick,Reuters,[],[],2019-12-18T14:46:15+0000,article,None,World,Africa,News,nyt://article/a2ee75f1-2bc8-55bb-a6b5-dbb079942f31,1208,nyt://article/a2ee75f1-2bc8-55bb-a6b5-dbb079942f31,"Ethiopia's Surveillance Network Crumbles, Meaning Less Fear and Less Control",,,"Ethiopia's Surveillance Network Crumbles, Meaning Less Fear and Less Control",,,,By Reuters,[],Reuters,,
3,The U.S. House of Representatives will vote on Wednesday to impeach President Donald Trump on charges that he abused the power of his office and obstructed Congress in its investigation of his dealings with Ukraine.,https://www.nytimes.com/reuters/2019/12/18/world/europe/18reuters-usa-trump-impeachment-charges-factbox.html,The U.S. House of Representatives will vote on Wednesday to impeach President Donald Trump on charges that he abused the power of his office and obstructed Congress in its investigation of his dealings with Ukraine.,(Reuters) - The U.S. House of Representatives will vote on Wednesday to impeach President Donald Trump on charges that he abused the power of his office and obstructed Congress in its investigation of his dealings with Ukraine.,Reuters,[],[],2019-12-18T14:46:13+0000,article,None,World,Europe,News,nyt://article/b31b24d0-663a-5a79-83bf-a25bb1ad5127,557,nyt://article/b31b24d0-663a-5a79-83bf-a25bb1ad5127,"Factbox: Abuse of Power, Obstruction-The Charges Against Trump Explained",,,"Factbox: Abuse of Power, Obstruction-The Charges Against Trump Explained",,,,By Reuters,[],Reuters,,
4,Global stock markets mostly dipped Thursday after the U.S. House of Representatives voted to impeach President Donald Trump and the central banks of Japan and Britain kept their interest rates low.,https://www.nytimes.com/aponline/2019/12/18/business/ap-financial-markets.html,Global stock markets mostly dipped Thursday after the U.S. House of Representatives voted to impeach President Donald Trump and the central banks of Japan and Britain kept their interest rates low.,BEIJING — Global stock markets mostly dipped Thursday after the U.S. House of Representatives voted to impeach President Donald Trump and the central banks of Japan and Britain kept their interest rates low.,AP,[],[],2019-12-18T14:45:32+0000,article,None,Business Day,,News,nyt://article/cf7821d0-76a0-52ab-bdd5-192a535e7e8d,374,nyt://article/cf7821d0-76a0-52ab-bdd5-192a535e7e8d,Global Stocks Dip After Trump Impeachment Vote,,,Global Stocks Dip After Trump Impeachment Vote,,,,By The Associated Press,[],The Associated Press,,
5,"Some fears surrounding Huawei Technologies are unfounded, the chief executive of France's leading telecoms operator Orange said on Wednesday, as the concerns threaten to delay the roll-out of 5G.",https://www.nytimes.com/reuters/2019/12/18/business/18reuters-orange-5g.html,"Some fears surrounding Huawei Technologies are unfounded, the chief executive of France's leading telecoms operator Orange said on Wednesday, as the concerns threaten to delay the roll-out of 5G.","PARIS — Some fears surrounding Huawei Technologies are unfounded, the chief executive of France's leading telecoms operator Orange said on Wednesday, as the concerns threaten to delay the roll-out of 5G.",Reuters,[],[],2019-12-18T14:43:05+0000,article,None,Business Day,,News,nyt://article/0998899d-e77a-579c-8f12-937d3dac4570,402,nyt://article/0998899d-e77a-579c-8f12-937d3dac4570,"Some Fears About Huawei Are 'Complete Nonsense', Orange's Boss Says",,,"Some Fears About Huawei Are 'Complete Nonsense', Orange's Boss Says",,,,By Reuters,[],Reuters,,
6,"Defiant in the face of a historic rebuke, President Donald Trump labeled his impeachment by the House of Representatives on Wednesday “a suicide march” for the Democratic Partyas he delivered a rambling two-hour rally speech that overlapped the vote.",https://www.nytimes.com/aponline/2019/12/18/us/politics/ap-us-trump.html,"Defiant in the face of a historic rebuke, President Donald Trump labeled his impeachment by the House of Representatives on Wednesday “a suicide march” for the Democratic Partyas he delivered a rambling two-hour rally speech that overlapped the vo...","BATTLE CREEK, Mich. — Defiant in the face of a historic rebuke, President Donald Trump labeled his impeachment by the House of Representatives on Wednesday “a suicide march” for the Democratic Partyas he delivered a rambling two-hour rally speech that overlapped the vote.",AP,[],[],2019-12-18T14:27:27+0000,article,None,U.S.,Politics,News,nyt://article/ea656d2a-e5da-5bb1-9cc2-349290a76fbd,902,nyt://article/ea656d2a-e5da-5bb1-9cc2-349290a76fbd,Defiant Trump Rallies Supporters as House Impeaches Him,,,Defiant Trump Rallies Supporters as House Impeaches Him,,,,By The Associated Press,[],The Associated Press,,
