,abstract,web_url,snippet,lead_paragraph,source,multimedia,keywords,pub_date,document_type,news_desk,section_name,subsection_name,type_of_material,_id,word_count,uri,headline_main,headline_kicker,headline_content_kicker,headline_print_headline,headline_name,headline_seo,headline_sub,byline_original,byline_person,byline_organization,print_section,print_page
0,U.S. President Donald Trump said in a tweet he will sign a $738 billion defense bill that sets policy on everything from family leave to fighter jets.,https://www.nytimes.com/reuters/2019/12/11/us/politics/11reuters-usa-defense-trump.html,U.S. President Donald Trump said in a tweet he will sign a $738 billion defense bill that sets policy on everything from family leave to fighter jets.,WASHINGTON — U.S. President Donald Trump said in a tweet he will sign a $738 billion defense bill that sets policy on everything from family leave to fighter jets.,Reuters,[],[],2019-12-11T16:43:29+0000,article,None,U.S.,Politics,News,nyt://article/8893a7e0-c947-58df-a04a-e3c3a8d8af41,138,nyt://article/8893a7e0-c947-58df-a04a-e3c3a8d8af41,Trump Says He Will Sign Defense Policy Bill After It Clears Congress,,,Trump Says He Will Sign Defense Policy Bill After It Clears Congress,,,,By Reuters,[],Reuters,,
1,"U.S. Senate Majority Leader Mitch McConnell on Wednesday said that the Republican-led chamber could start an impeachment trial of President Donald Trump, a fellow Republican, next month.",https://www.nytimes.com/reuters/2019/12/11/us/politics/11reuters-usa-trump-impeachment-senate.html,"U.S. Senate Majority Leader Mitch McConnell on Wednesday said that the Republican-led chamber could start an impeachment trial of President Donald Trump, a fellow Republican, next month.","WASHINGTON — U.S. Senate Majority Leader Mitch McConnell on Wednesday said that the Republican-led chamber could start an impeachment trial of President Donald Trump, a fellow Republican, next month.",Reuters,[],[],2019-12-11T16:43:24+0000,article,None,U.S.,Politics,News,nyt://article/1d9187d6-e516-5e6e-81cd-463f5035685c,69,nyt://article/1d9187d6-e516-5e6e-81cd-463f5035685c,U.S. Senate Could Start Impeachment Trial Next Month: McConnell,,,U.S. Senate Could Start Impeachment Trial Next Month: McConnell,,,,By Reuters,[],Reuters,,
2,"A year ago, Shoshana Zuboff dropped an intellectual bomb on the technology industry. She hasn’t stood still since.",https://www.nytimes.com/aponline/2019/12/11/business/ap-us-surveillance-capitalism.html,"A year ago, Shoshana Zuboff dropped an intellectual bomb on the technology industry. She hasn’t stood still since.","A year ago, Shoshana Zuboff dropped an intellectual bomb on the technology industry. She hasn’t stood still since.",AP,[],[],2019-12-11T16:42:31+0000,article,None,Business Day,,News,nyt://article/26036be9-087b-5b65-8218-54a8e36d9893,831,nyt://article/26036be9-087b-5b65-8218-54a8e36d9893,Meet the Scholar Who Diagnosed ‘Surveillance Capitalism’,,,Meet the Scholar Who Diagnosed &#8216;Surveillance Capitalism&#8217;,,,,By The Associated Press,[],The Associated Press,,
3,"Finland's new prime minister said on Wednesday the center-left coalition government had given its ""silent blessing"" to the Foreign Minister to go ahead with plans to repatriate children of women who traveled to Syria to join Islamic State.",https://www.nytimes.com/reuters/2019/12/11/world/europe/11reuters-syria-security-finland.html,"Finland's new prime minister said on Wednesday the center-left coalition government had given its ""silent blessing"" to the Foreign Minister to go ahead with plans to repatriate children of women who traveled to Syria to join Islamic State.","HELSINKI — Finland's new prime minister said on Wednesday the center-left coalition government had given its ""silent blessing"" to the Foreign Minister to go ahead with plans to repatriate children of women who traveled to Syria to join Islamic State.",Reuters,[],[],2019-12-11T16:37:29+0000,article,None,World,Europe,News,nyt://article/7b0e328e-f7ae-5903-9f54-8876ab5a6753,384,nyt://article/7b0e328e-f7ae-5903-9f54-8876ab5a6753,New Finland Leader: 'Silent Blessing' Given to Bring Home Islamic State Kids,,,New Finland Leader: 'Silent Blessing' Given to Bring Home Islamic State Kids,,,,By Reuters,[],Reuters,,
4,Britain's election on Thursday is widely referred to as the most important in a generation given the impact it will have on the country leaving the European Union and choosing between starkly opposed economic paths. ,https://www.nytimes.com/reuters/2019/12/11/business/11reuters-britain-election-markets-scenarios.html,Britain's election on Thursday is widely referred to as the most important in a generation given the impact it will have on the country leaving the European Union and choosing between starkly opposed economic paths. ,LONDON — Britain's election on Thursday is widely referred to as the most important in a generation given the impact it will have on the country leaving the European Union and choosing between starkly opposed economic paths. ,Reuters,[],[],2019-12-11T16:31:15+0000,article,None,Business Day,,News,nyt://article/b5360039-ef88-501d-b1b0-769009438a9a,1119,nyt://article/b5360039-ef88-501d-b1b0-769009438a9a,UK's Winter Election: What's in It for Markets?,,,UK's Winter Election: What's in It for Markets?,,,,By Reuters,[],Reuters,,
5,"Lebanon cannot expect to receive international aid for its battered economy until a new government undertakes serious reforms, diplomats decided at a closed-door meeting in Paris on Wednesday.",https://www.nytimes.com/aponline/2019/12/11/world/middleeast/ap-ml-lebanon.html,"Lebanon cannot expect to receive international aid for its battered economy until a new government undertakes serious reforms, diplomats decided at a closed-door meeting in Paris on Wednesday.","PARIS — Lebanon cannot expect to receive international aid for its battered economy until a new government undertakes serious reforms, diplomats decided at a closed-door meeting in Paris on Wednesday.",AP,[],[],2019-12-11T16:27:41+0000,article,None,World,Middle East,News,nyt://article/c2cc044c-f9a2-5e13-aebe-90abd028caed,885,nyt://article/c2cc044c-f9a2-5e13-aebe-90abd028caed,Diplomats to Lebanon: Expect No Aid Before Government Formed,,,Diplomats to Lebanon: Expect No Aid Before Government Formed,,,,By The Associated Press,[],The Associated Press,,
6,"Near the end of a marathon impeachment hearing in the House of Representatives last month, former White House national security aide Fiona Hill tied conservative jabs at George Soros to “the longest-running anti-Semitic trope that we have in history.” ",https://www.nytimes.com/aponline/2019/12/11/us/ap-religion-soros-antisemitism.html,"Near the end of a marathon impeachment hearing in the House of Representatives last month, former White House national security aide Fiona Hill tied conservative jabs at George Soros to “the longest-running anti-Semitic trope that we have in histo...","Near the end of a marathon impeachment hearing in the House of Representatives last month, former White House national security aide Fiona Hill tied conservative jabs at George Soros to “the longest-running anti-Semitic trope that we have in history.” ",AP,[],[],2019-12-11T16:24:38+0000,article,None,U.S.,,News,nyt://article/a97de111-036a-57dc-a034-2e392dc42c03,1202,nyt://article/a97de111-036a-57dc-a034-2e392dc42c03,Soros Attacks in Impeachment Saga Spark Anti-Semitism Debate,,,Soros Attacks in Impeachment Saga Spark Anti-Semitism Debate,,,,By The Associated Press,[],The Associated Press,,
7,Pete Mulvihill has felt optimistic enough about selling books that he bought a third bookstore within the past two months.,https://www.nytimes.com/aponline/2019/12/11/business/ap-us-smallbiz-small-talk-booksellers.html,Pete Mulvihill has felt optimistic enough about selling books that he bought a third bookstore within the past two months.,NEW YORK — Pete Mulvihill has felt optimistic enough about selling books that he bought a third bookstore within the past two months.,AP,[],[],2019-12-11T16:03:28+0000,article,None,Business Day,,News,nyt://article/a98e803a-534c-50ae-93fc-6a9c8bbf642c,996,nyt://article/a98e803a-534c-50ae-93fc-6a9c8bbf642c,"Indie Booksellers Persevere Despite Amazon, Rising Costs",,,"Indie Booksellers Persevere Despite Amazon, Rising Costs",,,,By The Associated Press,[],The Associated Press,,
