,abstract,web_url,snippet,lead_paragraph,source,multimedia,keywords,pub_date,document_type,news_desk,section_name,type_of_material,_id,word_count,uri,headline_main,headline_kicker,headline_content_kicker,headline_print_headline,headline_name,headline_seo,headline_sub,byline_original,byline_person,byline_organization,subsection_name,print_section,print_page
0,Elizabeth Warren is fighting to regain momentum in the turbulent tussle for the Democratic presidential nomination amid lingering questions about her consistency and ability to defeat President Donald Trump. ,https://www.nytimes.com/aponline/2020/01/27/us/ap-us-election-2020-warren.html,Elizabeth Warren is fighting to regain momentum in the turbulent tussle for the Democratic presidential nomination amid lingering questions about her consistency and ability to defeat President Donald Trump. ,"DES MOINES, Iowa — Elizabeth Warren is fighting to regain momentum in the turbulent tussle for the Democratic presidential nomination amid lingering questions about her consistency and ability to defeat President Donald Trump. ",AP,[],[],2020-01-27T05:21:29+0000,article,None,U.S.,News,nyt://article/832b9c52-3cf5-52a9-8f04-074dc8ea5daa,1232,nyt://article/832b9c52-3cf5-52a9-8f04-074dc8ea5daa,Elizabeth Warren Seeks a Spark in the Final Sprint to Iowa,,,Elizabeth Warren Seeks a Spark in the Final Sprint to Iowa,,,,By The Associated Press,[],The Associated Press,,,
1,"At nearly nine p.m. on Saturday, Samy Amkieh was about to head back to his office after braving 20 degree temperatures to knock on doors for three hours in East Des Moines. But the 20-year-old field organizer knocked on one more door and was rewarded by convincing the resident to be a team leader for Bernie Sanders at a nearby caucus location.",https://www.nytimes.com/aponline/2020/01/27/us/politics/ap-us-election-2020-iowa.html,"At nearly nine p.m. on Saturday, Samy Amkieh was about to head back to his office after braving 20 degree temperatures to knock on doors for three hours in East Des Moines. But the 20-year-old field organizer knocked on one more door and was rewar...","ANKENY, Iowa — At nearly nine p.m. on Saturday, Samy Amkieh was about to head back to his office after braving 20 degree temperatures to knock on doors for three hours in East Des Moines. But the 20-year-old field organizer knocked on one more door and was rewarded by convincing the resident to be a team leader for Bernie Sanders at a nearby caucus location.",AP,[],[],2020-01-27T05:15:52+0000,article,None,U.S.,News,nyt://article/b7177b58-b4c9-5ec8-997e-7b194a92737e,1290,nyt://article/b7177b58-b4c9-5ec8-997e-7b194a92737e,Organization Becomes Critical in Final Week Before Iowa Vote,,,Organization Becomes Critical in Final Week Before Iowa Vote,,,,By The Associated Press,[],The Associated Press,Politics,,
2,"The weekend is over. The senators on the campaign trail are turning into pumpkins, as Amy Klobuchar put it. And we’re signing off for the night.",https://www.nytimes.com/live/2020/iowa-democratic-caucus-01-26/good-night-iowa,"The weekend is over. The senators on the campaign trail are turning into pumpkins, as Amy Klobuchar put it. And we’re signing off for the night.","DES MOINES — The weekend is over. The senators on the campaign trail are turning into pumpkins, as Amy Klobuchar put it. And we’re signing off for the night.",The New York Times,[],[],2020-01-27T02:46:24+0000,article,Politics,U.S.,Live Blog Post,nyt://article/3e612777-47c2-5162-a288-d82aa1c2effc,111,nyt://article/3e612777-47c2-5162-a288-d82aa1c2effc,"Good night, Iowa.",,,,,,,By Maggie Astor,"[{'firstname': 'Maggie', 'middlename': None, 'lastname': 'Astor', 'qualifier': None, 'title': None, 'role': 'reported', 'organization': '', 'rank': 1}]",,Politics,,
3,"The candidates were in Iowa, but in Washington there was a major impeachment development.",https://www.nytimes.com/live/2020/iowa-democratic-caucus-01-26/bolton-biden-klobuchar,"The candidates were in Iowa, but in Washington there was a major impeachment development.","DES MOINES — News that President Trump told John Bolton, the former national security adviser, that he wanted to continue freezing aid to Ukraine until officials there helped with investigations into Democrats including the Biden family rippled through the campaign trail in Iowa on Sunday night. ",The New York Times,[],[],2020-01-27T02:22:15+0000,article,Politics,U.S.,Live Blog Post,nyt://article/e31a257e-4a4c-585d-8a8e-7bc513b9a08f,257,nyt://article/e31a257e-4a4c-585d-8a8e-7bc513b9a08f,The Bolton revelation sinks in on the campaign trail.,,,,,,,By Nick Corasaniti and Thomas Kaplan,"[{'firstname': 'Nick', 'middlename': None, 'lastname': 'Corasaniti', 'qualifier': None, 'title': None, 'role': 'reported', 'organization': '', 'rank': 1}, {'firstname': 'Thomas', 'middlename': None, 'lastname': 'Kaplan', 'qualifier': None, 'title': None, 'role': 'reported', 'organization': '', 'rank': 2}]",,Politics,,
4,"And they’re losing sleep. “Sometimes I can’t fall asleep at night,” one woman said. “I just can’t stop thinking about it.”",https://www.nytimes.com/live/2020/iowa-democratic-caucus-01-26/iowa-caucus-undecided,"And they’re losing sleep. “Sometimes I can’t fall asleep at night,” one woman said. “I just can’t stop thinking about it.”",WEST DES MOINES — What’s it like to be a still-undecided Iowa Democrat eight days before the state’s first-in-the-nation presidential caucuses?,The New York Times,[],[],2020-01-27T01:12:21+0000,article,Politics,U.S.,Live Blog Post,nyt://article/3bd3724d-716f-5aad-8aa4-650e405d831b,211,nyt://article/3bd3724d-716f-5aad-8aa4-650e405d831b,‘I’m really up in the air’: some Iowans are still undecided.,,,,,,,By Reid J. Epstein,"[{'firstname': 'Reid', 'middlename': 'J.', 'lastname': 'Epstein', 'qualifier': None, 'title': None, 'role': 'reported', 'organization': '', 'rank': 1}]",,Politics,,
