,abstract,web_url,snippet,lead_paragraph,source,multimedia,keywords,pub_date,document_type,news_desk,section_name,type_of_material,_id,word_count,uri,headline_main,headline_kicker,headline_content_kicker,headline_print_headline,headline_name,headline_seo,headline_sub,byline_original,byline_person,byline_organization,print_section,print_page,subsection_name
0,Searching for the best sources on the Bridge collapse around the Web.,https://thelede.blogs.nytimes.com/2007/08/02/following-the-minneapolis-bridge-collapse/,Searching for the best sources on the Bridge collapse around the Web.,Searching for the best sources on the Bridge collapse around the Web. The full story from The Times is here.,The New York Times,[],[],2007-08-02T21:22:37+0000,article,,Blogs,News,nyt://article/1cd9223a-b61d-504d-af1d-01a4140691f5,1831,nyt://article/1cd9223a-b61d-504d-af1d-01a4140691f5,Following the Minneapolis Bridge Collapse,The Lede,,,,,,By Mike Nizza,"[{'firstname': 'Mike', 'middlename': None, 'lastname': 'Nizza', 'qualifier': None, 'title': None, 'role': 'reported', 'organization': '', 'rank': 1}]",,,,
1,Rescue workers halted their efforts this afternoon to search the waters of the Mississippi River for dozens of people still missing after strong currents blocked their work.,https://www.nytimes.com/2007/08/02/us/02cnd-bridge.html,Rescue workers halted their efforts this afternoon to search the waters of the Mississippi River for dozens of people still missing after strong currents blocked their work.,Rescue workers halted their efforts this afternoon to search the waters of the Mississippi River in Minneapolis for dozens of people still missing in the wreckage of a collapsed highway bridge after strong currents blocked their work. ,The New York Times,"[{'rank': 0, 'subtype': 'xlarge', 'caption': None, 'credit': None, 'type': 'image', 'url': 'images/2007/08/02/us/02bridge.600.jpg', 'height': 296, 'width': 600, 'legacy': {'xlarge': 'images/2007/08/02/us/02bridge.600.jpg', 'xlargewidth': 600, 'xlargeheight': 296}, 'subType': 'xlarge', 'crop_name': 'articleLarge'}, {'rank': 0, 'subtype': 'popup', 'caption': None, 'credit': None, 'type': 'image', 'url': 'images/2007/08/02/us/02bridge.600.jpg', 'height': 296, 'width': 600, 'legacy': {}, 'subType': 'popup', 'crop_name': 'popup'}, {'rank': 0, 'subtype': 'sfSpan', 'caption': None, 'credit': None, 'type': 'image', 'url': 'images/2007/08/02/us/Bridge-Collapse.395.jpg', 'height': 265, 'width': 395, 'legacy': {}, 'subType': 'sfSpan', 'crop_name': 'sfSpan'}, {'rank': 0, 'subtype': 'hpLarge', 'caption': None, 'credit': None, 'type': 'image', 'url': 'images/2007/08/02/us/02bridge5.511.jpg', 'height': 252, 'width': 511, 'legacy': {}, 'subType': 'hpLarge', 'crop_name': 'hpLarge'}, {'rank': 0, 'subtype': 'thumbnail', 'caption': None, 'credit': None, 'type': 'image', 'url': 'images/2007/08/02/us/02bridge5.75.jpg', 'height': 75, 'width': 75, 'legacy': {'thumbnail': 'images/2007/08/02/us/02bridge5.75.jpg', 'thumbnailwidth': 75, 'thumbnailheight': 75}, 'subType': 'thumbnail', 'crop_name': 'thumbStandard'}]","[{'name': 'subject', 'value': 'Roads and Traffic', 'rank': 1, 'major': 'N'}, {'name': 'subject', 'value': 'ACCIDENTS AND SAFETY', 'rank': 2, 'major': 'N'}, {'name': 'glocations', 'value': 'Mississippi River', 'rank': 3, 'major': 'N'}, {'name': 'glocations', 'value': 'Minneapolis (Minn)', 'rank': 4, 'major': 'N'}, {'name': 'subject', 'value': 'Bridges and Tunnels', 'rank': 5, 'major': 'N'}]",2007-08-02T04:00:00+0000,article,ContinuousNews,U.S.,News,nyt://article/45a62097-ad68-5299-93bc-37bda256864d,2150,nyt://article/45a62097-ad68-5299-93bc-37bda256864d,Dozens Missing as Minneapolis Search Efforts Are Halted,,,Search Efforts Halted on Minneapolis Bridge,,,,By Jon Elsen and Libby Sander,"[{'firstname': 'Jon', 'middlename': None, 'lastname': 'Elsen', 'qualifier': None, 'title': None, 'role': 'reported', 'organization': '', 'rank': 1}, {'firstname': 'Libby', 'middlename': None, 'lastname': 'Sander', 'qualifier': None, 'title': None, 'role': 'reported', 'organization': '', 'rank': 2}]",,,,
2,"An Interstate highway bridge in downtown Minneapolis loaded with rush-hour traffic dropped more than 60 feet into the Mississippi River, sending at least 50 vehicles and passengers into the water.",https://www.nytimes.com/2007/08/02/us/02bridge.html,"An Interstate highway bridge in downtown Minneapolis loaded with rush-hour traffic dropped more than 60 feet into the Mississippi River, sending at least 50 vehicles and passengers into the water.","An Interstate highway bridge in downtown Minneapolis loaded with rush-hour traffic dropped more than 60 feet into the Mississippi River last night, sending at least 50 vehicles and passengers into the water.",The New York Times,"[{'rank': 0, 'subtype': 'xlarge', 'caption': None, 'credit': None, 'type': 'image', 'url': 'images/2007/08/01/us/02bridge.2-600.jpg', 'height': 320, 'width': 600, 'legacy': {'xlarge': 'images/2007/08/01/us/02bridge.2-600.jpg', 'xlargewidth': 600, 'xlargeheight': 320}, 'subType': 'xlarge', 'crop_name': 'articleLarge'}, {'rank': 0, 'subtype': 'popup', 'caption': None, 'credit': None, 'type': 'image', 'url': 'images/2007/08/01/us/02bridge.2-600.jpg', 'height': 320, 'width': 600, 'legacy': {}, 'subType': 'popup', 'crop_name': 'popup'}, {'rank': 0, 'subtype': 'sfSpan', 'caption': None, 'credit': None, 'type': 'image', 'url': 'images/2007/08/01/us/02bridge.2-395.jpg', 'height': 250, 'width': 395, 'legacy': {}, 'subType': 'sfSpan', 'crop_name': 'sfSpan'}]","[{'name': 'glocations', 'value': 'Minnesota', 'rank': 1, 'major': 'N'}, {'name': 'subject', 'value': 'Bridges and Tunnels', 'rank': 2, 'major': 'N'}, {'name': 'subject', 'value': 'ACCIDENTS AND SAFETY', 'rank': 3, 'major': 'N'}, {'name': 'glocations', 'value': 'Minneapolis (Minn)', 'rank': 4, 'major': 'N'}, {'name': 'subject', 'value': 'Roads and Traffic', 'rank': 5, 'major': 'N'}, {'name': 'glocations', 'value': 'St Paul (Minn)', 'rank': 6, 'major': 'N'}, {'name': 'glocations', 'value': 'Mississippi River', 'rank': 7, 'major': 'N'}]",2007-08-02T04:00:00+0000,article,National,U.S.,News,nyt://article/4677a423-7b98-503e-b06e-7238f4ca91d7,949,nyt://article/4677a423-7b98-503e-b06e-7238f4ca91d7,Bridge Collapse in Minneapolis Kills at Least 7,,,Bridge Failure In Minnesota Kills 7 People,,,,By Libby Sander and Susan Saulny,"[{'firstname': 'Libby', 'middlename': None, 'lastname': 'Sander', 'qualifier': None, 'title': None, 'role': 'reported', 'organization': '', 'rank': 1}, {'firstname': 'Susan', 'middlename': None, 'lastname': 'Saulny', 'qualifier': None, 'title': None, 'role': 'reported', 'organization': '', 'rank': 2}]",,A,1,
3,"An Interstate highway bridge in central Minneapolis loaded with rush-hour traffic dropped more than 60 feet into the Mississippi River tonight, sending at least 50 vehicles and passengers into the water below.",https://www.nytimes.com/2007/08/02/world/americas/02iht-02cndbridge.6949265.html,,"An Interstate highway bridge in central Minneapolis loaded with rush-hour traffic dropped more than 60 feet into the Mississippi River tonight, sending at least 50 vehicles and passengers into the water below.",International Herald Tribune,[],[],2007-08-01T05:00:00+0000,article,IHT News,World,News,nyt://article/392267f2-ee38-50a0-a504-15c1c39a7a15,772,nyt://article/392267f2-ee38-50a0-a504-15c1c39a7a15,Bridge collapse in Minneapolis kills at least 6,,,Bridge collapse in Minneapolis kills at least 6,,,,By Libby Sander and Susan Saulny,"[{'firstname': 'Libby', 'middlename': None, 'lastname': 'Sander', 'qualifier': None, 'title': None, 'role': 'reported', 'organization': '', 'rank': 1}, {'firstname': 'Susan', 'middlename': None, 'lastname': 'Saulny', 'qualifier': None, 'title': None, 'role': 'reported', 'organization': '', 'rank': 2}]",,,,Americas
4,"Only six months after winning their seats, new members find is Congress even more unpopular than President Bush.",https://www.nytimes.com/2007/06/29/us/politics/29web-hulse.html,"Only six months after winning their seats, new members find is Congress even more unpopular than President Bush.","Think about it this way: You want a job really, really badly, more than you ever wanted anything. You devote months to pursuing the position, working around the clock, enduring the worst kind of scrutiny and criticism and spending tens of millions of dollars that were excruciatingly hard to come by.",The New York Times,[],"[{'name': 'organizations', 'value': 'Senate', 'rank': 1, 'major': 'N'}, {'name': 'subject', 'value': 'Elections', 'rank': 2, 'major': 'N'}]",2007-06-29T14:52:00+0000,article,National,U.S.,News,nyt://article/95ffd0d6-df7c-53e0-8345-1d1ee53b03a8,791,nyt://article/95ffd0d6-df7c-53e0-8345-1d1ee53b03a8,Frustrating Lesson for Senate Freshmen,,,,,,,By Carl Hulse,"[{'firstname': 'Carl', 'middlename': None, 'lastname': 'Hulse', 'qualifier': None, 'title': None, 'role': 'reported', 'organization': '', 'rank': 1}]",,,,Politics
5,Three moderate Democratic freshmen are complicating efforts by President Bush and Senate leaders to pass a proposed immigration measure this week.,https://www.nytimes.com/2007/06/28/washington/28dems.html,Three moderate Democratic freshmen are complicating efforts by President Bush and Senate leaders to pass a proposed immigration measure this week.,"WASHINGTON, June 27 — In narrowly winning her seat last year, Senator Claire McCaskill of Missouri ran hard against what she saw as a flawed approach in Congress to dealing with illegal immigration. Ms. McCaskill, a Democratic newcomer, says she is not about to change her view now. ",The New York Times,[],"[{'name': 'subject', 'value': 'IMMIGRATION AND REFUGEES', 'rank': 1, 'major': 'N'}, {'name': 'persons', 'value': 'McCaskill, Claire', 'rank': 2, 'major': 'N'}, {'name': 'organizations', 'value': 'Senate', 'rank': 3, 'major': 'N'}]",2007-06-28T04:00:00+0000,article,National,Washington,News,nyt://article/883dd4c6-79aa-5f90-b503-196c97493e9e,1023,nyt://article/883dd4c6-79aa-5f90-b503-196c97493e9e,New Senators Resist Overhaul of Immigration,,,New Senators Resist Overhaul Of Immigration,,,,By Carl Hulse,"[{'firstname': 'Carl', 'middlename': None, 'lastname': 'Hulse', 'qualifier': None, 'title': None, 'role': 'reported', 'organization': '', 'rank': 1}]",,A,1,
