,abstract,web_url,snippet,lead_paragraph,source,multimedia,keywords,pub_date,document_type,news_desk,section_name,subsection_name,type_of_material,_id,word_count,uri,headline_main,headline_kicker,headline_content_kicker,headline_print_headline,headline_name,headline_seo,headline_sub,byline_original,byline_person,byline_organization,print_section,print_page
0,Developments in the Boston Marathon attacks and the civil war in Syria dominate the Sunday shows this week.,https://thecaucus.blogs.nytimes.com/2013/04/27/sunday-breakfast-menu-april-28/,Developments in the Boston Marathon attacks and the civil war in Syria dominate the Sunday shows this week.,"National security and foreign affairs share the limelight on the Sunday political shows this week, featuring conversations about the investigation into the Boston Marathon bombings and the response to new developments in Syria’s civil war.",The New York Times,[],"[{'name': 'subject', 'value': 'United States Politics and Government', 'rank': 1, 'major': 'N'}]",2013-04-27T22:26:52+0000,article,,U.S.,Politics,News,nyt://article/f336ea4c-3d8a-5cb8-af53-b90bcb6eb5f7,577,nyt://article/f336ea4c-3d8a-5cb8-af53-b90bcb6eb5f7,"Sunday Breakfast Menu, April 28",The Caucus,,,,,,By Emmarie Huetteman,"[{'firstname': 'Emmarie', 'middlename': None, 'lastname': 'Huetteman', 'qualifier': None, 'title': None, 'role': 'reported', 'organization': '', 'rank': 1}]",,,
1,The Senate reached an agreement Thursday night to give the secretary of transportation enough flexibility to bring the nation’s air-traffic control system back up to full strength.,https://www.nytimes.com/2013/04/26/us/politics/senate-moves-to-stop-air-controller-furloughs-and-prevent-travel-delays.html,The Senate reached an agreement Thursday night to give the secretary of transportation enough flexibility to bring the nation’s air-traffic control system back up to full strength.,"WASHINGTON — Driven by bipartisan concerns over mounting airport delays, the Senate reached agreement on Thursday night to give the secretary of transportation enough flexibility to bring the nation’s air traffic control system back up to full strength.",The New York Times,[],"[{'name': 'organizations', 'value': 'Senate', 'rank': 1, 'major': 'N'}, {'name': 'persons', 'value': 'Weisman, Jonathan', 'rank': 2, 'major': 'N'}, {'name': 'subject', 'value': 'AIR TRAFFIC CONTROL', 'rank': 3, 'major': 'N'}, {'name': 'subject', 'value': 'Budgets and Budgeting', 'rank': 4, 'major': 'N'}, {'name': 'organizations', 'value': 'Transportation Department (US)', 'rank': 5, 'major': 'N'}, {'name': 'organizations', 'value': 'Federal Aviation Administration', 'rank': 6, 'major': 'N'}, {'name': 'subject', 'value': 'AIRLINES AND AIRPLANES', 'rank': 7, 'major': 'N'}, {'name': 'subject', 'value': 'Delays (Transportation)', 'rank': 8, 'major': 'N'}, {'name': 'glocations', 'value': 'United States', 'rank': 9, 'major': 'N'}, {'name': 'subject', 'value': 'Government Employees', 'rank': 10, 'major': 'N'}, {'name': 'subject', 'value': 'Federal Budget (US)', 'rank': 11, 'major': 'N'}]",2013-04-26T02:00:05+0000,article,National,U.S.,Politics,News,nyt://article/f2f5c500-7396-5c04-b1c8-e82fc6252e7f,752,nyt://article/f2f5c500-7396-5c04-b1c8-e82fc6252e7f,Senate Moves to Stop Air-Controller Furloughs and Prevent Travel Delays,,,Senate Moves to Stop Air Controller Furloughs and Prevent Travel Delays,,,,By Jonathan Weisman,"[{'firstname': 'Jonathan', 'middlename': None, 'lastname': 'Weisman', 'qualifier': None, 'title': None, 'role': 'reported', 'organization': '', 'rank': 1}]",,A,12
2,See which senators voted against their party on recent gun legislation.,https://www.nytimes.com/interactive/2013/04/18/us/where-senators-voted-against-their-party.html,See which senators voted against their party on recent gun legislation.,See which senators voted against their party on recent gun legislation.,The New York Times,[],"[{'name': 'subject', 'value': 'Gun Control', 'rank': 1, 'major': 'N'}, {'name': 'subject', 'value': 'Law and Legislation', 'rank': 2, 'major': 'N'}, {'name': 'subject', 'value': 'United States Politics and Government', 'rank': 3, 'major': 'N'}, {'name': 'organizations', 'value': 'Senate', 'rank': 4, 'major': 'N'}]",2013-04-19T03:20:47+0000,multimedia,U.S.,U.S.,,Interactive Feature,nyt://interactive/49b1df1d-9dde-5203-a5b4-7d6f3a90504d,0,nyt://interactive/49b1df1d-9dde-5203-a5b4-7d6f3a90504d,Where Senators Voted Against Their Party,,,,,,,,[],,,
3,"A showdown was set for Wednesday on gun control that will determine the shape of legislation inspired by the shootings in Newtown, Conn.",https://www.nytimes.com/2013/04/17/us/politics/senate-sets-flurry-of-crucial-votes-on-gun-measures.html,"A showdown was set for Wednesday on gun control that will determine the shape of legislation inspired by the shootings in Newtown, Conn.","WASHINGTON —   The Senate will vote Wednesday afternoon on a series of gun measures that may determine the shape of legislation inspired by the shootings in Newtown, Conn. By late Tuesday night, a bipartisan amendment to the legislation, which would expand background checks for gun buyers, seemed all but doomed as two members who the measure’s sponsors had hoped would support it announced they would not.",The New York Times,"[{'rank': 0, 'subtype': 'wide', 'caption': None, 'credit': None, 'type': 'image', 'url': 'images/2013/04/17/us/2subGUNS/2subGUNS-thumbWide.jpg', 'height': 126, 'width': 190, 'legacy': {'widewidth': 190, 'wideheight': 126, 'wide': 'images/2013/04/17/us/2subGUNS/2subGUNS-thumbWide.jpg'}, 'subType': 'wide', 'crop_name': 'thumbWide'}, {'rank': 0, 'subtype': 'videoThumb', 'caption': None, 'credit': None, 'type': 'image', 'url': 'images/2013/04/17/us/2subGUNS/2subGUNS-videoThumb.jpg', 'height': 50, 'width': 75, 'legacy': {}, 'subType': 'videoThumb', 'crop_name': 'videoThumb'}, {'rank': 0, 'subtype': 'videoLarge', 'caption': None, 'credit': None, 'type': 'image', 'url': 'images/2013/04/17/us/2subGUNS/2subGUNS-videoLarge.jpg', 'height': 507, 'width': 768, 'legacy': {}, 'subType': 'videoLarge', 'crop_name': 'videoLarge'}, {'rank': 0, 'subtype': 'miniMoth', 'caption': None, 'credit': None, 'type': 'image', 'url': 'images/2013/04/17/us/2subGUNS/2subGUNS-miniMoth.jpg', 'height': 70, 'width': 151, 'legacy': {}, 'subType': 'miniMoth', 'crop_name': 'miniMoth'}, {'rank': 0, 'subtype': 'xlarge', 'caption': None, 'credit': None, 'type': 'image', 'url': 'images/2013/04/17/us/2subGUNS/2subGUNS-articleLarge.jpg', 'height': 448, 'width': 600, 'legacy': {'xlarge': 'images/2013/04/17/us/2subGUNS/2subGUNS-articleLarge.jpg', 'xlargewidth': 600, 'xlargeheight': 448}, 'subType': 'xlarge', 'crop_name': 'articleLarge'}, {'rank': 0, 'subtype': 'blog480', 'caption': None, 'credit': None, 'type': 'image', 'url': 'images/2013/04/17/us/2subGUNS/2subGUNS-blog480.jpg', 'height': 358, 'width': 480, 'legacy': {}, 'subType': 'blog480', 'crop_name': 'blog480'}, {'rank': 0, 'subtype': 'blog427', 'caption': None, 'credit': None, 'type': 'image', 'url': 'images/2013/04/17/us/2subGUNS/2subGUNS-blog427.jpg', 'height': 319, 'width': 427, 'legacy': {}, 'subType': 'blog427', 'crop_name': 'blog427'}, {'rank': 0, 'subtype': 'tmagArticle', 'caption': None, 'credit': None, 'type': 'image', 'url': 'images/2013/04/17/us/2subGUNS/2subGUNS-tmagArticle.jpg', 'height': 442, 'width': 592, 'legacy': {}, 'subType': 'tmagArticle', 'crop_name': 'tmagArticle'}, {'rank': 0, 'subtype': 'jumbo', 'caption': None, 'credit': None, 'type': 'image', 'url': 'images/2013/04/17/us/2subGUNS/2subGUNS-jumbo.jpg', 'height': 765, 'width': 1024, 'legacy': {}, 'subType': 'jumbo', 'crop_name': 'jumbo'}, {'rank': 0, 'subtype': 'blog225', 'caption': None, 'credit': None, 'type': 'image', 'url': 'images/2013/04/17/us/2subGUNS/2subGUNS-blog225.jpg', 'height': 168, 'width': 225, 'legacy': {}, 'subType': 'blog225', 'crop_name': 'blog225'}, {'rank': 0, 'subtype': 'popup', 'caption': None, 'credit': None, 'type': 'image', 'url': 'images/2013/04/17/us/2subGUNS/2subGUNS-popup.jpg', 'height': 485, 'width': 650, 'legacy': {}, 'subType': 'popup', 'crop_name': 'popup'}, {'rank': 0, 'subtype': 'blog533', 'caption': None, 'credit': None, 'type': 'image', 'url': 'images/2013/04/17/us/2subGUNS/2subGUNS-blog533.jpg', 'height': 398, 'width': 533, 'legacy': {}, 'subType': 'blog533', 'crop_name': 'blog533'}, {'rank': 0, 'subtype': 'tmagSF', 'caption': None, 'credit': None, 'type': 'image', 'url': 'images/2013/04/17/us/2subGUNS/2subGUNS-tmagSF.jpg', 'height': 270, 'width': 362, 'legacy': {}, 'subType': 'tmagSF', 'crop_name': 'tmagSF'}, {'rank': 0, 'subtype': 'slide', 'caption': None, 'credit': None, 'type': 'image', 'url': 'images/2013/04/17/us/2subGUNS/2subGUNS-slide.jpg', 'height': 448, 'width': 600, 'legacy': {}, 'subType': 'slide', 'crop_name': 'slide'}, {'rank': 0, 'subtype': 'superJumbo', 'caption': None, 'credit': None, 'type': 'image', 'url': 'images/2013/04/17/us/2subGUNS/2subGUNS-superJumbo.jpg', 'height': 1529, 'width': 2048, 'legacy': {}, 'subType': 'superJumbo', 'crop_name': 'superJumbo'}, {'rank': 0, 'subtype': 'square320', 'caption': None, 'credit': None, 'type': 'image', 'url': 'images/2013/04/17/us/2subGUNS/2subGUNS-square320.jpg', 'height': 320, 'width': 320, 'legacy': {}, 'subType': 'square320', 'crop_name': 'square320'}, {'rank': 0, 'subtype': 'filmstrip', 'caption': None, 'credit': None, 'type': 'image', 'url': 'images/2013/04/17/us/2subGUNS/2subGUNS-filmstrip.jpg', 'height': 190, 'width': 190, 'legacy': {}, 'subType': 'filmstrip', 'crop_name': 'filmstrip'}, {'rank': 0, 'subtype': 'square640', 'caption': None, 'credit': None, 'type': 'image', 'url': 'images/2013/04/17/us/2subGUNS/2subGUNS-square640.jpg', 'height': 640, 'width': 640, 'legacy': {}, 'subType': 'square640', 'crop_name': 'square640'}, {'rank': 0, 'subtype': 'moth', 'caption': None, 'credit': None, 'type': 'image', 'url': 'images/2013/04/17/us/2subGUNS/2subGUNS-moth.jpg', 'height': 151, 'width': 151, 'legacy': {}, 'subType': 'moth', 'crop_name': 'moth'}, {'rank': 0, 'subtype': 'articleInline', 'caption': None, 'credit': None, 'type': 'image', 'url': 'images/2013/04/17/us/2subGUNS/2subGUNS-articleInline.jpg', 'height': 142, 'width': 190, 'legacy': {}, 'subType': 'articleInline', 'crop_name': 'articleInline'}, {'rank': 0, 'subtype': 'hpSmall', 'caption': None, 'credit': None, 'type': 'image', 'url': 'images/2013/04/17/us/2subGUNS/2subGUNS-hpSmall.jpg', 'height': 122, 'width': 163, 'legacy': {}, 'subType': 'hpSmall', 'crop_name': 'hpSmall'}, {'rank': 0, 'subtype': 'blogSmallInline', 'caption': None, 'credit': None, 'type': 'image', 'url': 'images/2013/04/17/us/2subGUNS/2subGUNS-blogSmallInline.jpg', 'height': 113, 'width': 151, 'legacy': {}, 'subType': 'blogSmallInline', 'crop_name': 'blogSmallInline'}, {'rank': 0, 'subtype': 'mediumFlexible177', 'caption': None, 'credit': None, 'type': 'image', 'url': 'images/2013/04/17/us/2subGUNS/2subGUNS-mediumFlexible177.jpg', 'height': 132, 'width': 177, 'legacy': {}, 'subType': 'mediumFlexible177', 'crop_name': 'mediumFlexible177'}, {'rank': 0, 'subtype': 'sfSpan', 'caption': None, 'credit': None, 'type': 'image', 'url': 'images/2013/04/17/us/2subGUNS/2subGUNS-sfSpan.jpg', 'height': 263, 'width': 395, 'legacy': {}, 'subType': 'sfSpan', 'crop_name': 'sfSpan'}, {'rank': 0, 'subtype': 'largeHorizontal375', 'caption': None, 'credit': None, 'type': 'image', 'url': 'images/2013/04/17/us/2subGUNS/2subGUNS-largeHorizontal375.jpg', 'height': 250, 'width': 375, 'legacy': {}, 'subType': 'largeHorizontal375', 'crop_name': 'largeHorizontal375'}, {'rank': 0, 'subtype': 'hpLarge', 'caption': None, 'credit': None, 'type': 'image', 'url': 'images/2013/04/17/us/2subGUNS/2subGUNS-hpLarge.jpg', 'height': 255, 'width': 511, 'legacy': {}, 'subType': 'hpLarge', 'crop_name': 'hpLarge'}, {'rank': 0, 'subtype': 'largeWidescreen573', 'caption': None, 'credit': None, 'type': 'image', 'url': 'images/2013/04/17/us/2subGUNS/2subGUNS-largeWidescreen573.jpg', 'height': 286, 'width': 573, 'legacy': {}, 'subType': 'largeWidescreen573', 'crop_name': 'largeWidescreen573'}, {'rank': 0, 'subtype': 'videoSmall', 'caption': None, 'credit': None, 'type': 'image', 'url': 'images/2013/04/17/us/2subGUNS/2subGUNS-videoSmall.jpg', 'height': 281, 'width': 500, 'legacy': {}, 'subType': 'videoSmall', 'crop_name': 'videoSmall'}, {'rank': 0, 'subtype': 'videoHpMedium', 'caption': None, 'credit': None, 'type': 'image', 'url': 'images/2013/04/17/us/2subGUNS/2subGUNS-videoHpMedium.jpg', 'height': 190, 'width': 337, 'legacy': {}, 'subType': 'videoHpMedium', 'crop_name': 'videoHpMedium'}, {'rank': 0, 'subtype': 'thumbnail', 'caption': None, 'credit': None, 'type': 'image', 'url': 'images/2013/04/17/us/2subGUNS/2subGUNS-thumbStandard.jpg', 'height': 75, 'width': 75, 'legacy': {'thumbnail': 'images/2013/04/17/us/2subGUNS/2subGUNS-thumbStandard.jpg', 'thumbnailwidth': 75, 'thumbnailheight': 75}, 'subType': 'thumbnail', 'crop_name': 'thumbStandard'}, {'rank': 0, 'subtype': 'thumbLarge', 'caption': None, 'credit': None, 'type': 'image', 'url': 'images/2013/04/17/us/2subGUNS/2subGUNS-thumbLarge.jpg', 'height': 150, 'width': 150, 'legacy': {}, 'subType': 'thumbLarge', 'crop_name': 'thumbLarge'}, {'rank': 0, 'subtype': 'blogSmallThumb', 'caption': None, 'credit': None, 'type': 'image', 'url': 'images/2013/04/17/us/2subGUNS/2subGUNS-blogSmallThumb.jpg', 'height': 50, 'width': 50, 'legacy': {}, 'subType': 'blogSmallThumb', 'crop_name': 'blogSmallThumb'}]","[{'name': 'subject', 'value': 'Gun Control', 'rank': 1, 'major': 'N'}, {'name': 'persons', 'value': 'Weisman, Jonathan', 'rank': 2, 'major': 'N'}, {'name': 'subject', 'value': 'Law and Legislation', 'rank': 3, 'major': 'N'}, {'name': 'persons', 'value': 'Steinhauer, Jennifer', 'rank': 4, 'major': 'N'}, {'name': 'organizations', 'value': 'Senate', 'rank': 5, 'major': 'N'}, {'name': 'organizations', 'value': 'Republican Party', 'rank': 6, 'major': 'N'}, {'name': 'subject', 'value': 'United States Politics and Government', 'rank': 7, 'major': 'N'}, {'name': 'persons', 'value': 'Manchin, Joe III', 'rank': 8, 'major': 'N'}, {'name': 'persons', 'value': 'Toomey, Patrick J', 'rank': 9, 'major': 'N'}]",2013-04-17T00:51:00+0000,article,National,U.S.,Politics,News,nyt://article/da45f1a1-d990-5035-8878-31f5ab76c06f,909,nyt://article/da45f1a1-d990-5035-8878-31f5ab76c06f,"Senate Sets Flurry of Crucial Votes on Gun Measures, Some Expanding Rights",,,"Senate Sets Flurry of Crucial Votes on Gun Measures, Some Expanding Rights",,,,By Jonathan Weisman and Jennifer Steinhauer,"[{'firstname': 'Jonathan', 'middlename': None, 'lastname': 'Weisman', 'qualifier': None, 'title': None, 'role': 'reported', 'organization': '', 'rank': 1}, {'firstname': 'Jennifer', 'middlename': None, 'lastname': 'Steinhauer', 'qualifier': None, 'title': None, 'role': 'reported', 'organization': '', 'rank': 2}]",,A,17
4,President Obama’s proposal to trim future Medicare and Social Security benefits as part of a deficit compromise could force Democrats to take an uncomfortable stand on a measure that is unpopular with their base.,https://www.nytimes.com/2013/04/14/us/politics/president-obamas-budget-revives-benefits-as-divisive-issue.html,President Obama’s proposal to trim future Medicare and Social Security benefits as part of a deficit compromise could force Democrats to take an uncomfortable stand on a measure that is unpopular with their base.,"WASHINGTON — Whether or not Republicans ever agree to a budget deal with President Obama, one thing seems certain: now that he has officially put Social Security and Medicare benefits on the negotiating table, opponents on his party’s left will make that an issue for Democrats in the midterm elections next year — and perhaps in the 2016 presidential contest.",The New York Times,[],"[{'name': 'organizations', 'value': 'Democratic Party', 'rank': 1, 'major': 'N'}, {'name': 'persons', 'value': 'Calmes, Jackie', 'rank': 2, 'major': 'N'}, {'name': 'subject', 'value': 'Presidential Election of 2016', 'rank': 3, 'major': 'N'}, {'name': 'subject', 'value': 'United States Politics and Government', 'rank': 4, 'major': 'N'}, {'name': 'persons', 'value': 'Obama, Barack', 'rank': 5, 'major': 'N'}, {'name': 'subject', 'value': 'Health Insurance and Managed Care', 'rank': 6, 'major': 'N'}, {'name': 'subject', 'value': 'Social Security (US)', 'rank': 7, 'major': 'N'}, {'name': 'subject', 'value': 'Federal Budget (US)', 'rank': 8, 'major': 'N'}, {'name': 'subject', 'value': 'Medicare', 'rank': 9, 'major': 'N'}, {'name': 'glocations', 'value': 'United States', 'rank': 10, 'major': 'N'}]",2013-04-13T22:39:05+0000,article,National,U.S.,Politics,News,nyt://article/648dfadf-0a9a-5b4f-9e9e-b69df724a489,1215,nyt://article/648dfadf-0a9a-5b4f-9e9e-b69df724a489,Obama’s Budget Revives Benefits as Divisive Issue,,,Obama’s Budget Revives Benefits as Divisive Issue,,,,By Jackie Calmes,"[{'firstname': 'Jackie', 'middlename': None, 'lastname': 'Calmes', 'qualifier': None, 'title': None, 'role': 'reported', 'organization': '', 'rank': 1}]",,A,1
