,abstract,web_url,snippet,lead_paragraph,source,multimedia,keywords,pub_date,document_type,news_desk,section_name,subsection_name,type_of_material,_id,word_count,uri,headline_main,headline_kicker,headline_content_kicker,headline_print_headline,headline_name,headline_seo,headline_sub,byline_original,byline_person,byline_organization
0,"Just past the roulette wheel and slot machines, the smoky bars and blinking lights, Nevada Democrats are preparing to weigh in on their party's presidential nomination fight. ",https://www.nytimes.com/aponline/2020/02/21/us/politics/ap-us-election-2020.html,"Just past the roulette wheel and slot machines, the smoky bars and blinking lights, Nevada Democrats are preparing to weigh in on their party's presidential nomination fight. ","LAS VEGAS — Just past the roulette wheel and slot machines, the smoky bars and blinking lights, Nevada Democrats are preparing to weigh in on their party's presidential nomination fight. ",AP,[],[],2020-02-21T21:59:32+0000,article,None,U.S.,Politics,News,nyt://article/9eca1c03-23a0-59b5-b1bd-232137991154,1122,nyt://article/9eca1c03-23a0-59b5-b1bd-232137991154,"Bright Lights, Big Stakes for Democrats in Nevada",,,"Bright Lights, Big Stakes for Democrats in Nevada",,,,By The Associated Press,[],The Associated Press
1,"Opposition leader Juan Guaidó said Friday that he trusts U.S. President Donald Trump's ""firm and determined” backing following a White House meeting aimed at helping him steer crisis-stricken Venezuela toward a democratic transition. ",https://www.nytimes.com/aponline/2020/02/21/world/americas/ap-lt-venezuela-guaido-.html,"Opposition leader Juan Guaidó said Friday that he trusts U.S. President Donald Trump's ""firm and determined” backing following a White House meeting aimed at helping him steer crisis-stricken Venezuela toward a democratic transition. ","CARACAS, Venezuela — Opposition leader Juan Guaidó said Friday that he trusts U.S. President Donald Trump's ""firm and determined” backing following a White House meeting aimed at helping him steer crisis-stricken Venezuela toward a democratic transition. ",AP,[],[],2020-02-21T21:56:34+0000,article,None,World,Americas,News,nyt://article/45f069c8-eb4d-5a71-acae-7416da27a91e,700,nyt://article/45f069c8-eb4d-5a71-acae-7416da27a91e,AP Interview: Venezuela's Guaidó Extols Trump Alliance,,,AP Interview: Venezuela's Guaid&#243; Extols Trump Alliance,,,,By The Associated Press,[],The Associated Press
2,Democratic presidential candidate Bernie Sanders said Friday he was briefed by U.S. officials “about a month ago” that Russia has been trying to help his campaign as part of Moscow's efforts to interfere in the 2020 presidential election. ,https://www.nytimes.com/aponline/2020/02/21/us/politics/ap-election-2020-sanders.html,Democratic presidential candidate Bernie Sanders said Friday he was briefed by U.S. officials “about a month ago” that Russia has been trying to help his campaign as part of Moscow's efforts to interfere in the 2020 presidential election. ,WASHINGTON — Democratic presidential candidate Bernie Sanders said Friday he was briefed by U.S. officials “about a month ago” that Russia has been trying to help his campaign as part of Moscow's efforts to interfere in the 2020 presidential election. ,AP,[],[],2020-02-21T21:50:17+0000,article,None,U.S.,Politics,News,nyt://article/e65f5b21-bc40-54ef-af3b-3ccc0206bdfc,470,nyt://article/e65f5b21-bc40-54ef-af3b-3ccc0206bdfc,Sanders Condemns Russian Influence in Election,,,Sanders Condemns Russian Influence in Election,,,,By The Associated Press,[],The Associated Press
3,"U.S. officials have told Democratic presidential contender Bernie Sanders that Russia is trying to help his campaign, the Washington Post reported on Friday.",https://www.nytimes.com/reuters/2020/02/21/us/politics/21reuters-usa-election-russia-sanders.html,"U.S. officials have told Democratic presidential contender Bernie Sanders that Russia is trying to help his campaign, the Washington Post reported on Friday.","WASHINGTON — U.S. officials have told Democratic presidential contender Bernie Sanders that Russia is trying to help his campaign, the Washington Post reported on Friday.",Reuters,[],[],2020-02-21T21:44:12+0000,article,None,U.S.,Politics,News,nyt://article/2c82f38e-adb8-5b88-a556-ad49cdbf3e9b,121,nyt://article/2c82f38e-adb8-5b88-a556-ad49cdbf3e9b,U.S. Officials Tell Democrat Sanders Russia Is Trying to Help His Campaign: Washington Post,,,U.S. Officials Tell Democrat Sanders Russia Is Trying to Help His Campaign: Washington Post,,,,By Reuters,[],Reuters
4,"President Donald Trump rallied supporters in the battleground state of Nevada on the eve of the state's caucuses and predicted chaos once again for Democrats for their management of the voting process, ",https://www.nytimes.com/aponline/2020/02/21/us/politics/ap-us-trump.html,"President Donald Trump rallied supporters in the battleground state of Nevada on the eve of the state's caucuses and predicted chaos once again for Democrats for their management of the voting process, ","LAS VEGAS — President Donald Trump rallied supporters in the battleground state of Nevada on the eve of the state's caucuses and predicted chaos once again for Democrats for their management of the voting process, ",AP,[],[],2020-02-21T21:29:22+0000,article,None,U.S.,Politics,News,nyt://article/3d2baa98-54b7-5c9b-8dce-de3169efa5b9,385,nyt://article/3d2baa98-54b7-5c9b-8dce-de3169efa5b9,Trump Rallies Nevada GOP Ahead of State's Dem Caucuses,,,Trump Rallies Nevada GOP Ahead of State's Dem Caucuses,,,,By The Associated Press,[],The Associated Press
5,"Beyond the presidential candidates themselves, the Nevada caucuses Saturday will test Democratic National Committee Chairman Tom Perez as he tries to keep an already messy primary season from devolving into chaos. ",https://www.nytimes.com/aponline/2020/02/21/us/politics/ap-us-election-2020-perez.html,"Beyond the presidential candidates themselves, the Nevada caucuses Saturday will test Democratic National Committee Chairman Tom Perez as he tries to keep an already messy primary season from devolving into chaos. ","Beyond the presidential candidates themselves, the Nevada caucuses Saturday will test Democratic National Committee Chairman Tom Perez as he tries to keep an already messy primary season from devolving into chaos. ",AP,[],[],2020-02-21T21:23:37+0000,article,None,U.S.,Politics,News,nyt://article/fd87d0db-73ad-5ad4-8d6b-8232b942a642,1054,nyt://article/fd87d0db-73ad-5ad4-8d6b-8232b942a642,DNC Chair Unbowed by 2020 Fracas: 'My Job Is ... To Win',,,DNC Chair Unbowed by 2020 Fracas: 'My Job Is ... To Win',,,,By The Associated Press,[],The Associated Press
6,"Nevada Democrats are hoping to avoid a repeat of the chaos that ensnared the Iowa caucuses, as voters gather across the Silver State on Saturday to make their presidential preferences known. Iowa's process cratered this month following a rushed effort by state Democrats to deploy a mobile app for caucus volunteers to report results. Democrats in Nevada were going to use the same app developer as Iowa did, but quickly sidelined those plans. They will still be relying to some extent on technology to assist in counting and reporting results, though, and like Iowa, they will have paper backups. ",https://www.nytimes.com/aponline/2020/02/21/us/politics/ap-us-election-2020-nevada-qa.html,"Nevada Democrats are hoping to avoid a repeat of the chaos that ensnared the Iowa caucuses, as voters gather across the Silver State on Saturday to make their presidential preferences known. Iowa's process cratered this month following a rushed ef...","Nevada Democrats are hoping to avoid a repeat of the chaos that ensnared the Iowa caucuses, as voters gather across the Silver State on Saturday to make their presidential preferences known. Iowa's process cratered this month following a rushed effort by state Democrats to deploy a mobile app for caucus volunteers to report results. Democrats in Nevada were going to use the same app developer as Iowa did, but quickly sidelined those plans. They will still be relying to some extent on technology to assist in counting and reporting results, though, and like Iowa, they will have paper backups. ",AP,[],[],2020-02-21T20:23:19+0000,article,None,U.S.,Politics,News,nyt://article/b7b18558-598c-5258-8e70-eda2008a1e73,1030,nyt://article/b7b18558-598c-5258-8e70-eda2008a1e73,"Looking to Nevada, Will Dems Avoid Mistakes of Iowa?",,,"Looking to Nevada, Will Dems Avoid Mistakes of Iowa?",,,,By The Associated Press,[],The Associated Press
7,"As a diverse crowd filled a college student union this week, they swapped stories of seeking refuge in the U.S. or living in households that were a mix of U.S. citizens and people in the country illegally. They hoped to share their experiences with presidential candidates seeking support ahead of Saturday's Nevada caucuses.",https://www.nytimes.com/aponline/2020/02/21/us/politics/ap-us-election-2020-immigration.html,"As a diverse crowd filled a college student union this week, they swapped stories of seeking refuge in the U.S. or living in households that were a mix of U.S. citizens and people in the country illegally. They hoped to share their experiences wit...","LAS VEGAS — As a diverse crowd filled a college student union this week, they swapped stories of seeking refuge in the U.S. or living in households that were a mix of U.S. citizens and people in the country illegally. They hoped to share their experiences with presidential candidates seeking support ahead of Saturday's Nevada caucuses.",AP,[],[],2020-02-21T20:23:17+0000,article,None,U.S.,Politics,News,nyt://article/a816df9e-23fe-526b-a092-7229435eacd3,1182,nyt://article/a816df9e-23fe-526b-a092-7229435eacd3,Democrats Avoid Immigration Specifics Ahead of Nevada Vote,,,Democrats Avoid Immigration Specifics Ahead of Nevada Vote,,,,By The Associated Press,[],The Associated Press
8,"Just weeks into this year's election cycle, Russia already is actively interfering in the U.S. presidential campaign in hopes of reelecting President Donald Trump, and is also trying to help the candidacy of Sen. Bernie Sanders on the Democratic side, intelligence officials have concluded.",https://www.nytimes.com/aponline/2020/02/21/us/politics/ap-us-election-2020-trump-russia.html,"Just weeks into this year's election cycle, Russia already is actively interfering in the U.S. presidential campaign in hopes of reelecting President Donald Trump, and is also trying to help the candidacy of Sen. Bernie Sanders on the Democratic s...","WASHINGTON — Just weeks into this year's election cycle, Russia already is actively interfering in the U.S. presidential campaign in hopes of reelecting President Donald Trump, and is also trying to help the candidacy of Sen. Bernie Sanders on the Democratic side, intelligence officials have concluded.",AP,[],[],2020-02-21T19:35:17+0000,article,None,U.S.,Politics,News,nyt://article/3fbd037d-9807-5c95-9e1b-3c3c76e8683f,1302,nyt://article/3fbd037d-9807-5c95-9e1b-3c3c76e8683f,2016 Again? Russia Back to Stirring Chaos in U.S. Election,,,2016 Again? Russia Back to Stirring Chaos in U.S. Election,,,,By The Associated Press,[],The Associated Press
