,abstract,web_url,snippet,lead_paragraph,source,multimedia,keywords,pub_date,document_type,news_desk,section_name,subsection_name,type_of_material,_id,word_count,uri,headline_main,headline_kicker,headline_content_kicker,headline_print_headline,headline_name,headline_seo,headline_sub,byline_original,byline_person,byline_organization,print_section,print_page
0,"Just past the roulette wheel and slot machines, the smoky bars and blinking lights, Nevada Democrats are preparing to weigh in on their party's presidential nomination fight. ",https://www.nytimes.com/aponline/2020/02/21/us/politics/ap-us-election-2020.html,"Just past the roulette wheel and slot machines, the smoky bars and blinking lights, Nevada Democrats are preparing to weigh in on their party's presidential nomination fight. ","LAS VEGAS — Just past the roulette wheel and slot machines, the smoky bars and blinking lights, Nevada Democrats are preparing to weigh in on their party's presidential nomination fight. ",AP,[],[],2020-02-21T21:59:32+0000,article,None,U.S.,Politics,News,nyt://article/9eca1c03-23a0-59b5-b1bd-232137991154,1122,nyt://article/9eca1c03-23a0-59b5-b1bd-232137991154,"Bright Lights, Big Stakes for Democrats in Nevada",,,"Bright Lights, Big Stakes for Democrats in Nevada",,,,By The Associated Press,[],The Associated Press,,
1,"When Wall Street expects the Federal Reserve to cut interest rates, should that influence the Fed's decisions?",https://www.nytimes.com/aponline/2020/02/21/business/ap-us-federal-reserve-markets.html,"When Wall Street expects the Federal Reserve to cut interest rates, should that influence the Fed's decisions?","WASHINGTON — When Wall Street expects the Federal Reserve to cut interest rates, should that influence the Fed's decisions?",AP,[],[],2020-02-21T21:56:25+0000,article,None,Business Day,,News,nyt://article/ce95e174-baba-5ff3-8427-26f494d9b310,794,nyt://article/ce95e174-baba-5ff3-8427-26f494d9b310,Fed Officials Downplay Virus Even as Markets See Rate Cuts,,,Fed Officials Downplay Virus Even as Markets See Rate Cuts,,,,By The Associated Press,[],The Associated Press,,
2,"President Donald Trump rallied supporters in the battleground state of Nevada on the eve of the state's caucuses and predicted chaos once again for Democrats for their management of the voting process, ",https://www.nytimes.com/aponline/2020/02/21/us/politics/ap-us-trump.html,"President Donald Trump rallied supporters in the battleground state of Nevada on the eve of the state's caucuses and predicted chaos once again for Democrats for their management of the voting process, ","LAS VEGAS — President Donald Trump rallied supporters in the battleground state of Nevada on the eve of the state's caucuses and predicted chaos once again for Democrats for their management of the voting process, ",AP,[],[],2020-02-21T21:29:22+0000,article,None,U.S.,Politics,News,nyt://article/3d2baa98-54b7-5c9b-8dce-de3169efa5b9,385,nyt://article/3d2baa98-54b7-5c9b-8dce-de3169efa5b9,Trump Rallies Nevada GOP Ahead of State's Dem Caucuses,,,Trump Rallies Nevada GOP Ahead of State's Dem Caucuses,,,,By The Associated Press,[],The Associated Press,,
3,"Beyond the presidential candidates themselves, the Nevada caucuses Saturday will test Democratic National Committee Chairman Tom Perez as he tries to keep an already messy primary season from devolving into chaos. ",https://www.nytimes.com/aponline/2020/02/21/us/politics/ap-us-election-2020-perez.html,"Beyond the presidential candidates themselves, the Nevada caucuses Saturday will test Democratic National Committee Chairman Tom Perez as he tries to keep an already messy primary season from devolving into chaos. ","Beyond the presidential candidates themselves, the Nevada caucuses Saturday will test Democratic National Committee Chairman Tom Perez as he tries to keep an already messy primary season from devolving into chaos. ",AP,[],[],2020-02-21T21:23:37+0000,article,None,U.S.,Politics,News,nyt://article/fd87d0db-73ad-5ad4-8d6b-8232b942a642,1054,nyt://article/fd87d0db-73ad-5ad4-8d6b-8232b942a642,DNC Chair Unbowed by 2020 Fracas: 'My Job Is ... To Win',,,DNC Chair Unbowed by 2020 Fracas: 'My Job Is ... To Win',,,,By The Associated Press,[],The Associated Press,,
4,Mike Bloomberg said Friday he’d free three women from confidentiality agreements that bar them from speaking publicly about sexual harassment or discrimination suits filed against him over the last three decades. ,https://www.nytimes.com/aponline/2020/02/21/us/politics/ap-us-election-2020-bloomberg.html,Mike Bloomberg said Friday he’d free three women from confidentiality agreements that bar them from speaking publicly about sexual harassment or discrimination suits filed against him over the last three decades. ,WASHINGTON — Mike Bloomberg said Friday he’d free three women from confidentiality agreements that bar them from speaking publicly about sexual harassment or discrimination suits filed against him over the last three decades. ,AP,[],[],2020-02-21T21:17:21+0000,article,None,U.S.,Politics,News,nyt://article/8d546ede-965a-5771-94c0-47d07ce670ff,864,nyt://article/8d546ede-965a-5771-94c0-47d07ce670ff,Bloomberg : 3 Women Can Be Released on Non-Disclosure Deals,,,Bloomberg : 3 Women Can Be Released on Non-Disclosure Deals,,,,By The Associated Press,[],The Associated Press,,
5,"As a diverse crowd filled a college student union this week, they swapped stories of seeking refuge in the U.S. or living in households that were a mix of U.S. citizens and people in the country illegally. They hoped to share their experiences with presidential candidates seeking support ahead of Saturday's Nevada caucuses.",https://www.nytimes.com/aponline/2020/02/21/us/politics/ap-us-election-2020-immigration.html,"As a diverse crowd filled a college student union this week, they swapped stories of seeking refuge in the U.S. or living in households that were a mix of U.S. citizens and people in the country illegally. They hoped to share their experiences wit...","LAS VEGAS — As a diverse crowd filled a college student union this week, they swapped stories of seeking refuge in the U.S. or living in households that were a mix of U.S. citizens and people in the country illegally. They hoped to share their experiences with presidential candidates seeking support ahead of Saturday's Nevada caucuses.",AP,[],[],2020-02-21T20:23:17+0000,article,None,U.S.,Politics,News,nyt://article/a816df9e-23fe-526b-a092-7229435eacd3,1182,nyt://article/a816df9e-23fe-526b-a092-7229435eacd3,Democrats Avoid Immigration Specifics Ahead of Nevada Vote,,,Democrats Avoid Immigration Specifics Ahead of Nevada Vote,,,,By The Associated Press,[],The Associated Press,,
