,abstract,web_url,snippet,lead_paragraph,source,multimedia,keywords,pub_date,document_type,news_desk,section_name,subsection_name,type_of_material,_id,word_count,uri,headline_main,headline_kicker,headline_content_kicker,headline_print_headline,headline_name,headline_seo,headline_sub,byline_original,byline_person,byline_organization,print_section,print_page
5,"The U.S. military has deployed a new addition to its nuclear arsenal — a long-range missile armed with a nuclear warhead of reduced destructive power. The so-called low-yield missile joins other, more powerful weapons aboard stealthy submarines prowling the oceans.",https://www.nytimes.com/aponline/2020/02/04/us/politics/ap-us-united-states-new-nuke.html,"The U.S. military has deployed a new addition to its nuclear arsenal — a long-range missile armed with a nuclear warhead of reduced destructive power. The so-called low-yield missile joins other, more powerful weapons aboard stealthy submarines pr...","WASHINGTON — The U.S. military has deployed a new addition to its nuclear arsenal — a long-range missile armed with a nuclear warhead of reduced destructive power. The so-called low-yield missile joins other, more powerful weapons aboard stealthy submarines prowling the oceans.",AP,[],[],2020-02-04T07:03:32+0000,article,None,U.S.,Politics,News,nyt://article/c76969c0-6039-5014-8168-a1d2259bcaf7,1090,nyt://article/c76969c0-6039-5014-8168-a1d2259bcaf7,US Adds 'Low Yield' Nuclear Weapon to Its Submarine Arsenal,,,US Adds 'Low Yield' Nuclear Weapon to Its Submarine Arsenal,,,,By The Associated Press,[],The Associated Press,,
6,Democrat Kweisi Mfume and Republican Kimberly Klacik won special primaries Tuesday for the Maryland congressional seat that was held by the late Elijah Cummings. ,https://www.nytimes.com/aponline/2020/02/04/us/ap-us-special-election-maryland-primary.html,Democrat Kweisi Mfume and Republican Kimberly Klacik won special primaries Tuesday for the Maryland congressional seat that was held by the late Elijah Cummings. ,BALTIMORE — Democrat Kweisi Mfume and Republican Kimberly Klacik won special primaries Tuesday for the Maryland congressional seat that was held by the late Elijah Cummings. ,AP,[],[],2020-02-04T06:06:31+0000,article,None,U.S.,,News,nyt://article/5d731d36-d037-5ade-81c1-7c115a9e02cb,583,nyt://article/5d731d36-d037-5ade-81c1-7c115a9e02cb,"Mfume, Klacik Win Party Primaries for Elijah Cummings' Seat",,,"Mfume, Klacik Win Party Primaries for Elijah Cummings' Seat",,,,By The Associated Press,[],The Associated Press,,
7,A film starring Jodie Foster is airing. And President Trump delivers his third State of the Union Address.,https://www.nytimes.com/2020/02/04/arts/television/whats-on-tv-tuesday-contact-and-the-state-of-the-union.html,A film starring Jodie Foster is airing. And President Trump delivers his third State of the Union Address.,"CONTACT (1997) 7 p.m. on Ovation. Based on the 1985 science-fiction novel of the same title by Carl Sagan,  “Contact” yearns to bridge the gap between humanity and technological advancement. Jodie Foster plays Ellie Arroway, a scientist devoted to finding extraterrestrial life, who picks up a radio signal from another planet. This garners national attention, and as Ellie decodes the aliens’ message, she must protect her work from those trying to steal or discount it.  Ellie and a young minister named Palmer Joss (Matthew McConaughey) engage in a debate throughout over science and religion — and Palmer also becomes a love interest. “But try as it might to convey a humanist, mystical message and to equate the search for extraterrestrial life with religious faith,” Stephen Holden wrote in his review for The New York Times, “‘Contact’ is much more convincing when worshiping at the cold shrine of technology.”",The New York Times,"[{'rank': 0, 'subtype': 'xlarge', 'caption': None, 'credit': None, 'type': 'image', 'url': 'images/2020/02/04/arts/04tvcol-1/merlin_147167862_c4e14954-7961-45c4-85a2-f7c62aa4534b-articleLarge.jpg', 'height': 387, 'width': 600, 'legacy': {'xlarge': 'images/2020/02/04/arts/04tvcol-1/merlin_147167862_c4e14954-7961-45c4-85a2-f7c62aa4534b-articleLarge.jpg', 'xlargewidth': 600, 'xlargeheight': 387}, 'subType': 'xlarge', 'crop_name': 'articleLarge'}, {'rank': 0, 'subtype': 'popup', 'caption': None, 'credit': None, 'type': 'image', 'url': 'images/2020/02/04/arts/04tvcol-1/merlin_147167862_c4e14954-7961-45c4-85a2-f7c62aa4534b-popup.jpg', 'height': 419, 'width': 650, 'legacy': {}, 'subType': 'popup', 'crop_name': 'popup'}, {'rank': 0, 'subtype': 'blog480', 'caption': None, 'credit': None, 'type': 'image', 'url': 'images/2020/02/04/arts/04tvcol-1/merlin_147167862_c4e14954-7961-45c4-85a2-f7c62aa4534b-blog480.jpg', 'height': 309, 'width': 480, 'legacy': {}, 'subType': 'blog480', 'crop_name': 'blog480'}, {'rank': 0, 'subtype': 'blog533', 'caption': None, 'credit': None, 'type': 'image', 'url': 'images/2020/02/04/arts/04tvcol-1/merlin_147167862_c4e14954-7961-45c4-85a2-f7c62aa4534b-blog533.jpg', 'height': 343, 'width': 533, 'legacy': {}, 'subType': 'blog533', 'crop_name': 'blog533'}, {'rank': 0, 'subtype': 'blog427', 'caption': None, 'credit': None, 'type': 'image', 'url': 'images/2020/02/04/arts/04tvcol-1/merlin_147167862_c4e14954-7961-45c4-85a2-f7c62aa4534b-blog427.jpg', 'height': 275, 'width': 427, 'legacy': {}, 'subType': 'blog427', 'crop_name': 'blog427'}, {'rank': 0, 'subtype': 'tmagSF', 'caption': None, 'credit': None, 'type': 'image', 'url': 'images/2020/02/04/arts/04tvcol-1/merlin_147167862_c4e14954-7961-45c4-85a2-f7c62aa4534b-tmagSF.jpg', 'height': 233, 'width': 362, 'legacy': {}, 'subType': 'tmagSF', 'crop_name': 'tmagSF'}, {'rank': 0, 'subtype': 'tmagArticle', 'caption': None, 'credit': None, 'type': 'image', 'url': 'images/2020/02/04/arts/04tvcol-1/merlin_147167862_c4e14954-7961-45c4-85a2-f7c62aa4534b-tmagArticle.jpg', 'height': 381, 'width': 592, 'legacy': {}, 'subType': 'tmagArticle', 'crop_name': 'tmagArticle'}, {'rank': 0, 'subtype': 'slide', 'caption': None, 'credit': None, 'type': 'image', 'url': 'images/2020/02/04/arts/04tvcol-1/merlin_147167862_c4e14954-7961-45c4-85a2-f7c62aa4534b-slide.jpg', 'height': 387, 'width': 600, 'legacy': {}, 'subType': 'slide', 'crop_name': 'slide'}, {'rank': 0, 'subtype': 'jumbo', 'caption': None, 'credit': None, 'type': 'image', 'url': 'images/2020/02/04/arts/04tvcol-1/merlin_147167862_c4e14954-7961-45c4-85a2-f7c62aa4534b-jumbo.jpg', 'height': 660, 'width': 1024, 'legacy': {}, 'subType': 'jumbo', 'crop_name': 'jumbo'}, {'rank': 0, 'subtype': 'superJumbo', 'caption': None, 'credit': None, 'type': 'image', 'url': 'images/2020/02/04/arts/04tvcol-1/merlin_147167862_c4e14954-7961-45c4-85a2-f7c62aa4534b-superJumbo.jpg', 'height': 1000, 'width': 1552, 'legacy': {}, 'subType': 'superJumbo', 'crop_name': 'superJumbo'}, {'rank': 0, 'subtype': 'blog225', 'caption': None, 'credit': None, 'type': 'image', 'url': 'images/2020/02/04/arts/04tvcol-1/merlin_147167862_c4e14954-7961-45c4-85a2-f7c62aa4534b-blog225.jpg', 'height': 145, 'width': 225, 'legacy': {}, 'subType': 'blog225', 'crop_name': 'blog225'}, {'rank': 0, 'subtype': 'master1050', 'caption': None, 'credit': None, 'type': 'image', 'url': 'images/2020/02/04/arts/04tvcol-1/merlin_147167862_c4e14954-7961-45c4-85a2-f7c62aa4534b-master1050.jpg', 'height': 677, 'width': 1050, 'legacy': {}, 'subType': 'master1050', 'crop_name': 'master1050'}, {'rank': 0, 'subtype': 'master675', 'caption': None, 'credit': None, 'type': 'image', 'url': 'images/2020/02/04/arts/04tvcol-1/merlin_147167862_c4e14954-7961-45c4-85a2-f7c62aa4534b-master675.jpg', 'height': 435, 'width': 675, 'legacy': {}, 'subType': 'master675', 'crop_name': 'master675'}, {'rank': 0, 'subtype': 'master495', 'caption': None, 'credit': None, 'type': 'image', 'url': 'images/2020/02/04/arts/04tvcol-1/merlin_147167862_c4e14954-7961-45c4-85a2-f7c62aa4534b-master495.jpg', 'height': 319, 'width': 495, 'legacy': {}, 'subType': 'master495', 'crop_name': 'master495'}, {'rank': 0, 'subtype': 'master180', 'caption': None, 'credit': None, 'type': 'image', 'url': 'images/2020/02/04/arts/04tvcol-1/merlin_147167862_c4e14954-7961-45c4-85a2-f7c62aa4534b-master180.jpg', 'height': 116, 'width': 180, 'legacy': {}, 'subType': 'master180', 'crop_name': 'master180'}, {'rank': 0, 'subtype': 'master315', 'caption': None, 'credit': None, 'type': 'image', 'url': 'images/2020/02/04/arts/04tvcol-1/merlin_147167862_c4e14954-7961-45c4-85a2-f7c62aa4534b-master315.jpg', 'height': 203, 'width': 315, 'legacy': {}, 'subType': 'master315', 'crop_name': 'master315'}, {'rank': 0, 'subtype': 'master768', 'caption': None, 'credit': None, 'type': 'image', 'url': 'images/2020/02/04/arts/04tvcol-1/merlin_147167862_c4e14954-7961-45c4-85a2-f7c62aa4534b-master768.jpg', 'height': 495, 'width': 768, 'legacy': {}, 'subType': 'master768', 'crop_name': 'master768'}, {'rank': 0, 'subtype': 'thumbnail', 'caption': None, 'credit': None, 'type': 'image', 'url': 'images/2020/02/04/arts/04tvcol-1/04tvcol-1-thumbStandard.jpg', 'height': 75, 'width': 75, 'legacy': {'thumbnail': 'images/2020/02/04/arts/04tvcol-1/04tvcol-1-thumbStandard.jpg', 'thumbnailwidth': 75, 'thumbnailheight': 75}, 'subType': 'thumbnail', 'crop_name': 'thumbStandard'}, {'rank': 0, 'subtype': 'blogSmallThumb', 'caption': None, 'credit': None, 'type': 'image', 'url': 'images/2020/02/04/arts/04tvcol-1/04tvcol-1-blogSmallThumb.jpg', 'height': 50, 'width': 50, 'legacy': {}, 'subType': 'blogSmallThumb', 'crop_name': 'blogSmallThumb'}, {'rank': 0, 'subtype': 'thumbLarge', 'caption': None, 'credit': None, 'type': 'image', 'url': 'images/2020/02/04/arts/04tvcol-1/04tvcol-1-thumbLarge.jpg', 'height': 150, 'width': 150, 'legacy': {}, 'subType': 'thumbLarge', 'crop_name': 'thumbLarge'}, {'rank': 0, 'subtype': 'smallSquare168', 'caption': None, 'credit': None, 'type': 'image', 'url': 'images/2020/02/04/arts/04tvcol-1/04tvcol-1-smallSquare168.jpg', 'height': 168, 'width': 168, 'legacy': {}, 'subType': 'smallSquare168', 'crop_name': 'smallSquare168'}, {'rank': 0, 'subtype': 'smallSquare252', 'caption': None, 'credit': None, 'type': 'image', 'url': 'images/2020/02/04/arts/04tvcol-1/04tvcol-1-smallSquare252.jpg', 'height': 252, 'width': 252, 'legacy': {}, 'subType': 'smallSquare252', 'crop_name': 'smallSquare252'}, {'rank': 0, 'subtype': 'square320', 'caption': None, 'credit': None, 'type': 'image', 'url': 'images/2020/02/04/arts/04tvcol-1/04tvcol-1-square320.jpg', 'height': 320, 'width': 320, 'legacy': {}, 'subType': 'square320', 'crop_name': 'square320'}, {'rank': 0, 'subtype': 'moth', 'caption': None, 'credit': None, 'type': 'image', 'url': 'images/2020/02/04/arts/04tvcol-1/04tvcol-1-moth.jpg', 'height': 151, 'width': 151, 'legacy': {}, 'subType': 'moth', 'crop_name': 'moth'}, {'rank': 0, 'subtype': 'filmstrip', 'caption': None, 'credit': None, 'type': 'image', 'url': 'images/2020/02/04/arts/04tvcol-1/04tvcol-1-filmstrip.jpg', 'height': 190, 'width': 190, 'legacy': {}, 'subType': 'filmstrip', 'crop_name': 'filmstrip'}, {'rank': 0, 'subtype': 'square640', 'caption': None, 'credit': None, 'type': 'image', 'url': 'images/2020/02/04/arts/04tvcol-1/04tvcol-1-square640.jpg', 'height': 640, 'width': 640, 'legacy': {}, 'subType': 'square640', 'crop_name': 'square640'}, {'rank': 0, 'subtype': 'mediumSquare149', 'caption': None, 'credit': None, 'type': 'image', 'url': 'images/2020/02/04/arts/04tvcol-1/04tvcol-1-mediumSquare149.jpg', 'height': 149, 'width': 149, 'legacy': {}, 'subType': 'mediumSquare149', 'crop_name': 'mediumSquare149'}, {'rank': 0, 'subtype': 'sfSpan', 'caption': None, 'credit': None, 'type': 'image', 'url': 'images/2020/02/04/arts/04tvcol-1/04tvcol-1-sfSpan.jpg', 'height': 263, 'width': 395, 'legacy': {}, 'subType': 'sfSpan', 'crop_name': 'sfSpan'}, {'rank': 0, 'subtype': 'largeHorizontal375', 'caption': None, 'credit': None, 'type': 'image', 'url': 'images/2020/02/04/arts/04tvcol-1/04tvcol-1-largeHorizontal375.jpg', 'height': 250, 'width': 375, 'legacy': {}, 'subType': 'largeHorizontal375', 'crop_name': 'largeHorizontal375'}, {'rank': 0, 'subtype': 'largeHorizontalJumbo', 'caption': None, 'credit': None, 'type': 'image', 'url': 'images/2020/02/04/arts/04tvcol-1/04tvcol-1-largeHorizontalJumbo.jpg', 'height': 683, 'width': 1024, 'legacy': {}, 'subType': 'largeHorizontalJumbo', 'crop_name': 'largeHorizontalJumbo'}, {'rank': 0, 'subtype': 'horizontalMediumAt2X', 'caption': None, 'credit': None, 'type': 'image', 'url': 'images/2020/02/04/arts/04tvcol-1/04tvcol-1-horizontalMediumAt2X.jpg', 'height': 1000, 'width': 1500, 'legacy': {}, 'subType': 'horizontalMediumAt2X', 'crop_name': 'horizontalMediumAt2X'}, {'rank': 0, 'subtype': 'hpLarge', 'caption': None, 'credit': None, 'type': 'image', 'url': 'images/2020/02/04/arts/04tvcol-1/04tvcol-1-hpLarge.jpg', 'height': 287, 'width': 511, 'legacy': {}, 'subType': 'hpLarge', 'crop_name': 'hpLarge'}, {'rank': 0, 'subtype': 'largeWidescreen573', 'caption': None, 'credit': None, 'type': 'image', 'url': 'images/2020/02/04/arts/04tvcol-1/04tvcol-1-largeWidescreen573.jpg', 'height': 322, 'width': 573, 'legacy': {}, 'subType': 'largeWidescreen573', 'crop_name': 'largeWidescreen573'}, {'rank': 0, 'subtype': 'largeWidescreen1050', 'caption': None, 'credit': None, 'type': 'image', 'url': 'images/2020/02/04/arts/04tvcol-1/04tvcol-1-largeWidescreen1050.jpg', 'height': 591, 'width': 1050, 'legacy': {}, 'subType': 'largeWidescreen1050', 'crop_name': 'largeWidescreen1050'}, {'rank': 0, 'subtype': 'wide', 'caption': None, 'credit': None, 'type': 'image', 'url': 'images/2020/02/04/arts/04tvcol-1/04tvcol-1-thumbWide.jpg', 'height': 126, 'width': 190, 'legacy': {'widewidth': 190, 'wideheight': 126, 'wide': 'images/2020/02/04/arts/04tvcol-1/04tvcol-1-thumbWide.jpg'}, 'subType': 'wide', 'crop_name': 'thumbWide'}, {'rank': 0, 'subtype': 'videoThumb', 'caption': None, 'credit': None, 'type': 'image', 'url': 'images/2020/02/04/arts/04tvcol-1/04tvcol-1-videoThumb.jpg', 'height': 50, 'width': 75, 'legacy': {}, 'subType': 'videoThumb', 'crop_name': 'videoThumb'}, {'rank': 0, 'subtype': 'videoLarge', 'caption': None, 'credit': None, 'type': 'image', 'url': 'images/2020/02/04/arts/04tvcol-1/04tvcol-1-videoLarge.jpg', 'height': 507, 'width': 768, 'legacy': {}, 'subType': 'videoLarge', 'crop_name': 'videoLarge'}, {'rank': 0, 'subtype': 'mediumThreeByTwo210', 'caption': None, 'credit': None, 'type': 'image', 'url': 'images/2020/02/04/arts/04tvcol-1/04tvcol-1-mediumThreeByTwo210.jpg', 'height': 140, 'width': 210, 'legacy': {}, 'subType': 'mediumThreeByTwo210', 'crop_name': 'mediumThreeByTwo210'}, {'rank': 0, 'subtype': 'mediumThreeByTwo225', 'caption': None, 'credit': None, 'type': 'image', 'url': 'images/2020/02/04/arts/04tvcol-1/04tvcol-1-mediumThreeByTwo225.jpg', 'height': 150, 'width': 225, 'legacy': {}, 'subType': 'mediumThreeByTwo225', 'crop_name': 'mediumThreeByTwo225'}, {'rank': 0, 'subtype': 'mediumThreeByTwo440', 'caption': None, 'credit': None, 'type': 'image', 'url': 'images/2020/02/04/arts/04tvcol-1/04tvcol-1-mediumThreeByTwo440.jpg', 'height': 293, 'width': 440, 'legacy': {}, 'subType': 'mediumThreeByTwo440', 'crop_name': 'mediumThreeByTwo440'}, {'rank': 0, 'subtype': 'mediumThreeByTwo252', 'caption': None, 'credit': None, 'type': 'image', 'url': 'images/2020/02/04/arts/04tvcol-1/04tvcol-1-mediumThreeByTwo252.jpg', 'height': 168, 'width': 252, 'legacy': {}, 'subType': 'mediumThreeByTwo252', 'crop_name': 'mediumThreeByTwo252'}, {'rank': 0, 'subtype': 'mediumThreeByTwo378', 'caption': None, 'credit': None, 'type': 'image', 'url': 'images/2020/02/04/arts/04tvcol-1/04tvcol-1-mediumThreeByTwo378.jpg', 'height': 252, 'width': 378, 'legacy': {}, 'subType': 'mediumThreeByTwo378', 'crop_name': 'mediumThreeByTwo378'}, {'rank': 0, 'subtype': 'threeByTwoLargeAt2X', 'caption': None, 'credit': None, 'type': 'image', 'url': 'images/2020/02/04/arts/04tvcol-1/04tvcol-1-threeByTwoLargeAt2X.jpg', 'height': 1000, 'width': 1500, 'legacy': {}, 'subType': 'threeByTwoLargeAt2X', 'crop_name': 'threeByTwoLargeAt2X'}, {'rank': 0, 'subtype': 'threeByTwoMediumAt2X', 'caption': None, 'credit': None, 'type': 'image', 'url': 'images/2020/02/04/arts/04tvcol-1/04tvcol-1-threeByTwoMediumAt2X.jpg', 'height': 1000, 'width': 1500, 'legacy': {}, 'subType': 'threeByTwoMediumAt2X', 'crop_name': 'threeByTwoMediumAt2X'}, {'rank': 0, 'subtype': 'threeByTwoSmallAt2X', 'caption': None, 'credit': None, 'type': 'image', 'url': 'images/2020/02/04/arts/04tvcol-1/04tvcol-1-threeByTwoSmallAt2X.jpg', 'height': 400, 'width': 600, 'legacy': {}, 'subType': 'threeByTwoSmallAt2X', 'crop_name': 'threeByTwoSmallAt2X'}, {'rank': 0, 'subtype': 'articleInline', 'caption': None, 'credit': None, 'type': 'image', 'url': 'images/2020/02/04/arts/04tvcol-1/merlin_147167862_c4e14954-7961-45c4-85a2-f7c62aa4534b-articleInline.jpg', 'height': 122, 'width': 190, 'legacy': {}, 'subType': 'articleInline', 'crop_name': 'articleInline'}, {'rank': 0, 'subtype': 'hpSmall', 'caption': None, 'credit': None, 'type': 'image', 'url': 'images/2020/02/04/arts/04tvcol-1/merlin_147167862_c4e14954-7961-45c4-85a2-f7c62aa4534b-hpSmall.jpg', 'height': 105, 'width': 163, 'legacy': {}, 'subType': 'hpSmall', 'crop_name': 'hpSmall'}, {'rank': 0, 'subtype': 'blogSmallInline', 'caption': None, 'credit': None, 'type': 'image', 'url': 'images/2020/02/04/arts/04tvcol-1/merlin_147167862_c4e14954-7961-45c4-85a2-f7c62aa4534b-blogSmallInline.jpg', 'height': 97, 'width': 151, 'legacy': {}, 'subType': 'blogSmallInline', 'crop_name': 'blogSmallInline'}, {'rank': 0, 'subtype': 'mediumFlexible177', 'caption': None, 'credit': None, 'type': 'image', 'url': 'images/2020/02/04/arts/04tvcol-1/merlin_147167862_c4e14954-7961-45c4-85a2-f7c62aa4534b-mediumFlexible177.jpg', 'height': 114, 'width': 177, 'legacy': {}, 'subType': 'mediumFlexible177', 'crop_name': 'mediumFlexible177'}, {'rank': 0, 'subtype': 'videoSmall', 'caption': None, 'credit': None, 'type': 'image', 'url': 'images/2020/02/04/arts/04tvcol-1/04tvcol-1-videoSmall.jpg', 'height': 281, 'width': 500, 'legacy': {}, 'subType': 'videoSmall', 'crop_name': 'videoSmall'}, {'rank': 0, 'subtype': 'videoHpMedium', 'caption': None, 'credit': None, 'type': 'image', 'url': 'images/2020/02/04/arts/04tvcol-1/04tvcol-1-videoHpMedium.jpg', 'height': 211, 'width': 375, 'legacy': {}, 'subType': 'videoHpMedium', 'crop_name': 'videoHpMedium'}, {'rank': 0, 'subtype': 'videoSixteenByNine600', 'caption': None, 'credit': None, 'type': 'image', 'url': 'images/2020/02/04/arts/04tvcol-1/04tvcol-1-videoSixteenByNine600.jpg', 'height': 338, 'width': 600, 'legacy': {}, 'subType': 'videoSixteenByNine600', 'crop_name': 'videoSixteenByNine600'}, {'rank': 0, 'subtype': 'videoSixteenByNine540', 'caption': None, 'credit': None, 'type': 'image', 'url': 'images/2020/02/04/arts/04tvcol-1/04tvcol-1-videoSixteenByNine540.jpg', 'height': 304, 'width': 540, 'legacy': {}, 'subType': 'videoSixteenByNine540', 'crop_name': 'videoSixteenByNine540'}, {'rank': 0, 'subtype': 'videoSixteenByNine495', 'caption': None, 'credit': None, 'type': 'image', 'url': 'images/2020/02/04/arts/04tvcol-1/04tvcol-1-videoSixteenByNine495.jpg', 'height': 278, 'width': 495, 'legacy': {}, 'subType': 'videoSixteenByNine495', 'crop_name': 'videoSixteenByNine495'}, {'rank': 0, 'subtype': 'videoSixteenByNine390', 'caption': None, 'credit': None, 'type': 'image', 'url': 'images/2020/02/04/arts/04tvcol-1/04tvcol-1-videoSixteenByNine390.jpg', 'height': 219, 'width': 390, 'legacy': {}, 'subType': 'videoSixteenByNine390', 'crop_name': 'videoSixteenByNine390'}, {'rank': 0, 'subtype': 'videoSixteenByNine1050', 'caption': None, 'credit': None, 'type': 'image', 'url': 'images/2020/02/04/arts/04tvcol-1/04tvcol-1-videoSixteenByNine1050.jpg', 'height': 591, 'width': 1050, 'legacy': {}, 'subType': 'videoSixteenByNine1050', 'crop_name': 'videoSixteenByNine1050'}, {'rank': 0, 'subtype': 'videoSixteenByNine480', 'caption': None, 'credit': None, 'type': 'image', 'url': 'images/2020/02/04/arts/04tvcol-1/04tvcol-1-videoSixteenByNine480.jpg', 'height': 270, 'width': 480, 'legacy': {}, 'subType': 'videoSixteenByNine480', 'crop_name': 'videoSixteenByNine480'}, {'rank': 0, 'subtype': 'videoSixteenByNine310', 'caption': None, 'credit': None, 'type': 'image', 'url': 'images/2020/02/04/arts/04tvcol-1/04tvcol-1-videoSixteenByNine310.jpg', 'height': 174, 'width': 310, 'legacy': {}, 'subType': 'videoSixteenByNine310', 'crop_name': 'videoSixteenByNine310'}, {'rank': 0, 'subtype': 'videoSixteenByNine225', 'caption': None, 'credit': None, 'type': 'image', 'url': 'images/2020/02/04/arts/04tvcol-1/04tvcol-1-videoSixteenByNine225.jpg', 'height': 126, 'width': 225, 'legacy': {}, 'subType': 'videoSixteenByNine225', 'crop_name': 'videoSixteenByNine225'}, {'rank': 0, 'subtype': 'videoSixteenByNine96', 'caption': None, 'credit': None, 'type': 'image', 'url': 'images/2020/02/04/arts/04tvcol-1/04tvcol-1-videoSixteenByNine96.jpg', 'height': 54, 'width': 96, 'legacy': {}, 'subType': 'videoSixteenByNine96', 'crop_name': 'videoSixteenByNine96'}, {'rank': 0, 'subtype': 'videoSixteenByNine768', 'caption': None, 'credit': None, 'type': 'image', 'url': 'images/2020/02/04/arts/04tvcol-1/04tvcol-1-videoSixteenByNine768.jpg', 'height': 432, 'width': 768, 'legacy': {}, 'subType': 'videoSixteenByNine768', 'crop_name': 'videoSixteenByNine768'}, {'rank': 0, 'subtype': 'videoSixteenByNine150', 'caption': None, 'credit': None, 'type': 'image', 'url': 'images/2020/02/04/arts/04tvcol-1/04tvcol-1-videoSixteenByNine150.jpg', 'height': 84, 'width': 150, 'legacy': {}, 'subType': 'videoSixteenByNine150', 'crop_name': 'videoSixteenByNine150'}, {'rank': 0, 'subtype': 'videoSixteenByNineJumbo1600', 'caption': None, 'credit': None, 'type': 'image', 'url': 'images/2020/02/04/arts/04tvcol-1/04tvcol-1-videoSixteenByNineJumbo1600.jpg', 'height': 873, 'width': 1552, 'legacy': {}, 'subType': 'videoSixteenByNineJumbo1600', 'crop_name': 'videoSixteenByNineJumbo1600'}, {'rank': 0, 'subtype': 'miniMoth', 'caption': None, 'credit': None, 'type': 'image', 'url': 'images/2020/02/04/arts/04tvcol-1/04tvcol-1-miniMoth.jpg', 'height': 70, 'width': 151, 'legacy': {}, 'subType': 'miniMoth', 'crop_name': 'miniMoth'}, {'rank': 0, 'subtype': 'windowsTile336H', 'caption': None, 'credit': None, 'type': 'image', 'url': 'images/2020/02/04/arts/04tvcol-1/04tvcol-1-windowsTile336H.jpg', 'height': 336, 'width': 694, 'legacy': {}, 'subType': 'windowsTile336H', 'crop_name': 'windowsTile336H'}, {'rank': 0, 'subtype': 'videoFifteenBySeven1305', 'caption': None, 'credit': None, 'type': 'image', 'url': 'images/2020/02/04/arts/04tvcol-1/04tvcol-1-videoFifteenBySeven1305.jpg', 'height': 609, 'width': 1305, 'legacy': {}, 'subType': 'videoFifteenBySeven1305', 'crop_name': 'videoFifteenBySeven1305'}, {'rank': 0, 'subtype': 'facebookJumbo', 'caption': None, 'credit': None, 'type': 'image', 'url': 'images/2020/02/04/arts/04tvcol-1/04tvcol-1-facebookJumbo.jpg', 'height': 549, 'width': 1050, 'legacy': {}, 'subType': 'facebookJumbo', 'crop_name': 'facebookJumbo'}, {'rank': 0, 'subtype': 'watch308', 'caption': None, 'credit': None, 'type': 'image', 'url': 'images/2020/02/04/arts/04tvcol-1/04tvcol-1-watch308.jpg', 'height': 348, 'width': 312, 'legacy': {}, 'subType': 'watch308', 'crop_name': 'watch308'}, {'rank': 0, 'subtype': 'watch268', 'caption': None, 'credit': None, 'type': 'image', 'url': 'images/2020/02/04/arts/04tvcol-1/04tvcol-1-watch268.jpg', 'height': 304, 'width': 272, 'legacy': {}, 'subType': 'watch268', 'crop_name': 'watch268'}, {'rank': 0, 'subtype': 'mobileMasterAt3x', 'caption': None, 'credit': None, 'type': 'image', 'url': 'images/2020/02/04/arts/04tvcol-1/merlin_147167862_c4e14954-7961-45c4-85a2-f7c62aa4534b-mobileMasterAt3x.jpg', 'height': 1000, 'width': 1552, 'legacy': {}, 'subType': 'mobileMasterAt3x', 'crop_name': 'mobileMasterAt3x'}]","[{'name': 'subject', 'value': 'Television', 'rank': 1, 'major': 'N'}, {'name': 'subject', 'value': 'Movies', 'rank': 2, 'major': 'N'}]",2020-02-04T06:00:07+0000,article,Culture,Arts,Television,News,nyt://article/21f502bf-334e-58aa-9f42-8e20623a3b38,459,nyt://article/21f502bf-334e-58aa-9f42-8e20623a3b38,What’s on TV Tuesday: ‘Contact’ and the State of the Union,,,What’s On Tuesday,,,,By Mariel Wamsley,"[{'firstname': 'Mariel', 'middlename': None, 'lastname': 'Wamsley', 'qualifier': None, 'title': None, 'role': 'reported', 'organization': '', 'rank': 1}]",,C,7
