,abstract,web_url,snippet,lead_paragraph,source,multimedia,keywords,pub_date,document_type,news_desk,section_name,subsection_name,type_of_material,_id,word_count,uri,headline_main,headline_kicker,headline_content_kicker,headline_print_headline,headline_name,headline_seo,headline_sub,byline_original,byline_person,byline_organization,print_section,print_page
3,U.S. Senate Republican leader Mitch McConnell on Tuesday appeared to reject a request from the Senate's top Democrat to call new witnesses in the expected impeachment trial of President Donald Trump.,https://www.nytimes.com/reuters/2019/12/17/us/politics/17reuters-usa-trump-impeachment-senate.html,U.S. Senate Republican leader Mitch McConnell on Tuesday appeared to reject a request from the Senate's top Democrat to call new witnesses in the expected impeachment trial of President Donald Trump.,WASHINGTON — U.S. Senate Republican leader Mitch McConnell on Tuesday appeared to reject a request from the Senate's top Democrat to call new witnesses in the expected impeachment trial of President Donald Trump.,Reuters,[],[],2019-12-17T15:57:51+0000,article,None,U.S.,Politics,News,nyt://article/9bbd1ebd-81fc-588b-88a1-108ce5293321,111,nyt://article/9bbd1ebd-81fc-588b-88a1-108ce5293321,McConnell Suggests Senate Will Not Call Witnesses Requested by Democrats in Impeachment Trial,,,McConnell Suggests Senate Will Not Call Witnesses Requested by Democrats in Impeachment Trial,,,,By Reuters,[],Reuters,,
4,"Negotiators reached a tentative deal to end a labor dispute that threatened this week's Democratic debate, allowing the event bringing together seven top presidential candidates to proceed, a service workers union and Democratic officials said on Tuesday.",https://www.nytimes.com/reuters/2019/12/17/us/politics/17reuters-usa-election-debate.html,"Negotiators reached a tentative deal to end a labor dispute that threatened this week's Democratic debate, allowing the event bringing together seven top presidential candidates to proceed, a service workers union and Democratic officials said on ...","INGLEWOOD, Calif. — Negotiators reached a tentative deal to end a labor dispute that threatened this week's Democratic debate, allowing the event bringing together seven top presidential candidates to proceed, a service workers union and Democratic officials said on Tuesday.",Reuters,[],[],2019-12-17T15:43:00+0000,article,None,U.S.,Politics,News,nyt://article/8df6c7e6-e7ed-50aa-925d-ced19e6e46f5,354,nyt://article/8df6c7e6-e7ed-50aa-925d-ced19e6e46f5,U.S. Democratic Debate to Proceed After Labor Dispute Settled,,,U.S. Democratic Debate to Proceed After Labor Dispute Settled,,,,By Reuters,[],Reuters,,
5,The State Department said Tuesday that recent congressional action to recognize the Armenian genocide does not reflect Trump administration policy.,https://www.nytimes.com/aponline/2019/12/17/us/politics/ap-us-united-states-turkey-armenian-genocide.html,The State Department said Tuesday that recent congressional action to recognize the Armenian genocide does not reflect Trump administration policy.,WASHINGTON — The State Department said Tuesday that recent congressional action to recognize the Armenian genocide does not reflect Trump administration policy.,AP,[],[],2019-12-17T15:27:33+0000,article,None,U.S.,Politics,News,nyt://article/10f4173d-9b9e-5e12-b1d4-d393a5d1341d,457,nyt://article/10f4173d-9b9e-5e12-b1d4-d393a5d1341d,State Department: Bill Noting Armenian Genocide Isn't Policy,,,State Department: Bill Noting Armenian Genocide Isn't Policy,,,,By The Associated Press,[],The Associated Press,,
6,"Prime Minister Boris Johnson has set a course to take Britain out of the European Union, and negotiate new free trade deals with Brussels and the United States. ",https://www.nytimes.com/reuters/2019/12/17/world/europe/17reuters-britain-eu-factbox.html,"Prime Minister Boris Johnson has set a course to take Britain out of the European Union, and negotiate new free trade deals with Brussels and the United States. ","LONDON — Prime Minister Boris Johnson has set a course to take Britain out of the European Union, and negotiate new free trade deals with Brussels and the United States. ",Reuters,[],[],2019-12-17T15:04:01+0000,article,None,World,Europe,News,nyt://article/ff412459-5fbc-5853-8af2-bdfb953eee0f,534,nyt://article/ff412459-5fbc-5853-8af2-bdfb953eee0f,"Factbox: Key Milestones on Britain's Road to Brexit, and Beyond",,,"Factbox: Key Milestones on Britain's Road to Brexit, and Beyond",,,,By Reuters,[],Reuters,,
7,"President Donald Trump supports massive U.S. government spending plans hammered out by Congress this week and plans to sign the $1.4 trillion budget bill into law, White House adviser Kellyanne Conway said on Tuesday.",https://www.nytimes.com/reuters/2019/12/17/us/politics/17reuters-usa-budget-trump.html,"President Donald Trump supports massive U.S. government spending plans hammered out by Congress this week and plans to sign the $1.4 trillion budget bill into law, White House adviser Kellyanne Conway said on Tuesday.","WASHINGTON — President Donald Trump supports massive U.S. government spending plans hammered out by Congress this week and plans to sign the $1.4 trillion budget bill into law, White House adviser Kellyanne Conway said on Tuesday.",Reuters,[],[],2019-12-17T15:01:02+0000,article,None,U.S.,Politics,News,nyt://article/e58dbc08-aa77-50a1-bc50-258ce5485e30,179,nyt://article/e58dbc08-aa77-50a1-bc50-258ce5485e30,Trump Poised to Sign Massive Government Spending Bill: White House,,,Trump Poised to Sign Massive Government Spending Bill: White House,,,,By Reuters,[],Reuters,,
8,"U.S. industrial production snapped back last month, posting the biggest gain in more than two years, boosted by the end of a strike at General Motors.",https://www.nytimes.com/aponline/2019/12/17/us/politics/bc-industrial-production.html,"U.S. industrial production snapped back last month, posting the biggest gain in more than two years, boosted by the end of a strike at General Motors.","WASHINGTON — U.S. industrial production snapped back last month, posting the biggest gain in more than two years, boosted by the end of a strike at General Motors.",AP,[],[],2019-12-17T14:21:30+0000,article,None,U.S.,Politics,News,nyt://article/76852e43-9c70-5411-aa74-eab96f7d84f9,228,nyt://article/76852e43-9c70-5411-aa74-eab96f7d84f9,"US Industrial Production Snaps Back, Rises 1.1% in November",,,"US Industrial Production Snaps Back, Rises 1.1% in November",,,,By The Associated Press,[],The Associated Press,,
