,abstract,web_url,snippet,lead_paragraph,source,multimedia,keywords,pub_date,document_type,news_desk,section_name,type_of_material,_id,word_count,uri,headline_main,headline_kicker,headline_content_kicker,headline_print_headline,headline_name,headline_seo,headline_sub,byline_original,byline_person,byline_organization,subsection_name,print_section,print_page
0,"A meeting of U.S. government officials to discuss further curbs on exports to Huawei and China is still on for Thursday, two sources said, despite pushback from President Donald Trump against the restrictions.",https://www.nytimes.com/reuters/2020/02/19/business/19reuters-usa-china-huawei-tech.html,"A meeting of U.S. government officials to discuss further curbs on exports to Huawei and China is still on for Thursday, two sources said, despite pushback from President Donald Trump against the restrictions.","WASHINGTON — A meeting of U.S. government officials to discuss further curbs on exports to Huawei and China is still on for Thursday, two sources said, despite pushback from President Donald Trump against the restrictions.",Reuters,[],[],2020-02-19T23:50:11+0000,article,None,Business Day,News,nyt://article/7e2509f4-f20c-5c71-b4ba-70467cfeb989,359,nyt://article/7e2509f4-f20c-5c71-b4ba-70467cfeb989,"U.S. Meeting on Huawei, China Policy Still On for Thursday Despite Trump Tweets: Sources",,,"U.S. Meeting on Huawei, China Policy Still On for Thursday Despite Trump Tweets: Sources",,,,By Reuters,[],Reuters,,,
1,The debate over fresh U.S. sanctions aimed at forcing out Venezuela's Nicolás Maduro played out Wednesday across the crisis-stricken nation — including a bustling Caracas bus terminal. ,https://www.nytimes.com/aponline/2020/02/19/world/americas/ap-lt-venezuela-sanctions.html,The debate over fresh U.S. sanctions aimed at forcing out Venezuela's Nicolás Maduro played out Wednesday across the crisis-stricken nation — including a bustling Caracas bus terminal. ,"CARACAS, Venezuela — The debate over fresh U.S. sanctions aimed at forcing out Venezuela's Nicolás Maduro played out Wednesday across the crisis-stricken nation — including a bustling Caracas bus terminal. ",AP,[],[],2020-02-19T23:47:15+0000,article,None,World,News,nyt://article/eb04acfa-e252-51b4-b482-715b95a37738,349,nyt://article/eb04acfa-e252-51b4-b482-715b95a37738,Venezuelans React to U.S. Sanctions Targeting Maduro,,,Venezuelans React to U.S. Sanctions Targeting Maduro,,,,By The Associated Press,[],The Associated Press,Americas,,
2,There's a common thread among the 11 felons who found favor with President Donald Trump this week — all who were pardoned or set free had advocates among the president’s wealthy friends and political allies.,https://www.nytimes.com/aponline/2020/02/19/us/politics/ap-us-trump-paths-to-clemency.html,There's a common thread among the 11 felons who found favor with President Donald Trump this week — all who were pardoned or set free had advocates among the president’s wealthy friends and political allies.,WASHINGTON — There's a common thread among the 11 felons who found favor with President Donald Trump this week — all who were pardoned or set free had advocates among the president’s wealthy friends and political allies.,AP,[],[],2020-02-19T23:41:19+0000,article,None,U.S.,News,nyt://article/39515aeb-4cb5-5970-99bc-d62ce31fe990,1643,nyt://article/39515aeb-4cb5-5970-99bc-d62ce31fe990,Trump Picks Pardon Requests From Wealthy Pals and GOP Donors,,,Trump Picks Pardon Requests From Wealthy Pals and GOP Donors,,,,By The Associated Press,[],The Associated Press,Politics,,
3,"Even as President Donald Trump renewed his public attacks on the Justice Department on Wednesday, there was little outward worry from either end of Pennsylvania Avenue that Attorney General William Barr would follow through on his private threat to resign over presidential meddling.",https://www.nytimes.com/aponline/2020/02/19/us/politics/ap-us-trump-attorney-general.html,"Even as President Donald Trump renewed his public attacks on the Justice Department on Wednesday, there was little outward worry from either end of Pennsylvania Avenue that Attorney General William Barr would follow through on his private threat t...","WASHINGTON — Even as President Donald Trump renewed his public attacks on the Justice Department on Wednesday, there was little outward worry from either end of Pennsylvania Avenue that Attorney General William Barr would follow through on his private threat to resign over presidential meddling.",AP,[],[],2020-02-19T23:35:18+0000,article,None,U.S.,News,nyt://article/69c17c9a-9890-553e-ad0d-3135025f96ee,1113,nyt://article/69c17c9a-9890-553e-ad0d-3135025f96ee,"As Trump Ups Attacks on Justice Dept, Barr Remains in Post",,,"As Trump Ups Attacks on Justice Dept, Barr Remains in Post",,,,By The Associated Press,[],The Associated Press,Politics,,
4,"President Donald Trump on Wednesday named U.S. ambassador to Germany Richard Grenell, a strong supporter of his policies, to be acting director of national intelligence.",https://www.nytimes.com/reuters/2020/02/19/us/politics/19reuters-usa-trump-dni.html,"President Donald Trump on Wednesday named U.S. ambassador to Germany Richard Grenell, a strong supporter of his policies, to be acting director of national intelligence.","BAKERSFIELD, Calif. — President Donald Trump on Wednesday named U.S. ambassador to Germany Richard Grenell, a strong supporter of his policies, to be acting director of national intelligence.",Reuters,[],[],2020-02-19T23:08:15+0000,article,None,U.S.,News,nyt://article/ab9d9ec9-308c-583c-b3ad-257bcfdcab4d,417,nyt://article/ab9d9ec9-308c-583c-b3ad-257bcfdcab4d,Trump Names U.S. Envoy to Germany Acting Director of National Intelligence,,,Trump Names U.S. Envoy to Germany Acting Director of National Intelligence,,,,By Reuters,[],Reuters,Politics,,
