,abstract,web_url,snippet,lead_paragraph,source,multimedia,keywords,pub_date,document_type,news_desk,section_name,subsection_name,type_of_material,_id,word_count,uri,headline_main,headline_kicker,headline_content_kicker,headline_print_headline,headline_name,headline_seo,headline_sub,byline_original,byline_person,byline_organization,print_section,print_page
0,"Iran said Tuesday that its top court confirmed a death sentence for an Iranian man convicted of spying for the CIA, with state media alleging that he had shared details of the Islamic Republic's nuclear program with the American spy agency. ",https://www.nytimes.com/aponline/2020/02/04/world/middleeast/ap-ml-iran-us.html,"Iran said Tuesday that its top court confirmed a death sentence for an Iranian man convicted of spying for the CIA, with state media alleging that he had shared details of the Islamic Republic's nuclear program with the American spy agency. ","TEHRAN, Iran — Iran said Tuesday that its top court confirmed a death sentence for an Iranian man convicted of spying for the CIA, with state media alleging that he had shared details of the Islamic Republic's nuclear program with the American spy agency. ",AP,[],[],2020-02-04T09:09:29+0000,article,None,World,Middle East,News,nyt://article/e8514f76-3245-533c-a66e-a1ebd62d5862,403,nyt://article/e8514f76-3245-533c-a66e-a1ebd62d5862,Iran to Execute Alleged Spy Who Gave Nuclear Secrets to CIA,,,Iran to Execute Alleged Spy Who Gave Nuclear Secrets to CIA,,,,By The Associated Press,[],The Associated Press,,
1,The Iowa Democratic Party released partial results of its kickoff presidential caucus after a daylong delay late Tuesday showing former Midwestern mayor Pete Buttigieg with a slight lead over progressive Vermont Sen. Bernie Sanders in the opening contest of the party's 2020 primary season.,https://www.nytimes.com/aponline/2020/02/04/us/politics/ap-us-election-2020.html,The Iowa Democratic Party released partial results of its kickoff presidential caucus after a daylong delay late Tuesday showing former Midwestern mayor Pete Buttigieg with a slight lead over progressive Vermont Sen. Bernie Sanders in the opening ...,"DES MOINES, Iowa — The Iowa Democratic Party released partial results of its kickoff presidential caucus after a daylong delay late Tuesday showing former Midwestern mayor Pete Buttigieg with a slight lead over progressive Vermont Sen. Bernie Sanders in the opening contest of the party's 2020 primary season.",AP,[],[],2020-02-04T09:00:51+0000,article,None,U.S.,Politics,News,nyt://article/388bac60-f915-587d-a5fb-aa7550ae69bd,1136,nyt://article/388bac60-f915-587d-a5fb-aa7550ae69bd,Buttigieg Slightly Leading Sanders in Partial Iowa Results,,,Buttigieg Slightly Leading Sanders in Partial Iowa Results,,,,By The Associated Press,[],The Associated Press,,
