,abstract,web_url,snippet,lead_paragraph,source,multimedia,keywords,pub_date,document_type,news_desk,section_name,subsection_name,type_of_material,_id,word_count,uri,headline_main,headline_kicker,headline_content_kicker,headline_print_headline,headline_name,headline_seo,headline_sub,byline_original,byline_person,byline_organization,print_section,print_page
0,President Donald Trump's reelection campaign is mustering governmental muscle as it tries to turn out Republican voters next month in early voting Iowa.,https://www.nytimes.com/aponline/2020/01/27/us/politics/ap-trump-iowa.html,President Donald Trump's reelection campaign is mustering governmental muscle as it tries to turn out Republican voters next month in early voting Iowa.,WASHINGTON — President Donald Trump's reelection campaign is mustering governmental muscle as it tries to turn out Republican voters next month in early voting Iowa.,AP,[],[],2020-01-27T17:06:37+0000,article,None,U.S.,Politics,News,nyt://article/1ca3541c-b71d-5c1f-a074-6be4821da906,245,nyt://article/1ca3541c-b71d-5c1f-a074-6be4821da906,Trump Officials and Backers to Flood Iowa on Caucus Day,,,Trump Officials and Backers to Flood Iowa on Caucus Day,,,,By The Associated Press,[],The Associated Press,,
1,"Britain's Prince Andrew has provided “zero cooperation” to the American investigators who want to interview him as part of their sex trafficking probe into Jeffrey Epstein, a U.S. prosecutor said Monday.",https://www.nytimes.com/aponline/2020/01/27/business/ap-us-jeffrey-epstein-prince-andrew.html,"Britain's Prince Andrew has provided “zero cooperation” to the American investigators who want to interview him as part of their sex trafficking probe into Jeffrey Epstein, a U.S. prosecutor said Monday.","NEW YORK — Britain's Prince Andrew has provided “zero cooperation” to the American investigators who want to interview him as part of their sex trafficking probe into Jeffrey Epstein, a U.S. prosecutor said Monday.",AP,[],[],2020-01-27T17:06:34+0000,article,None,Business Day,,News,nyt://article/3770580b-c595-547e-8727-870df2c766cb,607,nyt://article/3770580b-c595-547e-8727-870df2c766cb,Prince Andrew Called Uncooperative in Jeffrey Epstein Probe,,,Prince Andrew Called Uncooperative in Jeffrey Epstein Probe,,,,By The Associated Press,[],The Associated Press,,
