,abstract,web_url,snippet,lead_paragraph,source,multimedia,keywords,pub_date,document_type,news_desk,section_name,subsection_name,type_of_material,_id,word_count,uri,headline_main,headline_kicker,headline_content_kicker,headline_print_headline,headline_name,headline_seo,headline_sub,byline_original,byline_person,byline_organization,print_section,print_page
0,"A full year before Election Day 2020, Republicans quietly executed a “dry run” of President Donald Trump's massive reelection machine.",https://www.nytimes.com/aponline/2019/12/10/us/politics/ap-us-election-2020-swing-states.html,"A full year before Election Day 2020, Republicans quietly executed a “dry run” of President Donald Trump's massive reelection machine.","WASHINGTON — A full year before Election Day 2020, Republicans quietly executed a “dry run” of President Donald Trump's massive reelection machine.",AP,[],[],2019-12-10T05:27:28+0000,article,None,U.S.,Politics,News,nyt://article/702cbfe7-6327-50ae-a866-2a18bcd7f644,1006,nyt://article/702cbfe7-6327-50ae-a866-2a18bcd7f644,A Free Pass for Trump? GOP Presses Edge in Key Battlegrounds,,,A Free Pass for Trump? GOP Presses Edge in Key Battlegrounds,,,,By The Associated Press,[],The Associated Press,,
1,"Democratic presidential contender Elizabeth Warren defended her Medicare for All healthcare proposal on Monday, telling members of an influential Nevada labor union that she wants all Americans to have coverage that is as good as theirs.",https://www.nytimes.com/reuters/2019/12/10/us/politics/10reuters-usa-election-nevada.html,"Democratic presidential contender Elizabeth Warren defended her Medicare for All healthcare proposal on Monday, telling members of an influential Nevada labor union that she wants all Americans to have coverage that is as good as theirs.","LAS VEGAS — Democratic presidential contender Elizabeth Warren defended her Medicare for All healthcare proposal on Monday, telling members of an influential Nevada labor union that she wants all Americans to have coverage that is as good as theirs.",Reuters,[],[],2019-12-10T05:24:33+0000,article,None,U.S.,Politics,News,nyt://article/9c68c84e-582c-59ce-b59b-09433120d873,434,nyt://article/9c68c84e-582c-59ce-b59b-09433120d873,Warren Woos Nevada Union Amid Healthcare Policy Concerns,,,Warren Woos Nevada Union Amid Healthcare Policy Concerns,,,,By Reuters,[],Reuters,,
2,"House Democrats announced two articles of impeachment against President Donald Trump, declaring he “betrayed the nation” with his actions toward Ukraine as they pushed toward historic proceedings that are certain to help define his presidency and shape the 2020 election.",https://www.nytimes.com/aponline/2019/12/10/us/politics/ap-us-trump-impeachment.html,"House Democrats announced two articles of impeachment against President Donald Trump, declaring he “betrayed the nation” with his actions toward Ukraine as they pushed toward historic proceedings that are certain to help define his presidency and ...","WASHINGTON — House Democrats announced two articles of impeachment against President Donald Trump, declaring he “betrayed the nation” with his actions toward Ukraine as they pushed toward historic proceedings that are certain to help define his presidency and shape the 2020 election.",AP,[],[],2019-12-10T05:15:36+0000,article,None,U.S.,Politics,News,nyt://article/f4b2b6ec-b54d-550e-a11d-6241e9d9fc21,1180,nyt://article/f4b2b6ec-b54d-550e-a11d-6241e9d9fc21,Democrats' Impeachment Charges Say Trump Betrayed the Nation,,,Democrats' Impeachment Charges Say Trump Betrayed the Nation,,,,By The Associated Press,[],The Associated Press,,
