,abstract,web_url,snippet,lead_paragraph,source,multimedia,keywords,pub_date,document_type,news_desk,section_name,type_of_material,_id,word_count,uri,headline_main,headline_kicker,headline_content_kicker,headline_print_headline,headline_name,headline_seo,headline_sub,byline_original,byline_person,byline_organization,subsection_name,print_section,print_page
0,"Trump administration officials have rescheduled for March 11 a critical meeting to discuss potential new U.S. restrictions on sales of technology to Huawei and China, people familiar with the matter said.",https://www.nytimes.com/reuters/2020/02/28/business/28reuters-usa-china-huawei-tech.html,"Trump administration officials have rescheduled for March 11 a critical meeting to discuss potential new U.S. restrictions on sales of technology to Huawei and China, people familiar with the matter said.","NEW YORK/WASHINGTON — Trump administration officials have rescheduled for March 11 a critical meeting to discuss potential new U.S. restrictions on sales of technology to Huawei and China, people familiar with the matter said.",Reuters,[],[],2020-02-29T00:17:59+0000,article,None,Business Day,News,nyt://article/df5be3dc-a7f1-55ed-b3a5-e6fcd6a2fccf,357,nyt://article/df5be3dc-a7f1-55ed-b3a5-e6fcd6a2fccf,"U.S. Moves High-Level U.S. Meeting on China Tech, Possible New Huawei Curbs to March: Sources",,,"U.S. Moves High-Level U.S. Meeting on China Tech, Possible New Huawei Curbs to March: Sources",,,,By Reuters,[],Reuters,,,
1,"The Trump administration on Friday said it would focus on concluding new trade agreements with Britain, the European Union and Kenya over the coming year, while strictly enforcing trade laws and pushing for reforms of the World Trade Organization.",https://www.nytimes.com/reuters/2020/02/28/business/28reuters-usa-trade.html,"The Trump administration on Friday said it would focus on concluding new trade agreements with Britain, the European Union and Kenya over the coming year, while strictly enforcing trade laws and pushing for reforms of the World Trade Organization.","WASHINGTON — The Trump administration on Friday said it would focus on concluding new trade agreements with Britain, the European Union and Kenya over the coming year, while strictly enforcing trade laws and pushing for reforms of the World Trade Organization.",Reuters,[],[],2020-02-29T00:17:44+0000,article,None,Business Day,News,nyt://article/f4478fd3-7a5d-5752-a21e-3275949b7ce6,440,nyt://article/f4478fd3-7a5d-5752-a21e-3275949b7ce6,"USTR Vows to Push for Trade Deals With Britain, EU; Seeks Reforms at WTO",,,"USTR Vows to Push for Trade Deals With Britain, EU; Seeks Reforms at WTO",,,,By Reuters,[],Reuters,,,
2,"A top aide to President Donald Trump complained Friday that the news media doesn't pay enough attention to the president's loving relationship with his 13-year-old son, Barron.",https://www.nytimes.com/aponline/2020/02/28/us/politics/ap-us-white-house-barron-trump.html,"A top aide to President Donald Trump complained Friday that the news media doesn't pay enough attention to the president's loving relationship with his 13-year-old son, Barron.","WASHINGTON — A top aide to President Donald Trump complained Friday that the news media doesn't pay enough attention to the president's loving relationship with his 13-year-old son, Barron.",AP,[],[],2020-02-29T00:14:16+0000,article,None,U.S.,News,nyt://article/43a0ed3e-de61-50c0-8869-35c67062a82b,142,nyt://article/43a0ed3e-de61-50c0-8869-35c67062a82b,Aide: Media Ignores Trump's Loving Bond With 13-Year-Old Son,,,Aide: Media Ignores Trump's Loving Bond With 13-Year-Old Son,,,,By The Associated Press,[],The Associated Press,Politics,,
3,"A federal judge shot down a challenge to the copyright of the Woody Guthrie folk anthem, blocking an attempt to put it in the public domain.",https://www.nytimes.com/2020/02/28/arts/music/this-land-is-your-land-copyright.html,"A federal judge shot down a challenge to the copyright of the Woody Guthrie folk anthem, blocking an attempt to put it in the public domain.","First, “Happy Birthday to You” lost its copyright. Then “We Shall Overcome” became public domain as well.",The New York Times,"[{'rank': 0, 'subtype': 'xlarge', 'caption': None, 'credit': None, 'type': 'image', 'url': 'images/2020/02/28/arts/28guthrie/28guthrie-articleLarge.jpg', 'height': 515, 'width': 600, 'legacy': {'xlarge': 'images/2020/02/28/arts/28guthrie/28guthrie-articleLarge.jpg', 'xlargewidth': 600, 'xlargeheight': 515}, 'subType': 'xlarge', 'crop_name': 'articleLarge'}, {'rank': 0, 'subtype': 'popup', 'caption': None, 'credit': None, 'type': 'image', 'url': 'images/2020/02/28/arts/28guthrie/28guthrie-popup.jpg', 'height': 500, 'width': 583, 'legacy': {}, 'subType': 'popup', 'crop_name': 'popup'}, {'rank': 0, 'subtype': 'blog480', 'caption': None, 'credit': None, 'type': 'image', 'url': 'images/2020/02/28/arts/28guthrie/28guthrie-blog480.jpg', 'height': 412, 'width': 480, 'legacy': {}, 'subType': 'blog480', 'crop_name': 'blog480'}, {'rank': 0, 'subtype': 'blog533', 'caption': None, 'credit': None, 'type': 'image', 'url': 'images/2020/02/28/arts/28guthrie/28guthrie-blog533.jpg', 'height': 458, 'width': 533, 'legacy': {}, 'subType': 'blog533', 'crop_name': 'blog533'}, {'rank': 0, 'subtype': 'blog427', 'caption': None, 'credit': None, 'type': 'image', 'url': 'images/2020/02/28/arts/28guthrie/28guthrie-blog427.jpg', 'height': 367, 'width': 427, 'legacy': {}, 'subType': 'blog427', 'crop_name': 'blog427'}, {'rank': 0, 'subtype': 'tmagSF', 'caption': None, 'credit': None, 'type': 'image', 'url': 'images/2020/02/28/arts/28guthrie/28guthrie-tmagSF.jpg', 'height': 311, 'width': 362, 'legacy': {}, 'subType': 'tmagSF', 'crop_name': 'tmagSF'}, {'rank': 0, 'subtype': 'tmagArticle', 'caption': None, 'credit': None, 'type': 'image', 'url': 'images/2020/02/28/arts/28guthrie/28guthrie-tmagArticle.jpg', 'height': 509, 'width': 592, 'legacy': {}, 'subType': 'tmagArticle', 'crop_name': 'tmagArticle'}, {'rank': 0, 'subtype': 'slide', 'caption': None, 'credit': None, 'type': 'image', 'url': 'images/2020/02/28/arts/28guthrie/28guthrie-slide.jpg', 'height': 500, 'width': 583, 'legacy': {}, 'subType': 'slide', 'crop_name': 'slide'}, {'rank': 0, 'subtype': 'jumbo', 'caption': None, 'credit': None, 'type': 'image', 'url': 'images/2020/02/28/arts/28guthrie/28guthrie-jumbo.jpg', 'height': 880, 'width': 1024, 'legacy': {}, 'subType': 'jumbo', 'crop_name': 'jumbo'}, {'rank': 0, 'subtype': 'superJumbo', 'caption': None, 'credit': None, 'type': 'image', 'url': 'images/2020/02/28/arts/28guthrie/28guthrie-superJumbo.jpg', 'height': 1759, 'width': 2048, 'legacy': {}, 'subType': 'superJumbo', 'crop_name': 'superJumbo'}, {'rank': 0, 'subtype': 'blog225', 'caption': None, 'credit': None, 'type': 'image', 'url': 'images/2020/02/28/arts/28guthrie/28guthrie-blog225.jpg', 'height': 193, 'width': 225, 'legacy': {}, 'subType': 'blog225', 'crop_name': 'blog225'}, {'rank': 0, 'subtype': 'master1050', 'caption': None, 'credit': None, 'type': 'image', 'url': 'images/2020/02/28/arts/28guthrie/28guthrie-master1050.jpg', 'height': 902, 'width': 1050, 'legacy': {}, 'subType': 'master1050', 'crop_name': 'master1050'}, {'rank': 0, 'subtype': 'master675', 'caption': None, 'credit': None, 'type': 'image', 'url': 'images/2020/02/28/arts/28guthrie/28guthrie-master675.jpg', 'height': 580, 'width': 675, 'legacy': {}, 'subType': 'master675', 'crop_name': 'master675'}, {'rank': 0, 'subtype': 'master495', 'caption': None, 'credit': None, 'type': 'image', 'url': 'images/2020/02/28/arts/28guthrie/28guthrie-master495.jpg', 'height': 425, 'width': 495, 'legacy': {}, 'subType': 'master495', 'crop_name': 'master495'}, {'rank': 0, 'subtype': 'master180', 'caption': None, 'credit': None, 'type': 'image', 'url': 'images/2020/02/28/arts/28guthrie/28guthrie-master180.jpg', 'height': 155, 'width': 180, 'legacy': {}, 'subType': 'master180', 'crop_name': 'master180'}, {'rank': 0, 'subtype': 'master315', 'caption': None, 'credit': None, 'type': 'image', 'url': 'images/2020/02/28/arts/28guthrie/28guthrie-master315.jpg', 'height': 271, 'width': 315, 'legacy': {}, 'subType': 'master315', 'crop_name': 'master315'}, {'rank': 0, 'subtype': 'master768', 'caption': None, 'credit': None, 'type': 'image', 'url': 'images/2020/02/28/arts/28guthrie/28guthrie-master768.jpg', 'height': 660, 'width': 768, 'legacy': {}, 'subType': 'master768', 'crop_name': 'master768'}, {'rank': 0, 'subtype': 'thumbnail', 'caption': None, 'credit': None, 'type': 'image', 'url': 'images/2020/02/28/arts/28guthrie/28guthrie-thumbStandard.jpg', 'height': 75, 'width': 75, 'legacy': {'thumbnail': 'images/2020/02/28/arts/28guthrie/28guthrie-thumbStandard.jpg', 'thumbnailwidth': 75, 'thumbnailheight': 75}, 'subType': 'thumbnail', 'crop_name': 'thumbStandard'}, {'rank': 0, 'subtype': 'blogSmallThumb', 'caption': None, 'credit': None, 'type': 'image', 'url': 'images/2020/02/28/arts/28guthrie/28guthrie-blogSmallThumb.jpg', 'height': 50, 'width': 50, 'legacy': {}, 'subType': 'blogSmallThumb', 'crop_name': 'blogSmallThumb'}, {'rank': 0, 'subtype': 'thumbLarge', 'caption': None, 'credit': None, 'type': 'image', 'url': 'images/2020/02/28/arts/28guthrie/28guthrie-thumbLarge.jpg', 'height': 150, 'width': 150, 'legacy': {}, 'subType': 'thumbLarge', 'crop_name': 'thumbLarge'}, {'rank': 0, 'subtype': 'smallSquare168', 'caption': None, 'credit': None, 'type': 'image', 'url': 'images/2020/02/28/arts/28guthrie/28guthrie-smallSquare168.jpg', 'height': 168, 'width': 168, 'legacy': {}, 'subType': 'smallSquare168', 'crop_name': 'smallSquare168'}, {'rank': 0, 'subtype': 'smallSquare252', 'caption': None, 'credit': None, 'type': 'image', 'url': 'images/2020/02/28/arts/28guthrie/28guthrie-smallSquare252.jpg', 'height': 252, 'width': 252, 'legacy': {}, 'subType': 'smallSquare252', 'crop_name': 'smallSquare252'}, {'rank': 0, 'subtype': 'square320', 'caption': None, 'credit': None, 'type': 'image', 'url': 'images/2020/02/28/arts/28guthrie/28guthrie-square320.jpg', 'height': 320, 'width': 320, 'legacy': {}, 'subType': 'square320', 'crop_name': 'square320'}, {'rank': 0, 'subtype': 'moth', 'caption': None, 'credit': None, 'type': 'image', 'url': 'images/2020/02/28/arts/28guthrie/28guthrie-moth.jpg', 'height': 151, 'width': 151, 'legacy': {}, 'subType': 'moth', 'crop_name': 'moth'}, {'rank': 0, 'subtype': 'filmstrip', 'caption': None, 'credit': None, 'type': 'image', 'url': 'images/2020/02/28/arts/28guthrie/28guthrie-filmstrip.jpg', 'height': 190, 'width': 190, 'legacy': {}, 'subType': 'filmstrip', 'crop_name': 'filmstrip'}, {'rank': 0, 'subtype': 'square640', 'caption': None, 'credit': None, 'type': 'image', 'url': 'images/2020/02/28/arts/28guthrie/28guthrie-square640.jpg', 'height': 640, 'width': 640, 'legacy': {}, 'subType': 'square640', 'crop_name': 'square640'}, {'rank': 0, 'subtype': 'mediumSquare149', 'caption': None, 'credit': None, 'type': 'image', 'url': 'images/2020/02/28/arts/28guthrie/28guthrie-mediumSquare149.jpg', 'height': 149, 'width': 149, 'legacy': {}, 'subType': 'mediumSquare149', 'crop_name': 'mediumSquare149'}, {'rank': 0, 'subtype': 'mediumSquareAt3X', 'caption': None, 'credit': None, 'type': 'image', 'url': 'images/2020/02/28/arts/28guthrie/28guthrie-mediumSquareAt3X.jpg', 'height': 1801, 'width': 1800, 'legacy': {}, 'subType': 'mediumSquareAt3X', 'crop_name': 'mediumSquareAt3X'}, {'rank': 0, 'subtype': 'sfSpan', 'caption': None, 'credit': None, 'type': 'image', 'url': 'images/2020/02/28/arts/28guthrie/28guthrie-sfSpan.jpg', 'height': 264, 'width': 395, 'legacy': {}, 'subType': 'sfSpan', 'crop_name': 'sfSpan'}, {'rank': 0, 'subtype': 'largeHorizontal375', 'caption': None, 'credit': None, 'type': 'image', 'url': 'images/2020/02/28/arts/28guthrie/28guthrie-largeHorizontal375.jpg', 'height': 250, 'width': 375, 'legacy': {}, 'subType': 'largeHorizontal375', 'crop_name': 'largeHorizontal375'}, {'rank': 0, 'subtype': 'largeHorizontalJumbo', 'caption': None, 'credit': None, 'type': 'image', 'url': 'images/2020/02/28/arts/28guthrie/28guthrie-largeHorizontalJumbo.jpg', 'height': 683, 'width': 1024, 'legacy': {}, 'subType': 'largeHorizontalJumbo', 'crop_name': 'largeHorizontalJumbo'}, {'rank': 0, 'subtype': 'horizontalMediumAt2X', 'caption': None, 'credit': None, 'type': 'image', 'url': 'images/2020/02/28/arts/28guthrie/28guthrie-horizontalMediumAt2X.jpg', 'height': 2456, 'width': 3681, 'legacy': {}, 'subType': 'horizontalMediumAt2X', 'crop_name': 'horizontalMediumAt2X'}, {'rank': 0, 'subtype': 'hpLarge', 'caption': None, 'credit': None, 'type': 'image', 'url': 'images/2020/02/28/arts/28guthrie/28guthrie-hpLarge.jpg', 'height': 288, 'width': 511, 'legacy': {}, 'subType': 'hpLarge', 'crop_name': 'hpLarge'}, {'rank': 0, 'subtype': 'largeWidescreen573', 'caption': None, 'credit': None, 'type': 'image', 'url': 'images/2020/02/28/arts/28guthrie/28guthrie-largeWidescreen573.jpg', 'height': 323, 'width': 573, 'legacy': {}, 'subType': 'largeWidescreen573', 'crop_name': 'largeWidescreen573'}, {'rank': 0, 'subtype': 'largeWidescreen1050', 'caption': None, 'credit': None, 'type': 'image', 'url': 'images/2020/02/28/arts/28guthrie/28guthrie-largeWidescreen1050.jpg', 'height': 591, 'width': 1050, 'legacy': {}, 'subType': 'largeWidescreen1050', 'crop_name': 'largeWidescreen1050'}, {'rank': 0, 'subtype': 'wide', 'caption': None, 'credit': None, 'type': 'image', 'url': 'images/2020/02/28/arts/28guthrie/28guthrie-thumbWide.jpg', 'height': 126, 'width': 190, 'legacy': {'widewidth': 190, 'wideheight': 126, 'wide': 'images/2020/02/28/arts/28guthrie/28guthrie-thumbWide.jpg'}, 'subType': 'wide', 'crop_name': 'thumbWide'}, {'rank': 0, 'subtype': 'videoThumb', 'caption': None, 'credit': None, 'type': 'image', 'url': 'images/2020/02/28/arts/28guthrie/28guthrie-videoThumb.jpg', 'height': 50, 'width': 75, 'legacy': {}, 'subType': 'videoThumb', 'crop_name': 'videoThumb'}, {'rank': 0, 'subtype': 'videoLarge', 'caption': None, 'credit': None, 'type': 'image', 'url': 'images/2020/02/28/arts/28guthrie/28guthrie-videoLarge.jpg', 'height': 507, 'width': 768, 'legacy': {}, 'subType': 'videoLarge', 'crop_name': 'videoLarge'}, {'rank': 0, 'subtype': 'mediumThreeByTwo210', 'caption': None, 'credit': None, 'type': 'image', 'url': 'images/2020/02/28/arts/28guthrie/28guthrie-mediumThreeByTwo210.jpg', 'height': 140, 'width': 210, 'legacy': {}, 'subType': 'mediumThreeByTwo210', 'crop_name': 'mediumThreeByTwo210'}, {'rank': 0, 'subtype': 'mediumThreeByTwo225', 'caption': None, 'credit': None, 'type': 'image', 'url': 'images/2020/02/28/arts/28guthrie/28guthrie-mediumThreeByTwo225.jpg', 'height': 150, 'width': 225, 'legacy': {}, 'subType': 'mediumThreeByTwo225', 'crop_name': 'mediumThreeByTwo225'}, {'rank': 0, 'subtype': 'mediumThreeByTwo440', 'caption': None, 'credit': None, 'type': 'image', 'url': 'images/2020/02/28/arts/28guthrie/28guthrie-mediumThreeByTwo440.jpg', 'height': 293, 'width': 440, 'legacy': {}, 'subType': 'mediumThreeByTwo440', 'crop_name': 'mediumThreeByTwo440'}, {'rank': 0, 'subtype': 'mediumThreeByTwo252', 'caption': None, 'credit': None, 'type': 'image', 'url': 'images/2020/02/28/arts/28guthrie/28guthrie-mediumThreeByTwo252.jpg', 'height': 168, 'width': 252, 'legacy': {}, 'subType': 'mediumThreeByTwo252', 'crop_name': 'mediumThreeByTwo252'}, {'rank': 0, 'subtype': 'mediumThreeByTwo378', 'caption': None, 'credit': None, 'type': 'image', 'url': 'images/2020/02/28/arts/28guthrie/28guthrie-mediumThreeByTwo378.jpg', 'height': 252, 'width': 378, 'legacy': {}, 'subType': 'mediumThreeByTwo378', 'crop_name': 'mediumThreeByTwo378'}, {'rank': 0, 'subtype': 'threeByTwoLargeAt2X', 'caption': None, 'credit': None, 'type': 'image', 'url': 'images/2020/02/28/arts/28guthrie/28guthrie-threeByTwoLargeAt2X.jpg', 'height': 2456, 'width': 3681, 'legacy': {}, 'subType': 'threeByTwoLargeAt2X', 'crop_name': 'threeByTwoLargeAt2X'}, {'rank': 0, 'subtype': 'threeByTwoMediumAt2X', 'caption': None, 'credit': None, 'type': 'image', 'url': 'images/2020/02/28/arts/28guthrie/28guthrie-threeByTwoMediumAt2X.jpg', 'height': 1001, 'width': 1500, 'legacy': {}, 'subType': 'threeByTwoMediumAt2X', 'crop_name': 'threeByTwoMediumAt2X'}, {'rank': 0, 'subtype': 'threeByTwoSmallAt2X', 'caption': None, 'credit': None, 'type': 'image', 'url': 'images/2020/02/28/arts/28guthrie/28guthrie-threeByTwoSmallAt2X.jpg', 'height': 400, 'width': 600, 'legacy': {}, 'subType': 'threeByTwoSmallAt2X', 'crop_name': 'threeByTwoSmallAt2X'}, {'rank': 0, 'subtype': 'articleInline', 'caption': None, 'credit': None, 'type': 'image', 'url': 'images/2020/02/28/arts/28guthrie/28guthrie-articleInline.jpg', 'height': 163, 'width': 190, 'legacy': {}, 'subType': 'articleInline', 'crop_name': 'articleInline'}, {'rank': 0, 'subtype': 'hpSmall', 'caption': None, 'credit': None, 'type': 'image', 'url': 'images/2020/02/28/arts/28guthrie/28guthrie-hpSmall.jpg', 'height': 140, 'width': 163, 'legacy': {}, 'subType': 'hpSmall', 'crop_name': 'hpSmall'}, {'rank': 0, 'subtype': 'blogSmallInline', 'caption': None, 'credit': None, 'type': 'image', 'url': 'images/2020/02/28/arts/28guthrie/28guthrie-blogSmallInline.jpg', 'height': 130, 'width': 151, 'legacy': {}, 'subType': 'blogSmallInline', 'crop_name': 'blogSmallInline'}, {'rank': 0, 'subtype': 'mediumFlexible177', 'caption': None, 'credit': None, 'type': 'image', 'url': 'images/2020/02/28/arts/28guthrie/28guthrie-mediumFlexible177.jpg', 'height': 152, 'width': 177, 'legacy': {}, 'subType': 'mediumFlexible177', 'crop_name': 'mediumFlexible177'}, {'rank': 0, 'subtype': 'videoSmall', 'caption': None, 'credit': None, 'type': 'image', 'url': 'images/2020/02/28/arts/28guthrie/28guthrie-videoSmall.jpg', 'height': 281, 'width': 500, 'legacy': {}, 'subType': 'videoSmall', 'crop_name': 'videoSmall'}, {'rank': 0, 'subtype': 'videoHpMedium', 'caption': None, 'credit': None, 'type': 'image', 'url': 'images/2020/02/28/arts/28guthrie/28guthrie-videoHpMedium.jpg', 'height': 211, 'width': 375, 'legacy': {}, 'subType': 'videoHpMedium', 'crop_name': 'videoHpMedium'}, {'rank': 0, 'subtype': 'videoSixteenByNine600', 'caption': None, 'credit': None, 'type': 'image', 'url': 'images/2020/02/28/arts/28guthrie/28guthrie-videoSixteenByNine600.jpg', 'height': 338, 'width': 600, 'legacy': {}, 'subType': 'videoSixteenByNine600', 'crop_name': 'videoSixteenByNine600'}, {'rank': 0, 'subtype': 'videoSixteenByNine540', 'caption': None, 'credit': None, 'type': 'image', 'url': 'images/2020/02/28/arts/28guthrie/28guthrie-videoSixteenByNine540.jpg', 'height': 304, 'width': 540, 'legacy': {}, 'subType': 'videoSixteenByNine540', 'crop_name': 'videoSixteenByNine540'}, {'rank': 0, 'subtype': 'videoSixteenByNine495', 'caption': None, 'credit': None, 'type': 'image', 'url': 'images/2020/02/28/arts/28guthrie/28guthrie-videoSixteenByNine495.jpg', 'height': 278, 'width': 495, 'legacy': {}, 'subType': 'videoSixteenByNine495', 'crop_name': 'videoSixteenByNine495'}, {'rank': 0, 'subtype': 'videoSixteenByNine390', 'caption': None, 'credit': None, 'type': 'image', 'url': 'images/2020/02/28/arts/28guthrie/28guthrie-videoSixteenByNine390.jpg', 'height': 219, 'width': 390, 'legacy': {}, 'subType': 'videoSixteenByNine390', 'crop_name': 'videoSixteenByNine390'}, {'rank': 0, 'subtype': 'videoSixteenByNine1050', 'caption': None, 'credit': None, 'type': 'image', 'url': 'images/2020/02/28/arts/28guthrie/28guthrie-videoSixteenByNine1050.jpg', 'height': 591, 'width': 1050, 'legacy': {}, 'subType': 'videoSixteenByNine1050', 'crop_name': 'videoSixteenByNine1050'}, {'rank': 0, 'subtype': 'videoSixteenByNine480', 'caption': None, 'credit': None, 'type': 'image', 'url': 'images/2020/02/28/arts/28guthrie/28guthrie-videoSixteenByNine480.jpg', 'height': 270, 'width': 480, 'legacy': {}, 'subType': 'videoSixteenByNine480', 'crop_name': 'videoSixteenByNine480'}, {'rank': 0, 'subtype': 'videoSixteenByNine310', 'caption': None, 'credit': None, 'type': 'image', 'url': 'images/2020/02/28/arts/28guthrie/28guthrie-videoSixteenByNine310.jpg', 'height': 174, 'width': 310, 'legacy': {}, 'subType': 'videoSixteenByNine310', 'crop_name': 'videoSixteenByNine310'}, {'rank': 0, 'subtype': 'videoSixteenByNine225', 'caption': None, 'credit': None, 'type': 'image', 'url': 'images/2020/02/28/arts/28guthrie/28guthrie-videoSixteenByNine225.jpg', 'height': 126, 'width': 225, 'legacy': {}, 'subType': 'videoSixteenByNine225', 'crop_name': 'videoSixteenByNine225'}, {'rank': 0, 'subtype': 'videoSixteenByNine96', 'caption': None, 'credit': None, 'type': 'image', 'url': 'images/2020/02/28/arts/28guthrie/28guthrie-videoSixteenByNine96.jpg', 'height': 54, 'width': 96, 'legacy': {}, 'subType': 'videoSixteenByNine96', 'crop_name': 'videoSixteenByNine96'}, {'rank': 0, 'subtype': 'videoSixteenByNine3000', 'caption': None, 'credit': None, 'type': 'image', 'url': 'images/2020/02/28/arts/28guthrie/28guthrie-videoSixteenByNine3000.jpg', 'height': 1689, 'width': 3000, 'legacy': {}, 'subType': 'videoSixteenByNine3000', 'crop_name': 'videoSixteenByNine3000'}, {'rank': 0, 'subtype': 'videoSixteenByNine768', 'caption': None, 'credit': None, 'type': 'image', 'url': 'images/2020/02/28/arts/28guthrie/28guthrie-videoSixteenByNine768.jpg', 'height': 432, 'width': 768, 'legacy': {}, 'subType': 'videoSixteenByNine768', 'crop_name': 'videoSixteenByNine768'}, {'rank': 0, 'subtype': 'videoSixteenByNine150', 'caption': None, 'credit': None, 'type': 'image', 'url': 'images/2020/02/28/arts/28guthrie/28guthrie-videoSixteenByNine150.jpg', 'height': 84, 'width': 150, 'legacy': {}, 'subType': 'videoSixteenByNine150', 'crop_name': 'videoSixteenByNine150'}, {'rank': 0, 'subtype': 'videoSixteenByNineJumbo1600', 'caption': None, 'credit': None, 'type': 'image', 'url': 'images/2020/02/28/arts/28guthrie/28guthrie-videoSixteenByNineJumbo1600.jpg', 'height': 901, 'width': 1600, 'legacy': {}, 'subType': 'videoSixteenByNineJumbo1600', 'crop_name': 'videoSixteenByNineJumbo1600'}, {'rank': 0, 'subtype': 'miniMoth', 'caption': None, 'credit': None, 'type': 'image', 'url': 'images/2020/02/28/arts/28guthrie/28guthrie-miniMoth.jpg', 'height': 70, 'width': 151, 'legacy': {}, 'subType': 'miniMoth', 'crop_name': 'miniMoth'}, {'rank': 0, 'subtype': 'windowsTile336H', 'caption': None, 'credit': None, 'type': 'image', 'url': 'images/2020/02/28/arts/28guthrie/28guthrie-windowsTile336H.jpg', 'height': 336, 'width': 694, 'legacy': {}, 'subType': 'windowsTile336H', 'crop_name': 'windowsTile336H'}, {'rank': 0, 'subtype': 'videoFifteenBySeven1305', 'caption': None, 'credit': None, 'type': 'image', 'url': 'images/2020/02/28/arts/28guthrie/28guthrie-videoFifteenBySeven1305.jpg', 'height': 609, 'width': 1305, 'legacy': {}, 'subType': 'videoFifteenBySeven1305', 'crop_name': 'videoFifteenBySeven1305'}, {'rank': 0, 'subtype': 'videoFifteenBySeven2610', 'caption': None, 'credit': None, 'type': 'image', 'url': 'images/2020/02/28/arts/28guthrie/28guthrie-videoFifteenBySeven2610.jpg', 'height': 1218, 'width': 2610, 'legacy': {}, 'subType': 'videoFifteenBySeven2610', 'crop_name': 'videoFifteenBySeven2610'}, {'rank': 0, 'subtype': 'facebookJumbo', 'caption': None, 'credit': None, 'type': 'image', 'url': 'images/2020/02/28/arts/28guthrie/28guthrie-facebookJumbo.jpg', 'height': 550, 'width': 1050, 'legacy': {}, 'subType': 'facebookJumbo', 'crop_name': 'facebookJumbo'}, {'rank': 0, 'subtype': 'watch308', 'caption': None, 'credit': None, 'type': 'image', 'url': 'images/2020/02/28/arts/28guthrie/28guthrie-watch308.jpg', 'height': 348, 'width': 312, 'legacy': {}, 'subType': 'watch308', 'crop_name': 'watch308'}, {'rank': 0, 'subtype': 'watch268', 'caption': None, 'credit': None, 'type': 'image', 'url': 'images/2020/02/28/arts/28guthrie/28guthrie-watch268.jpg', 'height': 304, 'width': 272, 'legacy': {}, 'subType': 'watch268', 'crop_name': 'watch268'}, {'rank': 0, 'subtype': 'verticalTwoByThree735', 'caption': None, 'credit': None, 'type': 'image', 'url': 'images/2020/02/28/arts/28guthrie/28guthrie-verticalTwoByThree735.jpg', 'height': 1104, 'width': 735, 'legacy': {}, 'subType': 'verticalTwoByThree735', 'crop_name': 'verticalTwoByThree735'}, {'rank': 0, 'subtype': 'mobileMasterAt3x', 'caption': None, 'credit': None, 'type': 'image', 'url': 'images/2020/02/28/arts/28guthrie/28guthrie-mobileMasterAt3x.jpg', 'height': 1546, 'width': 1800, 'legacy': {}, 'subType': 'mobileMasterAt3x', 'crop_name': 'mobileMasterAt3x'}]","[{'name': 'persons', 'value': 'Guthrie, Woody', 'rank': 1, 'major': 'N'}, {'name': 'creative_works', 'value': 'This Land Is Your Land (Song)', 'rank': 2, 'major': 'N'}, {'name': 'subject', 'value': 'Copyrights and Copyright Violations', 'rank': 3, 'major': 'N'}, {'name': 'subject', 'value': 'Royalties', 'rank': 4, 'major': 'N'}, {'name': 'subject', 'value': 'Music', 'rank': 5, 'major': 'N'}]",2020-02-28T23:19:11+0000,article,Culture,Arts,News,nyt://article/51c149a5-7b7d-56a0-83cb-89a4bbc45e8b,568,nyt://article/51c149a5-7b7d-56a0-83cb-89a4bbc45e8b,"‘This Land Is Your Land’ Is Still Private Property, Court Rules",,,,,,,By Ben Sisario,"[{'firstname': 'Ben', 'middlename': None, 'lastname': 'Sisario', 'qualifier': None, 'title': None, 'role': 'reported', 'organization': '', 'rank': 1}]",,Music,,
