,abstract,web_url,snippet,lead_paragraph,source,multimedia,keywords,pub_date,document_type,news_desk,section_name,subsection_name,type_of_material,_id,word_count,uri,headline_main,headline_kicker,headline_content_kicker,headline_print_headline,headline_name,headline_seo,headline_sub,byline_original,byline_person,byline_organization,print_section,print_page
0,"President Trump did not use the phrase “climate change,” but the plan to plant one trillion trees — unveiled last month by the World Economic Forum in Davos  and embraced by Republicans as a way to address global warming — will reduce greenhouse gas emissions. As trees grow, they absorb and store the carbon dioxide emissions that are driving planetary warming. ",https://www.nytimes.com/live/2020/fact-check-state-of-the-union-02-04/to-protect-the-environment-days-ago-i-announced-that-the-united-states-will-join-the-one-trillion-trees-initiative-an-ambitious-,,"President Trump did not use the phrase “climate change,” but the plan to plant one trillion trees — unveiled last month by the World Economic Forum in Davos  and embraced by Republicans as a way to address global warming — will reduce greenhouse gas emissions. As trees grow, they absorb and store the carbon dioxide emissions that are driving planetary warming. ",The New York Times,[],[],2020-02-05T02:58:33+0000,article,Washington,U.S.,Politics,Live Blog Post,nyt://article/84cb2d94-044d-5fbc-a215-7970c66e596c,127,nyt://article/84cb2d94-044d-5fbc-a215-7970c66e596c,"“To protect the environment, days ago, I announced that the United States will join the One Trillion Trees Initiative, an ambitious effort to bring together government and the private sector to plant new trees in America and around the world.”",,,,,,,By Lisa Friedman,"[{'firstname': 'Lisa', 'middlename': None, 'lastname': 'Friedman', 'qualifier': None, 'title': None, 'role': 'reported', 'organization': '', 'rank': 1}]",,,
1,"The conservative talk show host, who announced he had advanced lung cancer, sat next to the first lady, Melania Trump, for the president’s speech.",https://www.nytimes.com/2020/02/04/us/politics/rush-limbaugh-medal-of-freedom.html,"The conservative talk show host, who announced he had advanced lung cancer, sat next to the first lady, Melania Trump, for the president’s speech.",,The New York Times,[],"[{'name': 'subject', 'value': 'United States Politics and Government', 'rank': 1, 'major': 'N'}, {'name': 'subject', 'value': 'State of the Union Message (US)', 'rank': 2, 'major': 'N'}, {'name': 'organizations', 'value': 'Democratic Party', 'rank': 3, 'major': 'N'}, {'name': 'persons', 'value': 'Limbaugh, Rush', 'rank': 4, 'major': 'N'}, {'name': 'persons', 'value': 'Trump, Donald J', 'rank': 5, 'major': 'N'}, {'name': 'persons', 'value': 'Trump, Melania', 'rank': 6, 'major': 'N'}, {'name': 'subject', 'value': 'Impeachment', 'rank': 7, 'major': 'N'}, {'name': 'subject', 'value': 'Awards, Decorations and Honors', 'rank': 8, 'major': 'N'}, {'name': 'subject', 'value': 'First Ladies (US)', 'rank': 9, 'major': 'N'}]",2020-02-05T02:58:07+0000,article,Express,U.S.,Politics,News,nyt://article/c714e91c-186f-5582-9aaa-948fe736ffe1,459,nyt://article/c714e91c-186f-5582-9aaa-948fe736ffe1,Rush Limbaugh Awarded Presidential Medal of Freedom at State of the Union,,,Limbaugh Is Honored With Medal By First Lady,,,,By Neil Vigdor,"[{'firstname': 'Neil', 'middlename': None, 'lastname': 'Vigdor', 'qualifier': None, 'title': None, 'role': 'reported', 'organization': '', 'rank': 1}]",,A,16
2,"Not only has President Trump failed to strengthen Medicare and Social Security, but the financial outlook for both trusts has not improved or worsened. That is at least partly the result of Mr. Trump’s tax law, which has left the Treasury Department to collect fewer taxes from Americans and, in turn, invest less money into each program. Last April, the government projected that Medicare funds would be depleted by 2026, three years earlier than estimated in 2017. The report noted that less money will flow into the fund because of low wages and lower taxes.",https://www.nytimes.com/live/2020/fact-check-state-of-the-union-02-04/we-will-always-protect-your-medicare-and-your-social-security-always,,"Not only has President Trump failed to strengthen Medicare and Social Security, but the financial outlook for both trusts has not improved or worsened. That is at least partly the result of Mr. Trump’s tax law, which has left the Treasury Department to collect fewer taxes from Americans and, in turn, invest less money into each program. Last April, the government projected that Medicare funds would be depleted by 2026, three years earlier than estimated in 2017. The report noted that less money will flow into the fund because of low wages and lower taxes.",The New York Times,[],[],2020-02-05T02:53:44+0000,article,Washington,U.S.,Politics,Live Blog Post,nyt://article/dafd0c92-da80-5686-86cc-d8d0dc2ff60c,98,nyt://article/dafd0c92-da80-5686-86cc-d8d0dc2ff60c,“We will always protect your Medicare and your Social Security always.”,,,,,,,By Linda Qiu,"[{'firstname': 'Linda', 'middlename': None, 'lastname': 'Qiu', 'qualifier': None, 'title': None, 'role': 'reported', 'organization': '', 'rank': 1}]",,,
