,abstract,web_url,snippet,lead_paragraph,source,multimedia,keywords,pub_date,document_type,news_desk,section_name,subsection_name,type_of_material,_id,word_count,uri,headline_main,headline_kicker,headline_content_kicker,headline_print_headline,headline_name,headline_seo,headline_sub,byline_original,byline_person,byline_organization,print_section,print_page
0,Democratic presidential contender Pete Buttigieg is picking up his first endorsement among South Carolina’s black lawmakers as attention in the early voting contest turns toward more diverse states.,https://www.nytimes.com/aponline/2020/02/12/us/politics/ap-us-election-2020-buttigieg-south-carolina.html,Democratic presidential contender Pete Buttigieg is picking up his first endorsement among South Carolina’s black lawmakers as attention in the early voting contest turns toward more diverse states.,"COLUMBIA, S.C. — Democratic presidential contender Pete Buttigieg is picking up his first endorsement among South Carolina’s black lawmakers as attention in the early voting contest turns toward more diverse states.",AP,[],[],2020-02-12T15:05:16+0000,article,None,U.S.,Politics,News,nyt://article/561cf33f-9342-5cca-ac2b-04e15f2b5106,290,nyt://article/561cf33f-9342-5cca-ac2b-04e15f2b5106,Buttigieg Lands Black South Carolina Lawmaker's Endorsement,,,Buttigieg Lands Black South Carolina Lawmaker's Endorsement,,,,By The Associated Press,[],The Associated Press,,
1,"President Donald Trump’s trade war dampened the overseas market for American-made whiskey last year, diminishing exports even as the domestic market continues to thrive.",https://www.nytimes.com/aponline/2020/02/12/business/ap-us-whiskey-sales.html,"President Donald Trump’s trade war dampened the overseas market for American-made whiskey last year, diminishing exports even as the domestic market continues to thrive.","FRANKFORT, Ky. — President Donald Trump’s trade war dampened the overseas market for American-made whiskey last year, diminishing exports even as the domestic market continues to thrive.",AP,[],[],2020-02-12T15:05:14+0000,article,None,Business Day,,News,nyt://article/faeeee48-30ca-54fd-99d3-14171d1a7f37,667,nyt://article/faeeee48-30ca-54fd-99d3-14171d1a7f37,US Whiskey Exports Decline as Trade Dispute With EU Persists,,,US Whiskey Exports Decline as Trade Dispute With EU Persists,,,,By The Associated Press,[],The Associated Press,,
2,Charges have been dropped against a Florida security guard accused of threatening President Donald Trump after prosecutors said his online video was “a rant by an idiot.”,https://www.nytimes.com/aponline/2020/02/12/us/ap-us-trump-florida-threat.html,Charges have been dropped against a Florida security guard accused of threatening President Donald Trump after prosecutors said his online video was “a rant by an idiot.”,"FORT LAUDERDALE, Fla. — Charges have been dropped against a Florida security guard accused of threatening President Donald Trump after prosecutors said his online video was “a rant by an idiot.”",AP,[],[],2020-02-12T14:47:15+0000,article,None,U.S.,,News,nyt://article/304c391a-7897-5370-880d-0ef38f30d55f,215,nyt://article/304c391a-7897-5370-880d-0ef38f30d55f,Charges Dropped Against Guard Accused of Threatening Trump,,,Charges Dropped Against Guard Accused of Threatening Trump,,,,By The Associated Press,[],The Associated Press,,
