,abstract,web_url,snippet,lead_paragraph,source,multimedia,keywords,pub_date,document_type,news_desk,section_name,subsection_name,type_of_material,_id,word_count,uri,headline_main,headline_kicker,headline_content_kicker,headline_print_headline,headline_name,headline_seo,headline_sub,byline_original,byline_person,byline_organization,print_section,print_page
0,"Central Americans asylum seekers sent to Mexico by the United States to await their U.S. court dates increasingly become the victims of kidnappings and other types of violence, aid group Doctors Without Borders said in a report published on Tuesday.",https://www.nytimes.com/reuters/2020/02/11/world/americas/11reuters-usa-immigration-mexico.html,"Central Americans asylum seekers sent to Mexico by the United States to await their U.S. court dates increasingly become the victims of kidnappings and other types of violence, aid group Doctors Without Borders said in a report published on Tuesda...","MEXICO CITY — Central Americans asylum seekers sent to Mexico by the United States to await their U.S. court dates increasingly become the victims of kidnappings and other types of violence, aid group Doctors Without Borders said in a report published on Tuesday.",Reuters,[],[],2020-02-11T17:11:22+0000,article,None,World,Americas,News,nyt://article/07d9d34c-6086-521f-966e-c6844e6cf894,560,nyt://article/07d9d34c-6086-521f-966e-c6844e6cf894,Central Americans Sent to Mexico by U.S. Increasingly Victims of Kidnappings: Aid Group,,,Central Americans Sent to Mexico by U.S. Increasingly Victims of Kidnappings: Aid Group,,,,By Reuters,[],Reuters,,
1,"President Donald Trump reiterated his criticism that the Federal Reserve has kept interest rates too high and seemed to say the U.S. central bank's chair, Jerome Powell, had hurt stock prices during his testimony to Congress on Tuesday. ",https://www.nytimes.com/reuters/2020/02/11/business/11reuters-usa-fed-powell-trump.html,"President Donald Trump reiterated his criticism that the Federal Reserve has kept interest rates too high and seemed to say the U.S. central bank's chair, Jerome Powell, had hurt stock prices during his testimony to Congress on Tuesday. ","WASHINGTON — President Donald Trump reiterated his criticism that the Federal Reserve has kept interest rates too high and seemed to say the U.S. central bank's chair, Jerome Powell, had hurt stock prices during his testimony to Congress on Tuesday. ",Reuters,[],[],2020-02-11T17:08:13+0000,article,None,Business Day,,News,nyt://article/8fa6ef4c-6813-5b68-8f56-8161e42bacb2,158,nyt://article/8fa6ef4c-6813-5b68-8f56-8161e42bacb2,Trump Lashes Out at Fed While Powell Testifies Before U.S. House Committee,,,Trump Lashes Out at Fed While Powell Testifies Before U.S. House Committee,,,,By Reuters,[],Reuters,,
