,abstract,web_url,snippet,lead_paragraph,print_section,print_page,source,multimedia,keywords,pub_date,document_type,news_desk,section_name,subsection_name,type_of_material,_id,word_count,uri,headline_main,headline_kicker,headline_content_kicker,headline_print_headline,headline_name,headline_seo,headline_sub,byline_original,byline_person,byline_organization
0,Members of the House granted The New York Times rare access to photograph their impeachment preparations.,https://www.nytimes.com/2019/12/12/us/politics/house-impeachment-vote.html,Members of the House granted The New York Times rare access to photograph their impeachment preparations.,"Some of the most intriguing moments in the impeachment fight on Capitol Hill take place in private, away from the hearing rooms and news conferences that throngs of cameras can scrupulously document.",A,12,The New York Times,[],"[{'name': 'subject', 'value': 'United States Politics and Government', 'rank': 1, 'major': 'N'}, {'name': 'subject', 'value': 'Trump-Ukraine Whistle-blower Complaint and Impeachment Inquiry', 'rank': 2, 'major': 'N'}, {'name': 'organizations', 'value': 'House of Representatives', 'rank': 3, 'major': 'N'}]",2019-12-12T10:00:44+0000,article,Washington,U.S.,Politics,News,nyt://article/88acf16b-5633-5eef-88c2-196c68d08d10,523,nyt://article/88acf16b-5633-5eef-88c2-196c68d08d10,An Inside Look at the Impeachment Case’s Most Intriguing Moments,,,Insider’s View Of a Long Day,,,,By Erin Schaff and Carl Hulse,"[{'firstname': 'Erin', 'middlename': None, 'lastname': 'Schaff', 'qualifier': None, 'title': None, 'role': 'reported', 'organization': '', 'rank': 1}, {'firstname': 'Carl', 'middlename': None, 'lastname': 'Hulse', 'qualifier': None, 'title': None, 'role': 'reported', 'organization': '', 'rank': 2}]",
1,"The United States is ready ""to simultaneously take concrete steps"" toward a deal aimed at getting North Korea to give up its nuclear and missile programs, but the Security Council must be prepared to respond to any provocations, the U.S. envoy to the United Nations said on Wednesday. ",https://www.nytimes.com/reuters/2019/12/12/world/europe/12reuters-northkorea-usa-un.html,"The United States is ready ""to simultaneously take concrete steps"" toward a deal aimed at getting North Korea to give up its nuclear and missile programs, but the Security Council must be prepared to respond to any provocations, the U.S. envoy to ...","UNITED NATIONS — The United States is ready ""to simultaneously take concrete steps"" toward a deal aimed at getting North Korea to give up its nuclear and missile programs, but the Security Council must be prepared to respond to any provocations, the U.S. envoy to the United Nations said on Wednesday. ",,,Reuters,[],[],2019-12-12T10:00:38+0000,article,None,World,Europe,News,nyt://article/8262b5f5-768c-515a-94fc-cbf118d63ea6,618,nyt://article/8262b5f5-768c-515a-94fc-cbf118d63ea6,"U.S. Tells U.N. It Is Ready to Be Flexible in North Korea Talks, Warns Against Provocations",,,"U.S. Tells U.N. It Is Ready to Be Flexible in North Korea Talks, Warns Against Provocations",,,,By Reuters,[],Reuters
