,abstract,web_url,snippet,lead_paragraph,print_section,print_page,source,multimedia,keywords,pub_date,document_type,news_desk,section_name,subsection_name,type_of_material,_id,word_count,uri,headline_main,headline_kicker,headline_content_kicker,headline_print_headline,headline_name,headline_seo,headline_sub,byline_original,byline_person,byline_organization
3,And why are baby boomers still in charge?,https://www.nytimes.com/2019/12/12/opinion/2020-democrats-kamala-harris.html,And why are baby boomers still in charge?,Listen and subscribe to our podcast from your mobile device: ,,,The New York Times,[],"[{'name': 'subject', 'value': 'United States Politics and Government', 'rank': 1, 'major': 'N'}, {'name': 'subject', 'value': 'Whites', 'rank': 2, 'major': 'N'}, {'name': 'organizations', 'value': 'Democratic Party', 'rank': 3, 'major': 'N'}, {'name': 'subject', 'value': 'Presidential Election of 2020', 'rank': 4, 'major': 'N'}, {'name': 'persons', 'value': 'Trump, Donald J', 'rank': 5, 'major': 'N'}, {'name': 'glocations', 'value': 'New Hampshire', 'rank': 6, 'major': 'N'}, {'name': 'glocations', 'value': 'Iowa', 'rank': 7, 'major': 'N'}, {'name': 'persons', 'value': 'Harris, Kamala D', 'rank': 8, 'major': 'N'}, {'name': 'subject', 'value': 'Debates (Political)', 'rank': 9, 'major': 'N'}, {'name': 'persons', 'value': 'Booker, Cory A', 'rank': 10, 'major': 'N'}, {'name': 'subject', 'value': 'Voting and Voters', 'rank': 11, 'major': 'N'}, {'name': 'persons', 'value': 'Biden, Joseph R Jr', 'rank': 12, 'major': 'N'}, {'name': 'persons', 'value': 'Buttigieg, Pete (1982- )', 'rank': 13, 'major': 'N'}, {'name': 'subject', 'value': 'Primaries and Caucuses', 'rank': 14, 'major': 'N'}, {'name': 'subject', 'value': 'Polls and Public Opinion', 'rank': 15, 'major': 'N'}, {'name': 'glocations', 'value': 'South Carolina', 'rank': 16, 'major': 'N'}, {'name': 'subject', 'value': 'Blacks', 'rank': 17, 'major': 'N'}, {'name': 'subject', 'value': 'Race and Ethnicity', 'rank': 18, 'major': 'N'}, {'name': 'subject', 'value': 'Baby Boomers', 'rank': 19, 'major': 'N'}, {'name': 'subject', 'value': 'Liberalism (US Politics)', 'rank': 20, 'major': 'N'}]",2019-12-12T10:00:12+0000,article,OpEd,Opinion,,Op-Ed,nyt://article/621f6405-3761-5563-a7be-244e8dc46f16,811,nyt://article/621f6405-3761-5563-a7be-244e8dc46f16,Why Is the Democratic Primary So White?,,,,,,,,[],
4,"Immense amounts of methane are escaping from oil and gas sites nationwide, worsening global warming, even as the Trump administration weakens restrictions on offenders.",https://www.nytimes.com/interactive/2019/12/12/climate/texas-methane-super-emitters.html,"Immense amounts of methane are escaping from oil and gas sites nationwide, worsening global warming, even as the Trump administration weakens restrictions on offenders.","Immense amounts of methane are escaping from oil and gas sites nationwide, worsening global warming, even as the Trump administration weakens restrictions on offenders.",A,20,The New York Times,[],"[{'name': 'subject', 'value': 'Methane', 'rank': 1, 'major': 'N'}, {'name': 'subject', 'value': 'Greenhouse Gas Emissions', 'rank': 2, 'major': 'N'}, {'name': 'subject', 'value': 'Global Warming', 'rank': 3, 'major': 'N'}, {'name': 'persons', 'value': 'Wehrum, William L', 'rank': 4, 'major': 'N'}, {'name': 'glocations', 'value': 'Texas', 'rank': 5, 'major': 'N'}, {'name': 'subject', 'value': 'Oil (Petroleum) and Gasoline', 'rank': 6, 'major': 'N'}, {'name': 'subject', 'value': 'Natural Gas', 'rank': 7, 'major': 'N'}, {'name': 'subject', 'value': 'Refineries', 'rank': 8, 'major': 'N'}, {'name': 'organizations', 'value': 'Environmental Protection Agency', 'rank': 9, 'major': 'N'}, {'name': 'subject', 'value': 'Regulation and Deregulation of Industry', 'rank': 10, 'major': 'N'}, {'name': 'persons', 'value': 'Trump, Donald J', 'rank': 11, 'major': 'N'}, {'name': 'glocations', 'value': 'Permian Basin (North America)', 'rank': 12, 'major': 'N'}]",2019-12-12T10:00:02+0000,multimedia,Climate,Climate,,Interactive Feature,nyt://interactive/ae60ac3e-0796-5940-8d51-8939f0c5ad1e,0,nyt://interactive/ae60ac3e-0796-5940-8d51-8939f0c5ad1e,"It’s a Vast, Invisible Climate Menace. We Made It Visible.",,,"An Invisible Menace to the Climate, Revealed in Infrared",,,,By Hiroko Tabuchi and Jonah M. Kessel,"[{'firstname': 'Hiroko', 'middlename': None, 'lastname': 'Tabuchi', 'qualifier': None, 'title': None, 'role': 'reported', 'organization': '', 'rank': 1}, {'firstname': 'Jonah', 'middlename': None, 'lastname': None, 'qualifier': None, 'title': None, 'role': 'reported', 'organization': '', 'rank': 2}]",
5,"UK shares leapt on Thursday as U.S. President Donald Trump said  the United States and China were very close to a trade deal, providing a shot in the arm to what had been a wait-and-watch session for markets with Britons voting in an election. ",https://www.nytimes.com/reuters/2019/12/12/business/12reuters-britain-stocks.html,"UK shares leapt on Thursday as U.S. President Donald Trump said  the United States and China were very close to a trade deal, providing a shot in the arm to what had been a wait-and-watch session for markets with Britons voting in an election. ","(Reuters) - UK shares leapt on Thursday as U.S. President Donald Trump said the United States and China were very close to a trade deal, providing a shot in the arm to what had been a wait-and-watch session for markets with Britons voting in an election. ",,,Reuters,[],[],2019-12-12T08:42:35+0000,article,None,Business Day,,News,nyt://article/a52209d9-7a62-5c82-b270-bc2ccb136c15,415,nyt://article/a52209d9-7a62-5c82-b270-bc2ccb136c15,UK Shares Ride Sino-U.S. Trade High; Election Result Watched,,,UK Shares Ride Sino-U.S. Trade High; Election Result Watched,,,,By Reuters,[],Reuters
6,"Euro zone banks enjoyed their best day in two months on Thursday after comments by new ECB chief Christine Lagarde, and European shares were propelled further by U.S.-China trade developments.",https://www.nytimes.com/reuters/2019/12/12/business/12reuters-europe-stocks.html,"Euro zone banks enjoyed their best day in two months on Thursday after comments by new ECB chief Christine Lagarde, and European shares were propelled further by U.S.-China trade developments.","(Reuters) - Euro zone banks enjoyed their best day in two months on Thursday after comments by new ECB chief Christine Lagarde, and European shares were propelled further by U.S.-China trade developments.",,,Reuters,[],[],2019-12-12T08:27:40+0000,article,None,Business Day,,News,nyt://article/9d872700-d33c-5532-a2c4-5b88eed9a341,401,nyt://article/9d872700-d33c-5532-a2c4-5b88eed9a341,"ECB, Upbeat Trade News Push Up European Shares Before UK Election Outcome",,,"ECB, Upbeat Trade News Push Up European Shares Before UK Election Outcome",,,,By Reuters,[],Reuters
7,"Prime Minister Boris Johnson's Conservative Party was on course for a resounding victory in Britain's election after voters backed his bid to deliver Brexit on Jan. 31, the country's most significant geopolitical move in 70 years.",https://www.nytimes.com/reuters/2019/12/12/world/europe/12reuters-britain-election.html,"Prime Minister Boris Johnson's Conservative Party was on course for a resounding victory in Britain's election after voters backed his bid to deliver Brexit on Jan. 31, the country's most significant geopolitical move in 70 years.","LONDON — Prime Minister Boris Johnson's Conservative Party was on course for a resounding victory in Britain's election after voters backed his bid to deliver Brexit on Jan. 31, the country's most significant geopolitical move in 70 years.",,,Reuters,[],[],2019-12-12T08:24:42+0000,article,None,World,Europe,News,nyt://article/cef96aba-78bb-5066-b198-da952147a26f,1131,nyt://article/cef96aba-78bb-5066-b198-da952147a26f,Brexit Beckons as UK's Johnson Coasts to Commanding Win,,,Brexit Beckons as UK's Johnson Coasts to Commanding Win,,,,By Reuters,[],Reuters
