,abstract,web_url,snippet,lead_paragraph,source,multimedia,keywords,pub_date,document_type,news_desk,section_name,subsection_name,type_of_material,_id,word_count,uri,headline_main,headline_kicker,headline_content_kicker,headline_print_headline,headline_name,headline_seo,headline_sub,byline_original,byline_person,byline_organization,print_section,print_page
0,"President Donald Trump on Tuesday pardoned Edward DeBartolo Jr., the former San Francisco 49ers owner convicted in a gambling fraud scandal who built one of the most successful NFL teams in the game's history.",https://www.nytimes.com/aponline/2020/02/18/us/politics/ap-trump-pardon.html,"President Donald Trump on Tuesday pardoned Edward DeBartolo Jr., the former San Francisco 49ers owner convicted in a gambling fraud scandal who built one of the most successful NFL teams in the game's history.","WASHINGTON — President Donald Trump on Tuesday pardoned Edward DeBartolo Jr., the former San Francisco 49ers owner convicted in a gambling fraud scandal who built one of the most successful NFL teams in the game's history.",AP,[],[],2020-02-18T16:26:14+0000,article,None,U.S.,Politics,News,nyt://article/279e3e08-ccb9-5901-bfe4-0e661202aeb8,934,nyt://article/279e3e08-ccb9-5901-bfe4-0e661202aeb8,Trump Pardons Ex-San Francisco 49ers Owner DeBartolo Jr.,,,Trump Pardons Ex-San Francisco 49ers Owner DeBartolo Jr.,,,,By The Associated Press,[],The Associated Press,,
1,A federal judge on Tuesday refused to delay sentencing for Roger Stone on his witness tampering and lying to Congress conviction as President Donald Trump kept up his unrelenting defense of his longtime confidant and said he wouldn’t be quieted on social media even if he's making things harder for his attorney general.,https://www.nytimes.com/aponline/2020/02/18/us/politics/ap-us-roger-stone-.html,A federal judge on Tuesday refused to delay sentencing for Roger Stone on his witness tampering and lying to Congress conviction as President Donald Trump kept up his unrelenting defense of his longtime confidant and said he wouldn’t be quieted on...,WASHINGTON — A federal judge on Tuesday refused to delay sentencing for Roger Stone on his witness tampering and lying to Congress conviction as President Donald Trump kept up his unrelenting defense of his longtime confidant and said he wouldn’t be quieted on social media even if he's making things harder for his attorney general.,AP,[],[],2020-02-18T15:56:20+0000,article,None,U.S.,Politics,News,nyt://article/5972f71c-4e82-5e4b-bbc3-5de05ecccb2a,520,nyt://article/5972f71c-4e82-5e4b-bbc3-5de05ecccb2a,Judge Refuses to Delay Sentencing of Trump Ally Roger Stone,,,Judge Refuses to Delay Sentencing of Trump Ally Roger Stone,,,,By The Associated Press,[],The Associated Press,,
2,The Trump administration announced sanctions Tuesday on a Russian state-controlled brokerage that has helped the Venezuelan government skirt an American oil embargo and enabled President Nicolas Maduro keep his grip on power in the South American country.,https://www.nytimes.com/aponline/2020/02/18/us/politics/bc-united-states-venezuela-rosneft.html,The Trump administration announced sanctions Tuesday on a Russian state-controlled brokerage that has helped the Venezuelan government skirt an American oil embargo and enabled President Nicolas Maduro keep his grip on power in the South American ...,WASHINGTON — The Trump administration announced sanctions Tuesday on a Russian state-controlled brokerage that has helped the Venezuelan government skirt an American oil embargo and enabled President Nicolas Maduro keep his grip on power in the South American country.,AP,[],[],2020-02-18T15:41:11+0000,article,None,U.S.,Politics,News,nyt://article/2da71b1c-ec30-5c2d-9814-00850d23cd90,612,nyt://article/2da71b1c-ec30-5c2d-9814-00850d23cd90,US Sanctions Russian Oil Trading Firm for Role in Venezuela,,,US Sanctions Russian Oil Trading Firm for Role in Venezuela,,,,By The Associated Press,[],The Associated Press,,
3,The United States on Tuesday ramped up pressure on Venezuela by blacklisting a subsidiary of Russian state oil major Rosneft that President Donald Trump's administration said provides a financial lifeline to President Nicolas Maduro's government.,https://www.nytimes.com/reuters/2020/02/18/world/americas/18reuters-venezuela-politics-usa.html,The United States on Tuesday ramped up pressure on Venezuela by blacklisting a subsidiary of Russian state oil major Rosneft that President Donald Trump's administration said provides a financial lifeline to President Nicolas Maduro's government.,WASHINGTON — The United States on Tuesday ramped up pressure on Venezuela by blacklisting a subsidiary of Russian state oil major Rosneft that President Donald Trump's administration said provides a financial lifeline to President Nicolas Maduro's government.,Reuters,[],[],2020-02-18T15:32:19+0000,article,None,World,Americas,News,nyt://article/32d86474-7eec-514b-b288-d737c338244a,855,nyt://article/32d86474-7eec-514b-b288-d737c338244a,U.S. Slaps Sanctions on Russian Oil Firm in Swipe at Venezuela's Maduro,,,U.S. Slaps Sanctions on Russian Oil Firm in Swipe at Venezuela's Maduro,,,,By Reuters,[],Reuters,,
