,abstract,web_url,snippet,lead_paragraph,source,multimedia,keywords,pub_date,document_type,news_desk,section_name,subsection_name,type_of_material,_id,word_count,uri,headline_main,headline_kicker,headline_content_kicker,headline_print_headline,headline_name,headline_seo,headline_sub,byline_original,byline_person,byline_organization,print_section,print_page
0,Follow live coverage and analysis from Times reporters.,https://www.nytimes.com/interactive/2020/02/11/us/elections/results-new-hampshire-live-updates.html,Follow live coverage and analysis from Times reporters.,Follow live coverage and analysis from Times reporters.,The New York Times,[],"[{'name': 'glocations', 'value': 'New Hampshire', 'rank': 1, 'major': 'N'}, {'name': 'subject', 'value': 'Primaries and Caucuses', 'rank': 2, 'major': 'N'}, {'name': 'organizations', 'value': 'Democratic Party', 'rank': 3, 'major': 'N'}, {'name': 'persons', 'value': 'Sanders, Bernard', 'rank': 4, 'major': 'N'}, {'name': 'persons', 'value': 'Buttigieg, Pete (1982- )', 'rank': 5, 'major': 'N'}, {'name': 'persons', 'value': 'Warren, Elizabeth', 'rank': 6, 'major': 'N'}, {'name': 'persons', 'value': 'Biden, Joseph R Jr', 'rank': 7, 'major': 'N'}, {'name': 'persons', 'value': 'Klobuchar, Amy', 'rank': 8, 'major': 'N'}]",2020-02-11T05:20:31+0000,multimedia,U.S.,U.S.,Elections,Interactive Feature,nyt://interactive/bfac9144-e14e-52a0-ae68-550080a960d5,0,nyt://interactive/bfac9144-e14e-52a0-ae68-550080a960d5,Latest Updates: New Hampshire Primaries,,,,,,,,[],,,
1,By John Whitesides and Amanda Becker,https://www.nytimes.com/reuters/2020/02/11/us/politics/11reuters-usa-election.html,By John Whitesides and Amanda Becker,By John Whitesides and Amanda Becker,Reuters,[],[],2020-02-11T05:08:16+0000,article,None,U.S.,Politics,News,nyt://article/07cc9acc-c3a5-592d-8f12-aa8b8e827183,430,nyt://article/07cc9acc-c3a5-592d-8f12-aa8b8e827183,"Sanders Narrowly Wins New Hampshire Democratic Primary, Biden Lags Badly",,,"Sanders Narrowly Wins New Hampshire Democratic Primary, Biden Lags Badly",,,,By Reuters,[],Reuters,,
2,"Two long-delayed New York-area rail projects received mixed reviews from federal officials Monday, as a plan for a replacement for a century-old bridge earned high enough marks to finally qualify for federal funding but a larger project to build a new tunnel under the Hudson River remained mired in a dispute over how much New York and New Jersey will pay.",https://www.nytimes.com/aponline/2020/02/11/us/ap-us-northeast-corridor-tunnels.html,"Two long-delayed New York-area rail projects received mixed reviews from federal officials Monday, as a plan for a replacement for a century-old bridge earned high enough marks to finally qualify for federal funding but a larger project to build a...","NEW YORK — Two long-delayed New York-area rail projects received mixed reviews from federal officials Monday, as a plan for a replacement for a century-old bridge earned high enough marks to finally qualify for federal funding but a larger project to build a new tunnel under the Hudson River remained mired in a dispute over how much New York and New Jersey will pay.",AP,[],[],2020-02-11T05:05:17+0000,article,None,U.S.,,News,nyt://article/3f37b832-f74d-599e-9cbc-7e1ec21a18bd,728,nyt://article/3f37b832-f74d-599e-9cbc-7e1ec21a18bd,Rail Bridge OK'd to Seek Fed Funds; Tunnel Doesn't Make Cut,,,Rail Bridge OK'd to Seek Fed Funds; Tunnel Doesn't Make Cut,,,,By The Associated Press,[],The Associated Press,,
