,abstract,web_url,snippet,lead_paragraph,source,multimedia,keywords,pub_date,document_type,news_desk,section_name,subsection_name,type_of_material,_id,word_count,uri,headline_main,headline_kicker,headline_content_kicker,headline_print_headline,headline_name,headline_seo,headline_sub,byline_original,byline_person,byline_organization,print_section,print_page
0,"Israel and the Palestinian Authority (PA) have reached an agreement to end a five-month long trade dispute, officials said on Thursday.",https://www.nytimes.com/reuters/2020/02/20/world/middleeast/20reuters-israel-palestinians-trade.html,"Israel and the Palestinian Authority (PA) have reached an agreement to end a five-month long trade dispute, officials said on Thursday.","JERUSALEM/RAMALLAH — Israel and the Palestinian Authority (PA) have reached an agreement to end a five-month long trade dispute, officials said on Thursday.",Reuters,[],[],2020-02-20T10:14:16+0000,article,None,World,Middle East,News,nyt://article/c977d974-ff5c-5a16-bc03-5404539129ba,343,nyt://article/c977d974-ff5c-5a16-bc03-5404539129ba,"Israel, Palestinian Authority Agree to End Trade Dispute: Officials",,,"Israel, Palestinian Authority Agree to End Trade Dispute: Officials",,,,By Reuters,[],Reuters,,
1,"In the wee hours of Jan. 8, Tehran retaliated over the U.S. killing of Iran’s most powerful general by bombarding the al-Asad air base in Iraq.",https://www.nytimes.com/reuters/2020/02/20/world/middleeast/20reuters-usa-pentagon-braininjury-insight.html,"In the wee hours of Jan. 8, Tehran retaliated over the U.S. killing of Iran’s most powerful general by bombarding the al-Asad air base in Iraq.","(Reuters) - In the wee hours of Jan. 8, Tehran retaliated over the U.S. killing of Iran’s most powerful general by bombarding the al-Asad air base in Iraq.",Reuters,[],[],2020-02-20T10:08:10+0000,article,None,World,Middle East,News,nyt://article/9ef2ee32-7802-59c6-a528-1ad4906fab68,1481,nyt://article/9ef2ee32-7802-59c6-a528-1ad4906fab68,'Hit With a Truck'-How Iran's Missiles Inflicted Brain Injury on U.S. Troops,,,'Hit With a Truck'-How Iran's Missiles Inflicted Brain Injury on U.S. Troops,,,,By Reuters,[],Reuters,,
2,His rivals were ready. He was not.,https://www.nytimes.com/2020/02/20/opinion/bloomberg-nevada-debate-democrats.html,His rivals were ready. He was not.,"You can buy ads and saturate the airwaves with them. You can buy allies, especially with the right budget.",The New York Times,"[{'rank': 0, 'subtype': 'xlarge', 'caption': None, 'credit': None, 'type': 'image', 'url': 'images/2020/02/20/opinion/20bruniWeb/20bruniWeb-articleLarge.jpg', 'height': 403, 'width': 600, 'legacy': {'xlarge': 'images/2020/02/20/opinion/20bruniWeb/20bruniWeb-articleLarge.jpg', 'xlargewidth': 600, 'xlargeheight': 403}, 'subType': 'xlarge', 'crop_name': 'articleLarge'}, {'rank': 0, 'subtype': 'popup', 'caption': None, 'credit': None, 'type': 'image', 'url': 'images/2020/02/20/opinion/20bruniWeb/20bruniWeb-popup.jpg', 'height': 437, 'width': 650, 'legacy': {}, 'subType': 'popup', 'crop_name': 'popup'}, {'rank': 0, 'subtype': 'blog480', 'caption': None, 'credit': None, 'type': 'image', 'url': 'images/2020/02/20/opinion/20bruniWeb/20bruniWeb-blog480.jpg', 'height': 323, 'width': 480, 'legacy': {}, 'subType': 'blog480', 'crop_name': 'blog480'}, {'rank': 0, 'subtype': 'blog533', 'caption': None, 'credit': None, 'type': 'image', 'url': 'images/2020/02/20/opinion/20bruniWeb/20bruniWeb-blog533.jpg', 'height': 358, 'width': 533, 'legacy': {}, 'subType': 'blog533', 'crop_name': 'blog533'}, {'rank': 0, 'subtype': 'blog427', 'caption': None, 'credit': None, 'type': 'image', 'url': 'images/2020/02/20/opinion/20bruniWeb/20bruniWeb-blog427.jpg', 'height': 287, 'width': 427, 'legacy': {}, 'subType': 'blog427', 'crop_name': 'blog427'}, {'rank': 0, 'subtype': 'tmagSF', 'caption': None, 'credit': None, 'type': 'image', 'url': 'images/2020/02/20/opinion/20bruniWeb/20bruniWeb-tmagSF.jpg', 'height': 243, 'width': 362, 'legacy': {}, 'subType': 'tmagSF', 'crop_name': 'tmagSF'}, {'rank': 0, 'subtype': 'tmagArticle', 'caption': None, 'credit': None, 'type': 'image', 'url': 'images/2020/02/20/opinion/20bruniWeb/20bruniWeb-tmagArticle.jpg', 'height': 398, 'width': 592, 'legacy': {}, 'subType': 'tmagArticle', 'crop_name': 'tmagArticle'}, {'rank': 0, 'subtype': 'slide', 'caption': None, 'credit': None, 'type': 'image', 'url': 'images/2020/02/20/opinion/20bruniWeb/20bruniWeb-slide.jpg', 'height': 403, 'width': 600, 'legacy': {}, 'subType': 'slide', 'crop_name': 'slide'}, {'rank': 0, 'subtype': 'jumbo', 'caption': None, 'credit': None, 'type': 'image', 'url': 'images/2020/02/20/opinion/20bruniWeb/20bruniWeb-jumbo.jpg', 'height': 688, 'width': 1024, 'legacy': {}, 'subType': 'jumbo', 'crop_name': 'jumbo'}, {'rank': 0, 'subtype': 'superJumbo', 'caption': None, 'credit': None, 'type': 'image', 'url': 'images/2020/02/20/opinion/20bruniWeb/20bruniWeb-superJumbo.jpg', 'height': 1377, 'width': 2048, 'legacy': {}, 'subType': 'superJumbo', 'crop_name': 'superJumbo'}, {'rank': 0, 'subtype': 'blog225', 'caption': None, 'credit': None, 'type': 'image', 'url': 'images/2020/02/20/opinion/20bruniWeb/20bruniWeb-blog225.jpg', 'height': 151, 'width': 225, 'legacy': {}, 'subType': 'blog225', 'crop_name': 'blog225'}, {'rank': 0, 'subtype': 'master1050', 'caption': None, 'credit': None, 'type': 'image', 'url': 'images/2020/02/20/opinion/20bruniWeb/20bruniWeb-master1050.jpg', 'height': 706, 'width': 1050, 'legacy': {}, 'subType': 'master1050', 'crop_name': 'master1050'}, {'rank': 0, 'subtype': 'master675', 'caption': None, 'credit': None, 'type': 'image', 'url': 'images/2020/02/20/opinion/20bruniWeb/20bruniWeb-master675.jpg', 'height': 454, 'width': 675, 'legacy': {}, 'subType': 'master675', 'crop_name': 'master675'}, {'rank': 0, 'subtype': 'master495', 'caption': None, 'credit': None, 'type': 'image', 'url': 'images/2020/02/20/opinion/20bruniWeb/20bruniWeb-master495.jpg', 'height': 333, 'width': 495, 'legacy': {}, 'subType': 'master495', 'crop_name': 'master495'}, {'rank': 0, 'subtype': 'master180', 'caption': None, 'credit': None, 'type': 'image', 'url': 'images/2020/02/20/opinion/20bruniWeb/20bruniWeb-master180.jpg', 'height': 121, 'width': 180, 'legacy': {}, 'subType': 'master180', 'crop_name': 'master180'}, {'rank': 0, 'subtype': 'master315', 'caption': None, 'credit': None, 'type': 'image', 'url': 'images/2020/02/20/opinion/20bruniWeb/20bruniWeb-master315.jpg', 'height': 212, 'width': 315, 'legacy': {}, 'subType': 'master315', 'crop_name': 'master315'}, {'rank': 0, 'subtype': 'master768', 'caption': None, 'credit': None, 'type': 'image', 'url': 'images/2020/02/20/opinion/20bruniWeb/20bruniWeb-master768.jpg', 'height': 516, 'width': 768, 'legacy': {}, 'subType': 'master768', 'crop_name': 'master768'}, {'rank': 0, 'subtype': 'thumbnail', 'caption': None, 'credit': None, 'type': 'image', 'url': 'images/2020/02/20/opinion/20bruniWeb/20bruniWeb-thumbStandard.jpg', 'height': 75, 'width': 75, 'legacy': {'thumbnail': 'images/2020/02/20/opinion/20bruniWeb/20bruniWeb-thumbStandard.jpg', 'thumbnailwidth': 75, 'thumbnailheight': 75}, 'subType': 'thumbnail', 'crop_name': 'thumbStandard'}, {'rank': 0, 'subtype': 'blogSmallThumb', 'caption': None, 'credit': None, 'type': 'image', 'url': 'images/2020/02/20/opinion/20bruniWeb/20bruniWeb-blogSmallThumb.jpg', 'height': 50, 'width': 50, 'legacy': {}, 'subType': 'blogSmallThumb', 'crop_name': 'blogSmallThumb'}, {'rank': 0, 'subtype': 'thumbLarge', 'caption': None, 'credit': None, 'type': 'image', 'url': 'images/2020/02/20/opinion/20bruniWeb/20bruniWeb-thumbLarge.jpg', 'height': 150, 'width': 150, 'legacy': {}, 'subType': 'thumbLarge', 'crop_name': 'thumbLarge'}, {'rank': 0, 'subtype': 'smallSquare168', 'caption': None, 'credit': None, 'type': 'image', 'url': 'images/2020/02/20/opinion/20bruniWeb/20bruniWeb-smallSquare168.jpg', 'height': 168, 'width': 168, 'legacy': {}, 'subType': 'smallSquare168', 'crop_name': 'smallSquare168'}, {'rank': 0, 'subtype': 'smallSquare252', 'caption': None, 'credit': None, 'type': 'image', 'url': 'images/2020/02/20/opinion/20bruniWeb/20bruniWeb-smallSquare252.jpg', 'height': 252, 'width': 252, 'legacy': {}, 'subType': 'smallSquare252', 'crop_name': 'smallSquare252'}, {'rank': 0, 'subtype': 'square320', 'caption': None, 'credit': None, 'type': 'image', 'url': 'images/2020/02/20/opinion/20bruniWeb/20bruniWeb-square320.jpg', 'height': 320, 'width': 320, 'legacy': {}, 'subType': 'square320', 'crop_name': 'square320'}, {'rank': 0, 'subtype': 'moth', 'caption': None, 'credit': None, 'type': 'image', 'url': 'images/2020/02/20/opinion/20bruniWeb/20bruniWeb-moth.jpg', 'height': 151, 'width': 151, 'legacy': {}, 'subType': 'moth', 'crop_name': 'moth'}, {'rank': 0, 'subtype': 'filmstrip', 'caption': None, 'credit': None, 'type': 'image', 'url': 'images/2020/02/20/opinion/20bruniWeb/20bruniWeb-filmstrip.jpg', 'height': 190, 'width': 190, 'legacy': {}, 'subType': 'filmstrip', 'crop_name': 'filmstrip'}, {'rank': 0, 'subtype': 'square640', 'caption': None, 'credit': None, 'type': 'image', 'url': 'images/2020/02/20/opinion/20bruniWeb/20bruniWeb-square640.jpg', 'height': 640, 'width': 640, 'legacy': {}, 'subType': 'square640', 'crop_name': 'square640'}, {'rank': 0, 'subtype': 'mediumSquare149', 'caption': None, 'credit': None, 'type': 'image', 'url': 'images/2020/02/20/opinion/20bruniWeb/20bruniWeb-mediumSquare149.jpg', 'height': 149, 'width': 149, 'legacy': {}, 'subType': 'mediumSquare149', 'crop_name': 'mediumSquare149'}, {'rank': 0, 'subtype': 'mediumSquareAt3X', 'caption': None, 'credit': None, 'type': 'image', 'url': 'images/2020/02/20/opinion/20bruniWeb/20bruniWeb-mediumSquareAt3X.jpg', 'height': 1800, 'width': 1800, 'legacy': {}, 'subType': 'mediumSquareAt3X', 'crop_name': 'mediumSquareAt3X'}, {'rank': 0, 'subtype': 'sfSpan', 'caption': None, 'credit': None, 'type': 'image', 'url': 'images/2020/02/20/opinion/20bruniWeb/20bruniWeb-sfSpan.jpg', 'height': 263, 'width': 395, 'legacy': {}, 'subType': 'sfSpan', 'crop_name': 'sfSpan'}, {'rank': 0, 'subtype': 'largeHorizontal375', 'caption': None, 'credit': None, 'type': 'image', 'url': 'images/2020/02/20/opinion/20bruniWeb/20bruniWeb-largeHorizontal375.jpg', 'height': 250, 'width': 375, 'legacy': {}, 'subType': 'largeHorizontal375', 'crop_name': 'largeHorizontal375'}, {'rank': 0, 'subtype': 'largeHorizontalJumbo', 'caption': None, 'credit': None, 'type': 'image', 'url': 'images/2020/02/20/opinion/20bruniWeb/20bruniWeb-largeHorizontalJumbo.jpg', 'height': 683, 'width': 1024, 'legacy': {}, 'subType': 'largeHorizontalJumbo', 'crop_name': 'largeHorizontalJumbo'}, {'rank': 0, 'subtype': 'horizontalMediumAt2X', 'caption': None, 'credit': None, 'type': 'image', 'url': 'images/2020/02/20/opinion/20bruniWeb/20bruniWeb-horizontalMediumAt2X.jpg', 'height': 2333, 'width': 3499, 'legacy': {}, 'subType': 'horizontalMediumAt2X', 'crop_name': 'horizontalMediumAt2X'}, {'rank': 0, 'subtype': 'hpLarge', 'caption': None, 'credit': None, 'type': 'image', 'url': 'images/2020/02/20/opinion/20bruniWeb/20bruniWeb-hpLarge.jpg', 'height': 287, 'width': 511, 'legacy': {}, 'subType': 'hpLarge', 'crop_name': 'hpLarge'}, {'rank': 0, 'subtype': 'largeWidescreen573', 'caption': None, 'credit': None, 'type': 'image', 'url': 'images/2020/02/20/opinion/20bruniWeb/20bruniWeb-largeWidescreen573.jpg', 'height': 322, 'width': 573, 'legacy': {}, 'subType': 'largeWidescreen573', 'crop_name': 'largeWidescreen573'}, {'rank': 0, 'subtype': 'largeWidescreen1050', 'caption': None, 'credit': None, 'type': 'image', 'url': 'images/2020/02/20/opinion/20bruniWeb/20bruniWeb-largeWidescreen1050.jpg', 'height': 591, 'width': 1050, 'legacy': {}, 'subType': 'largeWidescreen1050', 'crop_name': 'largeWidescreen1050'}, {'rank': 0, 'subtype': 'wide', 'caption': None, 'credit': None, 'type': 'image', 'url': 'images/2020/02/20/opinion/20bruniWeb/20bruniWeb-thumbWide.jpg', 'height': 126, 'width': 190, 'legacy': {'widewidth': 190, 'wideheight': 126, 'wide': 'images/2020/02/20/opinion/20bruniWeb/20bruniWeb-thumbWide.jpg'}, 'subType': 'wide', 'crop_name': 'thumbWide'}, {'rank': 0, 'subtype': 'videoThumb', 'caption': None, 'credit': None, 'type': 'image', 'url': 'images/2020/02/20/opinion/20bruniWeb/20bruniWeb-videoThumb.jpg', 'height': 50, 'width': 75, 'legacy': {}, 'subType': 'videoThumb', 'crop_name': 'videoThumb'}, {'rank': 0, 'subtype': 'videoLarge', 'caption': None, 'credit': None, 'type': 'image', 'url': 'images/2020/02/20/opinion/20bruniWeb/20bruniWeb-videoLarge.jpg', 'height': 507, 'width': 768, 'legacy': {}, 'subType': 'videoLarge', 'crop_name': 'videoLarge'}, {'rank': 0, 'subtype': 'mediumThreeByTwo210', 'caption': None, 'credit': None, 'type': 'image', 'url': 'images/2020/02/20/opinion/20bruniWeb/20bruniWeb-mediumThreeByTwo210.jpg', 'height': 140, 'width': 210, 'legacy': {}, 'subType': 'mediumThreeByTwo210', 'crop_name': 'mediumThreeByTwo210'}, {'rank': 0, 'subtype': 'mediumThreeByTwo225', 'caption': None, 'credit': None, 'type': 'image', 'url': 'images/2020/02/20/opinion/20bruniWeb/20bruniWeb-mediumThreeByTwo225.jpg', 'height': 150, 'width': 225, 'legacy': {}, 'subType': 'mediumThreeByTwo225', 'crop_name': 'mediumThreeByTwo225'}, {'rank': 0, 'subtype': 'mediumThreeByTwo440', 'caption': None, 'credit': None, 'type': 'image', 'url': 'images/2020/02/20/opinion/20bruniWeb/20bruniWeb-mediumThreeByTwo440.jpg', 'height': 293, 'width': 440, 'legacy': {}, 'subType': 'mediumThreeByTwo440', 'crop_name': 'mediumThreeByTwo440'}, {'rank': 0, 'subtype': 'mediumThreeByTwo252', 'caption': None, 'credit': None, 'type': 'image', 'url': 'images/2020/02/20/opinion/20bruniWeb/20bruniWeb-mediumThreeByTwo252.jpg', 'height': 168, 'width': 252, 'legacy': {}, 'subType': 'mediumThreeByTwo252', 'crop_name': 'mediumThreeByTwo252'}, {'rank': 0, 'subtype': 'mediumThreeByTwo378', 'caption': None, 'credit': None, 'type': 'image', 'url': 'images/2020/02/20/opinion/20bruniWeb/20bruniWeb-mediumThreeByTwo378.jpg', 'height': 252, 'width': 378, 'legacy': {}, 'subType': 'mediumThreeByTwo378', 'crop_name': 'mediumThreeByTwo378'}, {'rank': 0, 'subtype': 'threeByTwoLargeAt2X', 'caption': None, 'credit': None, 'type': 'image', 'url': 'images/2020/02/20/opinion/20bruniWeb/20bruniWeb-threeByTwoLargeAt2X.jpg', 'height': 2011, 'width': 3015, 'legacy': {}, 'subType': 'threeByTwoLargeAt2X', 'crop_name': 'threeByTwoLargeAt2X'}, {'rank': 0, 'subtype': 'threeByTwoMediumAt2X', 'caption': None, 'credit': None, 'type': 'image', 'url': 'images/2020/02/20/opinion/20bruniWeb/20bruniWeb-threeByTwoMediumAt2X.jpg', 'height': 1000, 'width': 1500, 'legacy': {}, 'subType': 'threeByTwoMediumAt2X', 'crop_name': 'threeByTwoMediumAt2X'}, {'rank': 0, 'subtype': 'threeByTwoSmallAt2X', 'caption': None, 'credit': None, 'type': 'image', 'url': 'images/2020/02/20/opinion/20bruniWeb/20bruniWeb-threeByTwoSmallAt2X.jpg', 'height': 400, 'width': 600, 'legacy': {}, 'subType': 'threeByTwoSmallAt2X', 'crop_name': 'threeByTwoSmallAt2X'}, {'rank': 0, 'subtype': 'articleInline', 'caption': None, 'credit': None, 'type': 'image', 'url': 'images/2020/02/20/opinion/20bruniWeb/20bruniWeb-articleInline.jpg', 'height': 128, 'width': 190, 'legacy': {}, 'subType': 'articleInline', 'crop_name': 'articleInline'}, {'rank': 0, 'subtype': 'hpSmall', 'caption': None, 'credit': None, 'type': 'image', 'url': 'images/2020/02/20/opinion/20bruniWeb/20bruniWeb-hpSmall.jpg', 'height': 110, 'width': 163, 'legacy': {}, 'subType': 'hpSmall', 'crop_name': 'hpSmall'}, {'rank': 0, 'subtype': 'blogSmallInline', 'caption': None, 'credit': None, 'type': 'image', 'url': 'images/2020/02/20/opinion/20bruniWeb/20bruniWeb-blogSmallInline.jpg', 'height': 102, 'width': 151, 'legacy': {}, 'subType': 'blogSmallInline', 'crop_name': 'blogSmallInline'}, {'rank': 0, 'subtype': 'mediumFlexible177', 'caption': None, 'credit': None, 'type': 'image', 'url': 'images/2020/02/20/opinion/20bruniWeb/20bruniWeb-mediumFlexible177.jpg', 'height': 119, 'width': 177, 'legacy': {}, 'subType': 'mediumFlexible177', 'crop_name': 'mediumFlexible177'}, {'rank': 0, 'subtype': 'videoSmall', 'caption': None, 'credit': None, 'type': 'image', 'url': 'images/2020/02/20/opinion/20bruniWeb/20bruniWeb-videoSmall.jpg', 'height': 281, 'width': 500, 'legacy': {}, 'subType': 'videoSmall', 'crop_name': 'videoSmall'}, {'rank': 0, 'subtype': 'videoHpMedium', 'caption': None, 'credit': None, 'type': 'image', 'url': 'images/2020/02/20/opinion/20bruniWeb/20bruniWeb-videoHpMedium.jpg', 'height': 211, 'width': 375, 'legacy': {}, 'subType': 'videoHpMedium', 'crop_name': 'videoHpMedium'}, {'rank': 0, 'subtype': 'videoSixteenByNine600', 'caption': None, 'credit': None, 'type': 'image', 'url': 'images/2020/02/20/opinion/20bruniWeb/20bruniWeb-videoSixteenByNine600.jpg', 'height': 338, 'width': 600, 'legacy': {}, 'subType': 'videoSixteenByNine600', 'crop_name': 'videoSixteenByNine600'}, {'rank': 0, 'subtype': 'videoSixteenByNine540', 'caption': None, 'credit': None, 'type': 'image', 'url': 'images/2020/02/20/opinion/20bruniWeb/20bruniWeb-videoSixteenByNine540.jpg', 'height': 304, 'width': 540, 'legacy': {}, 'subType': 'videoSixteenByNine540', 'crop_name': 'videoSixteenByNine540'}, {'rank': 0, 'subtype': 'videoSixteenByNine495', 'caption': None, 'credit': None, 'type': 'image', 'url': 'images/2020/02/20/opinion/20bruniWeb/20bruniWeb-videoSixteenByNine495.jpg', 'height': 278, 'width': 495, 'legacy': {}, 'subType': 'videoSixteenByNine495', 'crop_name': 'videoSixteenByNine495'}, {'rank': 0, 'subtype': 'videoSixteenByNine390', 'caption': None, 'credit': None, 'type': 'image', 'url': 'images/2020/02/20/opinion/20bruniWeb/20bruniWeb-videoSixteenByNine390.jpg', 'height': 219, 'width': 390, 'legacy': {}, 'subType': 'videoSixteenByNine390', 'crop_name': 'videoSixteenByNine390'}, {'rank': 0, 'subtype': 'videoSixteenByNine1050', 'caption': None, 'credit': None, 'type': 'image', 'url': 'images/2020/02/20/opinion/20bruniWeb/20bruniWeb-videoSixteenByNine1050.jpg', 'height': 591, 'width': 1050, 'legacy': {}, 'subType': 'videoSixteenByNine1050', 'crop_name': 'videoSixteenByNine1050'}, {'rank': 0, 'subtype': 'videoSixteenByNine480', 'caption': None, 'credit': None, 'type': 'image', 'url': 'images/2020/02/20/opinion/20bruniWeb/20bruniWeb-videoSixteenByNine480.jpg', 'height': 270, 'width': 480, 'legacy': {}, 'subType': 'videoSixteenByNine480', 'crop_name': 'videoSixteenByNine480'}, {'rank': 0, 'subtype': 'videoSixteenByNine310', 'caption': None, 'credit': None, 'type': 'image', 'url': 'images/2020/02/20/opinion/20bruniWeb/20bruniWeb-videoSixteenByNine310.jpg', 'height': 174, 'width': 310, 'legacy': {}, 'subType': 'videoSixteenByNine310', 'crop_name': 'videoSixteenByNine310'}, {'rank': 0, 'subtype': 'videoSixteenByNine225', 'caption': None, 'credit': None, 'type': 'image', 'url': 'images/2020/02/20/opinion/20bruniWeb/20bruniWeb-videoSixteenByNine225.jpg', 'height': 126, 'width': 225, 'legacy': {}, 'subType': 'videoSixteenByNine225', 'crop_name': 'videoSixteenByNine225'}, {'rank': 0, 'subtype': 'videoSixteenByNine96', 'caption': None, 'credit': None, 'type': 'image', 'url': 'images/2020/02/20/opinion/20bruniWeb/20bruniWeb-videoSixteenByNine96.jpg', 'height': 54, 'width': 96, 'legacy': {}, 'subType': 'videoSixteenByNine96', 'crop_name': 'videoSixteenByNine96'}, {'rank': 0, 'subtype': 'videoSixteenByNine3000', 'caption': None, 'credit': None, 'type': 'image', 'url': 'images/2020/02/20/opinion/20bruniWeb/20bruniWeb-videoSixteenByNine3000.jpg', 'height': 1687, 'width': 3000, 'legacy': {}, 'subType': 'videoSixteenByNine3000', 'crop_name': 'videoSixteenByNine3000'}, {'rank': 0, 'subtype': 'videoSixteenByNine768', 'caption': None, 'credit': None, 'type': 'image', 'url': 'images/2020/02/20/opinion/20bruniWeb/20bruniWeb-videoSixteenByNine768.jpg', 'height': 432, 'width': 768, 'legacy': {}, 'subType': 'videoSixteenByNine768', 'crop_name': 'videoSixteenByNine768'}, {'rank': 0, 'subtype': 'videoSixteenByNine150', 'caption': None, 'credit': None, 'type': 'image', 'url': 'images/2020/02/20/opinion/20bruniWeb/20bruniWeb-videoSixteenByNine150.jpg', 'height': 84, 'width': 150, 'legacy': {}, 'subType': 'videoSixteenByNine150', 'crop_name': 'videoSixteenByNine150'}, {'rank': 0, 'subtype': 'videoSixteenByNineJumbo1600', 'caption': None, 'credit': None, 'type': 'image', 'url': 'images/2020/02/20/opinion/20bruniWeb/20bruniWeb-videoSixteenByNineJumbo1600.jpg', 'height': 900, 'width': 1600, 'legacy': {}, 'subType': 'videoSixteenByNineJumbo1600', 'crop_name': 'videoSixteenByNineJumbo1600'}, {'rank': 0, 'subtype': 'miniMoth', 'caption': None, 'credit': None, 'type': 'image', 'url': 'images/2020/02/20/opinion/20bruniWeb/20bruniWeb-miniMoth.jpg', 'height': 70, 'width': 151, 'legacy': {}, 'subType': 'miniMoth', 'crop_name': 'miniMoth'}, {'rank': 0, 'subtype': 'windowsTile336H', 'caption': None, 'credit': None, 'type': 'image', 'url': 'images/2020/02/20/opinion/20bruniWeb/20bruniWeb-windowsTile336H.jpg', 'height': 336, 'width': 694, 'legacy': {}, 'subType': 'windowsTile336H', 'crop_name': 'windowsTile336H'}, {'rank': 0, 'subtype': 'videoFifteenBySeven1305', 'caption': None, 'credit': None, 'type': 'image', 'url': 'images/2020/02/20/opinion/20bruniWeb/20bruniWeb-videoFifteenBySeven1305.jpg', 'height': 609, 'width': 1305, 'legacy': {}, 'subType': 'videoFifteenBySeven1305', 'crop_name': 'videoFifteenBySeven1305'}, {'rank': 0, 'subtype': 'videoFifteenBySeven2610', 'caption': None, 'credit': None, 'type': 'image', 'url': 'images/2020/02/20/opinion/20bruniWeb/20bruniWeb-videoFifteenBySeven2610.jpg', 'height': 1218, 'width': 2610, 'legacy': {}, 'subType': 'videoFifteenBySeven2610', 'crop_name': 'videoFifteenBySeven2610'}, {'rank': 0, 'subtype': 'facebookJumbo', 'caption': None, 'credit': None, 'type': 'image', 'url': 'images/2020/02/20/opinion/20bruniWeb/20bruniWeb-facebookJumbo.jpg', 'height': 549, 'width': 1050, 'legacy': {}, 'subType': 'facebookJumbo', 'crop_name': 'facebookJumbo'}, {'rank': 0, 'subtype': 'watch308', 'caption': None, 'credit': None, 'type': 'image', 'url': 'images/2020/02/20/opinion/20bruniWeb/20bruniWeb-watch308.jpg', 'height': 348, 'width': 312, 'legacy': {}, 'subType': 'watch308', 'crop_name': 'watch308'}, {'rank': 0, 'subtype': 'watch268', 'caption': None, 'credit': None, 'type': 'image', 'url': 'images/2020/02/20/opinion/20bruniWeb/20bruniWeb-watch268.jpg', 'height': 303, 'width': 272, 'legacy': {}, 'subType': 'watch268', 'crop_name': 'watch268'}, {'rank': 0, 'subtype': 'verticalTwoByThree735', 'caption': None, 'credit': None, 'type': 'image', 'url': 'images/2020/02/20/opinion/20bruniWeb/20bruniWeb-verticalTwoByThree735.jpg', 'height': 1103, 'width': 735, 'legacy': {}, 'subType': 'verticalTwoByThree735', 'crop_name': 'verticalTwoByThree735'}, {'rank': 0, 'subtype': 'mobileMasterAt3x', 'caption': None, 'credit': None, 'type': 'image', 'url': 'images/2020/02/20/opinion/20bruniWeb/20bruniWeb-mobileMasterAt3x.jpg', 'height': 1210, 'width': 1800, 'legacy': {}, 'subType': 'mobileMasterAt3x', 'crop_name': 'mobileMasterAt3x'}]","[{'name': 'subject', 'value': 'Presidential Election of 2020', 'rank': 1, 'major': 'N'}, {'name': 'subject', 'value': 'Debates (Political)', 'rank': 2, 'major': 'N'}, {'name': 'subject', 'value': 'Primaries and Caucuses', 'rank': 3, 'major': 'N'}, {'name': 'organizations', 'value': 'Democratic Party', 'rank': 4, 'major': 'N'}, {'name': 'persons', 'value': 'Bloomberg, Michael R', 'rank': 5, 'major': 'N'}, {'name': 'persons', 'value': 'Buttigieg, Pete (1982- )', 'rank': 6, 'major': 'N'}, {'name': 'persons', 'value': 'Sanders, Bernard', 'rank': 7, 'major': 'N'}, {'name': 'persons', 'value': 'Warren, Elizabeth', 'rank': 8, 'major': 'N'}, {'name': 'glocations', 'value': 'Nevada', 'rank': 9, 'major': 'N'}]",2020-02-20T10:00:34+0000,article,OpEd,Opinion,,Op-Ed,nyt://article/f7ce0f2f-a7a8-5cae-93a7-b5ca36dc31c5,1288,nyt://article/f7ce0f2f-a7a8-5cae-93a7-b5ca36dc31c5,"Despite His Billions, Bloomberg Busts",,,,,,,By Frank Bruni,"[{'firstname': 'Frank', 'middlename': None, 'lastname': 'Bruni', 'qualifier': None, 'title': None, 'role': 'reported', 'organization': '', 'rank': 1}]",,,
