,abstract,web_url,snippet,lead_paragraph,source,multimedia,keywords,pub_date,document_type,news_desk,section_name,subsection_name,type_of_material,_id,word_count,uri,headline_main,headline_kicker,headline_content_kicker,headline_print_headline,headline_name,headline_seo,headline_sub,byline_original,byline_person,byline_organization,print_section,print_page
0,"U.S. Secretary of State Mike Pompeo on Tuesday came out in support of Arsenal player Mesut Ozil for his criticism of China's treatment of ethnic Uighur Muslims, saying Beijing can censor the team's football games but cannot hide rights violations.",https://www.nytimes.com/reuters/2019/12/17/world/asia/17reuters-arsenal-china-pompeo.html,"U.S. Secretary of State Mike Pompeo on Tuesday came out in support of Arsenal player Mesut Ozil for his criticism of China's treatment of ethnic Uighur Muslims, saying Beijing can censor the team's football games but cannot hide rights violations.","WASHINGTON — U.S. Secretary of State Mike Pompeo on Tuesday came out in support of Arsenal player Mesut Ozil for his criticism of China's treatment of ethnic Uighur Muslims, saying Beijing can censor the team's football games but cannot hide rights violations.",Reuters,[],[],2019-12-17T16:21:40+0000,article,None,World,Asia Pacific,News,nyt://article/1d3a9273-4e43-56ad-a666-d1f6791197ad,421,nyt://article/1d3a9273-4e43-56ad-a666-d1f6791197ad,Pompeo Expresses Support for Arsenal Player in Criticism of China's Treatment of Uighurs,,,Pompeo Expresses Support for Arsenal Player in Criticism of China's Treatment of Uighurs,,,,By Reuters,[],Reuters,,
1,"Germany believes a new U.S. law imposing sanctions on companies building Russia's contested seabed Nord Stream 2 pipeline could affect ongoing construction works off the coast of Denmark, Bild newspaper said, citing a government document.",https://www.nytimes.com/reuters/2019/12/17/world/europe/17reuters-usa-russia-sanctions-germany.html,"Germany believes a new U.S. law imposing sanctions on companies building Russia's contested seabed Nord Stream 2 pipeline could affect ongoing construction works off the coast of Denmark, Bild newspaper said, citing a government document.","BERLIN — Germany believes a new U.S. law imposing sanctions on companies building Russia's contested seabed Nord Stream 2 pipeline could affect ongoing construction works off the coast of Denmark, Bild newspaper said, citing a government document.",Reuters,[],[],2019-12-17T16:07:22+0000,article,None,World,Europe,News,nyt://article/010cfd6e-e8e3-59e9-9f64-024f608ca200,143,nyt://article/010cfd6e-e8e3-59e9-9f64-024f608ca200,U.S. Sanctions Could Hit Pipeline Building in Danish Waters: Bild,,,U.S. Sanctions Could Hit Pipeline Building in Danish Waters: Bild,,,,By Reuters,[],Reuters,,
