,abstract,web_url,snippet,lead_paragraph,source,multimedia,keywords,pub_date,document_type,news_desk,section_name,subsection_name,type_of_material,_id,word_count,uri,headline_main,headline_kicker,headline_content_kicker,headline_print_headline,headline_name,headline_seo,headline_sub,byline_original,byline_person,byline_organization,print_section,print_page
0,"Detailed results and maps from Iowa, the first contest in the 2020 presidential election.",https://www.nytimes.com/interactive/2020/02/04/us/elections/results-iowa-caucus.html,"Detailed results and maps from Iowa, the first contest in the 2020 presidential election.","Detailed results and maps from Iowa, the first contest in the 2020 presidential election.",The New York Times,[],"[{'name': 'subject', 'value': 'Elections', 'rank': 1, 'major': 'N'}, {'name': 'subject', 'value': 'Presidential Election of 2020', 'rank': 2, 'major': 'N'}, {'name': 'glocations', 'value': 'Iowa', 'rank': 3, 'major': 'N'}, {'name': 'subject', 'value': 'Primaries and Caucuses', 'rank': 4, 'major': 'N'}]",2020-02-04T21:27:44+0000,multimedia,U.S.,U.S.,Elections,Interactive Feature,nyt://interactive/50ad2fb8-d7d8-5b66-9da8-c5e4b5b51a29,0,nyt://interactive/50ad2fb8-d7d8-5b66-9da8-c5e4b5b51a29,Live: Iowa Caucus Results 2020,,,,,,,"By Jasmine C. Lee, Rebecca Lieberman, Aliza Aufrichtig and Matthew Bloch","[{'firstname': 'Jasmine', 'middlename': 'C.', 'lastname': 'Lee', 'qualifier': None, 'title': None, 'role': 'reported', 'organization': '', 'rank': 1}, {'firstname': 'Rebecca', 'middlename': None, 'lastname': 'Lieberman', 'qualifier': None, 'title': None, 'role': 'reported', 'organization': '', 'rank': 2}, {'firstname': 'Aliza', 'middlename': None, 'lastname': 'Aufrichtig', 'qualifier': None, 'title': None, 'role': 'reported', 'organization': '', 'rank': 3}, {'firstname': 'Matthew', 'middlename': None, 'lastname': 'Bloch', 'qualifier': None, 'title': None, 'role': 'reported', 'organization': '', 'rank': 4}]",,,
1,"The European Union will extend indefinitely the time limit to resolve disputes in the Iran 2015 nuclear accord to avoid having to go to the U.N. Security Council or triggering new sanctions, the EU's top diplomat said during a visit to Tehran.",https://www.nytimes.com/reuters/2020/02/04/world/middleeast/04reuters-iran-nuclear-eu.html,"The European Union will extend indefinitely the time limit to resolve disputes in the Iran 2015 nuclear accord to avoid having to go to the U.N. Security Council or triggering new sanctions, the EU's top diplomat said during a visit to Tehran.","BRUSSELS — The European Union will extend indefinitely the time limit to resolve disputes in the Iran 2015 nuclear accord to avoid having to go to the U.N. Security Council or triggering new sanctions, the EU's top diplomat said during a visit to Tehran.",Reuters,[],[],2020-02-04T21:25:41+0000,article,None,World,Middle East,News,nyt://article/fb8a507d-85dd-5fc4-b7f8-5948d15d4a66,369,nyt://article/fb8a507d-85dd-5fc4-b7f8-5948d15d4a66,"Europe to Avoid Taking Iran Nuclear Dispute to U.N., EU's Top Diplomat Says",,,"Europe to Avoid Taking Iran Nuclear Dispute to U.N., EU's Top Diplomat Says",,,,By Reuters,[],Reuters,,
