,abstract,web_url,snippet,lead_paragraph,source,multimedia,keywords,pub_date,document_type,news_desk,section_name,subsection_name,type_of_material,_id,word_count,uri,headline_main,headline_kicker,headline_content_kicker,headline_print_headline,headline_name,headline_seo,headline_sub,byline_original,byline_person,byline_organization,print_section,print_page
0,"President Trump’s aggressive use of tariffs did bring the Chinese to the negotiating table, and the United States and China signed an initial trade deal last month. But the president’s trade victory came at a high cost. His heavy use of tariffs has been painful for American consumers and businesses that are paying higher prices for products, and economists say it has weighed on the manufacturing sector that he wanted to help.",https://www.nytimes.com/live/2020/fact-check-state-of-the-union-02-04/i-also-promised-citizens-i-would-impose-tariffs-to-confront-chinas-massive-theft-of-americas-jobs-our-strategy-has-worked,,"President Trump’s aggressive use of tariffs did bring the Chinese to the negotiating table, and the United States and China signed an initial trade deal last month. But the president’s trade victory came at a high cost. His heavy use of tariffs has been painful for American consumers and businesses that are paying higher prices for products, and economists say it has weighed on the manufacturing sector that he wanted to help.",The New York Times,[],[],2020-02-05T02:33:55+0000,article,Washington,U.S.,Politics,Live Blog Post,nyt://article/d82788a6-d856-5fb5-b5cf-805777102c7c,74,nyt://article/d82788a6-d856-5fb5-b5cf-805777102c7c,“I also promised citizens I would impose tariffs to confront China’s massive theft of America’s jobs. Our strategy has worked.”,,,,,,,By Ana Swanson,"[{'firstname': 'Ana', 'middlename': None, 'lastname': 'Swanson', 'qualifier': None, 'title': None, 'role': 'reported', 'organization': '', 'rank': 1}]",,,
1,"If you count President Barack Obama’s budget passed for 2017, and take into account 2018 and 2019, President Trump will have spent $2.1 trillion, as he has yet to completely spend the 2020 budget. Adjusted for inflation, both Presidents George W. Bush and Barack Obama spent more each year from 2007 through 2012, according to Breaking Defense, an industry publication.",https://www.nytimes.com/live/2020/fact-check-state-of-the-union-02-04/to-safeguard-american-liberty-we-have-invested-a-record-breaking-2-2-trillion-dollars-in-the-united-states-military,,"If you count President Barack Obama’s budget passed for 2017, and take into account 2018 and 2019, President Trump will have spent $2.1 trillion, as he has yet to completely spend the 2020 budget. Adjusted for inflation, both Presidents George W. Bush and Barack Obama spent more each year from 2007 through 2012, according to Breaking Defense, an industry publication.",The New York Times,[],[],2020-02-05T02:30:37+0000,article,Washington,U.S.,Politics,Live Blog Post,nyt://article/d0d6d6ff-773e-547a-8063-bcd8d401e1e7,63,nyt://article/d0d6d6ff-773e-547a-8063-bcd8d401e1e7,"“To safeguard American liberty, we have invested a record-breaking $2.2 trillion dollars in the United States military.”",,,,,,,By Thomas Gibbons-Neff,"[{'firstname': 'Thomas', 'middlename': None, 'lastname': 'Gibbons-Neff', 'qualifier': None, 'title': None, 'role': 'reported', 'organization': '', 'rank': 1}]",,,
2,"Since President Trump won election in 2016, the S&P 500-stock index and the Dow Jones industrial average are each up about 60 percent.",https://www.nytimes.com/live/2020/fact-check-state-of-the-union-02-04/since-my-election-us-stock-markets-have-soared-70-percent-adding-more-than-12-trillion-to-our-nations-wealth-transcending-anythi,,"Since President Trump won election in 2016, the S&P 500-stock index and the Dow Jones industrial average are each up about 60 percent.",The New York Times,[],[],2020-02-05T02:27:04+0000,article,Washington,U.S.,Politics,Live Blog Post,nyt://article/2fe93984-9fb0-540c-9228-909c246a1a2c,25,nyt://article/2fe93984-9fb0-540c-9228-909c246a1a2c,"“Since my election, U.S. stock markets have soared 70 percent, adding more than $12 trillion to our nation’s wealth, transcending anything anyone believed was possible. This is a record.”",,,,,,,By Jim Tankersley,"[{'firstname': 'Jim', 'middlename': None, 'lastname': 'Tankersley', 'qualifier': None, 'title': None, 'role': 'reported', 'organization': '', 'rank': 1}]",,,
3,"According to the Quarterly Census of Employment and Wages, the United States has added fewer than 11,000 new manufacturing establishments since President Trump took office. The bulk of those — more than 8,000 — employ five people or fewer.",https://www.nytimes.com/live/2020/fact-check-state-of-the-union-02-04/we-are-restoring-our-nations-manufacturing-might-even-though-predictions-were-that-this-could-never-be-done-after-losing-60000-f,,"According to the Quarterly Census of Employment and Wages, the United States has added fewer than 11,000 new manufacturing establishments since President Trump took office. The bulk of those — more than 8,000 — employ five people or fewer.",The New York Times,[],[],2020-02-05T02:23:00+0000,article,Washington,U.S.,Politics,Live Blog Post,nyt://article/c2bb56d9-c758-56a7-b617-21dd8999d963,41,nyt://article/c2bb56d9-c758-56a7-b617-21dd8999d963,"“We are restoring our nation’s manufacturing might, even though predictions were that this could never be done. After losing 60,000 factories under the previous two administrations, America has now gained 12,000 new factories under my administration.”",,,,,,,By Jim Tankersley,"[{'firstname': 'Jim', 'middlename': None, 'lastname': 'Tankersley', 'qualifier': None, 'title': None, 'role': 'reported', 'organization': '', 'rank': 1}]",,,
4,"The United States is the top producer of oil and natural gas, but it is inaccurate to credit the Trump administration or President Trump’s deregulation agenda. According to the Energy Information Administration, the United States became the world’s top oil producer in 2013 and overtook Russia as the world’s leading gas producer as far back as 2009.",https://www.nytimes.com/live/2020/fact-check-state-of-the-union-02-04/thanks-to-our-bold-regulatory-reduction-campaign-the-united-states-has-become-the-no-1-producer-of-oil-and-natural-gas-anywhere-,,"The United States is the top producer of oil and natural gas, but it is inaccurate to credit the Trump administration or President Trump’s deregulation agenda. According to the Energy Information Administration, the United States became the world’s top oil producer in 2013 and overtook Russia as the world’s leading gas producer as far back as 2009.",The New York Times,[],[],2020-02-05T02:22:04+0000,article,Washington,U.S.,Politics,Live Blog Post,nyt://article/e4a7fe36-47f6-5581-a0ae-d5ad73c90697,59,nyt://article/e4a7fe36-47f6-5581-a0ae-d5ad73c90697,"“Thanks to our bold regulatory reduction campaign, the United States has become the No. 1 producer of oil and natural gas anywhere in the world, by far.”",,,,,,,By Lisa Friedman,"[{'firstname': 'Lisa', 'middlename': None, 'lastname': 'Friedman', 'qualifier': None, 'title': None, 'role': 'reported', 'organization': '', 'rank': 1}]",,,
5,"The unemployment rate under President Trump has averaged 4 percent. That is lower than even President Lyndon B. Johnson, who averaged 4.2 percent. Mr. Trump has benefited from inheriting a low unemployment rate from President Barack Obama.",https://www.nytimes.com/live/2020/fact-check-state-of-the-union-02-04/the-average-unemployment-under-my-administration-is-lower-than-any-administration-in-the-history-of-our-country,,"The unemployment rate under President Trump has averaged 4 percent. That is lower than even President Lyndon B. Johnson, who averaged 4.2 percent. Mr. Trump has benefited from inheriting a low unemployment rate from President Barack Obama.",The New York Times,[],[],2020-02-05T02:21:31+0000,article,Washington,U.S.,Politics,Live Blog Post,nyt://article/6a7b5847-80a3-5599-be42-24b78b4db5aa,39,nyt://article/6a7b5847-80a3-5599-be42-24b78b4db5aa,“The average unemployment under my administration is lower than any administration in the history of our country.”,,,,,,,By Jim Tankersley,"[{'firstname': 'Jim', 'middlename': None, 'lastname': 'Tankersley', 'qualifier': None, 'title': None, 'role': 'reported', 'organization': '', 'rank': 1}]",,,
