,abstract,web_url,snippet,lead_paragraph,source,multimedia,keywords,pub_date,document_type,news_desk,section_name,subsection_name,type_of_material,_id,word_count,uri,headline_main,headline_kicker,headline_content_kicker,headline_print_headline,headline_name,headline_seo,headline_sub,byline_original,byline_person,byline_organization,print_section,print_page
0,"India has offered to partially open up its poultry and dairy markets in a bid for a limited trade deal during U.S. President Donald Trump's first official visit to the country this month, people familiar with the protracted talks say.",https://www.nytimes.com/reuters/2020/02/13/world/asia/13reuters-usa-trade-india.html,"India has offered to partially open up its poultry and dairy markets in a bid for a limited trade deal during U.S. President Donald Trump's first official visit to the country this month, people familiar with the protracted talks say.","NEW DELHI/WASHINGTON — India has offered to partially open up its poultry and dairy markets in a bid for a limited trade deal during U.S. President Donald Trump's first official visit to the country this month, people familiar with the protracted talks say.",Reuters,[],[],2020-02-13T18:35:12+0000,article,None,World,Asia Pacific,News,nyt://article/8a5ea06e-546a-520c-805d-1d94bc66fddd,751,nyt://article/8a5ea06e-546a-520c-805d-1d94bc66fddd,"India Offers U.S. Dairy, Chicken Access in Bid for Elusive Trade Deal With Trump",,,"India Offers U.S. Dairy, Chicken Access in Bid for Elusive Trade Deal With Trump",,,,By Reuters,[],Reuters,,
1,"President Donald Trump's former chief of staff John Kelly has dismissed the U.S. president's unprecedented engagement with North Korean leader Kim Jong Un as futile, saying he had never believed North Korea would give up its nuclear weapons and Pyongyang had played the United States to its benefit.",https://www.nytimes.com/reuters/2020/02/13/world/asia/13reuters-northkorea-usa-kelly.html,"President Donald Trump's former chief of staff John Kelly has dismissed the U.S. president's unprecedented engagement with North Korean leader Kim Jong Un as futile, saying he had never believed North Korea would give up its nuclear weapons and Py...","WASHINGTON — President Donald Trump's former chief of staff John Kelly has dismissed the U.S. president's unprecedented engagement with North Korean leader Kim Jong Un as futile, saying he had never believed North Korea would give up its nuclear weapons and Pyongyang had played the United States to its benefit.",Reuters,[],[],2020-02-13T18:32:18+0000,article,None,World,Asia Pacific,News,nyt://article/6b848731-d6e6-50fc-af6a-98d4bd821edf,435,nyt://article/6b848731-d6e6-50fc-af6a-98d4bd821edf,Former Chief of Staff Kelly Rejects Trump North Korea Approach as Futile: Report,,,Former Chief of Staff Kelly Rejects Trump North Korea Approach as Futile: Report,,,,By Reuters,[],Reuters,,
2,"A White House meeting between U.S. President Donald Trump and New York Governor Andrew Cuomo over New York's pro-immigrant policies was ""productive,"" according to Trump's top homeland official.",https://www.nytimes.com/reuters/2020/02/13/us/politics/13reuters-usa-immigration-new-york.html,"A White House meeting between U.S. President Donald Trump and New York Governor Andrew Cuomo over New York's pro-immigrant policies was ""productive,"" according to Trump's top homeland official.","WASHINGTON — A White House meeting between U.S. President Donald Trump and New York Governor Andrew Cuomo over New York's pro-immigrant policies was ""productive,"" according to Trump's top homeland official.",Reuters,[],[],2020-02-13T18:05:19+0000,article,None,U.S.,Politics,News,nyt://article/f084cc8b-30a2-5728-8de9-3fb443b6313c,410,nyt://article/f084cc8b-30a2-5728-8de9-3fb443b6313c,Trump Had 'Productive' Meeting With Cuomo Over NY Immigrant Policies: Official,,,Trump Had 'Productive' Meeting With Cuomo Over NY Immigrant Policies: Official,,,,By Reuters,[],Reuters,,
3,New York Gov. Andrew Cuomo visited the White House on Thursday in the hope he could persuade President Donald Trump to reverse a decision to boot New Yorkers from programs that allow travelers to avoid long lines at the U.S. border.,https://www.nytimes.com/aponline/2020/02/13/us/ap-us-traveler-program-suspended.html,New York Gov. Andrew Cuomo visited the White House on Thursday in the hope he could persuade President Donald Trump to reverse a decision to boot New Yorkers from programs that allow travelers to avoid long lines at the U.S. border.,WASHINGTON — New York Gov. Andrew Cuomo visited the White House on Thursday in the hope he could persuade President Donald Trump to reverse a decision to boot New Yorkers from programs that allow travelers to avoid long lines at the U.S. border.,AP,[],[],2020-02-13T18:02:14+0000,article,None,U.S.,,News,nyt://article/fdb1f719-5131-58b1-82b9-88d48a973fe0,598,nyt://article/fdb1f719-5131-58b1-82b9-88d48a973fe0,Cuomo Meets With Trump to Offer Deal on Travelers Program,,,Cuomo Meets With Trump to Offer Deal on Travelers Program,,,,By The Associated Press,[],The Associated Press,,
4,Colin Kaepernick can add author and publisher to his resume. ,https://www.nytimes.com/aponline/2020/02/13/sports/football/ap-fbn-kaepernick-memoir.html,Colin Kaepernick can add author and publisher to his resume. ,NEW YORK — Colin Kaepernick can add author and publisher to his resume. ,AP,[],[],2020-02-13T17:32:12+0000,article,None,Sports,Pro Football,News,nyt://article/3654644f-5f5f-5efc-87a1-96f9f079a4be,296,nyt://article/3654644f-5f5f-5efc-87a1-96f9f079a4be,Kaepernick to Release Memoir Through His Publishing Company,,,Kaepernick to Release Memoir Through His Publishing Company,,,,By The Associated Press,[],The Associated Press,,
5,Suggested reading from critics and editors at The New York Times.,https://www.nytimes.com/2020/02/13/books/review/10-new-books-we-recommend-this-week.html,Suggested reading from critics and editors at The New York Times.,"I’m on the record as a fan of the San Francisco 49ers, so after they lost the Super Bowl to the Kansas City Patrick Mahomes a couple of weeks ago, my first thought was: “Is it baseball season yet?”",The New York Times,"[{'rank': 0, 'subtype': 'xlarge', 'caption': None, 'credit': None, 'type': 'image', 'url': 'images/2020/02/16/books/16edchoice1/16edchoice1-articleLarge.jpg', 'height': 301, 'width': 600, 'legacy': {'xlarge': 'images/2020/02/16/books/16edchoice1/16edchoice1-articleLarge.jpg', 'xlargewidth': 600, 'xlargeheight': 301}, 'subType': 'xlarge', 'crop_name': 'articleLarge'}, {'rank': 0, 'subtype': 'popup', 'caption': None, 'credit': None, 'type': 'image', 'url': 'images/2020/02/16/books/16edchoice1/16edchoice1-popup.jpg', 'height': 326, 'width': 650, 'legacy': {}, 'subType': 'popup', 'crop_name': 'popup'}, {'rank': 0, 'subtype': 'blog480', 'caption': None, 'credit': None, 'type': 'image', 'url': 'images/2020/02/16/books/16edchoice1/16edchoice1-blog480.jpg', 'height': 241, 'width': 480, 'legacy': {}, 'subType': 'blog480', 'crop_name': 'blog480'}, {'rank': 0, 'subtype': 'blog533', 'caption': None, 'credit': None, 'type': 'image', 'url': 'images/2020/02/16/books/16edchoice1/16edchoice1-blog533.jpg', 'height': 268, 'width': 533, 'legacy': {}, 'subType': 'blog533', 'crop_name': 'blog533'}, {'rank': 0, 'subtype': 'blog427', 'caption': None, 'credit': None, 'type': 'image', 'url': 'images/2020/02/16/books/16edchoice1/16edchoice1-blog427.jpg', 'height': 214, 'width': 427, 'legacy': {}, 'subType': 'blog427', 'crop_name': 'blog427'}, {'rank': 0, 'subtype': 'tmagSF', 'caption': None, 'credit': None, 'type': 'image', 'url': 'images/2020/02/16/books/16edchoice1/16edchoice1-tmagSF.jpg', 'height': 182, 'width': 362, 'legacy': {}, 'subType': 'tmagSF', 'crop_name': 'tmagSF'}, {'rank': 0, 'subtype': 'tmagArticle', 'caption': None, 'credit': None, 'type': 'image', 'url': 'images/2020/02/16/books/16edchoice1/16edchoice1-tmagArticle.jpg', 'height': 297, 'width': 592, 'legacy': {}, 'subType': 'tmagArticle', 'crop_name': 'tmagArticle'}, {'rank': 0, 'subtype': 'slide', 'caption': None, 'credit': None, 'type': 'image', 'url': 'images/2020/02/16/books/16edchoice1/16edchoice1-slide.jpg', 'height': 301, 'width': 600, 'legacy': {}, 'subType': 'slide', 'crop_name': 'slide'}, {'rank': 0, 'subtype': 'jumbo', 'caption': None, 'credit': None, 'type': 'image', 'url': 'images/2020/02/16/books/16edchoice1/16edchoice1-jumbo.jpg', 'height': 514, 'width': 1024, 'legacy': {}, 'subType': 'jumbo', 'crop_name': 'jumbo'}, {'rank': 0, 'subtype': 'superJumbo', 'caption': None, 'credit': None, 'type': 'image', 'url': 'images/2020/02/16/books/16edchoice1/16edchoice1-superJumbo.jpg', 'height': 913, 'width': 1818, 'legacy': {}, 'subType': 'superJumbo', 'crop_name': 'superJumbo'}, {'rank': 0, 'subtype': 'blog225', 'caption': None, 'credit': None, 'type': 'image', 'url': 'images/2020/02/16/books/16edchoice1/16edchoice1-blog225.jpg', 'height': 113, 'width': 225, 'legacy': {}, 'subType': 'blog225', 'crop_name': 'blog225'}, {'rank': 0, 'subtype': 'master1050', 'caption': None, 'credit': None, 'type': 'image', 'url': 'images/2020/02/16/books/16edchoice1/16edchoice1-master1050.jpg', 'height': 527, 'width': 1050, 'legacy': {}, 'subType': 'master1050', 'crop_name': 'master1050'}, {'rank': 0, 'subtype': 'master675', 'caption': None, 'credit': None, 'type': 'image', 'url': 'images/2020/02/16/books/16edchoice1/16edchoice1-master675.jpg', 'height': 339, 'width': 675, 'legacy': {}, 'subType': 'master675', 'crop_name': 'master675'}, {'rank': 0, 'subtype': 'master495', 'caption': None, 'credit': None, 'type': 'image', 'url': 'images/2020/02/16/books/16edchoice1/16edchoice1-master495.jpg', 'height': 249, 'width': 495, 'legacy': {}, 'subType': 'master495', 'crop_name': 'master495'}, {'rank': 0, 'subtype': 'master180', 'caption': None, 'credit': None, 'type': 'image', 'url': 'images/2020/02/16/books/16edchoice1/16edchoice1-master180.jpg', 'height': 90, 'width': 180, 'legacy': {}, 'subType': 'master180', 'crop_name': 'master180'}, {'rank': 0, 'subtype': 'master315', 'caption': None, 'credit': None, 'type': 'image', 'url': 'images/2020/02/16/books/16edchoice1/16edchoice1-master315.jpg', 'height': 158, 'width': 315, 'legacy': {}, 'subType': 'master315', 'crop_name': 'master315'}, {'rank': 0, 'subtype': 'master768', 'caption': None, 'credit': None, 'type': 'image', 'url': 'images/2020/02/16/books/16edchoice1/16edchoice1-master768.jpg', 'height': 386, 'width': 768, 'legacy': {}, 'subType': 'master768', 'crop_name': 'master768'}, {'rank': 0, 'subtype': 'thumbnail', 'caption': None, 'credit': None, 'type': 'image', 'url': 'images/2020/02/16/books/16edchoice1/16edchoice1-thumbStandard.jpg', 'height': 75, 'width': 75, 'legacy': {'thumbnail': 'images/2020/02/16/books/16edchoice1/16edchoice1-thumbStandard.jpg', 'thumbnailwidth': 75, 'thumbnailheight': 75}, 'subType': 'thumbnail', 'crop_name': 'thumbStandard'}, {'rank': 0, 'subtype': 'blogSmallThumb', 'caption': None, 'credit': None, 'type': 'image', 'url': 'images/2020/02/16/books/16edchoice1/16edchoice1-blogSmallThumb.jpg', 'height': 50, 'width': 50, 'legacy': {}, 'subType': 'blogSmallThumb', 'crop_name': 'blogSmallThumb'}, {'rank': 0, 'subtype': 'thumbLarge', 'caption': None, 'credit': None, 'type': 'image', 'url': 'images/2020/02/16/books/16edchoice1/16edchoice1-thumbLarge.jpg', 'height': 150, 'width': 150, 'legacy': {}, 'subType': 'thumbLarge', 'crop_name': 'thumbLarge'}, {'rank': 0, 'subtype': 'smallSquare168', 'caption': None, 'credit': None, 'type': 'image', 'url': 'images/2020/02/16/books/16edchoice1/16edchoice1-smallSquare168.jpg', 'height': 168, 'width': 168, 'legacy': {}, 'subType': 'smallSquare168', 'crop_name': 'smallSquare168'}, {'rank': 0, 'subtype': 'smallSquare252', 'caption': None, 'credit': None, 'type': 'image', 'url': 'images/2020/02/16/books/16edchoice1/16edchoice1-smallSquare252.jpg', 'height': 252, 'width': 252, 'legacy': {}, 'subType': 'smallSquare252', 'crop_name': 'smallSquare252'}, {'rank': 0, 'subtype': 'square320', 'caption': None, 'credit': None, 'type': 'image', 'url': 'images/2020/02/16/books/16edchoice1/16edchoice1-square320.jpg', 'height': 320, 'width': 320, 'legacy': {}, 'subType': 'square320', 'crop_name': 'square320'}, {'rank': 0, 'subtype': 'moth', 'caption': None, 'credit': None, 'type': 'image', 'url': 'images/2020/02/16/books/16edchoice1/16edchoice1-moth.jpg', 'height': 151, 'width': 151, 'legacy': {}, 'subType': 'moth', 'crop_name': 'moth'}, {'rank': 0, 'subtype': 'filmstrip', 'caption': None, 'credit': None, 'type': 'image', 'url': 'images/2020/02/16/books/16edchoice1/16edchoice1-filmstrip.jpg', 'height': 190, 'width': 190, 'legacy': {}, 'subType': 'filmstrip', 'crop_name': 'filmstrip'}, {'rank': 0, 'subtype': 'mediumSquare149', 'caption': None, 'credit': None, 'type': 'image', 'url': 'images/2020/02/16/books/16edchoice1/16edchoice1-mediumSquare149.jpg', 'height': 149, 'width': 149, 'legacy': {}, 'subType': 'mediumSquare149', 'crop_name': 'mediumSquare149'}, {'rank': 0, 'subtype': 'sfSpan', 'caption': None, 'credit': None, 'type': 'image', 'url': 'images/2020/02/16/books/16edchoice1/16edchoice1-sfSpan.jpg', 'height': 263, 'width': 395, 'legacy': {}, 'subType': 'sfSpan', 'crop_name': 'sfSpan'}, {'rank': 0, 'subtype': 'largeHorizontal375', 'caption': None, 'credit': None, 'type': 'image', 'url': 'images/2020/02/16/books/16edchoice1/16edchoice1-largeHorizontal375.jpg', 'height': 250, 'width': 375, 'legacy': {}, 'subType': 'largeHorizontal375', 'crop_name': 'largeHorizontal375'}, {'rank': 0, 'subtype': 'largeHorizontalJumbo', 'caption': None, 'credit': None, 'type': 'image', 'url': 'images/2020/02/16/books/16edchoice1/16edchoice1-largeHorizontalJumbo.jpg', 'height': 683, 'width': 1024, 'legacy': {}, 'subType': 'largeHorizontalJumbo', 'crop_name': 'largeHorizontalJumbo'}, {'rank': 0, 'subtype': 'horizontalMediumAt2X', 'caption': None, 'credit': None, 'type': 'image', 'url': 'images/2020/02/16/books/16edchoice1/16edchoice1-horizontalMediumAt2X.jpg', 'height': 1212, 'width': 1818, 'legacy': {}, 'subType': 'horizontalMediumAt2X', 'crop_name': 'horizontalMediumAt2X'}, {'rank': 0, 'subtype': 'hpLarge', 'caption': None, 'credit': None, 'type': 'image', 'url': 'images/2020/02/16/books/16edchoice1/16edchoice1-hpLarge.jpg', 'height': 288, 'width': 511, 'legacy': {}, 'subType': 'hpLarge', 'crop_name': 'hpLarge'}, {'rank': 0, 'subtype': 'largeWidescreen573', 'caption': None, 'credit': None, 'type': 'image', 'url': 'images/2020/02/16/books/16edchoice1/16edchoice1-largeWidescreen573.jpg', 'height': 322, 'width': 573, 'legacy': {}, 'subType': 'largeWidescreen573', 'crop_name': 'largeWidescreen573'}, {'rank': 0, 'subtype': 'largeWidescreen1050', 'caption': None, 'credit': None, 'type': 'image', 'url': 'images/2020/02/16/books/16edchoice1/16edchoice1-largeWidescreen1050.jpg', 'height': 591, 'width': 1050, 'legacy': {}, 'subType': 'largeWidescreen1050', 'crop_name': 'largeWidescreen1050'}, {'rank': 0, 'subtype': 'wide', 'caption': None, 'credit': None, 'type': 'image', 'url': 'images/2020/02/16/books/16edchoice1/16edchoice1-thumbWide.jpg', 'height': 126, 'width': 190, 'legacy': {'widewidth': 190, 'wideheight': 126, 'wide': 'images/2020/02/16/books/16edchoice1/16edchoice1-thumbWide.jpg'}, 'subType': 'wide', 'crop_name': 'thumbWide'}, {'rank': 0, 'subtype': 'videoThumb', 'caption': None, 'credit': None, 'type': 'image', 'url': 'images/2020/02/16/books/16edchoice1/16edchoice1-videoThumb.jpg', 'height': 50, 'width': 75, 'legacy': {}, 'subType': 'videoThumb', 'crop_name': 'videoThumb'}, {'rank': 0, 'subtype': 'videoLarge', 'caption': None, 'credit': None, 'type': 'image', 'url': 'images/2020/02/16/books/16edchoice1/16edchoice1-videoLarge.jpg', 'height': 507, 'width': 768, 'legacy': {}, 'subType': 'videoLarge', 'crop_name': 'videoLarge'}, {'rank': 0, 'subtype': 'mediumThreeByTwo210', 'caption': None, 'credit': None, 'type': 'image', 'url': 'images/2020/02/16/books/16edchoice1/16edchoice1-mediumThreeByTwo210.jpg', 'height': 140, 'width': 210, 'legacy': {}, 'subType': 'mediumThreeByTwo210', 'crop_name': 'mediumThreeByTwo210'}, {'rank': 0, 'subtype': 'mediumThreeByTwo225', 'caption': None, 'credit': None, 'type': 'image', 'url': 'images/2020/02/16/books/16edchoice1/16edchoice1-mediumThreeByTwo225.jpg', 'height': 150, 'width': 225, 'legacy': {}, 'subType': 'mediumThreeByTwo225', 'crop_name': 'mediumThreeByTwo225'}, {'rank': 0, 'subtype': 'mediumThreeByTwo440', 'caption': None, 'credit': None, 'type': 'image', 'url': 'images/2020/02/16/books/16edchoice1/16edchoice1-mediumThreeByTwo440.jpg', 'height': 293, 'width': 440, 'legacy': {}, 'subType': 'mediumThreeByTwo440', 'crop_name': 'mediumThreeByTwo440'}, {'rank': 0, 'subtype': 'mediumThreeByTwo252', 'caption': None, 'credit': None, 'type': 'image', 'url': 'images/2020/02/16/books/16edchoice1/16edchoice1-mediumThreeByTwo252.jpg', 'height': 168, 'width': 252, 'legacy': {}, 'subType': 'mediumThreeByTwo252', 'crop_name': 'mediumThreeByTwo252'}, {'rank': 0, 'subtype': 'mediumThreeByTwo378', 'caption': None, 'credit': None, 'type': 'image', 'url': 'images/2020/02/16/books/16edchoice1/16edchoice1-mediumThreeByTwo378.jpg', 'height': 252, 'width': 378, 'legacy': {}, 'subType': 'mediumThreeByTwo378', 'crop_name': 'mediumThreeByTwo378'}, {'rank': 0, 'subtype': 'threeByTwoLargeAt2X', 'caption': None, 'credit': None, 'type': 'image', 'url': 'images/2020/02/16/books/16edchoice1/16edchoice1-threeByTwoLargeAt2X.jpg', 'height': 1210, 'width': 1814, 'legacy': {}, 'subType': 'threeByTwoLargeAt2X', 'crop_name': 'threeByTwoLargeAt2X'}, {'rank': 0, 'subtype': 'threeByTwoMediumAt2X', 'caption': None, 'credit': None, 'type': 'image', 'url': 'images/2020/02/16/books/16edchoice1/16edchoice1-threeByTwoMediumAt2X.jpg', 'height': 1001, 'width': 1500, 'legacy': {}, 'subType': 'threeByTwoMediumAt2X', 'crop_name': 'threeByTwoMediumAt2X'}, {'rank': 0, 'subtype': 'threeByTwoSmallAt2X', 'caption': None, 'credit': None, 'type': 'image', 'url': 'images/2020/02/16/books/16edchoice1/16edchoice1-threeByTwoSmallAt2X.jpg', 'height': 400, 'width': 600, 'legacy': {}, 'subType': 'threeByTwoSmallAt2X', 'crop_name': 'threeByTwoSmallAt2X'}, {'rank': 0, 'subtype': 'articleInline', 'caption': None, 'credit': None, 'type': 'image', 'url': 'images/2020/02/16/books/16edchoice1/16edchoice1-articleInline.jpg', 'height': 95, 'width': 190, 'legacy': {}, 'subType': 'articleInline', 'crop_name': 'articleInline'}, {'rank': 0, 'subtype': 'hpSmall', 'caption': None, 'credit': None, 'type': 'image', 'url': 'images/2020/02/16/books/16edchoice1/16edchoice1-hpSmall.jpg', 'height': 82, 'width': 163, 'legacy': {}, 'subType': 'hpSmall', 'crop_name': 'hpSmall'}, {'rank': 0, 'subtype': 'blogSmallInline', 'caption': None, 'credit': None, 'type': 'image', 'url': 'images/2020/02/16/books/16edchoice1/16edchoice1-blogSmallInline.jpg', 'height': 76, 'width': 151, 'legacy': {}, 'subType': 'blogSmallInline', 'crop_name': 'blogSmallInline'}, {'rank': 0, 'subtype': 'mediumFlexible177', 'caption': None, 'credit': None, 'type': 'image', 'url': 'images/2020/02/16/books/16edchoice1/16edchoice1-mediumFlexible177.jpg', 'height': 89, 'width': 177, 'legacy': {}, 'subType': 'mediumFlexible177', 'crop_name': 'mediumFlexible177'}, {'rank': 0, 'subtype': 'videoSmall', 'caption': None, 'credit': None, 'type': 'image', 'url': 'images/2020/02/16/books/16edchoice1/16edchoice1-videoSmall.jpg', 'height': 281, 'width': 500, 'legacy': {}, 'subType': 'videoSmall', 'crop_name': 'videoSmall'}, {'rank': 0, 'subtype': 'videoHpMedium', 'caption': None, 'credit': None, 'type': 'image', 'url': 'images/2020/02/16/books/16edchoice1/16edchoice1-videoHpMedium.jpg', 'height': 211, 'width': 375, 'legacy': {}, 'subType': 'videoHpMedium', 'crop_name': 'videoHpMedium'}, {'rank': 0, 'subtype': 'videoSixteenByNine600', 'caption': None, 'credit': None, 'type': 'image', 'url': 'images/2020/02/16/books/16edchoice1/16edchoice1-videoSixteenByNine600.jpg', 'height': 338, 'width': 600, 'legacy': {}, 'subType': 'videoSixteenByNine600', 'crop_name': 'videoSixteenByNine600'}, {'rank': 0, 'subtype': 'videoSixteenByNine540', 'caption': None, 'credit': None, 'type': 'image', 'url': 'images/2020/02/16/books/16edchoice1/16edchoice1-videoSixteenByNine540.jpg', 'height': 304, 'width': 540, 'legacy': {}, 'subType': 'videoSixteenByNine540', 'crop_name': 'videoSixteenByNine540'}, {'rank': 0, 'subtype': 'videoSixteenByNine495', 'caption': None, 'credit': None, 'type': 'image', 'url': 'images/2020/02/16/books/16edchoice1/16edchoice1-videoSixteenByNine495.jpg', 'height': 278, 'width': 495, 'legacy': {}, 'subType': 'videoSixteenByNine495', 'crop_name': 'videoSixteenByNine495'}, {'rank': 0, 'subtype': 'videoSixteenByNine390', 'caption': None, 'credit': None, 'type': 'image', 'url': 'images/2020/02/16/books/16edchoice1/16edchoice1-videoSixteenByNine390.jpg', 'height': 219, 'width': 390, 'legacy': {}, 'subType': 'videoSixteenByNine390', 'crop_name': 'videoSixteenByNine390'}, {'rank': 0, 'subtype': 'videoSixteenByNine1050', 'caption': None, 'credit': None, 'type': 'image', 'url': 'images/2020/02/16/books/16edchoice1/16edchoice1-videoSixteenByNine1050.jpg', 'height': 591, 'width': 1050, 'legacy': {}, 'subType': 'videoSixteenByNine1050', 'crop_name': 'videoSixteenByNine1050'}, {'rank': 0, 'subtype': 'videoSixteenByNine480', 'caption': None, 'credit': None, 'type': 'image', 'url': 'images/2020/02/16/books/16edchoice1/16edchoice1-videoSixteenByNine480.jpg', 'height': 270, 'width': 480, 'legacy': {}, 'subType': 'videoSixteenByNine480', 'crop_name': 'videoSixteenByNine480'}, {'rank': 0, 'subtype': 'videoSixteenByNine310', 'caption': None, 'credit': None, 'type': 'image', 'url': 'images/2020/02/16/books/16edchoice1/16edchoice1-videoSixteenByNine310.jpg', 'height': 174, 'width': 310, 'legacy': {}, 'subType': 'videoSixteenByNine310', 'crop_name': 'videoSixteenByNine310'}, {'rank': 0, 'subtype': 'videoSixteenByNine225', 'caption': None, 'credit': None, 'type': 'image', 'url': 'images/2020/02/16/books/16edchoice1/16edchoice1-videoSixteenByNine225.jpg', 'height': 126, 'width': 225, 'legacy': {}, 'subType': 'videoSixteenByNine225', 'crop_name': 'videoSixteenByNine225'}, {'rank': 0, 'subtype': 'videoSixteenByNine96', 'caption': None, 'credit': None, 'type': 'image', 'url': 'images/2020/02/16/books/16edchoice1/16edchoice1-videoSixteenByNine96.jpg', 'height': 54, 'width': 96, 'legacy': {}, 'subType': 'videoSixteenByNine96', 'crop_name': 'videoSixteenByNine96'}, {'rank': 0, 'subtype': 'videoSixteenByNine768', 'caption': None, 'credit': None, 'type': 'image', 'url': 'images/2020/02/16/books/16edchoice1/16edchoice1-videoSixteenByNine768.jpg', 'height': 432, 'width': 768, 'legacy': {}, 'subType': 'videoSixteenByNine768', 'crop_name': 'videoSixteenByNine768'}, {'rank': 0, 'subtype': 'videoSixteenByNine150', 'caption': None, 'credit': None, 'type': 'image', 'url': 'images/2020/02/16/books/16edchoice1/16edchoice1-videoSixteenByNine150.jpg', 'height': 84, 'width': 150, 'legacy': {}, 'subType': 'videoSixteenByNine150', 'crop_name': 'videoSixteenByNine150'}, {'rank': 0, 'subtype': 'videoSixteenByNineJumbo1600', 'caption': None, 'credit': None, 'type': 'image', 'url': 'images/2020/02/16/books/16edchoice1/16edchoice1-videoSixteenByNineJumbo1600.jpg', 'height': 900, 'width': 1600, 'legacy': {}, 'subType': 'videoSixteenByNineJumbo1600', 'crop_name': 'videoSixteenByNineJumbo1600'}, {'rank': 0, 'subtype': 'miniMoth', 'caption': None, 'credit': None, 'type': 'image', 'url': 'images/2020/02/16/books/16edchoice1/16edchoice1-miniMoth.jpg', 'height': 70, 'width': 151, 'legacy': {}, 'subType': 'miniMoth', 'crop_name': 'miniMoth'}, {'rank': 0, 'subtype': 'windowsTile336H', 'caption': None, 'credit': None, 'type': 'image', 'url': 'images/2020/02/16/books/16edchoice1/16edchoice1-windowsTile336H.jpg', 'height': 336, 'width': 694, 'legacy': {}, 'subType': 'windowsTile336H', 'crop_name': 'windowsTile336H'}, {'rank': 0, 'subtype': 'videoFifteenBySeven1305', 'caption': None, 'credit': None, 'type': 'image', 'url': 'images/2020/02/16/books/16edchoice1/16edchoice1-videoFifteenBySeven1305.jpg', 'height': 609, 'width': 1305, 'legacy': {}, 'subType': 'videoFifteenBySeven1305', 'crop_name': 'videoFifteenBySeven1305'}, {'rank': 0, 'subtype': 'facebookJumbo', 'caption': None, 'credit': None, 'type': 'image', 'url': 'images/2020/02/16/books/16edchoice1/16edchoice1-facebookJumbo.jpg', 'height': 550, 'width': 1050, 'legacy': {}, 'subType': 'facebookJumbo', 'crop_name': 'facebookJumbo'}, {'rank': 0, 'subtype': 'watch308', 'caption': None, 'credit': None, 'type': 'image', 'url': 'images/2020/02/16/books/16edchoice1/16edchoice1-watch308.jpg', 'height': 348, 'width': 312, 'legacy': {}, 'subType': 'watch308', 'crop_name': 'watch308'}, {'rank': 0, 'subtype': 'watch268', 'caption': None, 'credit': None, 'type': 'image', 'url': 'images/2020/02/16/books/16edchoice1/16edchoice1-watch268.jpg', 'height': 303, 'width': 272, 'legacy': {}, 'subType': 'watch268', 'crop_name': 'watch268'}, {'rank': 0, 'subtype': 'mobileMasterAt3x', 'caption': None, 'credit': None, 'type': 'image', 'url': 'images/2020/02/16/books/16edchoice1/16edchoice1-mobileMasterAt3x.jpg', 'height': 904, 'width': 1800, 'legacy': {}, 'subType': 'mobileMasterAt3x', 'crop_name': 'mobileMasterAt3x'}]","[{'name': 'subject', 'value': 'Books and Literature', 'rank': 1, 'major': 'N'}]",2020-02-13T17:19:35+0000,article,BookReview,Books,Book Review,List,nyt://article/641a92da-511f-50e1-88d8-7e512d84662b,1339,nyt://article/641a92da-511f-50e1-88d8-7e512d84662b,10 New Books We Recommend This Week,Editors’ Choice,,Staff Picks From the Book Review,,,,,[],,BR,23
