,abstract,web_url,snippet,lead_paragraph,source,multimedia,keywords,pub_date,document_type,news_desk,section_name,subsection_name,type_of_material,_id,word_count,uri,headline_main,headline_kicker,headline_content_kicker,headline_print_headline,headline_name,headline_seo,headline_sub,byline_original,byline_person,byline_organization,print_section,print_page
0,"As Iowans prepare to cast the first votes of the 2020 Democratic nomination process, they’re asking one question: Who can win?",https://www.nytimes.com/2020/02/03/podcasts/the-daily/iowa-caucus.html,"As Iowans prepare to cast the first votes of the 2020 Democratic nomination process, they’re asking one question: Who can win?",Listen and subscribe to our podcast from your mobile device:Via Apple Podcasts | Via Spotify | Via Stitcher,The New York Times,[],"[{'name': 'subject', 'value': 'Primaries and Caucuses', 'rank': 1, 'major': 'N'}, {'name': 'glocations', 'value': 'Iowa', 'rank': 2, 'major': 'N'}, {'name': 'subject', 'value': 'Presidential Election of 2020', 'rank': 3, 'major': 'N'}, {'name': 'organizations', 'value': 'Democratic Party', 'rank': 4, 'major': 'N'}, {'name': 'organizations', 'value': 'Democratic National Committee', 'rank': 5, 'major': 'N'}, {'name': 'persons', 'value': 'Biden, Joseph R Jr', 'rank': 6, 'major': 'N'}, {'name': 'persons', 'value': 'Buttigieg, Pete (1982- )', 'rank': 7, 'major': 'N'}, {'name': 'persons', 'value': 'Sanders, Bernard', 'rank': 8, 'major': 'N'}, {'name': 'persons', 'value': 'Warren, Elizabeth', 'rank': 9, 'major': 'N'}]",2020-02-03T11:00:08+0000,article,Podcasts,Podcasts,The Daily,News,nyt://article/43f35b49-5dfa-5137-88bc-cbee72c4d338,317,nyt://article/43f35b49-5dfa-5137-88bc-cbee72c4d338,The Field: Iowa’s Electability Complex,,,,,,,,[],,,
1,Presidential politics move fast. What we're watching heading into a new week on the 2020 campaign:,https://www.nytimes.com/aponline/2020/02/03/us/politics/ap-us-election-2020-watch.html,Presidential politics move fast. What we're watching heading into a new week on the 2020 campaign:,"DES MOINES, Iowa — Presidential politics move fast. What we're watching heading into a new week on the 2020 campaign:",AP,[],[],2020-02-03T10:54:27+0000,article,None,U.S.,Politics,News,nyt://article/5badff7a-8aca-5415-8695-dacce687c7d5,980,nyt://article/5badff7a-8aca-5415-8695-dacce687c7d5,2020 Watch: Now It's Time for Real Votes to Shape Field,,,2020 Watch: Now It's Time for Real Votes to Shape Field,,,,By The Associated Press,[],The Associated Press,,
