,abstract,web_url,snippet,lead_paragraph,source,multimedia,keywords,pub_date,document_type,news_desk,section_name,subsection_name,type_of_material,_id,word_count,uri,headline_main,headline_kicker,headline_content_kicker,headline_print_headline,headline_name,headline_seo,headline_sub,byline_original,byline_person,byline_organization,print_section,print_page
0,"The Senate approved a bipartisan measure Thursday aimed at limiting President Donald Trump's authority to launch military operations against Iran, with eight Republicans joining Democrats in a post-impeachment bid to constrain the White House. ",https://www.nytimes.com/aponline/2020/02/13/us/politics/ap-us-trump-war-powers-congress.html,"The Senate approved a bipartisan measure Thursday aimed at limiting President Donald Trump's authority to launch military operations against Iran, with eight Republicans joining Democrats in a post-impeachment bid to constrain the White House. ","WASHINGTON — The Senate approved a bipartisan measure Thursday aimed at limiting President Donald Trump's authority to launch military operations against Iran, with eight Republicans joining Democrats in a post-impeachment bid to constrain the White House. ",AP,[],[],2020-02-13T05:11:13+0000,article,None,U.S.,Politics,News,nyt://article/44976285-0dda-59dc-af94-ff59a70ecc2f,891,nyt://article/44976285-0dda-59dc-af94-ff59a70ecc2f,Senate Moves to Limit Trump on Military Force Against Iran,,,Senate Moves to Limit Trump on Military Force Against Iran,,,,By The Associated Press,[],The Associated Press,,
1,One of President Donald Trump's nominees for the Federal Reserve will likely face skeptical questioning from a Senate committee Thursday over her unconventional economic views.,https://www.nytimes.com/aponline/2020/02/13/business/ap-us-federal-reserve-shelton.html,One of President Donald Trump's nominees for the Federal Reserve will likely face skeptical questioning from a Senate committee Thursday over her unconventional economic views.,WASHINGTON — One of President Donald Trump's nominees for the Federal Reserve will likely face skeptical questioning from a Senate committee Thursday over her unconventional economic views.,AP,[],[],2020-02-13T05:02:13+0000,article,None,Business Day,,News,nyt://article/663a5a98-4fcd-5f7f-bb33-f1f6af5b7a1a,863,nyt://article/663a5a98-4fcd-5f7f-bb33-f1f6af5b7a1a,A Trump Fed Choice Faces Senate Scrutiny Over Policy Views,,,A Trump Fed Choice Faces Senate Scrutiny Over Policy Views,,,,By The Associated Press,[],The Associated Press,,
2,"An ally of President Nicolás Maduro said Wednesday that officials have detained a close relative of opposition leader Juan Guaidó, accusing the uncle of trying to smuggle “dangerous materials” into Venezuela. ",https://www.nytimes.com/aponline/2020/02/12/world/americas/ap-lt-venezuela-guaid.html,"An ally of President Nicolás Maduro said Wednesday that officials have detained a close relative of opposition leader Juan Guaidó, accusing the uncle of trying to smuggle “dangerous materials” into Venezuela. ","CARACAS, Venezuela — An ally of President Nicolás Maduro said Wednesday that officials have detained a close relative of opposition leader Juan Guaidó, accusing the uncle of trying to smuggle “dangerous materials” into Venezuela. ",AP,[],[],2020-02-13T03:26:28+0000,article,None,World,Americas,News,nyt://article/33325318-4339-54e2-8b6f-b917011a7b24,309,nyt://article/33325318-4339-54e2-8b6f-b917011a7b24,Venezuelan Officials Arrest Opposition Leader's Uncle,,,Venezuelan Officials Arrest Opposition Leader's Uncle,,,,By The Associated Press,[],The Associated Press,,
