,abstract,web_url,snippet,lead_paragraph,source,multimedia,keywords,pub_date,document_type,news_desk,section_name,subsection_name,type_of_material,_id,word_count,uri,headline_main,headline_kicker,headline_content_kicker,headline_print_headline,headline_name,headline_seo,headline_sub,byline_original,byline_person,byline_organization,print_section,print_page
0,U.S. President Donald Trump said on Tuesday that Israeli Prime Minister Benjamin Netanyahu told him the Trump administration's proposed plan for Middle East peace would be a basis for direct negotiations.,https://www.nytimes.com/reuters/2020/01/28/world/middleeast/28reuters-israel-palestinians-plan-trump.html,U.S. President Donald Trump said on Tuesday that Israeli Prime Minister Benjamin Netanyahu told him the Trump administration's proposed plan for Middle East peace would be a basis for direct negotiations.,WASHINGTON — U.S. President Donald Trump said on Tuesday that Israeli Prime Minister Benjamin Netanyahu told him the Trump administration's proposed plan for Middle East peace would be a basis for direct negotiations.,Reuters,[],[],2020-01-28T18:49:36+0000,article,None,World,Middle East,News,nyt://article/28cb2c50-bed2-5187-9183-a6e6a249dc17,102,nyt://article/28cb2c50-bed2-5187-9183-a6e6a249dc17,Netanyahu Says Peace Plan Would Be Base for Negotiations: Trump,,,Netanyahu Says Peace Plan Would Be Base for Negotiations: Trump,,,,By Reuters,[],Reuters,,
1,Lawyers defending U.S. President Donald Trump in his Senate impeachment trial wrap up their presentation on Tuesday.,https://www.nytimes.com/reuters/2020/01/28/world/europe/28reuters-usa-trump-impeachment-whatnext-factbox.html,Lawyers defending U.S. President Donald Trump in his Senate impeachment trial wrap up their presentation on Tuesday.,(Reuters) - Lawyers defending U.S. President Donald Trump in his Senate impeachment trial wrap up their presentation on Tuesday.,Reuters,[],[],2020-01-28T18:46:20+0000,article,None,World,Europe,News,nyt://article/d6322563-9181-50dd-bbcc-5a5e4512bd03,332,nyt://article/d6322563-9181-50dd-bbcc-5a5e4512bd03,Trump Impeachment: What Happens Next?,,,Trump Impeachment: What Happens Next?,,,,By Reuters,[],Reuters,,
2,"A group of Iranian lawmakers on Tuesday asked parliament to debate a motion for Iran to quit a treaty governing global nuclear arms control, a move apparently aimed at pressuring European powers to salvage Tehran's own 2015 nuclear deal.",https://www.nytimes.com/reuters/2020/01/28/world/middleeast/28reuters-iran-nuclear-npt.html,"A group of Iranian lawmakers on Tuesday asked parliament to debate a motion for Iran to quit a treaty governing global nuclear arms control, a move apparently aimed at pressuring European powers to salvage Tehran's own 2015 nuclear deal.","DUBAI — A group of Iranian lawmakers on Tuesday asked parliament to debate a motion for Iran to quit a treaty governing global nuclear arms control, a move apparently aimed at pressuring European powers to salvage Tehran's own 2015 nuclear deal.",Reuters,[],[],2020-01-28T18:46:12+0000,article,None,World,Middle East,News,nyt://article/5c6df6a9-28c3-5e6e-9eaa-4c6b35da6575,386,nyt://article/5c6df6a9-28c3-5e6e-9eaa-4c6b35da6575,Iran Lawmakers Call for Debate on Quitting Nuclear Arms Treaty,,,Iran Lawmakers Call for Debate on Quitting Nuclear Arms Treaty,,,,By Reuters,[],Reuters,,
3,"U.S. Senate Democratic leader Chuck Schumer on Tuesday rejected a proposal from a couple of Republican senators that lawmakers view a book manuscript produced by a former adviser to President Donald Trump in a classified setting, saying nothing can substitute for sworn testimony.",https://www.nytimes.com/reuters/2020/01/28/world/europe/28reuters-usa-trump-impeachment-manuscript.html,"U.S. Senate Democratic leader Chuck Schumer on Tuesday rejected a proposal from a couple of Republican senators that lawmakers view a book manuscript produced by a former adviser to President Donald Trump in a classified setting, saying nothing ca...","WASHINGTON — U.S. Senate Democratic leader Chuck Schumer on Tuesday rejected a proposal from a couple of Republican senators that lawmakers view a book manuscript produced by a former adviser to President Donald Trump in a classified setting, saying nothing can substitute for sworn testimony.",Reuters,[],[],2020-01-28T18:43:09+0000,article,None,World,Europe,News,nyt://article/c9dccbd2-3395-58af-a0d9-66f8ee0f96cd,95,nyt://article/c9dccbd2-3395-58af-a0d9-66f8ee0f96cd,Democrat Schumer Calls Proposal to Peruse Bolton Manuscript in Private 'Absurd',,,Democrat Schumer Calls Proposal to Peruse Bolton Manuscript in Private 'Absurd',,,,By Reuters,[],Reuters,,
4,Republican U.S. Senator Lindsey Graham on Tuesday said he would support a plan making former national security adviser John Bolton's book manuscript available for senators to review as they weigh President Donald Trump's impeachment.,https://www.nytimes.com/reuters/2020/01/28/world/europe/28reuters-usa-trump-impeachment-transcript.html,Republican U.S. Senator Lindsey Graham on Tuesday said he would support a plan making former national security adviser John Bolton's book manuscript available for senators to review as they weigh President Donald Trump's impeachment.,WASHINGTON — Republican U.S. Senator Lindsey Graham on Tuesday said he would support a plan making former national security adviser John Bolton's book manuscript available for senators to review as they weigh President Donald Trump's impeachment.,Reuters,[],[],2020-01-28T18:40:12+0000,article,None,World,Europe,News,nyt://article/06ee93bd-0436-56bd-87e7-15365f20bb13,97,nyt://article/06ee93bd-0436-56bd-87e7-15365f20bb13,Sen. Graham Backs Plan to Make Bolton Manuscript Available to Senators,,,Sen. Graham Backs Plan to Make Bolton Manuscript Available to Senators,,,,By Reuters,[],Reuters,,
5,"When U.S. presidential candidate Joe Biden went to an Iowa university to campaign this week, one thing was in short supply: students who support him.",https://www.nytimes.com/reuters/2020/01/28/us/28reuters-usa-election-biden.html,"When U.S. presidential candidate Joe Biden went to an Iowa university to campaign this week, one thing was in short supply: students who support him.","CEDAR FALLS, Iowa — When U.S. presidential candidate Joe Biden went to an Iowa university to campaign this week, one thing was in short supply: students who support him.",Reuters,[],[],2020-01-28T18:37:14+0000,article,None,U.S.,,News,nyt://article/55ae76dd-eb88-595a-ad47-bc7524b68b0b,518,nyt://article/55ae76dd-eb88-595a-ad47-bc7524b68b0b,Biden's Final Iowa Drive Sweeps Through Rival Territory,,,Biden's Final Iowa Drive Sweeps Through Rival Territory,,,,By Reuters,[],Reuters,,
