,abstract,web_url,snippet,lead_paragraph,source,multimedia,keywords,pub_date,document_type,news_desk,section_name,type_of_material,_id,word_count,uri,headline_main,headline_kicker,headline_content_kicker,headline_print_headline,headline_name,headline_seo,headline_sub,byline_original,byline_person,byline_organization,subsection_name,print_section,print_page
0,"Votersseeking to take back a U.S. Senate seat in closely divided North Carolina must choose whether liberal populism or centrist pragmatism is best suited to unseat Republican incumbent Thom Tillis, a devotee of President Donald Trump. ",https://www.nytimes.com/aponline/2020/02/22/us/ap-us-election-2020-senate-north-carolina.html,"Votersseeking to take back a U.S. Senate seat in closely divided North Carolina must choose whether liberal populism or centrist pragmatism is best suited to unseat Republican incumbent Thom Tillis, a devotee of President Donald Trump. ","DURHAM, N.C. — Votersseeking to take back a U.S. Senate seat in closely divided North Carolina must choose whether liberal populism or centrist pragmatism is best suited to unseat Republican incumbent Thom Tillis, a devotee of President Donald Trump. ",AP,[],[],2020-02-22T14:20:15+0000,article,None,U.S.,News,nyt://article/fbdf42f4-1bdd-555f-b66b-351266b90b5d,886,nyt://article/fbdf42f4-1bdd-555f-b66b-351266b90b5d,Populism vs. Pragmatism Underpins N Carolina Senate Primary,,,Populism vs. Pragmatism Underpins N Carolina Senate Primary,,,,By The Associated Press,[],The Associated Press,,,
1,"In their boisterous presidential debate, several Democrats sold short the health care plans of rivals or glossed over aspects of their own record. In an audacious league of his own, President Donald Trump celebrated the elimination of a tax that still exists and went deep and wide in distorting what he's done in office.",https://www.nytimes.com/aponline/2020/02/22/us/politics/ap-us-fact-check-week.html,"In their boisterous presidential debate, several Democrats sold short the health care plans of rivals or glossed over aspects of their own record. In an audacious league of his own, President Donald Trump celebrated the elimination of a tax that s...","WASHINGTON — In their boisterous presidential debate, several Democrats sold short the health care plans of rivals or glossed over aspects of their own record. In an audacious league of his own, President Donald Trump celebrated the elimination of a tax that still exists and went deep and wide in distorting what he's done in office.",AP,[],[],2020-02-22T13:35:21+0000,article,None,U.S.,News,nyt://article/803e57be-c458-5a6c-abe7-e0c3f0f26022,2102,nyt://article/803e57be-c458-5a6c-abe7-e0c3f0f26022,AP FACT CHECK: Donald Trump and the Audacity of Hype,,,AP FACT CHECK: Donald Trump and the Audacity of Hype,,,,By The Associated Press,[],The Associated Press,Politics,,
2,"Bernie Sanders solidified his front-runner status with what appeared to be a decisive victory in the Democratic presidential caucuses in Nevada on Saturday, while Joe Biden was on track for a second-place finish that would give his struggling campaign new hope.",https://www.nytimes.com/reuters/2020/02/22/us/politics/22reuters-usa-election.html,"Bernie Sanders solidified his front-runner status with what appeared to be a decisive victory in the Democratic presidential caucuses in Nevada on Saturday, while Joe Biden was on track for a second-place finish that would give his struggling camp...","LAS VEGAS — Bernie Sanders solidified his front-runner status with what appeared to be a decisive victory in the Democratic presidential caucuses in Nevada on Saturday, while Joe Biden was on track for a second-place finish that would give his struggling campaign new hope.",Reuters,[],[],2020-02-22T11:32:12+0000,article,None,U.S.,News,nyt://article/862e525a-5c17-54f4-814f-28db2f009ad4,990,nyt://article/862e525a-5c17-54f4-814f-28db2f009ad4,"Sanders Projected for Decisive Win in Nevada, Biden on Track for Second Place",,,"Sanders Projected for Decisive Win in Nevada, Biden on Track for Second Place",,,,By Reuters,[],Reuters,Politics,,
3,"Nevada Democrats will host hundreds of caucuses on Saturday, the third contest in the state-by-state presidential nominating process, almost three weeks after the Iowa caucuses caused mayhem when a technical meltdown delayed results. ",https://www.nytimes.com/reuters/2020/02/22/us/politics/22reuters-usa-election-nevada-explainer.html,"Nevada Democrats will host hundreds of caucuses on Saturday, the third contest in the state-by-state presidential nominating process, almost three weeks after the Iowa caucuses caused mayhem when a technical meltdown delayed results. ","WASHINGTON — Nevada Democrats will host hundreds of caucuses on Saturday, the third contest in the state-by-state presidential nominating process, almost three weeks after the Iowa caucuses caused mayhem when a technical meltdown delayed results. ",Reuters,[],[],2020-02-22T11:23:11+0000,article,None,U.S.,News,nyt://article/99ea1165-b785-52e8-8631-44749be331d1,871,nyt://article/99ea1165-b785-52e8-8631-44749be331d1,Nevada Caucuses Present New Test to Democrats After Chaotic Iowa Contest,,,Nevada Caucuses Present New Test to Democrats After Chaotic Iowa Contest,,,,By Reuters,[],Reuters,Politics,,
4,"Iranian state TV on Saturday announced the first partial results from the country’s parliamentary elections, indicating a strong showing by hard-liners in the capital Tehran, although authorities have not released full results or the all-important turnout figure.",https://www.nytimes.com/aponline/2020/02/22/world/middleeast/ap-ml-iran-elections.html,"Iranian state TV on Saturday announced the first partial results from the country’s parliamentary elections, indicating a strong showing by hard-liners in the capital Tehran, although authorities have not released full results or the all-important...","TEHRAN, Iran — Iranian state TV on Saturday announced the first partial results from the country’s parliamentary elections, indicating a strong showing by hard-liners in the capital Tehran, although authorities have not released full results or the all-important turnout figure.",AP,[],[],2020-02-22T11:14:14+0000,article,None,World,News,nyt://article/cb07005a-6a71-5479-90b5-1b4899424303,491,nyt://article/cb07005a-6a71-5479-90b5-1b4899424303,Iran's Hard-Liners Take Early Lead in Tehran After Vote,,,Iran's Hard-Liners Take Early Lead in Tehran After Vote,,,,By The Associated Press,[],The Associated Press,Middle East,,
