,abstract,web_url,snippet,lead_paragraph,source,multimedia,keywords,pub_date,document_type,news_desk,section_name,subsection_name,type_of_material,_id,word_count,uri,headline_main,headline_kicker,headline_content_kicker,headline_print_headline,headline_name,headline_seo,headline_sub,byline_original,byline_person,byline_organization,print_section,print_page
0,"Nevada caucus officials and voters at multiple sites on Saturday reported voting rules confusion, calculation glitches and delays in reporting tallies - despite efforts to avoid the issues that plagued Iowa's caucuses earlier this month.",https://www.nytimes.com/reuters/2020/02/22/us/politics/22reuters-usa-election-nevada-delays.html,"Nevada caucus officials and voters at multiple sites on Saturday reported voting rules confusion, calculation glitches and delays in reporting tallies - despite efforts to avoid the issues that plagued Iowa's caucuses earlier this month.","LAS VEGAS — Nevada caucus officials and voters at multiple sites on Saturday reported voting rules confusion, calculation glitches and delays in reporting tallies - despite efforts to avoid the issues that plagued Iowa's caucuses earlier this month.",Reuters,[],[],2020-02-23T02:08:12+0000,article,None,U.S.,Politics,News,nyt://article/bff2544a-5284-5ceb-9c20-ef41d9468f59,569,nyt://article/bff2544a-5284-5ceb-9c20-ef41d9468f59,"Slow Results, Confusion and Complaints at Nevada Caucus Sites",,,"Slow Results, Confusion and Complaints at Nevada Caucus Sites",,,,By Reuters,[],Reuters,,
1,"Sen. Bernie Sanders cruised to victory in the Nevada caucuses, heartening his supporters and stoking alarm among moderates who fear he is too liberal and would lose to President Donald Trump. ",https://www.nytimes.com/aponline/2020/02/22/us/politics/ap-us-election-2020-takeaways.html,"Sen. Bernie Sanders cruised to victory in the Nevada caucuses, heartening his supporters and stoking alarm among moderates who fear he is too liberal and would lose to President Donald Trump. ","LAS VEGAS — Sen. Bernie Sanders cruised to victory in the Nevada caucuses, heartening his supporters and stoking alarm among moderates who fear he is too liberal and would lose to President Donald Trump. ",AP,[],[],2020-02-23T01:56:16+0000,article,None,U.S.,Politics,News,nyt://article/812b47cf-ca43-59f0-ae01-981848068e5a,1047,nyt://article/812b47cf-ca43-59f0-ae01-981848068e5a,Sanders on Top: Key Takeaways From the Nevada Caucuses,,,Sanders on Top: Key Takeaways From the Nevada Caucuses,,,,By The Associated Press,[],The Associated Press,,
