,abstract,web_url,snippet,lead_paragraph,source,multimedia,keywords,pub_date,document_type,news_desk,section_name,subsection_name,type_of_material,_id,word_count,uri,headline_main,headline_kicker,headline_content_kicker,headline_print_headline,headline_name,headline_seo,headline_sub,byline_original,byline_person,byline_organization,print_section,print_page
0,Democratic presidential candidate Pete Buttigieg encountered tough questions and some skepticism about how he'd help end racial disparities in policing as he worked to reach out to Nevada's communities of color Saturday.,https://www.nytimes.com/aponline/2019/12/21/us/politics/ap-election-2020-buttigieg.html,Democratic presidential candidate Pete Buttigieg encountered tough questions and some skepticism about how he'd help end racial disparities in policing as he worked to reach out to Nevada's communities of color Saturday.,"LAS VEGAS — Democratic presidential candidate Pete Buttigieg tackled issues of racial disparity as he met with Nevada's communities of color Saturday, though the small-town Indiana mayor encountered tough questions and skepticism from some voters. ",AP,[],[],2019-12-21T15:27:37+0000,article,None,U.S.,Politics,News,nyt://article/60a486c9-894c-5d19-8f39-8c062d847849,918,nyt://article/60a486c9-894c-5d19-8f39-8c062d847849,Buttigieg Playing Catchup in Reaching Nevada Voters of Color,,,Buttigieg Playing Catchup in Reaching Nevada Voters of Color,,,,By The Associated Press,[],The Associated Press,,
1,"On a Saturday evening in June 2018, with temperatures in the 70s and the Red Sox playing at Fenway Park, supporters of Massachusetts Sen. Elizabeth Warren gathered at the City Winery Boston for a fundraiser.",https://www.nytimes.com/aponline/2019/12/21/us/politics/ap-us-election-2020-warren-wine.html,"On a Saturday evening in June 2018, with temperatures in the 70s and the Red Sox playing at Fenway Park, supporters of Massachusetts Sen. Elizabeth Warren gathered at the City Winery Boston for a fundraiser.","WASHINGTON — On a Saturday evening in June 2018, with temperatures in the 70s and the Red Sox playing at Fenway Park, supporters of Massachusetts Sen. Elizabeth Warren gathered at the City Winery Boston for a fundraiser.",AP,[],[],2019-12-21T14:27:27+0000,article,None,U.S.,Politics,News,nyt://article/12916e3a-16a6-58ab-9be5-a7d9ff3c727a,1331,nyt://article/12916e3a-16a6-58ab-9be5-a7d9ff3c727a,Warren's Souvenir Wine Bottle Pops Up in Big-Donor Debate,,,Warren's Souvenir Wine Bottle Pops Up in Big-Donor Debate,,,,By The Associated Press,[],The Associated Press,,
