,abstract,web_url,snippet,lead_paragraph,source,multimedia,keywords,pub_date,document_type,news_desk,section_name,subsection_name,type_of_material,_id,word_count,uri,headline_main,headline_kicker,headline_content_kicker,headline_print_headline,headline_name,headline_seo,headline_sub,byline_original,byline_person,byline_organization,print_section,print_page
0,"U.S. prosecutors said in court on Tuesday that Lev Parnas, an associate of U.S. President Donald Trump's personal lawyer Rudy Giuliani, received a $1 million payment from a lawyer for Ukrainian oligarch Dmytro Firtash.",https://www.nytimes.com/reuters/2019/12/17/us/politics/17reuters-usa-trump-giuliani-parnas-oligarch.html,"U.S. prosecutors said in court on Tuesday that Lev Parnas, an associate of U.S. President Donald Trump's personal lawyer Rudy Giuliani, received a $1 million payment from a lawyer for Ukrainian oligarch Dmytro Firtash.","NEW YORK — U.S. prosecutors said in court on Tuesday that Lev Parnas, an associate of U.S. President Donald Trump's personal lawyer Rudy Giuliani, received a $1 million payment from a lawyer for Ukrainian oligarch Dmytro Firtash.",Reuters,[],[],2019-12-17T18:15:57+0000,article,None,U.S.,Politics,News,nyt://article/f13847b6-6686-5efb-bb69-5dd56f009efb,535,nyt://article/f13847b6-6686-5efb-bb69-5dd56f009efb,Giuliani Associate Paid $1 Million by Indicted Ukrainian Oligarch's Lawyer: Prosecutor,,,Giuliani Associate Paid $1 Million by Indicted Ukrainian Oligarch's Lawyer: Prosecutor,,,,By Reuters,[],Reuters,,
1,"The Democrats' next primary debate will proceed as scheduled this week, the Democratic National Committee announced Tuesday, after the party stepped in to help arrange a settlement to a labor dispute that had threatened the forum.",https://www.nytimes.com/aponline/2019/12/17/us/politics/ap-us-election-2020-democratic-debate-labor-dispute.html,"The Democrats' next primary debate will proceed as scheduled this week, the Democratic National Committee announced Tuesday, after the party stepped in to help arrange a settlement to a labor dispute that had threatened the forum.","WASHINGTON — The Democrats' next primary debate will proceed as scheduled this week, the Democratic National Committee announced Tuesday, after the party stepped in to help arrange a settlement to a labor dispute that had threatened the forum.",AP,[],[],2019-12-17T14:57:32+0000,article,None,U.S.,Politics,News,nyt://article/220ddd22-da73-54d7-a7c2-fd796350a3f1,244,nyt://article/220ddd22-da73-54d7-a7c2-fd796350a3f1,Democratic Debate to Proceed After Labor Agreement Reached,,,Democratic Debate to Proceed After Labor Agreement Reached,,,,By The Associated Press,[],The Associated Press,,
2,"Rudy Giuliani, the president's personal attorney, is now openly admitting that he pushed President Donald Trump to dismiss the former ambassador to Ukraine — a key factor in the Democrats' impeachment case against his boss.",https://www.nytimes.com/aponline/2019/12/17/us/politics/ap-us-trump-impeachment-giuliani.html,"Rudy Giuliani, the president's personal attorney, is now openly admitting that he pushed President Donald Trump to dismiss the former ambassador to Ukraine — a key factor in the Democrats' impeachment case against his boss.","WASHINGTON — Rudy Giuliani, the president's personal attorney, is now openly admitting that he pushed President Donald Trump to dismiss the former ambassador to Ukraine — a key factor in the Democrats' impeachment case against his boss.",AP,[],[],2019-12-17T13:06:28+0000,article,None,U.S.,Politics,News,nyt://article/68c8dc07-614c-528e-8916-acd01506df9f,907,nyt://article/68c8dc07-614c-528e-8916-acd01506df9f,Giuliani Brags About Forcing Out Trump's Ukraine Ambassador,,,Giuliani Brags About Forcing Out Trump's Ukraine Ambassador,,,,By The Associated Press,[],The Associated Press,,
3,U.S. President Donald Trump is expected to be impeached on Wednesday when the Democratic-led House of Representatives votes on charges stemming from his effort to pressure Ukraine to investigate political rival Joe Biden.,https://www.nytimes.com/reuters/2019/12/17/world/europe/17reuters-usa-trump-impeachment-trials-explainer.html,U.S. President Donald Trump is expected to be impeached on Wednesday when the Democratic-led House of Representatives votes on charges stemming from his effort to pressure Ukraine to investigate political rival Joe Biden.,(Reuters) - U.S. President Donald Trump is expected to be impeached on Wednesday when the Democratic-led House of Representatives votes on charges stemming from his effort to pressure Ukraine to investigate political rival Joe Biden.,Reuters,[],[],2019-12-17T11:06:49+0000,article,None,World,Europe,News,nyt://article/fb5ad25d-e684-5a0f-b0e5-9a91765216bc,655,nyt://article/fb5ad25d-e684-5a0f-b0e5-9a91765216bc,Explainer: How Trump's Impeachment Trial Would Differ From a Criminal One,,,Explainer: How Trump's Impeachment Trial Would Differ From a Criminal One,,,,By Reuters,[],Reuters,,
4,"Former Ohio Gov. Ted Strickland has endorsed Joe Biden for president, promising important support from the state's industrial working class regions while highlighting some of the former vice president's potential challenges in the state.",https://www.nytimes.com/aponline/2019/12/17/us/politics/ap-us-election-2020-biden-ohio.html,"Former Ohio Gov. Ted Strickland has endorsed Joe Biden for president, promising important support from the state's industrial working class regions while highlighting some of the former vice president's potential challenges in the state.","COLUMBUS, Ohio — Former Ohio Gov. Ted Strickland has endorsed Joe Biden for president, promising important support from the state's industrial working class regions while highlighting some of the former vice president's potential challenges in the state.",AP,[],[],2019-12-17T11:06:30+0000,article,None,U.S.,Politics,News,nyt://article/a43d482a-dada-500d-ad79-21c7199fa6dd,432,nyt://article/a43d482a-dada-500d-ad79-21c7199fa6dd,Former Ohio Gov. Ted Strickland Endorses Biden for President,,,Former Ohio Gov. Ted Strickland Endorses Biden for President,,,,By The Associated Press,[],The Associated Press,,
5,"An associate of U.S. President Donald Trump's personal lawyer Rudy Giuliani is expected to appear in court on Tuesday, as federal prosecutors seek to have him jailed for allegedly concealing a $1 million payment they said he received from Russia before his arrest.",https://www.nytimes.com/reuters/2019/12/17/us/politics/17reuters-usa-trump-giuliani-parnas.html,"An associate of U.S. President Donald Trump's personal lawyer Rudy Giuliani is expected to appear in court on Tuesday, as federal prosecutors seek to have him jailed for allegedly concealing a $1 million payment they said he received from Russia b...","NEW YORK — An associate of U.S. President Donald Trump's personal lawyer Rudy Giuliani is expected to appear in court on Tuesday, as federal prosecutors seek to have him jailed for allegedly concealing a $1 million payment they said he received from Russia before his arrest.",Reuters,[],[],2019-12-17T11:03:42+0000,article,None,U.S.,Politics,News,nyt://article/f258baf9-1667-55a1-a098-dc1e9b637c84,351,nyt://article/f258baf9-1667-55a1-a098-dc1e9b637c84,Giuliani Associate Due in Court as Prosecutors Seek to Revoke Bail,,,Giuliani Associate Due in Court as Prosecutors Seek to Revoke Bail,,,,By Reuters,[],Reuters,,
6,"On the eve of his expected impeachment in the U.S. House of Representatives, President Donald Trump accused Democrats of pursuing an ""illegal, partisan attempted coup"" and declaring war on American democracy as they seek to remove him from office for pressing Ukraine to investigate political rival Joe Biden.",https://www.nytimes.com/reuters/2019/12/17/us/politics/17reuters-usa-trump-impeachment.html,"On the eve of his expected impeachment in the U.S. House of Representatives, President Donald Trump accused Democrats of pursuing an ""illegal, partisan attempted coup"" and declaring war on American democracy as they seek to remove him from office ...","WASHINGTON — On the eve of his expected impeachment in the U.S. House of Representatives, President Donald Trump accused Democrats of pursuing an ""illegal, partisan attempted coup"" and declaring war on American democracy as they seek to remove him from office for pressing Ukraine to investigate political rival Joe Biden.",Reuters,[],[],2019-12-17T11:03:41+0000,article,None,U.S.,Politics,News,nyt://article/bb996712-b12d-5b0f-a0dd-808b72fa0e1d,841,nyt://article/bb996712-b12d-5b0f-a0dd-808b72fa0e1d,"On Eve of Expected Impeachment, Trump Lashes Out at Pelosi, Democrats",,,"On Eve of Expected Impeachment, Trump Lashes Out at Pelosi, Democrats",,,,By Reuters,[],Reuters,,
7,"On the eve of almost-certain impeachment, President Donald Trump fired off a furious letter Tuesday to House Speaker Nancy Pelosi denouncing the ""vicious crusade” against him, while Democrats amassed the votes they needed and Republicans looked ahead, vowing to defend Trump at next month's Senate trial.",https://www.nytimes.com/aponline/2019/12/17/us/politics/ap-us-trump-impeachment.html,"On the eve of almost-certain impeachment, President Donald Trump fired off a furious letter Tuesday to House Speaker Nancy Pelosi denouncing the ""vicious crusade” against him, while Democrats amassed the votes they needed and Republicans looked ah...","WASHINGTON — On the eve of almost-certain impeachment, President Donald Trump fired off a furious letter Tuesday to House Speaker Nancy Pelosi denouncing the ""vicious crusade” against him, while Democrats amassed the votes they needed and Republicans looked ahead, vowing to defend Trump at next month's Senate trial.",AP,[],[],2019-12-17T05:21:31+0000,article,None,U.S.,Politics,News,nyt://article/64bf05a3-5198-5179-90f7-b1134ced96fa,1255,nyt://article/64bf05a3-5198-5179-90f7-b1134ced96fa,House Nears Impeachment as Trump Decries 'Vicious Crusade',,,House Nears Impeachment as Trump Decries 'Vicious Crusade',,,,By The Associated Press,[],The Associated Press,,
