,abstract,web_url,snippet,lead_paragraph,source,multimedia,keywords,pub_date,document_type,news_desk,section_name,subsection_name,type_of_material,_id,word_count,uri,headline_main,headline_kicker,headline_content_kicker,headline_print_headline,headline_name,headline_seo,headline_sub,byline_original,byline_person,byline_organization,print_section,print_page
0,"Democratic presidential candidates pledged to boost funding for public schools, increase teacher salaries and reduce college debt at a Saturday forum that cast a rare spotlight on education, an issue that has received only passing attention in recent debates.",https://www.nytimes.com/aponline/2019/12/14/us/politics/ap-us-election-2020-democrats.html,"Democratic presidential candidates pledged to boost funding for public schools, increase teacher salaries and reduce college debt at a Saturday forum that cast a rare spotlight on education, an issue that has received only passing attention in rec...","PITTSBURGH — Democratic presidential candidates pledged to boost funding for public schools, increase teacher salaries and reduce college debt at a Saturday forum that cast a rare spotlight on education, an issue that has received only passing attention in recent debates.",AP,[],[],2019-12-14T22:15:28+0000,article,None,U.S.,Politics,News,nyt://article/2b3936b7-822d-5109-8acd-e189f9f94a77,870,nyt://article/2b3936b7-822d-5109-8acd-e189f9f94a77,"Democratic Hopefuls Pledge More Money for Schools, Teachers",,,"Democratic Hopefuls Pledge More Money for Schools, Teachers",,,,By The Associated Press,[],The Associated Press,,
1,"A House freshman from New Jersey who was planning to break with his party and vote against impeaching President Donald Trump will become a Republican, a GOP official said Saturday.",https://www.nytimes.com/aponline/2019/12/14/us/politics/ap-us-trump-impeachment-democrat.html,"A House freshman from New Jersey who was planning to break with his party and vote against impeaching President Donald Trump will become a Republican, a GOP official said Saturday.","WASHINGTON — A House freshman from New Jersey who was planning to break with his party and vote against impeaching President Donald Trump will become a Republican, a GOP official said Saturday.",AP,[],[],2019-12-14T21:06:32+0000,article,None,U.S.,Politics,News,nyt://article/22aa585c-3dd1-5208-ad71-8eb7c3fc8484,606,nyt://article/22aa585c-3dd1-5208-ad71-8eb7c3fc8484,AP Source: NJ Dem Lawmaker Plans to Become a Republican,,,AP Source: NJ Dem Lawmaker Plans to Become a Republican,,,,By The Associated Press,[],The Associated Press,,
2,"U.S. Democratic presidential contender Pete Buttigieg released the names of his major fundraisers on Friday, bowing to growing pressure from rival Elizabeth Warren and U.S. journalists to be more transparent in his campaign.",https://www.nytimes.com/reuters/2019/12/14/business/14reuters-usa-election-buttigieg-fundraiser.html,"U.S. Democratic presidential contender Pete Buttigieg released the names of his major fundraisers on Friday, bowing to growing pressure from rival Elizabeth Warren and U.S. journalists to be more transparent in his campaign.","(Reuters) - U.S. Democratic presidential contender Pete Buttigieg released the names of his major fundraisers on Friday, bowing to growing pressure from rival Elizabeth Warren and U.S. journalists to be more transparent in his campaign.",Reuters,[],[],2019-12-14T20:45:31+0000,article,None,Business Day,,News,nyt://article/d1b99fe4-d79d-5204-a098-b56e36705120,398,nyt://article/d1b99fe4-d79d-5204-a098-b56e36705120,U.S. Presidential Candidate Buttigieg Releases List of Major Fundraisers,,,U.S. Presidential Candidate Buttigieg Releases List of Major Fundraisers,,,,By Reuters,[],Reuters,,
3,The Constitution says no. Democrats are still deciding.,https://www.nytimes.com/2019/12/14/opinion/sunday/is-pete-buttigieg-just-too-young-to-be-president.html,The Constitution says no. Democrats are still deciding.,"Finland just elected the world’s youngest prime minister, Sanna Marin, who’s 34. Time magazine named Greta Thunberg, 16, its youngest-ever “Person of the Year.”",The New York Times,"[{'rank': 0, 'subtype': 'xlarge', 'caption': None, 'credit': None, 'type': 'image', 'url': 'images/2019/12/15/opinion/sunday/15bruni/15bruni-articleLarge.jpg', 'height': 445, 'width': 600, 'legacy': {'xlarge': 'images/2019/12/15/opinion/sunday/15bruni/15bruni-articleLarge.jpg', 'xlargewidth': 600, 'xlargeheight': 445}, 'subType': 'xlarge', 'crop_name': 'articleLarge'}, {'rank': 0, 'subtype': 'popup', 'caption': None, 'credit': None, 'type': 'image', 'url': 'images/2019/12/15/opinion/sunday/15bruni/15bruni-popup.jpg', 'height': 482, 'width': 650, 'legacy': {}, 'subType': 'popup', 'crop_name': 'popup'}, {'rank': 0, 'subtype': 'blog480', 'caption': None, 'credit': None, 'type': 'image', 'url': 'images/2019/12/15/opinion/sunday/15bruni/15bruni-blog480.jpg', 'height': 356, 'width': 480, 'legacy': {}, 'subType': 'blog480', 'crop_name': 'blog480'}, {'rank': 0, 'subtype': 'blog533', 'caption': None, 'credit': None, 'type': 'image', 'url': 'images/2019/12/15/opinion/sunday/15bruni/15bruni-blog533.jpg', 'height': 395, 'width': 533, 'legacy': {}, 'subType': 'blog533', 'crop_name': 'blog533'}, {'rank': 0, 'subtype': 'blog427', 'caption': None, 'credit': None, 'type': 'image', 'url': 'images/2019/12/15/opinion/sunday/15bruni/15bruni-blog427.jpg', 'height': 317, 'width': 427, 'legacy': {}, 'subType': 'blog427', 'crop_name': 'blog427'}, {'rank': 0, 'subtype': 'tmagSF', 'caption': None, 'credit': None, 'type': 'image', 'url': 'images/2019/12/15/opinion/sunday/15bruni/15bruni-tmagSF.jpg', 'height': 268, 'width': 362, 'legacy': {}, 'subType': 'tmagSF', 'crop_name': 'tmagSF'}, {'rank': 0, 'subtype': 'tmagArticle', 'caption': None, 'credit': None, 'type': 'image', 'url': 'images/2019/12/15/opinion/sunday/15bruni/15bruni-tmagArticle.jpg', 'height': 439, 'width': 592, 'legacy': {}, 'subType': 'tmagArticle', 'crop_name': 'tmagArticle'}, {'rank': 0, 'subtype': 'slide', 'caption': None, 'credit': None, 'type': 'image', 'url': 'images/2019/12/15/opinion/sunday/15bruni/15bruni-slide.jpg', 'height': 445, 'width': 600, 'legacy': {}, 'subType': 'slide', 'crop_name': 'slide'}, {'rank': 0, 'subtype': 'jumbo', 'caption': None, 'credit': None, 'type': 'image', 'url': 'images/2019/12/15/opinion/sunday/15bruni/15bruni-jumbo.jpg', 'height': 759, 'width': 1024, 'legacy': {}, 'subType': 'jumbo', 'crop_name': 'jumbo'}, {'rank': 0, 'subtype': 'superJumbo', 'caption': None, 'credit': None, 'type': 'image', 'url': 'images/2019/12/15/opinion/sunday/15bruni/15bruni-superJumbo.jpg', 'height': 1519, 'width': 2048, 'legacy': {}, 'subType': 'superJumbo', 'crop_name': 'superJumbo'}, {'rank': 0, 'subtype': 'blog225', 'caption': None, 'credit': None, 'type': 'image', 'url': 'images/2019/12/15/opinion/sunday/15bruni/15bruni-blog225.jpg', 'height': 167, 'width': 225, 'legacy': {}, 'subType': 'blog225', 'crop_name': 'blog225'}, {'rank': 0, 'subtype': 'master1050', 'caption': None, 'credit': None, 'type': 'image', 'url': 'images/2019/12/15/opinion/sunday/15bruni/15bruni-master1050.jpg', 'height': 779, 'width': 1050, 'legacy': {}, 'subType': 'master1050', 'crop_name': 'master1050'}, {'rank': 0, 'subtype': 'master675', 'caption': None, 'credit': None, 'type': 'image', 'url': 'images/2019/12/15/opinion/sunday/15bruni/15bruni-master675.jpg', 'height': 501, 'width': 675, 'legacy': {}, 'subType': 'master675', 'crop_name': 'master675'}, {'rank': 0, 'subtype': 'master495', 'caption': None, 'credit': None, 'type': 'image', 'url': 'images/2019/12/15/opinion/sunday/15bruni/15bruni-master495.jpg', 'height': 367, 'width': 495, 'legacy': {}, 'subType': 'master495', 'crop_name': 'master495'}, {'rank': 0, 'subtype': 'master180', 'caption': None, 'credit': None, 'type': 'image', 'url': 'images/2019/12/15/opinion/sunday/15bruni/15bruni-master180.jpg', 'height': 133, 'width': 180, 'legacy': {}, 'subType': 'master180', 'crop_name': 'master180'}, {'rank': 0, 'subtype': 'master315', 'caption': None, 'credit': None, 'type': 'image', 'url': 'images/2019/12/15/opinion/sunday/15bruni/15bruni-master315.jpg', 'height': 234, 'width': 315, 'legacy': {}, 'subType': 'master315', 'crop_name': 'master315'}, {'rank': 0, 'subtype': 'master768', 'caption': None, 'credit': None, 'type': 'image', 'url': 'images/2019/12/15/opinion/sunday/15bruni/15bruni-master768.jpg', 'height': 570, 'width': 768, 'legacy': {}, 'subType': 'master768', 'crop_name': 'master768'}, {'rank': 0, 'subtype': 'thumbnail', 'caption': None, 'credit': None, 'type': 'image', 'url': 'images/2019/12/15/opinion/sunday/15bruni/15bruni-thumbStandard.jpg', 'height': 75, 'width': 75, 'legacy': {'thumbnail': 'images/2019/12/15/opinion/sunday/15bruni/15bruni-thumbStandard.jpg', 'thumbnailwidth': 75, 'thumbnailheight': 75}, 'subType': 'thumbnail', 'crop_name': 'thumbStandard'}, {'rank': 0, 'subtype': 'blogSmallThumb', 'caption': None, 'credit': None, 'type': 'image', 'url': 'images/2019/12/15/opinion/sunday/15bruni/15bruni-blogSmallThumb.jpg', 'height': 50, 'width': 50, 'legacy': {}, 'subType': 'blogSmallThumb', 'crop_name': 'blogSmallThumb'}, {'rank': 0, 'subtype': 'thumbLarge', 'caption': None, 'credit': None, 'type': 'image', 'url': 'images/2019/12/15/opinion/sunday/15bruni/15bruni-thumbLarge.jpg', 'height': 150, 'width': 150, 'legacy': {}, 'subType': 'thumbLarge', 'crop_name': 'thumbLarge'}, {'rank': 0, 'subtype': 'smallSquare168', 'caption': None, 'credit': None, 'type': 'image', 'url': 'images/2019/12/15/opinion/sunday/15bruni/15bruni-smallSquare168.jpg', 'height': 168, 'width': 168, 'legacy': {}, 'subType': 'smallSquare168', 'crop_name': 'smallSquare168'}, {'rank': 0, 'subtype': 'smallSquare252', 'caption': None, 'credit': None, 'type': 'image', 'url': 'images/2019/12/15/opinion/sunday/15bruni/15bruni-smallSquare252.jpg', 'height': 252, 'width': 252, 'legacy': {}, 'subType': 'smallSquare252', 'crop_name': 'smallSquare252'}, {'rank': 0, 'subtype': 'square320', 'caption': None, 'credit': None, 'type': 'image', 'url': 'images/2019/12/15/opinion/sunday/15bruni/15bruni-square320.jpg', 'height': 320, 'width': 320, 'legacy': {}, 'subType': 'square320', 'crop_name': 'square320'}, {'rank': 0, 'subtype': 'moth', 'caption': None, 'credit': None, 'type': 'image', 'url': 'images/2019/12/15/opinion/sunday/15bruni/15bruni-moth.jpg', 'height': 151, 'width': 151, 'legacy': {}, 'subType': 'moth', 'crop_name': 'moth'}, {'rank': 0, 'subtype': 'filmstrip', 'caption': None, 'credit': None, 'type': 'image', 'url': 'images/2019/12/15/opinion/sunday/15bruni/15bruni-filmstrip.jpg', 'height': 190, 'width': 190, 'legacy': {}, 'subType': 'filmstrip', 'crop_name': 'filmstrip'}, {'rank': 0, 'subtype': 'square640', 'caption': None, 'credit': None, 'type': 'image', 'url': 'images/2019/12/15/opinion/sunday/15bruni/15bruni-square640.jpg', 'height': 640, 'width': 640, 'legacy': {}, 'subType': 'square640', 'crop_name': 'square640'}, {'rank': 0, 'subtype': 'mediumSquare149', 'caption': None, 'credit': None, 'type': 'image', 'url': 'images/2019/12/15/opinion/sunday/15bruni/15bruni-mediumSquare149.jpg', 'height': 149, 'width': 149, 'legacy': {}, 'subType': 'mediumSquare149', 'crop_name': 'mediumSquare149'}, {'rank': 0, 'subtype': 'sfSpan', 'caption': None, 'credit': None, 'type': 'image', 'url': 'images/2019/12/15/opinion/sunday/15bruni/15bruni-sfSpan.jpg', 'height': 263, 'width': 395, 'legacy': {}, 'subType': 'sfSpan', 'crop_name': 'sfSpan'}, {'rank': 0, 'subtype': 'largeHorizontal375', 'caption': None, 'credit': None, 'type': 'image', 'url': 'images/2019/12/15/opinion/sunday/15bruni/15bruni-largeHorizontal375.jpg', 'height': 250, 'width': 375, 'legacy': {}, 'subType': 'largeHorizontal375', 'crop_name': 'largeHorizontal375'}, {'rank': 0, 'subtype': 'largeHorizontalJumbo', 'caption': None, 'credit': None, 'type': 'image', 'url': 'images/2019/12/15/opinion/sunday/15bruni/15bruni-largeHorizontalJumbo.jpg', 'height': 683, 'width': 1024, 'legacy': {}, 'subType': 'largeHorizontalJumbo', 'crop_name': 'largeHorizontalJumbo'}, {'rank': 0, 'subtype': 'horizontalMediumAt2X', 'caption': None, 'credit': None, 'type': 'image', 'url': 'images/2019/12/15/opinion/sunday/15bruni/15bruni-horizontalMediumAt2X.jpg', 'height': 2157, 'width': 3236, 'legacy': {}, 'subType': 'horizontalMediumAt2X', 'crop_name': 'horizontalMediumAt2X'}, {'rank': 0, 'subtype': 'hpLarge', 'caption': None, 'credit': None, 'type': 'image', 'url': 'images/2019/12/15/opinion/sunday/15bruni/15bruni-hpLarge.jpg', 'height': 287, 'width': 511, 'legacy': {}, 'subType': 'hpLarge', 'crop_name': 'hpLarge'}, {'rank': 0, 'subtype': 'largeWidescreen573', 'caption': None, 'credit': None, 'type': 'image', 'url': 'images/2019/12/15/opinion/sunday/15bruni/15bruni-largeWidescreen573.jpg', 'height': 322, 'width': 573, 'legacy': {}, 'subType': 'largeWidescreen573', 'crop_name': 'largeWidescreen573'}, {'rank': 0, 'subtype': 'largeWidescreen1050', 'caption': None, 'credit': None, 'type': 'image', 'url': 'images/2019/12/15/opinion/sunday/15bruni/15bruni-largeWidescreen1050.jpg', 'height': 591, 'width': 1050, 'legacy': {}, 'subType': 'largeWidescreen1050', 'crop_name': 'largeWidescreen1050'}, {'rank': 0, 'subtype': 'wide', 'caption': None, 'credit': None, 'type': 'image', 'url': 'images/2019/12/15/opinion/sunday/15bruni/15bruni-thumbWide.jpg', 'height': 126, 'width': 190, 'legacy': {'widewidth': 190, 'wideheight': 126, 'wide': 'images/2019/12/15/opinion/sunday/15bruni/15bruni-thumbWide.jpg'}, 'subType': 'wide', 'crop_name': 'thumbWide'}, {'rank': 0, 'subtype': 'videoThumb', 'caption': None, 'credit': None, 'type': 'image', 'url': 'images/2019/12/15/opinion/sunday/15bruni/15bruni-videoThumb.jpg', 'height': 50, 'width': 75, 'legacy': {}, 'subType': 'videoThumb', 'crop_name': 'videoThumb'}, {'rank': 0, 'subtype': 'videoLarge', 'caption': None, 'credit': None, 'type': 'image', 'url': 'images/2019/12/15/opinion/sunday/15bruni/15bruni-videoLarge.jpg', 'height': 507, 'width': 768, 'legacy': {}, 'subType': 'videoLarge', 'crop_name': 'videoLarge'}, {'rank': 0, 'subtype': 'mediumThreeByTwo210', 'caption': None, 'credit': None, 'type': 'image', 'url': 'images/2019/12/15/opinion/sunday/15bruni/15bruni-mediumThreeByTwo210.jpg', 'height': 140, 'width': 210, 'legacy': {}, 'subType': 'mediumThreeByTwo210', 'crop_name': 'mediumThreeByTwo210'}, {'rank': 0, 'subtype': 'mediumThreeByTwo225', 'caption': None, 'credit': None, 'type': 'image', 'url': 'images/2019/12/15/opinion/sunday/15bruni/15bruni-mediumThreeByTwo225.jpg', 'height': 150, 'width': 225, 'legacy': {}, 'subType': 'mediumThreeByTwo225', 'crop_name': 'mediumThreeByTwo225'}, {'rank': 0, 'subtype': 'mediumThreeByTwo440', 'caption': None, 'credit': None, 'type': 'image', 'url': 'images/2019/12/15/opinion/sunday/15bruni/15bruni-mediumThreeByTwo440.jpg', 'height': 293, 'width': 440, 'legacy': {}, 'subType': 'mediumThreeByTwo440', 'crop_name': 'mediumThreeByTwo440'}, {'rank': 0, 'subtype': 'mediumThreeByTwo252', 'caption': None, 'credit': None, 'type': 'image', 'url': 'images/2019/12/15/opinion/sunday/15bruni/15bruni-mediumThreeByTwo252.jpg', 'height': 168, 'width': 252, 'legacy': {}, 'subType': 'mediumThreeByTwo252', 'crop_name': 'mediumThreeByTwo252'}, {'rank': 0, 'subtype': 'mediumThreeByTwo378', 'caption': None, 'credit': None, 'type': 'image', 'url': 'images/2019/12/15/opinion/sunday/15bruni/15bruni-mediumThreeByTwo378.jpg', 'height': 252, 'width': 378, 'legacy': {}, 'subType': 'mediumThreeByTwo378', 'crop_name': 'mediumThreeByTwo378'}, {'rank': 0, 'subtype': 'threeByTwoLargeAt2X', 'caption': None, 'credit': None, 'type': 'image', 'url': 'images/2019/12/15/opinion/sunday/15bruni/15bruni-threeByTwoLargeAt2X.jpg', 'height': 1038, 'width': 1556, 'legacy': {}, 'subType': 'threeByTwoLargeAt2X', 'crop_name': 'threeByTwoLargeAt2X'}, {'rank': 0, 'subtype': 'threeByTwoMediumAt2X', 'caption': None, 'credit': None, 'type': 'image', 'url': 'images/2019/12/15/opinion/sunday/15bruni/15bruni-threeByTwoMediumAt2X.jpg', 'height': 1001, 'width': 1500, 'legacy': {}, 'subType': 'threeByTwoMediumAt2X', 'crop_name': 'threeByTwoMediumAt2X'}, {'rank': 0, 'subtype': 'threeByTwoSmallAt2X', 'caption': None, 'credit': None, 'type': 'image', 'url': 'images/2019/12/15/opinion/sunday/15bruni/15bruni-threeByTwoSmallAt2X.jpg', 'height': 400, 'width': 600, 'legacy': {}, 'subType': 'threeByTwoSmallAt2X', 'crop_name': 'threeByTwoSmallAt2X'}, {'rank': 0, 'subtype': 'articleInline', 'caption': None, 'credit': None, 'type': 'image', 'url': 'images/2019/12/15/opinion/sunday/15bruni/15bruni-articleInline.jpg', 'height': 120, 'width': 190, 'legacy': {}, 'subType': 'articleInline', 'crop_name': 'articleInline'}, {'rank': 0, 'subtype': 'hpSmall', 'caption': None, 'credit': None, 'type': 'image', 'url': 'images/2019/12/15/opinion/sunday/15bruni/15bruni-hpSmall.jpg', 'height': 103, 'width': 163, 'legacy': {}, 'subType': 'hpSmall', 'crop_name': 'hpSmall'}, {'rank': 0, 'subtype': 'blogSmallInline', 'caption': None, 'credit': None, 'type': 'image', 'url': 'images/2019/12/15/opinion/sunday/15bruni/15bruni-blogSmallInline.jpg', 'height': 95, 'width': 151, 'legacy': {}, 'subType': 'blogSmallInline', 'crop_name': 'blogSmallInline'}, {'rank': 0, 'subtype': 'mediumFlexible177', 'caption': None, 'credit': None, 'type': 'image', 'url': 'images/2019/12/15/opinion/sunday/15bruni/15bruni-mediumFlexible177.jpg', 'height': 112, 'width': 177, 'legacy': {}, 'subType': 'mediumFlexible177', 'crop_name': 'mediumFlexible177'}, {'rank': 0, 'subtype': 'videoSmall', 'caption': None, 'credit': None, 'type': 'image', 'url': 'images/2019/12/15/opinion/sunday/15bruni/15bruni-videoSmall.jpg', 'height': 281, 'width': 500, 'legacy': {}, 'subType': 'videoSmall', 'crop_name': 'videoSmall'}, {'rank': 0, 'subtype': 'videoHpMedium', 'caption': None, 'credit': None, 'type': 'image', 'url': 'images/2019/12/15/opinion/sunday/15bruni/15bruni-videoHpMedium.jpg', 'height': 211, 'width': 375, 'legacy': {}, 'subType': 'videoHpMedium', 'crop_name': 'videoHpMedium'}, {'rank': 0, 'subtype': 'videoSixteenByNine600', 'caption': None, 'credit': None, 'type': 'image', 'url': 'images/2019/12/15/opinion/sunday/15bruni/15bruni-videoSixteenByNine600.jpg', 'height': 338, 'width': 600, 'legacy': {}, 'subType': 'videoSixteenByNine600', 'crop_name': 'videoSixteenByNine600'}, {'rank': 0, 'subtype': 'videoSixteenByNine540', 'caption': None, 'credit': None, 'type': 'image', 'url': 'images/2019/12/15/opinion/sunday/15bruni/15bruni-videoSixteenByNine540.jpg', 'height': 304, 'width': 540, 'legacy': {}, 'subType': 'videoSixteenByNine540', 'crop_name': 'videoSixteenByNine540'}, {'rank': 0, 'subtype': 'videoSixteenByNine495', 'caption': None, 'credit': None, 'type': 'image', 'url': 'images/2019/12/15/opinion/sunday/15bruni/15bruni-videoSixteenByNine495.jpg', 'height': 278, 'width': 495, 'legacy': {}, 'subType': 'videoSixteenByNine495', 'crop_name': 'videoSixteenByNine495'}, {'rank': 0, 'subtype': 'videoSixteenByNine390', 'caption': None, 'credit': None, 'type': 'image', 'url': 'images/2019/12/15/opinion/sunday/15bruni/15bruni-videoSixteenByNine390.jpg', 'height': 219, 'width': 390, 'legacy': {}, 'subType': 'videoSixteenByNine390', 'crop_name': 'videoSixteenByNine390'}, {'rank': 0, 'subtype': 'videoSixteenByNine1050', 'caption': None, 'credit': None, 'type': 'image', 'url': 'images/2019/12/15/opinion/sunday/15bruni/15bruni-videoSixteenByNine1050.jpg', 'height': 591, 'width': 1050, 'legacy': {}, 'subType': 'videoSixteenByNine1050', 'crop_name': 'videoSixteenByNine1050'}, {'rank': 0, 'subtype': 'videoSixteenByNine480', 'caption': None, 'credit': None, 'type': 'image', 'url': 'images/2019/12/15/opinion/sunday/15bruni/15bruni-videoSixteenByNine480.jpg', 'height': 270, 'width': 480, 'legacy': {}, 'subType': 'videoSixteenByNine480', 'crop_name': 'videoSixteenByNine480'}, {'rank': 0, 'subtype': 'videoSixteenByNine310', 'caption': None, 'credit': None, 'type': 'image', 'url': 'images/2019/12/15/opinion/sunday/15bruni/15bruni-videoSixteenByNine310.jpg', 'height': 174, 'width': 310, 'legacy': {}, 'subType': 'videoSixteenByNine310', 'crop_name': 'videoSixteenByNine310'}, {'rank': 0, 'subtype': 'videoSixteenByNine225', 'caption': None, 'credit': None, 'type': 'image', 'url': 'images/2019/12/15/opinion/sunday/15bruni/15bruni-videoSixteenByNine225.jpg', 'height': 126, 'width': 225, 'legacy': {}, 'subType': 'videoSixteenByNine225', 'crop_name': 'videoSixteenByNine225'}, {'rank': 0, 'subtype': 'videoSixteenByNine96', 'caption': None, 'credit': None, 'type': 'image', 'url': 'images/2019/12/15/opinion/sunday/15bruni/15bruni-videoSixteenByNine96.jpg', 'height': 54, 'width': 96, 'legacy': {}, 'subType': 'videoSixteenByNine96', 'crop_name': 'videoSixteenByNine96'}, {'rank': 0, 'subtype': 'videoSixteenByNine768', 'caption': None, 'credit': None, 'type': 'image', 'url': 'images/2019/12/15/opinion/sunday/15bruni/15bruni-videoSixteenByNine768.jpg', 'height': 432, 'width': 768, 'legacy': {}, 'subType': 'videoSixteenByNine768', 'crop_name': 'videoSixteenByNine768'}, {'rank': 0, 'subtype': 'videoSixteenByNine150', 'caption': None, 'credit': None, 'type': 'image', 'url': 'images/2019/12/15/opinion/sunday/15bruni/15bruni-videoSixteenByNine150.jpg', 'height': 84, 'width': 150, 'legacy': {}, 'subType': 'videoSixteenByNine150', 'crop_name': 'videoSixteenByNine150'}, {'rank': 0, 'subtype': 'videoSixteenByNineJumbo1600', 'caption': None, 'credit': None, 'type': 'image', 'url': 'images/2019/12/15/opinion/sunday/15bruni/15bruni-videoSixteenByNineJumbo1600.jpg', 'height': 899, 'width': 1600, 'legacy': {}, 'subType': 'videoSixteenByNineJumbo1600', 'crop_name': 'videoSixteenByNineJumbo1600'}, {'rank': 0, 'subtype': 'miniMoth', 'caption': None, 'credit': None, 'type': 'image', 'url': 'images/2019/12/15/opinion/sunday/15bruni/15bruni-miniMoth.jpg', 'height': 70, 'width': 151, 'legacy': {}, 'subType': 'miniMoth', 'crop_name': 'miniMoth'}, {'rank': 0, 'subtype': 'windowsTile336H', 'caption': None, 'credit': None, 'type': 'image', 'url': 'images/2019/12/15/opinion/sunday/15bruni/15bruni-windowsTile336H.jpg', 'height': 336, 'width': 694, 'legacy': {}, 'subType': 'windowsTile336H', 'crop_name': 'windowsTile336H'}, {'rank': 0, 'subtype': 'videoFifteenBySeven1305', 'caption': None, 'credit': None, 'type': 'image', 'url': 'images/2019/12/15/opinion/sunday/15bruni/15bruni-videoFifteenBySeven1305.jpg', 'height': 609, 'width': 1305, 'legacy': {}, 'subType': 'videoFifteenBySeven1305', 'crop_name': 'videoFifteenBySeven1305'}, {'rank': 0, 'subtype': 'videoFifteenBySeven2610', 'caption': None, 'credit': None, 'type': 'image', 'url': 'images/2019/12/15/opinion/sunday/15bruni/15bruni-videoFifteenBySeven2610.jpg', 'height': 1218, 'width': 2610, 'legacy': {}, 'subType': 'videoFifteenBySeven2610', 'crop_name': 'videoFifteenBySeven2610'}, {'rank': 0, 'subtype': 'facebookJumbo', 'caption': None, 'credit': None, 'type': 'image', 'url': 'images/2019/12/15/opinion/sunday/15bruni/15bruni-facebookJumbo.jpg', 'height': 550, 'width': 1050, 'legacy': {}, 'subType': 'facebookJumbo', 'crop_name': 'facebookJumbo'}, {'rank': 0, 'subtype': 'watch308', 'caption': None, 'credit': None, 'type': 'image', 'url': 'images/2019/12/15/opinion/sunday/15bruni/15bruni-watch308.jpg', 'height': 348, 'width': 312, 'legacy': {}, 'subType': 'watch308', 'crop_name': 'watch308'}, {'rank': 0, 'subtype': 'watch268', 'caption': None, 'credit': None, 'type': 'image', 'url': 'images/2019/12/15/opinion/sunday/15bruni/15bruni-watch268.jpg', 'height': 303, 'width': 272, 'legacy': {}, 'subType': 'watch268', 'crop_name': 'watch268'}, {'rank': 0, 'subtype': 'verticalTwoByThree735', 'caption': None, 'credit': None, 'type': 'image', 'url': 'images/2019/12/15/opinion/sunday/15bruni/15bruni-verticalTwoByThree735.jpg', 'height': 1103, 'width': 735, 'legacy': {}, 'subType': 'verticalTwoByThree735', 'crop_name': 'verticalTwoByThree735'}, {'rank': 0, 'subtype': 'mobileMasterAt3x', 'caption': None, 'credit': None, 'type': 'image', 'url': 'images/2019/12/15/opinion/sunday/15bruni/15bruni-mobileMasterAt3x.jpg', 'height': 1763, 'width': 1800, 'legacy': {}, 'subType': 'mobileMasterAt3x', 'crop_name': 'mobileMasterAt3x'}]","[{'name': 'persons', 'value': 'Buttigieg, Pete (1982- )', 'rank': 1, 'major': 'N'}, {'name': 'organizations', 'value': 'Democratic Party', 'rank': 2, 'major': 'N'}, {'name': 'subject', 'value': 'AGE, CHRONOLOGICAL', 'rank': 3, 'major': 'N'}, {'name': 'subject', 'value': 'Presidential Election of 2020', 'rank': 4, 'major': 'N'}, {'name': 'subject', 'value': 'United States Politics and Government', 'rank': 5, 'major': 'N'}, {'name': 'subject', 'value': 'Presidents and Presidency (US)', 'rank': 6, 'major': 'N'}, {'name': 'persons', 'value': 'Trump, Donald J', 'rank': 7, 'major': 'N'}]",2019-12-14T19:30:12+0000,article,OpEd,Opinion,Sunday Review,Op-Ed,nyt://article/90d26fe6-4301-5eaf-a07d-c59f0367b4c3,1590,nyt://article/90d26fe6-4301-5eaf-a07d-c59f0367b4c3,Is Pete Buttigieg Just Too Young to Be President?,,,Is Buttigieg Just Too Young to Be President?,,,,By Frank Bruni,"[{'firstname': 'Frank', 'middlename': None, 'lastname': 'Bruni', 'qualifier': None, 'title': None, 'role': 'reported', 'organization': '', 'rank': 1}]",,SR,3
