,abstract,web_url,snippet,lead_paragraph,source,multimedia,keywords,pub_date,document_type,news_desk,section_name,subsection_name,type_of_material,_id,word_count,uri,headline_main,headline_kicker,headline_content_kicker,headline_print_headline,headline_name,headline_seo,headline_sub,byline_original,byline_person,byline_organization,print_section,print_page
0,Democratic presidential contender Pete Buttigieg is picking up his first endorsement among South Carolina’s black lawmakers as attention in the early voting contest turns toward more diverse states.,https://www.nytimes.com/aponline/2020/02/12/us/politics/ap-us-election-2020-buttigieg-south-carolina.html,Democratic presidential contender Pete Buttigieg is picking up his first endorsement among South Carolina’s black lawmakers as attention in the early voting contest turns toward more diverse states.,"COLUMBIA, S.C. — Democratic presidential contender Pete Buttigieg is picking up his first endorsement among South Carolina’s black lawmakers as attention in the early voting contest turns toward more diverse states.",AP,[],[],2020-02-12T15:05:16+0000,article,None,U.S.,Politics,News,nyt://article/561cf33f-9342-5cca-ac2b-04e15f2b5106,290,nyt://article/561cf33f-9342-5cca-ac2b-04e15f2b5106,Buttigieg Lands Black South Carolina Lawmaker's Endorsement,,,Buttigieg Lands Black South Carolina Lawmaker's Endorsement,,,,By The Associated Press,[],The Associated Press,,
1,Democratic presidential candidate Tom Steyer has hired one of South Carolina's most influential black lawmakers as an adviser to his campaign as the billionaire businessman tries to make inroads in a state where black voters will play a dominant role in the Feb. 29 primary.,https://www.nytimes.com/aponline/2020/02/12/us/politics/ap-us-election-2020-steyer-south-carolina.html,Democratic presidential candidate Tom Steyer has hired one of South Carolina's most influential black lawmakers as an adviser to his campaign as the billionaire businessman tries to make inroads in a state where black voters will play a dominant r...,"COLUMBIA, S.C. — Democratic presidential candidate Tom Steyer has hired one of South Carolina's most influential black lawmakers as an adviser to his campaign as the billionaire businessman tries to make inroads in a state where black voters will play a dominant role in the Feb. 29 primary.",AP,[],[],2020-02-12T14:32:14+0000,article,None,U.S.,Politics,News,nyt://article/6653b424-b626-580d-a9a9-a70406f41cf4,486,nyt://article/6653b424-b626-580d-a9a9-a70406f41cf4,Steyer Hires Longest-Serving SC House Lawmaker as Adviser,,,Steyer Hires Longest-Serving SC House Lawmaker as Adviser,,,,By The Associated Press,[],The Associated Press,,
2,The Latest on the 2020 presidential primary campaign (all times local):,https://www.nytimes.com/aponline/2020/02/12/us/politics/ap-us-election-2020-the-latest.html,The Latest on the 2020 presidential primary campaign (all times local):,WASHINGTON — The Latest on the 2020 presidential primary campaign (all times local):,AP,[],[],2020-02-12T13:44:20+0000,article,None,U.S.,Politics,News,nyt://article/294f8ceb-f7f6-56d0-abd7-85f351a898ff,1945,nyt://article/294f8ceb-f7f6-56d0-abd7-85f351a898ff,The Latest: Bloomberg Says He's Prepared to Take on Trump,,,The Latest: Bloomberg Says He's Prepared to Take on Trump,,,,By The Associated Press,[],The Associated Press,,
3,"Bernie Sanders won New Hampshire, but the Democratic race might not be settled anytime soon.",https://www.nytimes.com/2020/02/12/us/politics/on-politics-primary-slog.html,"Bernie Sanders won New Hampshire, but the Democratic race might not be settled anytime soon.","Good morning and welcome to On Politics, your guide to the day in national politics. I’m Lisa Lerer, your host, in Manchester, N.H., the morning after the New Hampshire primary.",The New York Times,"[{'rank': 0, 'subtype': 'xlarge', 'caption': None, 'credit': None, 'type': 'image', 'url': 'images/2020/02/03/us/3onpolitics-pm-02/3onpolitics-pm-02-articleLarge.jpg', 'height': 383, 'width': 600, 'legacy': {'xlarge': 'images/2020/02/03/us/3onpolitics-pm-02/3onpolitics-pm-02-articleLarge.jpg', 'xlargewidth': 600, 'xlargeheight': 383}, 'subType': 'xlarge', 'crop_name': 'articleLarge'}, {'rank': 0, 'subtype': 'popup', 'caption': None, 'credit': None, 'type': 'image', 'url': 'images/2020/02/03/us/3onpolitics-pm-02/3onpolitics-pm-02-popup.jpg', 'height': 415, 'width': 650, 'legacy': {}, 'subType': 'popup', 'crop_name': 'popup'}, {'rank': 0, 'subtype': 'blog480', 'caption': None, 'credit': None, 'type': 'image', 'url': 'images/2020/02/03/us/3onpolitics-pm-02/3onpolitics-pm-02-blog480.jpg', 'height': 307, 'width': 480, 'legacy': {}, 'subType': 'blog480', 'crop_name': 'blog480'}, {'rank': 0, 'subtype': 'blog533', 'caption': None, 'credit': None, 'type': 'image', 'url': 'images/2020/02/03/us/3onpolitics-pm-02/3onpolitics-pm-02-blog533.jpg', 'height': 340, 'width': 533, 'legacy': {}, 'subType': 'blog533', 'crop_name': 'blog533'}, {'rank': 0, 'subtype': 'blog427', 'caption': None, 'credit': None, 'type': 'image', 'url': 'images/2020/02/03/us/3onpolitics-pm-02/3onpolitics-pm-02-blog427.jpg', 'height': 273, 'width': 427, 'legacy': {}, 'subType': 'blog427', 'crop_name': 'blog427'}, {'rank': 0, 'subtype': 'tmagSF', 'caption': None, 'credit': None, 'type': 'image', 'url': 'images/2020/02/03/us/3onpolitics-pm-02/3onpolitics-pm-02-tmagSF.jpg', 'height': 231, 'width': 362, 'legacy': {}, 'subType': 'tmagSF', 'crop_name': 'tmagSF'}, {'rank': 0, 'subtype': 'tmagArticle', 'caption': None, 'credit': None, 'type': 'image', 'url': 'images/2020/02/03/us/3onpolitics-pm-02/3onpolitics-pm-02-tmagArticle.jpg', 'height': 378, 'width': 592, 'legacy': {}, 'subType': 'tmagArticle', 'crop_name': 'tmagArticle'}, {'rank': 0, 'subtype': 'slide', 'caption': None, 'credit': None, 'type': 'image', 'url': 'images/2020/02/03/us/3onpolitics-pm-02/3onpolitics-pm-02-slide.jpg', 'height': 383, 'width': 600, 'legacy': {}, 'subType': 'slide', 'crop_name': 'slide'}, {'rank': 0, 'subtype': 'jumbo', 'caption': None, 'credit': None, 'type': 'image', 'url': 'images/2020/02/03/us/3onpolitics-pm-02/3onpolitics-pm-02-jumbo.jpg', 'height': 654, 'width': 1024, 'legacy': {}, 'subType': 'jumbo', 'crop_name': 'jumbo'}, {'rank': 0, 'subtype': 'superJumbo', 'caption': None, 'credit': None, 'type': 'image', 'url': 'images/2020/02/03/us/3onpolitics-pm-02/3onpolitics-pm-02-superJumbo.jpg', 'height': 999, 'width': 1564, 'legacy': {}, 'subType': 'superJumbo', 'crop_name': 'superJumbo'}, {'rank': 0, 'subtype': 'blog225', 'caption': None, 'credit': None, 'type': 'image', 'url': 'images/2020/02/03/us/3onpolitics-pm-02/3onpolitics-pm-02-blog225.jpg', 'height': 144, 'width': 225, 'legacy': {}, 'subType': 'blog225', 'crop_name': 'blog225'}, {'rank': 0, 'subtype': 'master1050', 'caption': None, 'credit': None, 'type': 'image', 'url': 'images/2020/02/03/us/3onpolitics-pm-02/3onpolitics-pm-02-master1050.jpg', 'height': 671, 'width': 1050, 'legacy': {}, 'subType': 'master1050', 'crop_name': 'master1050'}, {'rank': 0, 'subtype': 'master675', 'caption': None, 'credit': None, 'type': 'image', 'url': 'images/2020/02/03/us/3onpolitics-pm-02/3onpolitics-pm-02-master675.jpg', 'height': 431, 'width': 675, 'legacy': {}, 'subType': 'master675', 'crop_name': 'master675'}, {'rank': 0, 'subtype': 'master495', 'caption': None, 'credit': None, 'type': 'image', 'url': 'images/2020/02/03/us/3onpolitics-pm-02/3onpolitics-pm-02-master495.jpg', 'height': 316, 'width': 495, 'legacy': {}, 'subType': 'master495', 'crop_name': 'master495'}, {'rank': 0, 'subtype': 'master180', 'caption': None, 'credit': None, 'type': 'image', 'url': 'images/2020/02/03/us/3onpolitics-pm-02/3onpolitics-pm-02-master180.jpg', 'height': 115, 'width': 180, 'legacy': {}, 'subType': 'master180', 'crop_name': 'master180'}, {'rank': 0, 'subtype': 'master315', 'caption': None, 'credit': None, 'type': 'image', 'url': 'images/2020/02/03/us/3onpolitics-pm-02/3onpolitics-pm-02-master315.jpg', 'height': 201, 'width': 315, 'legacy': {}, 'subType': 'master315', 'crop_name': 'master315'}, {'rank': 0, 'subtype': 'master768', 'caption': None, 'credit': None, 'type': 'image', 'url': 'images/2020/02/03/us/3onpolitics-pm-02/3onpolitics-pm-02-master768.jpg', 'height': 491, 'width': 768, 'legacy': {}, 'subType': 'master768', 'crop_name': 'master768'}, {'rank': 0, 'subtype': 'thumbnail', 'caption': None, 'credit': None, 'type': 'image', 'url': 'images/2020/02/03/us/3onpolitics-pm-02/3onpolitics-pm-02-thumbStandard.jpg', 'height': 75, 'width': 75, 'legacy': {'thumbnail': 'images/2020/02/03/us/3onpolitics-pm-02/3onpolitics-pm-02-thumbStandard.jpg', 'thumbnailwidth': 75, 'thumbnailheight': 75}, 'subType': 'thumbnail', 'crop_name': 'thumbStandard'}, {'rank': 0, 'subtype': 'blogSmallThumb', 'caption': None, 'credit': None, 'type': 'image', 'url': 'images/2020/02/03/us/3onpolitics-pm-02/3onpolitics-pm-02-blogSmallThumb.jpg', 'height': 50, 'width': 50, 'legacy': {}, 'subType': 'blogSmallThumb', 'crop_name': 'blogSmallThumb'}, {'rank': 0, 'subtype': 'thumbLarge', 'caption': None, 'credit': None, 'type': 'image', 'url': 'images/2020/02/03/us/3onpolitics-pm-02/3onpolitics-pm-02-thumbLarge.jpg', 'height': 150, 'width': 150, 'legacy': {}, 'subType': 'thumbLarge', 'crop_name': 'thumbLarge'}, {'rank': 0, 'subtype': 'smallSquare168', 'caption': None, 'credit': None, 'type': 'image', 'url': 'images/2020/02/03/us/3onpolitics-pm-02/3onpolitics-pm-02-smallSquare168.jpg', 'height': 168, 'width': 168, 'legacy': {}, 'subType': 'smallSquare168', 'crop_name': 'smallSquare168'}, {'rank': 0, 'subtype': 'smallSquare252', 'caption': None, 'credit': None, 'type': 'image', 'url': 'images/2020/02/03/us/3onpolitics-pm-02/3onpolitics-pm-02-smallSquare252.jpg', 'height': 252, 'width': 252, 'legacy': {}, 'subType': 'smallSquare252', 'crop_name': 'smallSquare252'}, {'rank': 0, 'subtype': 'square320', 'caption': None, 'credit': None, 'type': 'image', 'url': 'images/2020/02/03/us/3onpolitics-pm-02/3onpolitics-pm-02-square320.jpg', 'height': 320, 'width': 320, 'legacy': {}, 'subType': 'square320', 'crop_name': 'square320'}, {'rank': 0, 'subtype': 'moth', 'caption': None, 'credit': None, 'type': 'image', 'url': 'images/2020/02/03/us/3onpolitics-pm-02/3onpolitics-pm-02-moth.jpg', 'height': 151, 'width': 151, 'legacy': {}, 'subType': 'moth', 'crop_name': 'moth'}, {'rank': 0, 'subtype': 'filmstrip', 'caption': None, 'credit': None, 'type': 'image', 'url': 'images/2020/02/03/us/3onpolitics-pm-02/3onpolitics-pm-02-filmstrip.jpg', 'height': 190, 'width': 190, 'legacy': {}, 'subType': 'filmstrip', 'crop_name': 'filmstrip'}, {'rank': 0, 'subtype': 'square640', 'caption': None, 'credit': None, 'type': 'image', 'url': 'images/2020/02/03/us/3onpolitics-pm-02/3onpolitics-pm-02-square640.jpg', 'height': 640, 'width': 640, 'legacy': {}, 'subType': 'square640', 'crop_name': 'square640'}, {'rank': 0, 'subtype': 'mediumSquare149', 'caption': None, 'credit': None, 'type': 'image', 'url': 'images/2020/02/03/us/3onpolitics-pm-02/3onpolitics-pm-02-mediumSquare149.jpg', 'height': 149, 'width': 149, 'legacy': {}, 'subType': 'mediumSquare149', 'crop_name': 'mediumSquare149'}, {'rank': 0, 'subtype': 'sfSpan', 'caption': None, 'credit': None, 'type': 'image', 'url': 'images/2020/02/03/us/3onpolitics-pm-02/3onpolitics-pm-02-sfSpan.jpg', 'height': 263, 'width': 395, 'legacy': {}, 'subType': 'sfSpan', 'crop_name': 'sfSpan'}, {'rank': 0, 'subtype': 'largeHorizontal375', 'caption': None, 'credit': None, 'type': 'image', 'url': 'images/2020/02/03/us/3onpolitics-pm-02/3onpolitics-pm-02-largeHorizontal375.jpg', 'height': 250, 'width': 375, 'legacy': {}, 'subType': 'largeHorizontal375', 'crop_name': 'largeHorizontal375'}, {'rank': 0, 'subtype': 'largeHorizontalJumbo', 'caption': None, 'credit': None, 'type': 'image', 'url': 'images/2020/02/03/us/3onpolitics-pm-02/3onpolitics-pm-02-largeHorizontalJumbo.jpg', 'height': 682, 'width': 1024, 'legacy': {}, 'subType': 'largeHorizontalJumbo', 'crop_name': 'largeHorizontalJumbo'}, {'rank': 0, 'subtype': 'horizontalMediumAt2X', 'caption': None, 'credit': None, 'type': 'image', 'url': 'images/2020/02/03/us/3onpolitics-pm-02/3onpolitics-pm-02-horizontalMediumAt2X.jpg', 'height': 999, 'width': 1499, 'legacy': {}, 'subType': 'horizontalMediumAt2X', 'crop_name': 'horizontalMediumAt2X'}, {'rank': 0, 'subtype': 'hpLarge', 'caption': None, 'credit': None, 'type': 'image', 'url': 'images/2020/02/03/us/3onpolitics-pm-02/3onpolitics-pm-02-hpLarge.jpg', 'height': 287, 'width': 511, 'legacy': {}, 'subType': 'hpLarge', 'crop_name': 'hpLarge'}, {'rank': 0, 'subtype': 'largeWidescreen573', 'caption': None, 'credit': None, 'type': 'image', 'url': 'images/2020/02/03/us/3onpolitics-pm-02/3onpolitics-pm-02-largeWidescreen573.jpg', 'height': 322, 'width': 573, 'legacy': {}, 'subType': 'largeWidescreen573', 'crop_name': 'largeWidescreen573'}, {'rank': 0, 'subtype': 'largeWidescreen1050', 'caption': None, 'credit': None, 'type': 'image', 'url': 'images/2020/02/03/us/3onpolitics-pm-02/3onpolitics-pm-02-largeWidescreen1050.jpg', 'height': 590, 'width': 1050, 'legacy': {}, 'subType': 'largeWidescreen1050', 'crop_name': 'largeWidescreen1050'}, {'rank': 0, 'subtype': 'wide', 'caption': None, 'credit': None, 'type': 'image', 'url': 'images/2020/02/03/us/3onpolitics-pm-02/3onpolitics-pm-02-thumbWide.jpg', 'height': 126, 'width': 190, 'legacy': {'widewidth': 190, 'wideheight': 126, 'wide': 'images/2020/02/03/us/3onpolitics-pm-02/3onpolitics-pm-02-thumbWide.jpg'}, 'subType': 'wide', 'crop_name': 'thumbWide'}, {'rank': 0, 'subtype': 'videoThumb', 'caption': None, 'credit': None, 'type': 'image', 'url': 'images/2020/02/03/us/3onpolitics-pm-02/3onpolitics-pm-02-videoThumb.jpg', 'height': 50, 'width': 75, 'legacy': {}, 'subType': 'videoThumb', 'crop_name': 'videoThumb'}, {'rank': 0, 'subtype': 'videoLarge', 'caption': None, 'credit': None, 'type': 'image', 'url': 'images/2020/02/03/us/3onpolitics-pm-02/3onpolitics-pm-02-videoLarge.jpg', 'height': 507, 'width': 768, 'legacy': {}, 'subType': 'videoLarge', 'crop_name': 'videoLarge'}, {'rank': 0, 'subtype': 'mediumThreeByTwo210', 'caption': None, 'credit': None, 'type': 'image', 'url': 'images/2020/02/03/us/3onpolitics-pm-02/3onpolitics-pm-02-mediumThreeByTwo210.jpg', 'height': 140, 'width': 210, 'legacy': {}, 'subType': 'mediumThreeByTwo210', 'crop_name': 'mediumThreeByTwo210'}, {'rank': 0, 'subtype': 'mediumThreeByTwo225', 'caption': None, 'credit': None, 'type': 'image', 'url': 'images/2020/02/03/us/3onpolitics-pm-02/3onpolitics-pm-02-mediumThreeByTwo225.jpg', 'height': 150, 'width': 225, 'legacy': {}, 'subType': 'mediumThreeByTwo225', 'crop_name': 'mediumThreeByTwo225'}, {'rank': 0, 'subtype': 'mediumThreeByTwo440', 'caption': None, 'credit': None, 'type': 'image', 'url': 'images/2020/02/03/us/3onpolitics-pm-02/3onpolitics-pm-02-mediumThreeByTwo440.jpg', 'height': 293, 'width': 440, 'legacy': {}, 'subType': 'mediumThreeByTwo440', 'crop_name': 'mediumThreeByTwo440'}, {'rank': 0, 'subtype': 'mediumThreeByTwo252', 'caption': None, 'credit': None, 'type': 'image', 'url': 'images/2020/02/03/us/3onpolitics-pm-02/3onpolitics-pm-02-mediumThreeByTwo252.jpg', 'height': 168, 'width': 252, 'legacy': {}, 'subType': 'mediumThreeByTwo252', 'crop_name': 'mediumThreeByTwo252'}, {'rank': 0, 'subtype': 'mediumThreeByTwo378', 'caption': None, 'credit': None, 'type': 'image', 'url': 'images/2020/02/03/us/3onpolitics-pm-02/3onpolitics-pm-02-mediumThreeByTwo378.jpg', 'height': 252, 'width': 378, 'legacy': {}, 'subType': 'mediumThreeByTwo378', 'crop_name': 'mediumThreeByTwo378'}, {'rank': 0, 'subtype': 'threeByTwoLargeAt2X', 'caption': None, 'credit': None, 'type': 'image', 'url': 'images/2020/02/03/us/3onpolitics-pm-02/3onpolitics-pm-02-threeByTwoLargeAt2X.jpg', 'height': 999, 'width': 1499, 'legacy': {}, 'subType': 'threeByTwoLargeAt2X', 'crop_name': 'threeByTwoLargeAt2X'}, {'rank': 0, 'subtype': 'threeByTwoMediumAt2X', 'caption': None, 'credit': None, 'type': 'image', 'url': 'images/2020/02/03/us/3onpolitics-pm-02/3onpolitics-pm-02-threeByTwoMediumAt2X.jpg', 'height': 999, 'width': 1499, 'legacy': {}, 'subType': 'threeByTwoMediumAt2X', 'crop_name': 'threeByTwoMediumAt2X'}, {'rank': 0, 'subtype': 'threeByTwoSmallAt2X', 'caption': None, 'credit': None, 'type': 'image', 'url': 'images/2020/02/03/us/3onpolitics-pm-02/3onpolitics-pm-02-threeByTwoSmallAt2X.jpg', 'height': 400, 'width': 600, 'legacy': {}, 'subType': 'threeByTwoSmallAt2X', 'crop_name': 'threeByTwoSmallAt2X'}, {'rank': 0, 'subtype': 'articleInline', 'caption': None, 'credit': None, 'type': 'image', 'url': 'images/2020/02/03/us/3onpolitics-pm-02/3onpolitics-pm-02-articleInline.jpg', 'height': 121, 'width': 190, 'legacy': {}, 'subType': 'articleInline', 'crop_name': 'articleInline'}, {'rank': 0, 'subtype': 'hpSmall', 'caption': None, 'credit': None, 'type': 'image', 'url': 'images/2020/02/03/us/3onpolitics-pm-02/3onpolitics-pm-02-hpSmall.jpg', 'height': 104, 'width': 163, 'legacy': {}, 'subType': 'hpSmall', 'crop_name': 'hpSmall'}, {'rank': 0, 'subtype': 'blogSmallInline', 'caption': None, 'credit': None, 'type': 'image', 'url': 'images/2020/02/03/us/3onpolitics-pm-02/3onpolitics-pm-02-blogSmallInline.jpg', 'height': 96, 'width': 151, 'legacy': {}, 'subType': 'blogSmallInline', 'crop_name': 'blogSmallInline'}, {'rank': 0, 'subtype': 'mediumFlexible177', 'caption': None, 'credit': None, 'type': 'image', 'url': 'images/2020/02/03/us/3onpolitics-pm-02/3onpolitics-pm-02-mediumFlexible177.jpg', 'height': 113, 'width': 177, 'legacy': {}, 'subType': 'mediumFlexible177', 'crop_name': 'mediumFlexible177'}, {'rank': 0, 'subtype': 'videoSmall', 'caption': None, 'credit': None, 'type': 'image', 'url': 'images/2020/02/03/us/3onpolitics-pm-02/3onpolitics-pm-02-videoSmall.jpg', 'height': 281, 'width': 500, 'legacy': {}, 'subType': 'videoSmall', 'crop_name': 'videoSmall'}, {'rank': 0, 'subtype': 'videoHpMedium', 'caption': None, 'credit': None, 'type': 'image', 'url': 'images/2020/02/03/us/3onpolitics-pm-02/3onpolitics-pm-02-videoHpMedium.jpg', 'height': 211, 'width': 375, 'legacy': {}, 'subType': 'videoHpMedium', 'crop_name': 'videoHpMedium'}, {'rank': 0, 'subtype': 'videoSixteenByNine600', 'caption': None, 'credit': None, 'type': 'image', 'url': 'images/2020/02/03/us/3onpolitics-pm-02/3onpolitics-pm-02-videoSixteenByNine600.jpg', 'height': 338, 'width': 600, 'legacy': {}, 'subType': 'videoSixteenByNine600', 'crop_name': 'videoSixteenByNine600'}, {'rank': 0, 'subtype': 'videoSixteenByNine540', 'caption': None, 'credit': None, 'type': 'image', 'url': 'images/2020/02/03/us/3onpolitics-pm-02/3onpolitics-pm-02-videoSixteenByNine540.jpg', 'height': 304, 'width': 540, 'legacy': {}, 'subType': 'videoSixteenByNine540', 'crop_name': 'videoSixteenByNine540'}, {'rank': 0, 'subtype': 'videoSixteenByNine495', 'caption': None, 'credit': None, 'type': 'image', 'url': 'images/2020/02/03/us/3onpolitics-pm-02/3onpolitics-pm-02-videoSixteenByNine495.jpg', 'height': 278, 'width': 495, 'legacy': {}, 'subType': 'videoSixteenByNine495', 'crop_name': 'videoSixteenByNine495'}, {'rank': 0, 'subtype': 'videoSixteenByNine390', 'caption': None, 'credit': None, 'type': 'image', 'url': 'images/2020/02/03/us/3onpolitics-pm-02/3onpolitics-pm-02-videoSixteenByNine390.jpg', 'height': 219, 'width': 390, 'legacy': {}, 'subType': 'videoSixteenByNine390', 'crop_name': 'videoSixteenByNine390'}, {'rank': 0, 'subtype': 'videoSixteenByNine1050', 'caption': None, 'credit': None, 'type': 'image', 'url': 'images/2020/02/03/us/3onpolitics-pm-02/3onpolitics-pm-02-videoSixteenByNine1050.jpg', 'height': 591, 'width': 1050, 'legacy': {}, 'subType': 'videoSixteenByNine1050', 'crop_name': 'videoSixteenByNine1050'}, {'rank': 0, 'subtype': 'videoSixteenByNine480', 'caption': None, 'credit': None, 'type': 'image', 'url': 'images/2020/02/03/us/3onpolitics-pm-02/3onpolitics-pm-02-videoSixteenByNine480.jpg', 'height': 270, 'width': 480, 'legacy': {}, 'subType': 'videoSixteenByNine480', 'crop_name': 'videoSixteenByNine480'}, {'rank': 0, 'subtype': 'videoSixteenByNine310', 'caption': None, 'credit': None, 'type': 'image', 'url': 'images/2020/02/03/us/3onpolitics-pm-02/3onpolitics-pm-02-videoSixteenByNine310.jpg', 'height': 174, 'width': 310, 'legacy': {}, 'subType': 'videoSixteenByNine310', 'crop_name': 'videoSixteenByNine310'}, {'rank': 0, 'subtype': 'videoSixteenByNine225', 'caption': None, 'credit': None, 'type': 'image', 'url': 'images/2020/02/03/us/3onpolitics-pm-02/3onpolitics-pm-02-videoSixteenByNine225.jpg', 'height': 126, 'width': 225, 'legacy': {}, 'subType': 'videoSixteenByNine225', 'crop_name': 'videoSixteenByNine225'}, {'rank': 0, 'subtype': 'videoSixteenByNine96', 'caption': None, 'credit': None, 'type': 'image', 'url': 'images/2020/02/03/us/3onpolitics-pm-02/3onpolitics-pm-02-videoSixteenByNine96.jpg', 'height': 54, 'width': 96, 'legacy': {}, 'subType': 'videoSixteenByNine96', 'crop_name': 'videoSixteenByNine96'}, {'rank': 0, 'subtype': 'videoSixteenByNine768', 'caption': None, 'credit': None, 'type': 'image', 'url': 'images/2020/02/03/us/3onpolitics-pm-02/3onpolitics-pm-02-videoSixteenByNine768.jpg', 'height': 432, 'width': 768, 'legacy': {}, 'subType': 'videoSixteenByNine768', 'crop_name': 'videoSixteenByNine768'}, {'rank': 0, 'subtype': 'videoSixteenByNine150', 'caption': None, 'credit': None, 'type': 'image', 'url': 'images/2020/02/03/us/3onpolitics-pm-02/3onpolitics-pm-02-videoSixteenByNine150.jpg', 'height': 84, 'width': 150, 'legacy': {}, 'subType': 'videoSixteenByNine150', 'crop_name': 'videoSixteenByNine150'}, {'rank': 0, 'subtype': 'videoSixteenByNineJumbo1600', 'caption': None, 'credit': None, 'type': 'image', 'url': 'images/2020/02/03/us/3onpolitics-pm-02/3onpolitics-pm-02-videoSixteenByNineJumbo1600.jpg', 'height': 879, 'width': 1564, 'legacy': {}, 'subType': 'videoSixteenByNineJumbo1600', 'crop_name': 'videoSixteenByNineJumbo1600'}, {'rank': 0, 'subtype': 'miniMoth', 'caption': None, 'credit': None, 'type': 'image', 'url': 'images/2020/02/03/us/3onpolitics-pm-02/3onpolitics-pm-02-miniMoth.jpg', 'height': 70, 'width': 151, 'legacy': {}, 'subType': 'miniMoth', 'crop_name': 'miniMoth'}, {'rank': 0, 'subtype': 'windowsTile336H', 'caption': None, 'credit': None, 'type': 'image', 'url': 'images/2020/02/03/us/3onpolitics-pm-02/3onpolitics-pm-02-windowsTile336H.jpg', 'height': 336, 'width': 694, 'legacy': {}, 'subType': 'windowsTile336H', 'crop_name': 'windowsTile336H'}, {'rank': 0, 'subtype': 'videoFifteenBySeven1305', 'caption': None, 'credit': None, 'type': 'image', 'url': 'images/2020/02/03/us/3onpolitics-pm-02/3onpolitics-pm-02-videoFifteenBySeven1305.jpg', 'height': 609, 'width': 1305, 'legacy': {}, 'subType': 'videoFifteenBySeven1305', 'crop_name': 'videoFifteenBySeven1305'}, {'rank': 0, 'subtype': 'facebookJumbo', 'caption': None, 'credit': None, 'type': 'image', 'url': 'images/2020/02/03/us/3onpolitics-pm-02/3onpolitics-pm-02-facebookJumbo.jpg', 'height': 550, 'width': 1050, 'legacy': {}, 'subType': 'facebookJumbo', 'crop_name': 'facebookJumbo'}, {'rank': 0, 'subtype': 'watch308', 'caption': None, 'credit': None, 'type': 'image', 'url': 'images/2020/02/03/us/3onpolitics-pm-02/3onpolitics-pm-02-watch308.jpg', 'height': 348, 'width': 312, 'legacy': {}, 'subType': 'watch308', 'crop_name': 'watch308'}, {'rank': 0, 'subtype': 'watch268', 'caption': None, 'credit': None, 'type': 'image', 'url': 'images/2020/02/03/us/3onpolitics-pm-02/3onpolitics-pm-02-watch268.jpg', 'height': 303, 'width': 272, 'legacy': {}, 'subType': 'watch268', 'crop_name': 'watch268'}, {'rank': 0, 'subtype': 'mobileMasterAt3x', 'caption': None, 'credit': None, 'type': 'image', 'url': 'images/2020/02/03/us/3onpolitics-pm-02/3onpolitics-pm-02-mobileMasterAt3x.jpg', 'height': 999, 'width': 1564, 'legacy': {}, 'subType': 'mobileMasterAt3x', 'crop_name': 'mobileMasterAt3x'}]","[{'name': 'subject', 'value': 'Presidential Election of 2020', 'rank': 1, 'major': 'N'}]",2020-02-12T12:00:03+0000,article,Politics,U.S.,Politics,News,nyt://article/1e12f6c2-8ac3-51d1-8794-9d4fd1a6d85c,1099,nyt://article/1e12f6c2-8ac3-51d1-8794-9d4fd1a6d85c,On Politics: We Could Be Here Awhile,,,,,,,By Lisa Lerer,"[{'firstname': 'Lisa', 'middlename': None, 'lastname': 'Lerer', 'qualifier': None, 'title': None, 'role': 'reported', 'organization': '', 'rank': 1}]",,,
