,abstract,web_url,snippet,lead_paragraph,source,multimedia,keywords,pub_date,document_type,news_desk,section_name,subsection_name,type_of_material,_id,word_count,uri,headline_main,headline_kicker,headline_content_kicker,headline_print_headline,headline_name,headline_seo,headline_sub,byline_original,byline_person,byline_organization,print_section,print_page
0,Utah Democrat Ben McAdams stepped into a small town city council chamber just outside Salt Lake City and took a deep breath.,https://www.nytimes.com/aponline/2019/12/16/us/politics/ap-us-trump-impeachment-democrats.html,Utah Democrat Ben McAdams stepped into a small town city council chamber just outside Salt Lake City and took a deep breath.,WASHINGTON — Utah Democrat Ben McAdams stepped into a small town city council chamber just outside Salt Lake City and took a deep breath.,AP,[],[],2019-12-17T00:00:41+0000,article,None,U.S.,Politics,News,nyt://article/9fbd0339-6ba9-5166-aca1-8cf9e33932de,806,nyt://article/9fbd0339-6ba9-5166-aca1-8cf9e33932de,Vulnerable Democrats Fall in Line Behind Trump Impeachment,,,Vulnerable Democrats Fall in Line Behind Trump Impeachment,,,,By The Associated Press,[],The Associated Press,,
1,"Democratic Representative Elissa Slotkin, co-author of a column that helped launch the impeachment inquiry of President Donald Trump, ended months of uncertainty on Monday by telling voters at a noisy town hall meeting that she will vote for impeachment.",https://www.nytimes.com/reuters/2019/12/16/world/europe/16reuters-usa-trump-impeachment-democrats.html,"Democratic Representative Elissa Slotkin, co-author of a column that helped launch the impeachment inquiry of President Donald Trump, ended months of uncertainty on Monday by telling voters at a noisy town hall meeting that she will vote for impea...","ROCHESTER, Mich. — Democratic Representative Elissa Slotkin, co-author of a column that helped launch the impeachment inquiry of President Donald Trump, ended months of uncertainty on Monday by telling voters at a noisy town hall meeting that she will vote for impeachment.",Reuters,[],[],2019-12-16T21:30:40+0000,article,None,World,Europe,News,nyt://article/9fbd6352-c8dd-58d7-9b30-384626cd7060,720,nyt://article/9fbd6352-c8dd-58d7-9b30-384626cd7060,"At Noisy Town Hall, a Vulnerable U.S. Democrat Says 'Yes' to Impeaching Trump",,,"At Noisy Town Hall, a Vulnerable U.S. Democrat Says 'Yes' to Impeaching Trump",,,,By Reuters,[],Reuters,,
2,"With the House of Representatives racing toward an impeachment vote this week, President Donald Trump will likely become the third president to face a Senate trial to determine whether he should be removed from office,.",https://www.nytimes.com/aponline/2019/12/16/us/politics/ap-us-ap-explains-impeachment-trial.html,"With the House of Representatives racing toward an impeachment vote this week, President Donald Trump will likely become the third president to face a Senate trial to determine whether he should be removed from office,.","WASHINGTON — With the House of Representatives racing toward an impeachment vote this week, President Donald Trump will likely become the third president to face a Senate trial to determine whether he should be removed from office,.",AP,[],[],2019-12-16T21:15:37+0000,article,None,U.S.,Politics,News,nyt://article/3c8a9fc2-2f60-5132-9353-412f07707073,1740,nyt://article/3c8a9fc2-2f60-5132-9353-412f07707073,AP Explains: What a Trump Impeachment Trial Might Look Like,,,AP Explains: What a Trump Impeachment Trial Might Look Like,,,,By The Associated Press,[],The Associated Press,,
3,U.S. Senate Democratic leader Chuck Schumer proposed in a letter released on Sunday that at least four witnesses including acting White House Chief of Staff Mick Mulvaney and former national security adviser John Bolton be subpoenaed to testify in the expected impeachment trial of President Donald Trump.,https://www.nytimes.com/reuters/2019/12/16/world/europe/16reuters-usa-trump-impeachment-schumer.html,U.S. Senate Democratic leader Chuck Schumer proposed in a letter released on Sunday that at least four witnesses including acting White House Chief of Staff Mick Mulvaney and former national security adviser John Bolton be subpoenaed to testify in...,WASHINGTON — U.S. Senate Democratic leader Chuck Schumer proposed in a letter released on Sunday that at least four witnesses including acting White House Chief of Staff Mick Mulvaney and former national security adviser John Bolton be subpoenaed to testify in the expected impeachment trial of President Donald Trump.,Reuters,[],[],2019-12-16T20:45:48+0000,article,None,World,Europe,News,nyt://article/cf45c7f2-4432-5c50-9f92-406e8cfda7cc,279,nyt://article/cf45c7f2-4432-5c50-9f92-406e8cfda7cc,"U.S. Senate's Schumer Wants Mulvaney, Bolton, Others to Testify in Impeachment Trial",,,"U.S. Senate's Schumer Wants Mulvaney, Bolton, Others to Testify in Impeachment Trial",,,,By Reuters,[],Reuters,,
