,abstract,web_url,snippet,lead_paragraph,source,multimedia,keywords,pub_date,document_type,news_desk,section_name,subsection_name,type_of_material,_id,word_count,uri,headline_main,headline_kicker,headline_content_kicker,headline_print_headline,headline_name,headline_seo,headline_sub,byline_original,byline_person,byline_organization,print_section,print_page
0,"With the Nevada caucuses less than a week away, Democratic presidential candidates campaigning were fixated on a rival who wasn't contesting the state. ",https://www.nytimes.com/aponline/2020/02/16/us/politics/ap-us-election-2020.html,"With the Nevada caucuses less than a week away, Democratic presidential candidates campaigning were fixated on a rival who wasn't contesting the state. ","CARSON CITY, Nev. — With the Nevada caucuses less than a week away, Democratic presidential candidates campaigning were fixated on a rival who wasn't contesting the state. ",AP,[],[],2020-02-16T23:26:13+0000,article,None,U.S.,Politics,News,nyt://article/be1ccce7-adc5-5830-9ed1-3e15cdbfcd1b,1012,nyt://article/be1ccce7-adc5-5830-9ed1-3e15cdbfcd1b,Bloomberg Takes Veiled Swipe at Rival's Aggressive Loyalists,,,Bloomberg Takes Veiled Swipe at Rival's Aggressive Loyalists,,,,By The Associated Press,[],The Associated Press,,
1,"Ahead of this month’s crucial South Carolina primary, the wife of presidential candidate Tom Steyer said that the foundation she runs is interested in considering an investment proposal from one of the state’s largest black church congregations. But she said the foundation wouldn’t act on it until after the primary.",https://www.nytimes.com/aponline/2020/02/16/us/politics/ap-us-election-2020-steyer.html,"Ahead of this month’s crucial South Carolina primary, the wife of presidential candidate Tom Steyer said that the foundation she runs is interested in considering an investment proposal from one of the state’s largest black church congregations. B...","COLUMBIA, S.C. — Ahead of this month’s crucial South Carolina primary, the wife of presidential candidate Tom Steyer said that the foundation she runs is interested in considering an investment proposal from one of the state’s largest black church congregations. But she said the foundation wouldn’t act on it until after the primary.",AP,[],[],2020-02-16T22:26:11+0000,article,None,U.S.,Politics,News,nyt://article/465c27cf-e220-5561-9a17-59e925223315,604,nyt://article/465c27cf-e220-5561-9a17-59e925223315,Steyer Foundation Mulling SC Investments-After the Primary,,,Steyer Foundation Mulling SC Investments-After the Primary,,,,By The Associated Press,[],The Associated Press,,
