,abstract,web_url,snippet,lead_paragraph,source,multimedia,keywords,pub_date,document_type,news_desk,section_name,type_of_material,_id,word_count,uri,headline_main,headline_kicker,headline_content_kicker,headline_print_headline,headline_name,headline_seo,headline_sub,byline_original,byline_person,byline_organization,subsection_name,print_section,print_page
6,"U.S. Democrats on Thursday pressed the Republican-controlled Senate to call Donald Trump's top lieutenants to testify in its trial of the impeached president, as they sought to focus attention on the trial ahead of the 2020 presidential election.",https://www.nytimes.com/reuters/2019/12/19/world/europe/19reuters-usa-trump-impeachment.html,"U.S. Democrats on Thursday pressed the Republican-controlled Senate to call Donald Trump's top lieutenants to testify in its trial of the impeached president, as they sought to focus attention on the trial ahead of the 2020 presidential election.","WASHINGTON — U.S. Democrats on Thursday pressed the Republican-controlled Senate to call Donald Trump's top lieutenants to testify in its trial of the impeached president, as they sought to focus attention on the trial ahead of the 2020 presidential election.",Reuters,[],[],2019-12-19T16:58:09+0000,article,None,World,News,nyt://article/ac75844d-612e-5a4b-abe7-6b6b27386346,930,nyt://article/ac75844d-612e-5a4b-abe7-6b6b27386346,Democrats Seek High-Profile Trial for Trump in Senate,,,Democrats Seek High-Profile Trial for Trump in Senate,,,,By Reuters,[],Reuters,Europe,,
7,"Rising Democratic candidate Pete Buttigieg came under attack during a debate among U.S. presidential hopefuls on Thursday, as his rivals questioned his lack of Washington experience and criticized his fundraising from wealthy donors.",https://www.nytimes.com/reuters/2019/12/19/world/europe/19reuters-usa-election-debate.html,"Rising Democratic candidate Pete Buttigieg came under attack during a debate among U.S. presidential hopefuls on Thursday, as his rivals questioned his lack of Washington experience and criticized his fundraising from wealthy donors.","LOS ANGELES — Rising Democratic candidate Pete Buttigieg came under attack during a debate among U.S. presidential hopefuls on Thursday, as his rivals questioned his lack of Washington experience and criticized his fundraising from wealthy donors.",Reuters,[],[],2019-12-19T16:55:01+0000,article,None,World,News,nyt://article/82d228ea-e45f-5d4c-a4d6-6552b31be562,921,nyt://article/82d228ea-e45f-5d4c-a4d6-6552b31be562,Wine Caves and Billionaires: Buttigieg Under Fire Over Fundraising at Democratic Debate,,,Wine Caves and Billionaires: Buttigieg Under Fire Over Fundraising at Democratic Debate,,,,By Reuters,[],Reuters,Europe,,
8,A new survey finds that Democrats haven’t fully embraced progressive policy proposals like free college and Medicare for all.,https://www.nytimes.com/2019/12/19/business/economy/democratic-voters-free-college.html,A new survey finds that Democrats haven’t fully embraced progressive policy proposals like free college and Medicare for all.,"Progressive policy ideas have dominated the early stages of the Democratic primary campaign. But as candidates gather in Los Angeles for another debate on Thursday evening, Democratic voters may be seeking more moderate options.",The New York Times,"[{'rank': 0, 'subtype': 'xlarge', 'caption': None, 'credit': None, 'type': 'image', 'url': 'images/2019/12/19/business/19survey4/19survey4-articleLarge.jpg', 'height': 400, 'width': 600, 'legacy': {'xlarge': 'images/2019/12/19/business/19survey4/19survey4-articleLarge.jpg', 'xlargewidth': 600, 'xlargeheight': 400}, 'subType': 'xlarge', 'crop_name': 'articleLarge'}, {'rank': 0, 'subtype': 'popup', 'caption': None, 'credit': None, 'type': 'image', 'url': 'images/2019/12/19/business/19survey4/19survey4-popup.jpg', 'height': 433, 'width': 650, 'legacy': {}, 'subType': 'popup', 'crop_name': 'popup'}, {'rank': 0, 'subtype': 'blog480', 'caption': None, 'credit': None, 'type': 'image', 'url': 'images/2019/12/19/business/19survey4/19survey4-blog480.jpg', 'height': 320, 'width': 480, 'legacy': {}, 'subType': 'blog480', 'crop_name': 'blog480'}, {'rank': 0, 'subtype': 'blog533', 'caption': None, 'credit': None, 'type': 'image', 'url': 'images/2019/12/19/business/19survey4/19survey4-blog533.jpg', 'height': 355, 'width': 533, 'legacy': {}, 'subType': 'blog533', 'crop_name': 'blog533'}, {'rank': 0, 'subtype': 'blog427', 'caption': None, 'credit': None, 'type': 'image', 'url': 'images/2019/12/19/business/19survey4/19survey4-blog427.jpg', 'height': 285, 'width': 427, 'legacy': {}, 'subType': 'blog427', 'crop_name': 'blog427'}, {'rank': 0, 'subtype': 'tmagSF', 'caption': None, 'credit': None, 'type': 'image', 'url': 'images/2019/12/19/business/19survey4/19survey4-tmagSF.jpg', 'height': 241, 'width': 362, 'legacy': {}, 'subType': 'tmagSF', 'crop_name': 'tmagSF'}, {'rank': 0, 'subtype': 'tmagArticle', 'caption': None, 'credit': None, 'type': 'image', 'url': 'images/2019/12/19/business/19survey4/19survey4-tmagArticle.jpg', 'height': 395, 'width': 592, 'legacy': {}, 'subType': 'tmagArticle', 'crop_name': 'tmagArticle'}, {'rank': 0, 'subtype': 'slide', 'caption': None, 'credit': None, 'type': 'image', 'url': 'images/2019/12/19/business/19survey4/19survey4-slide.jpg', 'height': 400, 'width': 600, 'legacy': {}, 'subType': 'slide', 'crop_name': 'slide'}, {'rank': 0, 'subtype': 'jumbo', 'caption': None, 'credit': None, 'type': 'image', 'url': 'images/2019/12/19/business/19survey4/19survey4-jumbo.jpg', 'height': 682, 'width': 1024, 'legacy': {}, 'subType': 'jumbo', 'crop_name': 'jumbo'}, {'rank': 0, 'subtype': 'superJumbo', 'caption': None, 'credit': None, 'type': 'image', 'url': 'images/2019/12/19/business/19survey4/19survey4-superJumbo.jpg', 'height': 1365, 'width': 2048, 'legacy': {}, 'subType': 'superJumbo', 'crop_name': 'superJumbo'}, {'rank': 0, 'subtype': 'blog225', 'caption': None, 'credit': None, 'type': 'image', 'url': 'images/2019/12/19/business/19survey4/19survey4-blog225.jpg', 'height': 150, 'width': 225, 'legacy': {}, 'subType': 'blog225', 'crop_name': 'blog225'}, {'rank': 0, 'subtype': 'master1050', 'caption': None, 'credit': None, 'type': 'image', 'url': 'images/2019/12/19/business/19survey4/19survey4-master1050.jpg', 'height': 700, 'width': 1050, 'legacy': {}, 'subType': 'master1050', 'crop_name': 'master1050'}, {'rank': 0, 'subtype': 'master675', 'caption': None, 'credit': None, 'type': 'image', 'url': 'images/2019/12/19/business/19survey4/19survey4-master675.jpg', 'height': 450, 'width': 675, 'legacy': {}, 'subType': 'master675', 'crop_name': 'master675'}, {'rank': 0, 'subtype': 'master495', 'caption': None, 'credit': None, 'type': 'image', 'url': 'images/2019/12/19/business/19survey4/19survey4-master495.jpg', 'height': 330, 'width': 495, 'legacy': {}, 'subType': 'master495', 'crop_name': 'master495'}, {'rank': 0, 'subtype': 'master180', 'caption': None, 'credit': None, 'type': 'image', 'url': 'images/2019/12/19/business/19survey4/19survey4-master180.jpg', 'height': 120, 'width': 180, 'legacy': {}, 'subType': 'master180', 'crop_name': 'master180'}, {'rank': 0, 'subtype': 'master315', 'caption': None, 'credit': None, 'type': 'image', 'url': 'images/2019/12/19/business/19survey4/19survey4-master315.jpg', 'height': 210, 'width': 315, 'legacy': {}, 'subType': 'master315', 'crop_name': 'master315'}, {'rank': 0, 'subtype': 'master768', 'caption': None, 'credit': None, 'type': 'image', 'url': 'images/2019/12/19/business/19survey4/19survey4-master768.jpg', 'height': 512, 'width': 768, 'legacy': {}, 'subType': 'master768', 'crop_name': 'master768'}, {'rank': 0, 'subtype': 'thumbnail', 'caption': None, 'credit': None, 'type': 'image', 'url': 'images/2019/12/19/business/19survey4/19survey4-thumbStandard.jpg', 'height': 75, 'width': 75, 'legacy': {'thumbnail': 'images/2019/12/19/business/19survey4/19survey4-thumbStandard.jpg', 'thumbnailwidth': 75, 'thumbnailheight': 75}, 'subType': 'thumbnail', 'crop_name': 'thumbStandard'}, {'rank': 0, 'subtype': 'blogSmallThumb', 'caption': None, 'credit': None, 'type': 'image', 'url': 'images/2019/12/19/business/19survey4/19survey4-blogSmallThumb.jpg', 'height': 50, 'width': 50, 'legacy': {}, 'subType': 'blogSmallThumb', 'crop_name': 'blogSmallThumb'}, {'rank': 0, 'subtype': 'thumbLarge', 'caption': None, 'credit': None, 'type': 'image', 'url': 'images/2019/12/19/business/19survey4/19survey4-thumbLarge.jpg', 'height': 150, 'width': 150, 'legacy': {}, 'subType': 'thumbLarge', 'crop_name': 'thumbLarge'}, {'rank': 0, 'subtype': 'smallSquare168', 'caption': None, 'credit': None, 'type': 'image', 'url': 'images/2019/12/19/business/19survey4/19survey4-smallSquare168.jpg', 'height': 168, 'width': 168, 'legacy': {}, 'subType': 'smallSquare168', 'crop_name': 'smallSquare168'}, {'rank': 0, 'subtype': 'smallSquare252', 'caption': None, 'credit': None, 'type': 'image', 'url': 'images/2019/12/19/business/19survey4/19survey4-smallSquare252.jpg', 'height': 252, 'width': 252, 'legacy': {}, 'subType': 'smallSquare252', 'crop_name': 'smallSquare252'}, {'rank': 0, 'subtype': 'square320', 'caption': None, 'credit': None, 'type': 'image', 'url': 'images/2019/12/19/business/19survey4/19survey4-square320.jpg', 'height': 320, 'width': 320, 'legacy': {}, 'subType': 'square320', 'crop_name': 'square320'}, {'rank': 0, 'subtype': 'moth', 'caption': None, 'credit': None, 'type': 'image', 'url': 'images/2019/12/19/business/19survey4/19survey4-moth.jpg', 'height': 151, 'width': 151, 'legacy': {}, 'subType': 'moth', 'crop_name': 'moth'}, {'rank': 0, 'subtype': 'filmstrip', 'caption': None, 'credit': None, 'type': 'image', 'url': 'images/2019/12/19/business/19survey4/19survey4-filmstrip.jpg', 'height': 190, 'width': 190, 'legacy': {}, 'subType': 'filmstrip', 'crop_name': 'filmstrip'}, {'rank': 0, 'subtype': 'square640', 'caption': None, 'credit': None, 'type': 'image', 'url': 'images/2019/12/19/business/19survey4/19survey4-square640.jpg', 'height': 640, 'width': 640, 'legacy': {}, 'subType': 'square640', 'crop_name': 'square640'}, {'rank': 0, 'subtype': 'mediumSquare149', 'caption': None, 'credit': None, 'type': 'image', 'url': 'images/2019/12/19/business/19survey4/19survey4-mediumSquare149.jpg', 'height': 149, 'width': 149, 'legacy': {}, 'subType': 'mediumSquare149', 'crop_name': 'mediumSquare149'}, {'rank': 0, 'subtype': 'sfSpan', 'caption': None, 'credit': None, 'type': 'image', 'url': 'images/2019/12/19/business/19survey4/19survey4-sfSpan.jpg', 'height': 263, 'width': 395, 'legacy': {}, 'subType': 'sfSpan', 'crop_name': 'sfSpan'}, {'rank': 0, 'subtype': 'largeHorizontal375', 'caption': None, 'credit': None, 'type': 'image', 'url': 'images/2019/12/19/business/19survey4/19survey4-largeHorizontal375.jpg', 'height': 250, 'width': 375, 'legacy': {}, 'subType': 'largeHorizontal375', 'crop_name': 'largeHorizontal375'}, {'rank': 0, 'subtype': 'largeHorizontalJumbo', 'caption': None, 'credit': None, 'type': 'image', 'url': 'images/2019/12/19/business/19survey4/19survey4-largeHorizontalJumbo.jpg', 'height': 682, 'width': 1024, 'legacy': {}, 'subType': 'largeHorizontalJumbo', 'crop_name': 'largeHorizontalJumbo'}, {'rank': 0, 'subtype': 'horizontalMediumAt2X', 'caption': None, 'credit': None, 'type': 'image', 'url': 'images/2019/12/19/business/19survey4/19survey4-horizontalMediumAt2X.jpg', 'height': 5363, 'width': 8047, 'legacy': {}, 'subType': 'horizontalMediumAt2X', 'crop_name': 'horizontalMediumAt2X'}, {'rank': 0, 'subtype': 'hpLarge', 'caption': None, 'credit': None, 'type': 'image', 'url': 'images/2019/12/19/business/19survey4/19survey4-hpLarge.jpg', 'height': 287, 'width': 511, 'legacy': {}, 'subType': 'hpLarge', 'crop_name': 'hpLarge'}, {'rank': 0, 'subtype': 'largeWidescreen573', 'caption': None, 'credit': None, 'type': 'image', 'url': 'images/2019/12/19/business/19survey4/19survey4-largeWidescreen573.jpg', 'height': 322, 'width': 573, 'legacy': {}, 'subType': 'largeWidescreen573', 'crop_name': 'largeWidescreen573'}, {'rank': 0, 'subtype': 'largeWidescreen1050', 'caption': None, 'credit': None, 'type': 'image', 'url': 'images/2019/12/19/business/19survey4/19survey4-largeWidescreen1050.jpg', 'height': 590, 'width': 1050, 'legacy': {}, 'subType': 'largeWidescreen1050', 'crop_name': 'largeWidescreen1050'}, {'rank': 0, 'subtype': 'wide', 'caption': None, 'credit': None, 'type': 'image', 'url': 'images/2019/12/19/business/19survey4/19survey4-thumbWide-v2.jpg', 'height': 126, 'width': 190, 'legacy': {'widewidth': 190, 'wideheight': 126, 'wide': 'images/2019/12/19/business/19survey4/19survey4-thumbWide-v2.jpg'}, 'subType': 'wide', 'crop_name': 'thumbWide'}, {'rank': 0, 'subtype': 'videoThumb', 'caption': None, 'credit': None, 'type': 'image', 'url': 'images/2019/12/19/business/19survey4/19survey4-videoThumb-v2.jpg', 'height': 50, 'width': 75, 'legacy': {}, 'subType': 'videoThumb', 'crop_name': 'videoThumb'}, {'rank': 0, 'subtype': 'videoLarge', 'caption': None, 'credit': None, 'type': 'image', 'url': 'images/2019/12/19/business/19survey4/19survey4-videoLarge-v2.jpg', 'height': 507, 'width': 768, 'legacy': {}, 'subType': 'videoLarge', 'crop_name': 'videoLarge'}, {'rank': 0, 'subtype': 'mediumThreeByTwo210', 'caption': None, 'credit': None, 'type': 'image', 'url': 'images/2019/12/19/business/19survey4/19survey4-mediumThreeByTwo210-v2.jpg', 'height': 140, 'width': 210, 'legacy': {}, 'subType': 'mediumThreeByTwo210', 'crop_name': 'mediumThreeByTwo210'}, {'rank': 0, 'subtype': 'mediumThreeByTwo225', 'caption': None, 'credit': None, 'type': 'image', 'url': 'images/2019/12/19/business/19survey4/19survey4-mediumThreeByTwo225-v2.jpg', 'height': 150, 'width': 225, 'legacy': {}, 'subType': 'mediumThreeByTwo225', 'crop_name': 'mediumThreeByTwo225'}, {'rank': 0, 'subtype': 'mediumThreeByTwo440', 'caption': None, 'credit': None, 'type': 'image', 'url': 'images/2019/12/19/business/19survey4/19survey4-mediumThreeByTwo440-v2.jpg', 'height': 293, 'width': 440, 'legacy': {}, 'subType': 'mediumThreeByTwo440', 'crop_name': 'mediumThreeByTwo440'}, {'rank': 0, 'subtype': 'mediumThreeByTwo252', 'caption': None, 'credit': None, 'type': 'image', 'url': 'images/2019/12/19/business/19survey4/19survey4-mediumThreeByTwo252-v2.jpg', 'height': 168, 'width': 252, 'legacy': {}, 'subType': 'mediumThreeByTwo252', 'crop_name': 'mediumThreeByTwo252'}, {'rank': 0, 'subtype': 'mediumThreeByTwo378', 'caption': None, 'credit': None, 'type': 'image', 'url': 'images/2019/12/19/business/19survey4/19survey4-mediumThreeByTwo378-v2.jpg', 'height': 252, 'width': 378, 'legacy': {}, 'subType': 'mediumThreeByTwo378', 'crop_name': 'mediumThreeByTwo378'}, {'rank': 0, 'subtype': 'threeByTwoLargeAt2X', 'caption': None, 'credit': None, 'type': 'image', 'url': 'images/2019/12/19/business/19survey4/19survey4-threeByTwoLargeAt2X-v2.jpg', 'height': 5324, 'width': 7987, 'legacy': {}, 'subType': 'threeByTwoLargeAt2X', 'crop_name': 'threeByTwoLargeAt2X'}, {'rank': 0, 'subtype': 'threeByTwoMediumAt2X', 'caption': None, 'credit': None, 'type': 'image', 'url': 'images/2019/12/19/business/19survey4/19survey4-threeByTwoMediumAt2X-v2.jpg', 'height': 1000, 'width': 1500, 'legacy': {}, 'subType': 'threeByTwoMediumAt2X', 'crop_name': 'threeByTwoMediumAt2X'}, {'rank': 0, 'subtype': 'threeByTwoSmallAt2X', 'caption': None, 'credit': None, 'type': 'image', 'url': 'images/2019/12/19/business/19survey4/19survey4-threeByTwoSmallAt2X-v2.jpg', 'height': 400, 'width': 600, 'legacy': {}, 'subType': 'threeByTwoSmallAt2X', 'crop_name': 'threeByTwoSmallAt2X'}, {'rank': 0, 'subtype': 'articleInline', 'caption': None, 'credit': None, 'type': 'image', 'url': 'images/2019/12/19/business/19survey4/19survey4-articleInline.jpg', 'height': 127, 'width': 190, 'legacy': {}, 'subType': 'articleInline', 'crop_name': 'articleInline'}, {'rank': 0, 'subtype': 'hpSmall', 'caption': None, 'credit': None, 'type': 'image', 'url': 'images/2019/12/19/business/19survey4/19survey4-hpSmall.jpg', 'height': 109, 'width': 163, 'legacy': {}, 'subType': 'hpSmall', 'crop_name': 'hpSmall'}, {'rank': 0, 'subtype': 'blogSmallInline', 'caption': None, 'credit': None, 'type': 'image', 'url': 'images/2019/12/19/business/19survey4/19survey4-blogSmallInline.jpg', 'height': 101, 'width': 151, 'legacy': {}, 'subType': 'blogSmallInline', 'crop_name': 'blogSmallInline'}, {'rank': 0, 'subtype': 'mediumFlexible177', 'caption': None, 'credit': None, 'type': 'image', 'url': 'images/2019/12/19/business/19survey4/19survey4-mediumFlexible177.jpg', 'height': 118, 'width': 177, 'legacy': {}, 'subType': 'mediumFlexible177', 'crop_name': 'mediumFlexible177'}, {'rank': 0, 'subtype': 'videoSmall', 'caption': None, 'credit': None, 'type': 'image', 'url': 'images/2019/12/19/business/19survey4/19survey4-videoSmall.jpg', 'height': 281, 'width': 500, 'legacy': {}, 'subType': 'videoSmall', 'crop_name': 'videoSmall'}, {'rank': 0, 'subtype': 'videoHpMedium', 'caption': None, 'credit': None, 'type': 'image', 'url': 'images/2019/12/19/business/19survey4/19survey4-videoHpMedium.jpg', 'height': 211, 'width': 375, 'legacy': {}, 'subType': 'videoHpMedium', 'crop_name': 'videoHpMedium'}, {'rank': 0, 'subtype': 'videoSixteenByNine600', 'caption': None, 'credit': None, 'type': 'image', 'url': 'images/2019/12/19/business/19survey4/19survey4-videoSixteenByNine600.jpg', 'height': 338, 'width': 600, 'legacy': {}, 'subType': 'videoSixteenByNine600', 'crop_name': 'videoSixteenByNine600'}, {'rank': 0, 'subtype': 'videoSixteenByNine540', 'caption': None, 'credit': None, 'type': 'image', 'url': 'images/2019/12/19/business/19survey4/19survey4-videoSixteenByNine540.jpg', 'height': 304, 'width': 540, 'legacy': {}, 'subType': 'videoSixteenByNine540', 'crop_name': 'videoSixteenByNine540'}, {'rank': 0, 'subtype': 'videoSixteenByNine495', 'caption': None, 'credit': None, 'type': 'image', 'url': 'images/2019/12/19/business/19survey4/19survey4-videoSixteenByNine495.jpg', 'height': 278, 'width': 495, 'legacy': {}, 'subType': 'videoSixteenByNine495', 'crop_name': 'videoSixteenByNine495'}, {'rank': 0, 'subtype': 'videoSixteenByNine390', 'caption': None, 'credit': None, 'type': 'image', 'url': 'images/2019/12/19/business/19survey4/19survey4-videoSixteenByNine390.jpg', 'height': 219, 'width': 390, 'legacy': {}, 'subType': 'videoSixteenByNine390', 'crop_name': 'videoSixteenByNine390'}, {'rank': 0, 'subtype': 'videoSixteenByNine1050', 'caption': None, 'credit': None, 'type': 'image', 'url': 'images/2019/12/19/business/19survey4/19survey4-videoSixteenByNine1050.jpg', 'height': 591, 'width': 1050, 'legacy': {}, 'subType': 'videoSixteenByNine1050', 'crop_name': 'videoSixteenByNine1050'}, {'rank': 0, 'subtype': 'videoSixteenByNine480', 'caption': None, 'credit': None, 'type': 'image', 'url': 'images/2019/12/19/business/19survey4/19survey4-videoSixteenByNine480.jpg', 'height': 270, 'width': 480, 'legacy': {}, 'subType': 'videoSixteenByNine480', 'crop_name': 'videoSixteenByNine480'}, {'rank': 0, 'subtype': 'videoSixteenByNine310', 'caption': None, 'credit': None, 'type': 'image', 'url': 'images/2019/12/19/business/19survey4/19survey4-videoSixteenByNine310.jpg', 'height': 174, 'width': 310, 'legacy': {}, 'subType': 'videoSixteenByNine310', 'crop_name': 'videoSixteenByNine310'}, {'rank': 0, 'subtype': 'videoSixteenByNine225', 'caption': None, 'credit': None, 'type': 'image', 'url': 'images/2019/12/19/business/19survey4/19survey4-videoSixteenByNine225.jpg', 'height': 126, 'width': 225, 'legacy': {}, 'subType': 'videoSixteenByNine225', 'crop_name': 'videoSixteenByNine225'}, {'rank': 0, 'subtype': 'videoSixteenByNine96', 'caption': None, 'credit': None, 'type': 'image', 'url': 'images/2019/12/19/business/19survey4/19survey4-videoSixteenByNine96.jpg', 'height': 54, 'width': 96, 'legacy': {}, 'subType': 'videoSixteenByNine96', 'crop_name': 'videoSixteenByNine96'}, {'rank': 0, 'subtype': 'videoSixteenByNine3000', 'caption': None, 'credit': None, 'type': 'image', 'url': 'images/2019/12/19/business/19survey4/19survey4-videoSixteenByNine3000.jpg', 'height': 1687, 'width': 3000, 'legacy': {}, 'subType': 'videoSixteenByNine3000', 'crop_name': 'videoSixteenByNine3000'}, {'rank': 0, 'subtype': 'videoSixteenByNine768', 'caption': None, 'credit': None, 'type': 'image', 'url': 'images/2019/12/19/business/19survey4/19survey4-videoSixteenByNine768.jpg', 'height': 432, 'width': 768, 'legacy': {}, 'subType': 'videoSixteenByNine768', 'crop_name': 'videoSixteenByNine768'}, {'rank': 0, 'subtype': 'videoSixteenByNine150', 'caption': None, 'credit': None, 'type': 'image', 'url': 'images/2019/12/19/business/19survey4/19survey4-videoSixteenByNine150.jpg', 'height': 84, 'width': 150, 'legacy': {}, 'subType': 'videoSixteenByNine150', 'crop_name': 'videoSixteenByNine150'}, {'rank': 0, 'subtype': 'videoSixteenByNineJumbo1600', 'caption': None, 'credit': None, 'type': 'image', 'url': 'images/2019/12/19/business/19survey4/19survey4-videoSixteenByNineJumbo1600.jpg', 'height': 900, 'width': 1600, 'legacy': {}, 'subType': 'videoSixteenByNineJumbo1600', 'crop_name': 'videoSixteenByNineJumbo1600'}, {'rank': 0, 'subtype': 'miniMoth', 'caption': None, 'credit': None, 'type': 'image', 'url': 'images/2019/12/19/business/19survey4/19survey4-miniMoth.jpg', 'height': 70, 'width': 151, 'legacy': {}, 'subType': 'miniMoth', 'crop_name': 'miniMoth'}, {'rank': 0, 'subtype': 'windowsTile336H', 'caption': None, 'credit': None, 'type': 'image', 'url': 'images/2019/12/19/business/19survey4/19survey4-windowsTile336H.jpg', 'height': 336, 'width': 694, 'legacy': {}, 'subType': 'windowsTile336H', 'crop_name': 'windowsTile336H'}, {'rank': 0, 'subtype': 'videoFifteenBySeven1305', 'caption': None, 'credit': None, 'type': 'image', 'url': 'images/2019/12/19/business/19survey4/19survey4-videoFifteenBySeven1305.jpg', 'height': 609, 'width': 1305, 'legacy': {}, 'subType': 'videoFifteenBySeven1305', 'crop_name': 'videoFifteenBySeven1305'}, {'rank': 0, 'subtype': 'videoFifteenBySeven2610', 'caption': None, 'credit': None, 'type': 'image', 'url': 'images/2019/12/19/business/19survey4/19survey4-videoFifteenBySeven2610.jpg', 'height': 1218, 'width': 2610, 'legacy': {}, 'subType': 'videoFifteenBySeven2610', 'crop_name': 'videoFifteenBySeven2610'}, {'rank': 0, 'subtype': 'facebookJumbo', 'caption': None, 'credit': None, 'type': 'image', 'url': 'images/2019/12/19/business/19survey4/19survey4-facebookJumbo.jpg', 'height': 549, 'width': 1050, 'legacy': {}, 'subType': 'facebookJumbo', 'crop_name': 'facebookJumbo'}, {'rank': 0, 'subtype': 'watch308', 'caption': None, 'credit': None, 'type': 'image', 'url': 'images/2019/12/19/business/19survey4/19survey4-watch308.jpg', 'height': 348, 'width': 312, 'legacy': {}, 'subType': 'watch308', 'crop_name': 'watch308'}, {'rank': 0, 'subtype': 'watch268', 'caption': None, 'credit': None, 'type': 'image', 'url': 'images/2019/12/19/business/19survey4/19survey4-watch268.jpg', 'height': 303, 'width': 272, 'legacy': {}, 'subType': 'watch268', 'crop_name': 'watch268'}, {'rank': 0, 'subtype': 'verticalTwoByThree735', 'caption': None, 'credit': None, 'type': 'image', 'url': 'images/2019/12/19/business/19survey4/19survey4-verticalTwoByThree735.jpg', 'height': 1102, 'width': 735, 'legacy': {}, 'subType': 'verticalTwoByThree735', 'crop_name': 'verticalTwoByThree735'}, {'rank': 0, 'subtype': 'mobileMasterAt3x', 'caption': None, 'credit': None, 'type': 'image', 'url': 'images/2019/12/19/business/19survey4/19survey4-mobileMasterAt3x.jpg', 'height': 1200, 'width': 1800, 'legacy': {}, 'subType': 'mobileMasterAt3x', 'crop_name': 'mobileMasterAt3x'}]","[{'name': 'subject', 'value': 'Health Insurance and Managed Care', 'rank': 1, 'major': 'N'}, {'name': 'subject', 'value': 'Presidential Election of 2020', 'rank': 2, 'major': 'N'}, {'name': 'subject', 'value': 'Polls and Public Opinion', 'rank': 3, 'major': 'N'}, {'name': 'subject', 'value': 'Voting and Voters', 'rank': 4, 'major': 'N'}, {'name': 'subject', 'value': 'Colleges and Universities', 'rank': 5, 'major': 'N'}, {'name': 'subject', 'value': 'Medicare', 'rank': 6, 'major': 'N'}, {'name': 'organizations', 'value': 'Democratic Party', 'rank': 7, 'major': 'N'}, {'name': 'persons', 'value': 'Sanders, Bernard', 'rank': 8, 'major': 'N'}, {'name': 'persons', 'value': 'Warren, Elizabeth', 'rank': 9, 'major': 'N'}, {'name': 'persons', 'value': 'Biden, Joseph R Jr', 'rank': 10, 'major': 'N'}, {'name': 'persons', 'value': 'Buttigieg, Pete (1982- )', 'rank': 11, 'major': 'N'}, {'name': 'subject', 'value': 'Debates (Political)', 'rank': 12, 'major': 'N'}]",2019-12-19T15:11:49+0000,article,Business,Business Day,News,nyt://article/97c432e5-cf2c-5bd3-a3c3-9e26ab69e0cf,1064,nyt://article/97c432e5-cf2c-5bd3-a3c3-9e26ab69e0cf,"Democrats Love Free College, Until You Offer Them More Options",,,,,,,By Ben Casselman,"[{'firstname': 'Ben', 'middlename': None, 'lastname': 'Casselman', 'qualifier': None, 'title': None, 'role': 'reported', 'organization': '', 'rank': 1}]",,Economy,,
