,abstract,web_url,snippet,lead_paragraph,source,multimedia,keywords,pub_date,document_type,news_desk,section_name,type_of_material,_id,word_count,uri,headline_main,headline_kicker,headline_content_kicker,headline_print_headline,headline_name,headline_seo,headline_sub,byline_original,byline_person,byline_organization,subsection_name,print_section,print_page
0,"New York billionaire Mike Bloomberg’s presidential campaign strategy is unprecedented, and his choice of rally location on Thursday to bounce back from an unsteady debate performance was unusual: Salt Lake City. ",https://www.nytimes.com/aponline/2020/02/20/us/ap-us-election-2020-bloomberg-utah.html,"New York billionaire Mike Bloomberg’s presidential campaign strategy is unprecedented, and his choice of rally location on Thursday to bounce back from an unsteady debate performance was unusual: Salt Lake City. ","SALT LAKE CITY — New York billionaire Mike Bloomberg’s presidential campaign strategy is unprecedented, and his choice of rally location on Thursday to bounce back from an unsteady debate performance was unusual: Salt Lake City. ",AP,[],[],2020-02-20T23:53:22+0000,article,None,U.S.,News,nyt://article/625f2bfd-1281-53b9-94cf-80b6635d49ec,635,nyt://article/625f2bfd-1281-53b9-94cf-80b6635d49ec,Bloomberg's Unusual 2020 Strategy Turns to Utah Post-Debate,,,Bloomberg's Unusual 2020 Strategy Turns to Utah Post-Debate,,,,By The Associated Press,[],The Associated Press,,,
1,Elizabeth Warren enters the final stretch before Saturday's Nevada Democratic caucus with a new and enviable but nonetheless critical mission: capitalizing on a standout performance during Wednesday's presidential debate.,https://www.nytimes.com/aponline/2020/02/20/us/politics/ap-us-election-2020-warren.html,Elizabeth Warren enters the final stretch before Saturday's Nevada Democratic caucus with a new and enviable but nonetheless critical mission: capitalizing on a standout performance during Wednesday's presidential debate.,WASHINGTON — Elizabeth Warren enters the final stretch before Saturday's Nevada Democratic caucus with a new and enviable but nonetheless critical mission: capitalizing on a standout performance during Wednesday's presidential debate.,AP,[],[],2020-02-20T23:08:18+0000,article,None,U.S.,News,nyt://article/2eb48d6e-2a75-59e1-a831-9864395ab87d,922,nyt://article/2eb48d6e-2a75-59e1-a831-9864395ab87d,Warren's Next Challenge: Maintain Post-Debate Momentum,,,Warren's Next Challenge: Maintain Post-Debate Momentum,,,,By The Associated Press,[],The Associated Press,Politics,,
2,"His aura suddenly shattered, a defiant Michael Bloomberg sent a pointed message Thursday to a political world grappling with his underwhelming presidential debate debut: He's not going away.",https://www.nytimes.com/aponline/2020/02/20/us/ap-us-election-2020.html,"His aura suddenly shattered, a defiant Michael Bloomberg sent a pointed message Thursday to a political world grappling with his underwhelming presidential debate debut: He's not going away.","SALT LAKE CITY — His aura suddenly shattered, a defiant Michael Bloomberg sent a pointed message Thursday to a political world grappling with his underwhelming presidential debate debut: He's not going away.",AP,[],[],2020-02-20T22:17:17+0000,article,None,U.S.,News,nyt://article/7a39eb47-637e-55cb-acfa-0427847a0f7e,937,nyt://article/7a39eb47-637e-55cb-acfa-0427847a0f7e,"Wounded but Defiant, Bloomberg Promises to Keep Fighting",,,"Wounded but Defiant, Bloomberg Promises to Keep Fighting",,,,By The Associated Press,[],The Associated Press,,,
3,"A group of Los Angeles artists were awaiting the results of the Democratic Party’s Iowa caucuses, hoping Bernie Sanders would win, when they fired off a hashtag on Twitter poking fun at Pete Buttigieg.",https://www.nytimes.com/aponline/2020/02/20/us/ap-election-2020-democrats-misinformation.html,"A group of Los Angeles artists were awaiting the results of the Democratic Party’s Iowa caucuses, hoping Bernie Sanders would win, when they fired off a hashtag on Twitter poking fun at Pete Buttigieg.","RINDGE, N.H. — A group of Los Angeles artists were awaiting the results of the Democratic Party’s Iowa caucuses, hoping Bernie Sanders would win, when they fired off a hashtag on Twitter poking fun at Pete Buttigieg.",AP,[],[],2020-02-20T21:05:19+0000,article,None,U.S.,News,nyt://article/abe98103-8471-5aad-985d-8ee1c6af2358,989,nyt://article/abe98103-8471-5aad-985d-8ee1c6af2358,Infighting and Online Hoaxes Mar Democrats' Campaign,,,Infighting and Online Hoaxes Mar Democrats' Campaign,,,,By The Associated Press,[],The Associated Press,,,
4,The Latest on presidential campaign developments (all times local.):,https://www.nytimes.com/aponline/2020/02/20/us/politics/ap-election-2020-the-latest-1st-ld-writethru.html,The Latest on presidential campaign developments (all times local.):,LAS VEGAS — The Latest on presidential campaign developments (all times local.):,AP,[],[],2020-02-20T20:26:32+0000,article,None,U.S.,News,nyt://article/b14d3f6b-b419-57d4-adf0-b9c759936182,969,nyt://article/b14d3f6b-b419-57d4-adf0-b9c759936182,The Latest: Warren Says Bloomberg NDA Refusal Disqualifying,,,The Latest: Warren Says Bloomberg NDA Refusal Disqualifying,,,,By The Associated Press,[],The Associated Press,Politics,,
