,abstract,web_url,snippet,lead_paragraph,print_section,print_page,source,multimedia,keywords,pub_date,document_type,news_desk,section_name,subsection_name,type_of_material,_id,word_count,uri,headline_main,headline_kicker,headline_content_kicker,headline_print_headline,headline_name,headline_seo,headline_sub,byline_original,byline_person,byline_organization
5,JAZZ.,https://www.nytimes.com/2006/07/28/arts/music/28jazz.html,JAZZ.,JAZZ,E,22,The New York Times,[],"[{'name': 'subject', 'value': 'Jazz', 'rank': 1, 'major': 'N'}]",2006-07-28T04:00:00+0000,article,Weekend,Arts,Music,News,nyt://article/a576d51c-f736-5fed-972a-e5bbd52c0fd4,1986,nyt://article/a576d51c-f736-5fed-972a-e5bbd52c0fd4,Jazz Listings,,,,,,,By The New York Times,[],The New York Times
6,ATTRACTIONS.,https://www.nytimes.com/2006/07/28/arts/28spar.html,ATTRACTIONS.,ATTRACTIONS,E,26,The New York Times,[],"[{'name': 'subject', 'value': 'Art', 'rank': 1, 'major': 'N'}, {'name': 'subject', 'value': 'Museums', 'rank': 2, 'major': 'N'}]",2006-07-28T04:00:00+0000,article,Weekend,Arts,,News,nyt://article/4fecf348-d00d-5251-8454-44938c9b5b4e,2574,nyt://article/4fecf348-d00d-5251-8454-44938c9b5b4e,Spare Times,,,,,,,By The New York Times,[],The New York Times
7,"LONDON — Arun Sarin, chief executive of Vodafone Group, has survived calls for his resignation from leading shareholders, though some analysts said dissatisfaction over strategy may persist.",https://www.nytimes.com/2006/07/26/technology/26iht-vodafone.2296420.html,,"LONDON — Arun Sarin, chief executive of Vodafone Group, has survived calls for his resignation from leading shareholders, though some analysts said dissatisfaction over strategy may persist.",,,International Herald Tribune,[],[],2006-07-26T05:00:00+0000,article,IHT News,Technology,,News,nyt://article/b435b640-84d0-57bf-af76-2ea6abb9a5d4,504,nyt://article/b435b640-84d0-57bf-af76-2ea6abb9a5d4,Vodafone chief survives calls for his resignation - Technology - International Herald Tribune,,,Vodafone chief survives calls for his resignation - Technology - International Herald Tribune,,,,By Eric Pfanner,"[{'firstname': 'Eric', 'middlename': None, 'lastname': 'Pfanner', 'qualifier': None, 'title': None, 'role': 'reported', 'organization': '', 'rank': 1}]",
8,"LONDON — Arun Sarin, chief executive of Vodafone Group, on Tuesday survived calls for his resignation from leading shareholders, though some analysts said dissatisfaction over the mobile phone network operator's strategy may persist.",https://www.nytimes.com/2006/07/25/technology/25iht-vodafone.2288903.html,,"LONDON — Arun Sarin, chief executive of Vodafone Group, on Tuesday survived calls for his resignation from leading shareholders, though some analysts said dissatisfaction over the mobile phone network operator's strategy may persist.",,,International Herald Tribune,[],[],2006-07-25T05:00:00+0000,article,IHT News,Technology,,News,nyt://article/0ed4a6a6-947b-5ec1-aa5f-21238fc1a16b,474,nyt://article/0ed4a6a6-947b-5ec1-aa5f-21238fc1a16b,Vodafone's chief survives vote - Technology - International Herald Tribune,,,Vodafone's chief survives vote - Technology - International Herald Tribune,,,,By Eric Pfanner,"[{'firstname': 'Eric', 'middlename': None, 'lastname': 'Pfanner', 'qualifier': None, 'title': None, 'role': 'reported', 'organization': '', 'rank': 1}]",
9,"A guide to cultural and recreational goings-on in and around Nassau and Suffolk Counties this week. Items for the guide should be sent at least three weeks in advance to lical@nytimes.com, or by mail to Long Island Weekly, 229 West 43d Street, New York, N.Y. 10036-3959.    MUSIC AND DANCE    Amagansett -- Leon Russell, rock. Thursday at 8 p.m. $60 to $70. Marc Cohn, acoustic. Friday at 8 p.m. $75 to $90. Stephen Talkhouse, 161 Main Street. (631) 267-3117.    Bay Shore -- Marc Cohn. July 29 at 8 p.m. $55. Boulton Center for the Performing Arts, 37 West Main Street. (631) 969-1101.    Bay Shore -- Long Island Tuba Quartet. Tuesday at 12:30 p.m. Free. Dr. King's Park, Main Street. (631) 224-5420.    Bellerose -- Wes Houston and band, rock/country. July 23 at 2 p.m. $3. Fuzzy's Pub, 239-21 Braddock Avenue. (718) 347-9616.    Bridgehampton -- Pat Humphries with Sandy Opatow, folk. July 29 at 8 p.m. $15 to $18. Unitarian Universalist Congregation of the South Fork, 997 Bridgehampton-Sag Harbor Turnpike. (631) 259-3399.    East Hampton -- American Musical Theater Salutes: ''Wouldn't It Be Lovely -- The Melodious Musicals of Lerner and Loewe,'' with Anna Bergman, Eric Michael Gillett and Alex Rybeck. July 23 at 7:30 p.m. $50; members, $45. Guild Hall, 158 Main Street. (631) 324-4050.    East Meadow -- Noontime Concerts: Vickie Smith, tribute to Ella Fitzgerald. Wednesday at noon. Free. Eisenhower Park, Merrick and Stewart Avenues. (516) 572-0218.    Farmingdale -- Summer of Ska Tour: Catch 22, Voodoo Glow Skulls and others. Thursday at 6 p.m. $15 to $17. Crazy Donkey, 1058 Route 110. (631) 753-1975.    Freeport -- Hot Gold, Hot Jazz with Linda Ciofalo. Thursday at 7:30 p.m. Free. Nautical Mile Esplanade, Woodcleft Avenue. (516) 223-2522, Extension 17.    Glen Cove -- British Night: Music and Dance of the British Isles. July 23 at 7:30 p.m. ''An Evening of Modern Dance,'' Centro Coreografico di Danza and Circle of Dance Repertory Company. Thursday at 7:30 p.m. The Day Trippers, music of the British Invasion. July 30 at 7:30 p.m. Morgan Park, Germaine Street and Landing Road. (516) 671-0017.    Great River -- The Homegrown String Band. July 23 at 2 p.m. Swingtime, swing band. July 30 at 2 p.m. Bayard Cutting Arboretum State Park, 440 Montauk Highway. (631) 224-5420.    Huntington -- Sol y Sombra Spanish Dance Company. July 23 at 8:30 p.m. ''Encore, Encore!,'' Huntington Community Band, ''1812 Overture.'' Wednesday at 8:30 p.m. Ravi Coltrane Quartet, jazz. Friday at 8:30 p.m. ''An Evening of Haitian Music,'' Emeline Michel, vocalist, and Buyu Ambroise Sextet, Latin jazz. July 29 at 8:30 p.m. Long Island Dance Consortium Showcase, Variations Dance Company, Nritya Saagaram Dance Academy and others. July 30 at 8:30 p.m. Heckscher Park, Main Street and Prime Avenue. (631) 271-8423.    Long Beach -- Alive N Kickin', pop. Thursday at 8 p.m. Neptune Boulevard Beach. (516) 431-1000, Extension 321.    Long Beach -- T'bazco Road, zydeco. Tuesday at 8 p.m. Free. New York Avenue Beach. (516) 431-1000, Extension 321.    Patchogue -- Live in the Lobby: Eric Dubin, singer-songwriter. Wednesday at 7:30 p.m. $5. Artimus Pyle and the LI Street Survivors, Lynyrd Skynrd tribute, with Seven Turns, Allman Brothers tribute. Friday at 7:30 p.m. $32 to $47. The Fixx with the Lizards, rock. July 29 at 7:30 p.m. Leon Russell, rock. July 30 at 7:30 p.m. $32 to $52. Patchogue Theater for the Performing Arts, 71 East Main Street. (631) 207-1313.    Smithtown -- Traditional New England Barn Dance, presented by the Long Island Traditional Music Association. Friday at 7:45 p.m. $10, adults; $9, seniors; $5, students. Smithtown Historical Society, 211 Main Street. (631) 369-7854.    St. James -- Metropolitan Guitar Trio. July 29 at 5 p.m. $5 to $15. Mills Pond House, 660 Route 25A. (631) 862-6575.    West Hempstead -- Hooligan's Irish Band. July 30 at 6:30 p.m. Free. Hall's Pond Park, Nassau Boulevard and Hemp Avenue. (516) 733-0879.    MUSEUMS AND GALLERIES    Amagansett -- Paintings by Joseph Haske and sculpture by Gavin Zeigler. Through Aug. 5. Hours: Mondays, Tuesdays and Thursdays, 10 a.m. to 5 p.m.; Fridays and Saturdays, 9 a.m. to 7 p.m.; Sundays, 9 a.m. to 5 p.m. Sylvester & Company at Home, 154 Main Street. (631) 267-9777.    Bellport -- ''Marine Life,'' works inspired by the sea. Tuesday through Aug. 20. Hours: Tuesdays through Saturdays, 11 a.m. to 5 p.m.; Sundays, noon to 4:30 p.m. Phoenix Gallery, 139 Main Street. (631) 776-0811.    East Hampton -- ''The Barrymores: Hollywood's First Family,'' photographs from the Barrymore collection. Through July 30. Guild Hall, 158 Main Street. (631) 324-4050.    East Hampton -- ''Light, Location, Color,'' drawings and neons from 1967 to 2006 by Stephen Antonakos. Through July 31. Free. Hours: Mondays and Thursdays through Saturdays, 10 a.m. to 5 p.m.; Sundays, 11 a.m. to 5 p.m. The Drawing Room, 16R Newtown Lane. (631) 324-5016.    East Islip -- ''Stilled Life,'' still lifes by various artists. Through Sept. 10. Hours: Wednesdays through Saturdays, 10 a.m. to 4 p.m.; Sundays, noon to 4 p.m. Islip Art Museum, 50 Irish Lane. (631) 224-5402.    Great Neck -- ''Vintage Israeli Posters.'' Through Aug. 9. Hours: Mondays through Thursdays, 9 a.m. to 9 p.m.; Fridays, 9 a.m. to 7 p.m.; Saturdays, 9:30 a.m. to 4 p.m. Great Neck Arts Center, 113 Middle Neck Road. (516) 829-2570.    Greenlawn -- Photographs by Christopher Appoldt. Through July 29. Hours: Mondays through Thursdays, 9 a.m. to 9 p.m.; Fridays, 10 a.m. to 9 p.m.; Saturdays, 9 a.m. to 5 p.m. Harborfields Public Library, 31 Broadway. (631) 757-4200.    Greenport -- Works by Marilyn Uhl-Utz. Through July 29. Hours: Mondays through Fridays, 10 a.m. to 8 p.m.; Saturdays, 10 a.m. to 5 p.m. Floyd Memorial Library, 539 First Street. (631) 477-0660.    Hampton Bays -- ''From the East Side to the East End,'' small works by Moses Soyer. Through Aug. 13. Free. Hours: Mondays, Tuesdays and Thursdays through Saturdays, 10:30 a.m. to 5:30 p.m.; Sundays, 1 to 5 p.m. Artisan Gallery, 15 Ponquogue Avenue. (631) 728-8040.    Huntington -- ''Hats Off to Huntington!,'' historical millinery creations. Through Sept. 29. Hours: Tuesdays through Fridays and Sundays, 1 to 4 p.m. David Conklin Farmhouse, 2 High Street. (631) 427-7045, Extension 401.    Huntington -- ''Pingyao: Inside the Wall,'' photographs by Susan Dooley. Through July 30. Free. Hours: Fridays, 5 to 9 p.m.; Saturdays, noon to 9 p.m.; Sundays, noon to 5 p.m. Fotofoto Gallery, 372 New York Avenue. (631) 549-0448.    Huntington -- ''Arthur Dove Watercolors,'' watercolors from the 1930's through the mid-1940's by Arthur Dove. Through Sept. 3. ''Man Ray in the Age of Electricity,'' solarized images and rayographs by Man Ray. Through Aug. 13. $5; seniors, $3; children ages 5 to 12, $1; under 5, free. Hours: Tuesdays through Thursdays, 10 a.m. to 5 p.m.; Fridays, 10 a.m. to 8:30 p.m.; Saturdays and Sundays, 1 to 8:30 p.m. The Heckscher Museum of Art, 2 Prime Avenue. (631) 351-3250.    Mattituck -- ''Portals and Pathways,'' photographs by Harvey Hellering and paintings by Rob White. Through July 30. Free. Hours: Mondays through Fridays, 10 a.m. to 5 p.m. Cecily's Love Lane Gallery, 80 Love Lane Gallery. (631) 298-8610.    Northport -- ''Movers and Shakers,'' collection of historical cocktail shakers and other memorabilia. Through Sept. 3. Donation: $3. Hours: Tuesdays through Sundays, 1 to 4:30 p.m. Northport Historical Society Museum, 215 Main Street. (631) 757-9859.    Riverhead -- ''Full Spectrum,'' Mac Well's paintings from 1965 to 2002. Through July 30. Hours: Thursdays through Sundays, noon to 5 p.m. Art Sites, 651 West Main Street. (631) 323-1426.    Riverhead -- ''By the Shore,'' paintings by various artists. Through July 29. Free. Hours: Mondays through Saturdays, 10 a.m. to 4 p.m.; Sundays, noon to 4 p.m. East End Arts Council Gallery, 133 East Main Street. (631) 727-0900.    Riverhead -- East End Art Council's Community School of the Arts Faculty Show. Through Aug. 31. Hours: Mondays through Fridays, 9 a.m. to 9 pm.; Saturdays, 9 a.m. to 5 p.m. Riverhead Free Library, 133 Court Street. (631) 369-2171.    Riverhead -- Four-Year Anniversary Exhibition, works by Sandi Woessner, Chris Stavropolis and others. Through Aug. 23. Reception: July 23, 3 to 6 p.m. Hours: Sundays through Tuesdays, 10 a.m. to 3 p.m.; Wednesdays to Saturdays, 10 a.m. to 5 p.m. The Blue Door Gallery, 40 East Main Street. (631) 208-8166.    Sag Harbor -- ''Local Scenes,'' works by Barbara Smith Thompson. Friday through Aug. 30. Reception: July 30, 5 to 7 p.m. Free. Canio's Books, 290 Main Street. (631) 725-4926.    Sag Harbor -- Summer Group Show, works by Marjorie Weiss, Day Bowman and others. Through Aug. 9. Hours: Sundays, Mondays and Wednesdays, 10 a.m. to 8 p.m.; Thursdays through Saturdays, 10 a.m. to 10 p.m. Karin Sanders Fine Art, 126 Main Street. (631) 899-3430.    Southampton -- ''Maritime Visions,'' works by Nahum Tschacbasov. Through July 31. Hours: Daily, 11 a.m. to 6 p.m. Bravura Art and Objects, 22 Nugent Street. (631) 259-2605.    Southampton -- ''Melodic Impasto,'' works by Frank Wimberly. Through July 31. Free. Hours: Fridays through Sundays, 1 to 6 p.m. Ferregut Tower Gallery, 3 South Main Street. (631) 287-0798.    Southampton -- Art Lecture, Nikki Lee, photographer, discusses her work documenting different cultural groups. July 29 at 5:30 p.m. Parrish Art Museum, 25 Job's Lane. (631) 282-2118, Extension 32.    Southold -- ''Hold Everything,'' period and contemporary baskets by Long Island artisans. July 29 through Sept. 3. Donation. Hours: Wednesdays, Saturdays and Sundays, 1 to 4 p.m. Southold Historical Society, Main Road and Maple Lane. (631) 765-5500.    Uniondale -- ''Scenes of the Sea,'' works by Frank Tarricone. Through July 31. Hours: Mondays through Thursdays, 9 a.m. to 9 p.m.; Fridays, 9 a.m. to 6 p.m.; Saturdays, 10 a.m. to 5 p.m. Uniondale Public Library, 400 Uniondale Avenue. (516) 489-2220.    OUTDOORS    East Hampton -- Tour of the Burying Ground and 1804 Gardiner Mill. July 29 at 10 a.m. $10. Mulford Farm, 10 James Lane. (631) 324-6850.    Sagaponack -- ''Historic Tour of Madoo,'' tour of the dairy barn, crib house and gardens. Thursday. $15. Madoo Conservancy, 618 Sagg Main Street. (631) 537-8200.    SPOKEN WORD    Amagansett -- Linda Opyr and Monica Enders, poets. July 23 at 4 p.m. Janice Bishop and Carole Sherman, poets. July 30 at 4 p.m. Free. Marine Museum, Atlantic Avenue and Bluff Road. (631) 324-8650.    Bridgehampton -- Fridays at Five: Linda Bird Francke, author of ''On the Road With St. Francis of Assisi.'' Friday at 5 p.m. Hampton Library, 2478 Main Street. (631) 537-0015.    East Hampton -- Thirty Years of Pushcart Prize-Winning Stories, read by Dana Delany, Elizabeth Perkins and Anson Mount. July 29 at 8 p.m. $45 to $100. Guild Hall, 158 Main Street. (631) 324-4050.    Huntington -- S. H. Post, author of ''Samsara Moon.'' Tuesday at 8 p.m. Book Revue, 313 New York Avenue. (631) 271-1442.    THEATER    Oyster Bay -- Shakespeare in the Park: ''The Taming of the Shrew,'' presented by the Long Island Shakespeare Festival. Thursday at 7 p.m. Planting Fields Arboretum State Historic Park, 1395 Planting Fields Road. (516) 922-9200.    Centerport -- ''Romeo and Juliet,'' presented by Arena Players Repertory Company. Through Aug. 27. $12. Suffolk Vanderbilt Museum, 180 Little Neck Road. (631) 854-5550.    East Farmingdale -- ''Arms and the Man'' by George Bernard Shaw, presented by the Arena Players Repertory Theater. Through Aug. 6. $16 to $22. ''The Rats'' by Agatha Christie and ''Murder Play'' by Brian J. Burton, presented by Arena Players Repertory Theater. Through Aug. 27. $18 to $22. Arena Players Second Stage Theater, 294 Route 109. (516) 293-0674.    East Hampton -- ''Gonzo: The Life and Times of Dr. Hunter S. Thompson, as Only He Could Tell It,'' presented by WordTheater and the John Drew Theater; performed by Xander Berkeley. Friday at 8 p.m. $30; members, $28. Guild Hall, 158 Main Street. (631) 324-4050.    Glen Cove -- ''The Complete Works of William Shakespeare (Abridged),'' by the Reduced Shakespeare Company; presented by Plaza Productions. July 29 at 7:30 p.m. Morgan Park, Germaine Street and Landing Road. (516) 671-0017.    Hempstead -- ''Grease'' by Jim Jacobs and Warren Casey, presented by Hofstra USA productions. Through July 30. $10 to $30. Hofstra University, (516) 463-6644.    Huntington -- ''All in the Timing,'' by David Ives; presented by Township Theater Group. Thursday at 8:30 p.m. Free. Heckscher Park, Main Street and Prime Avenue. (631) 271-8423.    Oakdale -- ''42nd Street'' by Rian James, James Seymour and Bradford Ropes. Through July 30. $16 to $20. ''101 Dalmatians,'' for children. Through July 29. $8. CM Performing Arts Center, 931 Montauk Avenue. (631) 218-2810.    Sag Harbor -- ''Viva La Vida!'' by Diane Shaffer, directed by Susana Tubert. Through Aug. 6. $45 to $60. Bay Street Theater, Main and Bay Streets. (631) 725-9500.    FILM    East Hampton -- ''Fiddler on the Roof,'' directed by Norman Jewison, with guest speakers, Sheldon Harnick and Joseph Stein. Thursday at 8 p.m. $20; members, $18. Guild Hall, 158 Main Street. (631) 324-4050.    Greenlawn -- ''Glory Road,'' directed by James Gartner. Friday at 1:30 and 7 p.m. Free. Harborfields Public Library, 31 Broadway. (631) 757-4200.    Huntington -- ''Vito After,'' documentary directed by Maria Pusateri, guest speaker. Thursday at 7:30 p.m. $12; members, $8. Cinema Arts Center, 423 Park Avenue. (631) 423-7611.    Southampton -- Monday Movies: ''Murderball,'' directed by Henry-Alex Rubin. Monday at 8 p.m. $8; members, $5. Parrish Art Museum, 25 Job's Lane. (631) 282-2118, Extension 32.    Stony Brook -- Stony Brook Film Festival: ''Manual of Love,'' directed by Giovanni Veronesi. In Italian with English subtitles. July 23 at 7 p.m. ''Mojave Phone Booth,'' directed by John Putch. July 23 at 9:30 p.m. ''Looking for Alexander,'' directed by Francis Leclerc. In French with English subtitles. Monday at 7 p.m. ''Coffee Date,'' directed by Stewart Wade. Monday at 9:30 p.m. ''La Guerra di Mario,'' directed by Antonio Capuano. In Italian with English subtitles. Tuesday at 7 p.m. ''Shanghai Dreams,'' directed by Wang Xiaoshuai. In Mandarin with English subtitles. Wednesday at 9:30 p.m. ''Expiration Date,'' directed by Rick Stevenson. Thursday at 7 p.m. ''Blind Guy Driving,'' directed by James Keach. Friday at 9:30 p.m. ''Aurora Borealis,'' directed by James Burke. July 29 at 8 p.m. $7; seniors and students, $5. Staller Center for the Arts, (631) 632-2787.    Westhampton Beach -- ''Russian Dolls,'' directed by Cédric Klapisch. Monday through Wednesday. $3 to $10. Westhampton Beach Performing Arts Center, 76 Main Street. (631) 288-1500.    COMEDY    Huntington -- Geist, visual comedian. Tuesday at 7:30 p.m. Free. Heckscher Park, Main Street and Prime Avenue. (631) 271-8423.    Sag Harbor -- Comedy Club: Tom Papa. Monday at 8 p.m. $48. Bay Street Theater, Main and Bay Streets. (631) 725-9500.    FOR CHILDREN    Bay Shore -- Laughing Pizza, children's music. Friday at 7 p.m. $10. Boulton Center for the Performing Arts, 37 West Main Street. (631) 969-1101.    Bridgehampton -- Sunday Sunsets: ''Improv 4 Kids,'' music and stories with audience participation. July 23 at 5:30 p.m. ''Magic and Comedy,'' magic show with Jim McCenahan. July 30 at 5:30 p.m. $12; members, $10. Children's Museum of the East End, 376 Bridgehampton/Sag Harbor Turnpike. (631) 537-8250.    Garden City -- ''Nanny McPhee,'' directed by Kirk Jones. July 23 at 1 p.m. ''Musical Space Travel,'' presented by Chris Peters. Tuesday and Wednesday, 1 and 3 p.m. ''Mid-Summer Magic,'' presented by the International Brotherhood of Magicians Ring 317. Thursday and July 30, 1 and 3 p.m. Chill in the Theater: ''Dreamer,'' directed by John Gatins. Friday at 1 p.m. $5; $3 with museum admission. Long Island Children's Museum, 11 Davis Avenue. (516) 224-5800.    Huntington -- ''Charlotte's Web,'' based on the book by E. B. White. July 30, 3 p.m. Caumsett State Historic Park, 25 Lloyd Harbor Road. (631) 423-1770.    Kings Park -- ''Hooray for Horseshoe Crabs,'' family nature program led by the Seatuck Environmental Association. July 29 at 7:30 p.m. Free. Sunken Meadows State Park, Route 25 A and Sunken Meadow Parkway. (631) 269-4333.    Port Jefferson -- ''Jack and the Beanstalk,'' children's theater. Friday and July 29, 11 a.m. $8. Theater Three, 412 Main Street. (631) 928-9100.    Sag Harbor -- Ice cream social, pony rides and games. July 30, 5 to 7 p.m. Old Wheeler's Church, 44 Union Street. (631) 324-3097.    Southampton -- Kidsummer Performance: ''Masked Marvels and Wondertales,'' Michael Cooper, storyteller and stilt-walker. Wednesday at 2 p.m. $12; members, $7. Parrish Art Museum, 25 Job's Lane. (631) 282-2118, Extension 32.    Westhampton Beach -- ''The Jungle Book,'' presented by the Missoula Children's Theater. Friday at 7 p.m. $12. Westhampton Beach Performing Arts Center, 76 Main Street. (631) 288-1500.",https://www.nytimes.com/2006/07/23/nyregion/calendar.html,"A guide to cultural and recreational goings-on in and around Nassau and Suffolk Counties this week. Items for the guide should be sent at least three weeks in advance to lical@nytimes.com, or by mail to Long Island Weekly, 229 West 43d Street, New...","A guide to cultural and recreational goings-on in and around Nassau and Suffolk Counties this week. Items for the guide should be sent at least three weeks in advance to lical@nytimes.com, or by mail to Long Island Weekly, 229 West 43d Street, New York, N.Y. 10036-3959.",LI,14,The New York Times,[],[],2006-07-23T05:00:00+0000,article,Long Island Weekly Desk,New York,,Schedule,nyt://article/b1c4764c-cd6a-55e4-81d2-d1b4ffafecf8,2850,nyt://article/b1c4764c-cd6a-55e4-81d2-d1b4ffafecf8,CALENDAR,,,CALENDAR,,,,,[],
