,abstract,web_url,snippet,lead_paragraph,print_section,print_page,source,multimedia,keywords,pub_date,document_type,news_desk,section_name,type_of_material,_id,word_count,uri,headline_main,headline_kicker,headline_content_kicker,headline_print_headline,headline_name,headline_seo,headline_sub,byline_original,byline_person,byline_organization
0,"Trading scandal may strengthen New York Stock Exchange; scandal bears close resemblence to one that shook Nasdaq stock market decade ago; in Nasdaq case, scandal forced market to clean house at top and to institute reforms that ended practices that had enabled brokers to systematically take advantage of their customers; result was far better market, one that was able to withstand intense public scrutiny that arrived few years later when technology stock boom cast light on Nasdaq; indictment of 15 former specialists could make this largest criminal case to come out of America's premier stock exchange since 1930's, when exchange's president, Richard Whitney, was imprisoned for fraud; photo (Market Place column) (M)",https://www.nytimes.com/2005/04/14/business/trading-scandal-may-strengthen-stock-exchange.html,"Trading scandal may strengthen New York Stock Exchange; scandal bears close resemblence to one that shook Nasdaq stock market decade ago; in Nasdaq case, scandal forced market to clean house at top and to institute reforms that ended practices tha...",A scandal can destroy an institution. Or it can renew it. The good news for the New York Stock Exchange is that the scandal that led to the indictments of people who had been extremely powerful on the floor of the exchange bears a close resemblance to the one that shook the Nasdaq stock market a decade ago.,C,1,The New York Times,[],"[{'name': 'organizations', 'value': 'LABRANCHE & CO', 'rank': 1, 'major': 'N'}, {'name': 'organizations', 'value': 'New York Stock Exchange', 'rank': 2, 'major': 'N'}, {'name': 'organizations', 'value': 'SPEAR LEEDS & KELLOGG', 'rank': 3, 'major': 'N'}, {'name': 'organizations', 'value': 'FLEET SPECIALISTS', 'rank': 4, 'major': 'N'}, {'name': 'organizations', 'value': 'VAN DER MOOLEN SPECIALISTS', 'rank': 5, 'major': 'N'}, {'name': 'organizations', 'value': 'Securities and Exchange Commission', 'rank': 6, 'major': 'N'}, {'name': 'organizations', 'value': 'BEAR WAGNER SPECIALISTS', 'rank': 7, 'major': 'N'}, {'name': 'organizations', 'value': 'Nasdaq Stock Market', 'rank': 8, 'major': 'N'}, {'name': 'persons', 'value': 'HAYWARD, MICHAEL J', 'rank': 9, 'major': 'N'}, {'name': 'persons', 'value': 'STERN, MICHAEL F', 'rank': 10, 'major': 'N'}, {'name': 'persons', 'value': 'TURK, WARREN', 'rank': 11, 'major': 'N'}, {'name': 'persons', 'value': 'DELANEY, FRANK A IV', 'rank': 12, 'major': 'N'}, {'name': 'persons', 'value': 'Foley, Donald R II', 'rank': 13, 'major': 'N'}, {'name': 'persons', 'value': 'FINNERTY, DAVID A', 'rank': 14, 'major': 'N'}, {'name': 'persons', 'value': 'PAROLISI, JAMES', 'rank': 15, 'major': 'N'}, {'name': 'persons', 'value': 'BONGIORNO, JOSEPH', 'rank': 16, 'major': 'N'}, {'name': 'persons', 'value': 'LUCKLOW, ROBERT', 'rank': 17, 'major': 'N'}, {'name': 'persons', 'value': 'Scavone, Robert A', 'rank': 18, 'major': 'N'}, {'name': 'persons', 'value': 'MCGAGH, PATRICK J', 'rank': 19, 'major': 'N'}, {'name': 'persons', 'value': 'Christie, Todd J', 'rank': 20, 'major': 'N'}, {'name': 'persons', 'value': 'HAYES, GERARD T', 'rank': 21, 'major': 'N'}, {'name': 'persons', 'value': 'FEE, KEVIN M', 'rank': 22, 'major': 'N'}, {'name': 'persons', 'value': 'Johnson, Robert A', 'rank': 23, 'major': 'N'}, {'name': 'persons', 'value': 'MURPHY, THOMAS J JR', 'rank': 24, 'major': 'N'}, {'name': 'persons', 'value': 'WHITNEY, RICHARD', 'rank': 25, 'major': 'N'}, {'name': 'persons', 'value': 'HUNT, SCOTT G', 'rank': 26, 'major': 'N'}, {'name': 'persons', 'value': 'MURPHY, PATRICK E', 'rank': 27, 'major': 'N'}, {'name': 'persons', 'value': 'DEBOER, FREDDY', 'rank': 28, 'major': 'N'}, {'name': 'persons', 'value': 'VOLPE, RICHARD P', 'rank': 29, 'major': 'N'}, {'name': 'subject', 'value': 'Frauds and Swindling', 'rank': 30, 'major': 'N'}, {'name': 'subject', 'value': 'Securities and Commodities Violations', 'rank': 31, 'major': 'N'}, {'name': 'subject', 'value': 'Ethics', 'rank': 32, 'major': 'N'}, {'name': 'subject', 'value': 'Nasdaq Composite Index', 'rank': 33, 'major': 'N'}, {'name': 'subject', 'value': 'Stocks and Bonds', 'rank': 34, 'major': 'N'}, {'name': 'subject', 'value': 'Regulation and Deregulation of Industry', 'rank': 35, 'major': 'N'}, {'name': 'subject', 'value': 'Brokers and Brokerage Firms', 'rank': 36, 'major': 'N'}, {'name': 'creative_works', 'value': 'MARKET PLACE (TIMES COLUMN)', 'rank': 37, 'major': 'N'}]",2005-04-14T05:00:00+0000,article,Business/Financial Desk,Business Day,News,nyt://article/4a289e35-3e1c-5aed-ad17-11ccb9619e08,996,nyt://article/4a289e35-3e1c-5aed-ad17-11ccb9619e08,Trading Scandal May Strengthen Stock Exchange,MARKET PLACE,,MARKET PLACE; Trading Scandal May Strengthen Stock Exchange,,,,By Floyd Norris,"[{'firstname': 'Floyd', 'middlename': None, 'lastname': 'Norris', 'qualifier': None, 'title': None, 'role': 'reported', 'organization': '', 'rank': 1}]",
1,"                   Weeks     This   Last   On     Week   Week   List   FICTION                 1   3   106   THE DA VINCI CODE, by Dan Brown. (Doubleday, $24.95; special illustrated edition, $35.) A murder at the Louvre leads to a trail of clues found in the work of Leonardo and to the discovery of a secret society.                 2   2   6   HONEYMOON, by James Patterson and Howard Roughan. (Little, Brown, $27.95.) An F.B.I. agent who is investigating a beautiful and mysterious woman finds himself becoming obsessed with her.                 3      1   SATURDAY, by Ian McEwan. (Nan A. Talese/Doubleday, $26.) A day in the life of a successful London neurosurgeon, troubled by 9/11 and the impending war in Iraq, who comes face to face with senseless violence.                 4   1   4   *THE RISING, by Tim LaHaye and Jerry B. Jenkins. (Tyndale, $25.99.) The Prince of Darkness chooses a Romanian woman to be the mother of the Antichrist.                 5   4   11   THE BROKER, by John Grisham. (Doubleday, $27.95.) The C.I.A. arranges a presidential pardon for a power broker who may know crucial secrets, laying a trap for the foreign intelligence service that wants him dead.                 6   6   2   WITH NO ONE AS WITNESS, by Elizabeth George. (HarperCollins, $26.95.) Detective Inspector Thomas Lynley and his colleagues hunt for a serial killer.                 7   8   79   THE FIVE PEOPLE YOU MEET IN HEAVEN, by Mitch Albom. (Hyperion, $19.95.) An old man who died trying to rescue a girl finds that all is explained in the afterlife.                 8   5   4   IMPOSSIBLE, by Danielle Steel. (Delacorte, $27.) A romance blossoms between the owner of a Parisian art gallery and a bohemian painter.                 9   7   3   COLD SERVICE, by Robert B. Parker. (Putnam, $24.95.) The Boston private eye Spenser seeks revenge on Ukrainian gangsters after his friend Hawk is critically injured by a sniper's bullets.                 10   10   8   PREP, by Curtis Sittenfeld. (Random House, $21.95.) A scholarship student encounters a world of privilege at an expensive boarding school in Massachusetts.                 11   9   4   VANISHING ACTS, by Jodi Picoult. (Atria, $25.) A woman who undertakes search-and-rescue missions in rural New Hampshire discovers that she herself has been a missing person for nearly 30 years.                 12      4   THE KILLING CLUB, by Marcie Walsh with Michael Malone. (Hyperion, $19.95.) A police detective investigates the deaths of friends of hers from high school.                 13   15   2   EXTREMELY LOUD AND INCREDIBLY CLOSE, by Jonathan Safran Foer. (Houghton Mifflin, $24.95.) A 9-year-old boy searches New York City for the lock that fits a key belonging to his father, who died on Sept. 11.                 14      1   DEAD OF NIGHT, by Randy Wayne White. (Putnam, $24.95.) Doc Ford, a government agent turned marine biologist, confronts the possibility of a catastrophic ecoterrorist attack in Florida.                 15   11   4   IRELAND, by Frank Delaney. (HarperCollins, $26.95.) Inspired by an itinerant storyteller, a boy immerses himself in the history and mythology of his country.              Weeks        This   Last   On        Week   Week   List   NONFICTION                 1   2   11   BLINK, by Malcolm Gladwell. (Little, Brown, $25.95.) The author of ''The Tipping Point'' explores the importance of hunch and instinct to the workings of the mind.                 2   1   3   A DEADLY GAME, by Catherine Crier with Cole Thompson. (ReganBooks/HarperCollins, $27.95.) A Court TV analyst looks at the Scott Peterson case.                 3   3   4   BLOOD BROTHER, by Anne Bird. (ReganBooks/ HarperCollins, $25.95.) The long-lost half sister of Scott Peterson explains why she is convinced of his guilt.                 4   4   2   CONSPIRACY OF FOOLS, by Kurt Eichenwald. (Broadway, $26.) The spectacular rise and fall of Enron, as reported by a correspondent for The New York Times.                 5   5   4   PLAN B, by Anne Lamott. (Riverhead, $24.95.) The author of ''Traveling Mercies'' meditates on personal and political matters and on the spiritual life.                 6   10   2   ON BULL----, by Harry G. Frankfurt. (Princeton University, $9.95.) A philosopher attempts a theoretical understanding of a ''vast and amorphous'' phenomenon.                 7   8   7   MEN IN BLACK, by Mark R. Levin. (Regnery, $27.95.) A conservative commentator enumerates ways in which ''the Supreme Court is destroying America.'' (+)                 8   6   6   *JUICED, by Jose Canseco. (ReganBooks/HarperCollins, $25.95.) The former slugger talks about his life in baseball and, especially, his use of steroids.                 9   9   13   COLLAPSE, by Jared Diamond. (Viking, $29.95.) A historical investigation, by the author of ''Guns, Germs, and Steel,'' into why some societies succeed while others fail.                 10   11   11   GOD'S POLITICS, by Jim Wallis. (HarperSanFrancisco, $24.95.) An evangelical Christian argues that Democrats must ''take back the faith'' and not allow conservative Republicans to hijack the Bible. (+)                 11   7   27   AMERICA (The BOOK), by Jon Stewart, Ben Karlin, David Javerbaum et al. (Warner, $24.95.) ''The Daily Show'' offers an illustrated parody of a civics textbook.                 12   15   8   SECRETS & MYSTERIES OF THE WORLD, by Sylvia Browne. (Hay House, $19.95.) The self-proclaimed psychic tries to explain the inexplicable.                 13   12   2   THE GLASS CASTLE, by Jeannette Walls. (Scribner, $25.) The author, a contributor to MSNBC.com, recalls a bizarre childhood during which she and her siblings were constantly being moved from one bleak place to another.                 14      1   THREE NIGHTS IN AUGUST, by Buzz Bissinger. (Houghton Mifflin, $25.) A three-game series in 2003 between the Cubs and the Cardinals, as seen through the eyes of Tony La Russa, the St. Louis manager.                 15      5   SMASHED, by Koren Zailckas. (Viking, $21.95.) A young woman remembers her excessive drinking throughout high school and college.                 16   14   11   *WITNESS, by Amber Frey. (ReganBooks/HarperCollins, $25.95.) A memoir by the California massage therapist who testified against Scott Peterson.          Rankings reflect sales, for the week ended March 26, at almost 4,000 bookstores plus wholesalers serving 50,000 other retailers, statistically weighted to represent all such outlets nationwide. An asterisk (*) indicates that a book's sales are barely distinguishable from those of the book above. A dagger (+) indicates that some bookstores report receiving bulk orders. Expanded rankings are available at The New York Times on the Web: nytimes.com/books.    Editors' Choice  Other recent books of particular interest    BREAK, BLOW, BURN, by Camille Paglia. (Pantheon, $20.) Smart, lively essays on 43 poems, written about them, not about her.    BOSS TWEED: The Rise and Fall of the Corrupt Pol Who Conceived the Soul of Modern New York, by Kenneth D. Ackerman. (Carroll & Graf, $27.) Our greatest master of useful graft.    A CHANGED MAN, by Francine Prose. (HarperCollins, $24.95.) A neo-Nazi engages a Jewish human rights leader in this morally concerned novel, asking for help in his effort to repent.    EUROPE CENTRAL, by William T. Vollmann. (Viking, $39.95.) A novel, mostly in stories, of Middle European fanaticism and resistance to it in the World War II period.    GIVE ME: (Songs for Lovers), by Irina Denezhkina. (Simon & Schuster, $19.95.) Precocity comes to modern Russia in these fictionalized memoirs by an acid-tongued young woman.    A GREAT IMPROVISATION: Franklin, France, and the Birth of America, by Stacy Schiff. (Holt, $30.) A wise account of Benjamin Franklin's diplomatic brilliance, revealed in Paris at 70.    CAMPO SANTO, by W. G. Sebald. (Random House, $24.95.) Literary and critical essays by the important German novelist who died in 2001.    OMAHA BLUES: A Memory Loop, by Joseph Lelyveld. (Farrar, Straus & Giroux, $22.) A memoir of a complicated childhood by a former executive editor of The Times.    RETURN TO GREATNESS: How America Lost Its Sense of Purpose and What It Needs to Do to Recover It, by Alan Wolfe. (Princeton University, $22.95.) A plan for restoring liberalism.    THE CONFEDERATE BATTLE FLAG: America's Most Embattled Emblem, by John M. Coski. (Belknap/Harvard University, $29.95.) The career of a symbol of heroic resistance that has also served as the banner of white supremacy.    WHEN THE MISSISSIPPI RAN BACKWARDS: Empire, Intrigue, Murder, and the New Madrid Earthquakes, by Jay Feldman. (Free Press, $27.) America's biggest quakes ever, in 1811-12.       The full reviews of these and other recent books are on the Web: nytimes.com/books  ",https://www.nytimes.com/2005/04/10/books/arts/best-sellers-april-10-2005.html,"Weeks     This   Last   On     Week   Week   List   FICTION                 1   3   106   THE DA VINCI CODE, by Dan Brown. (Doubleday, $24.95; special illustrated edition, $35.) A murder at the Louvre leads to a trail of clues found in the work of...",Weeks,7,34,The New York Times,[],[],2005-04-10T05:00:00+0000,article,Book Review Desk,Books,List,nyt://article/25839d6e-3f04-58c9-8e27-d92a5c19aea1,1261,nyt://article/25839d6e-3f04-58c9-8e27-d92a5c19aea1,"BEST SELLERS: April 10, 2005",,,"BEST SELLERS: April 10, 2005",,,,,[],
2,Mary Delaney letter responds to Thomas Cahill April 5 Op-Ed article; praises Pope John Paul II for his connection to common man,https://www.nytimes.com/2005/04/09/opinion/a-farewell-to-a-pope-for-the-ages-727385.html,Mary Delaney letter responds to Thomas Cahill April 5 Op-Ed article; praises Pope John Paul II for his connection to common man,To the Editor:,A,18,The New York Times,[],"[{'name': 'organizations', 'value': 'Roman Catholic Church', 'rank': 1, 'major': 'N'}, {'name': 'persons', 'value': 'Cahill, Thomas', 'rank': 2, 'major': 'N'}, {'name': 'persons', 'value': 'John Paul II', 'rank': 3, 'major': 'N'}, {'name': 'persons', 'value': 'DELANEY, MARY', 'rank': 4, 'major': 'N'}]",2005-04-09T05:00:00+0000,article,Editorial Desk,Opinion,Letter,nyt://article/b664060a-e5bb-5b6d-8442-7edd2c931a08,162,nyt://article/b664060a-e5bb-5b6d-8442-7edd2c931a08,A Farewell to a Pope for the Ages,,,A Farewell to a Pope for the Ages,,,,,[],
3,>,https://www.nytimes.com/2005/04/09/opinion/a-farewell-to-a-pope-for-the-ages-8-letters.html,,>,,,The New York Times,[],[],2005-04-09T05:00:00+0000,article,None,Opinion,News,nyt://article/eaa19b14-a46a-5567-8c24-bd4a67509dd1,871,nyt://article/eaa19b14-a46a-5567-8c24-bd4a67509dd1,A Farewell to a Pope for the Ages (8 Letters),,,A Farewell to a Pope for the Ages (8 Letters),,,,,[],
