,abstract,web_url,snippet,lead_paragraph,print_section,print_page,source,multimedia,keywords,pub_date,document_type,news_desk,section_name,subsection_name,type_of_material,_id,word_count,uri,headline_main,headline_kicker,headline_content_kicker,headline_print_headline,headline_name,headline_seo,headline_sub,byline_original,byline_person,byline_organization
0,JAZZ.,https://www.nytimes.com/2006/08/04/arts/music/04jazz.html,JAZZ.,JAZZ,E,21,The New York Times,[],"[{'name': 'subject', 'value': 'Music', 'rank': 1, 'major': 'N'}, {'name': 'subject', 'value': 'Jazz', 'rank': 2, 'major': 'N'}]",2006-08-04T04:00:00+0000,article,Weekend,Arts,Music,News,nyt://article/8d455ca2-6453-5e56-ab84-85a0b3c61d8a,2481,nyt://article/8d455ca2-6453-5e56-ab84-85a0b3c61d8a,Jazz Listings,,,,,,,By The New York Times,[],The New York Times
1,POP.,https://www.nytimes.com/2006/08/04/arts/04pop.html,POP.,POP,E,20,The New York Times,[],"[{'name': 'subject', 'value': 'Music', 'rank': 1, 'major': 'N'}, {'name': 'subject', 'value': 'Rock Music', 'rank': 2, 'major': 'N'}]",2006-08-04T04:00:00+0000,article,Weekend,Arts,,News,nyt://article/07bfe793-bbf7-5385-9bd0-bb6e9ed8c0ab,2125,nyt://article/07bfe793-bbf7-5385-9bd0-bb6e9ed8c0ab,Rock/Pop Listings,,,,,,,By The New York Times,[],The New York Times
2," 9 P.M. (TNT) NIGHTMARES AND DREAMSCAPES: FROM THE STORIES OF STEPHEN KING -- How does Mr. King sleep at night with his imagination running at such a clip? In ''Autopsy Room Four,'' Part 7 of this eight-episode horror series, Richard Thomas plays a man about to witness his own autopsy after a snakebite paralyzes him; Greta Scacchi (above, with Mr. Thomas) is the doctor who -- finally -- arouses his senses. At 10, in ''You Know They Got a Hell of a Band,'' the series finale, Steven Weber and Kim Delaney portray a couple on a road trip who can't find their way out of town.    8 P.M. (Discovery) EVERYTHING YOU NEED TO KNOW -- Last month, Gary Hall Jr., the Olympic gold-medal swimmer, successfully fended off a shark until his sister Bebe could kill it with a spear gun, but you may not be so lucky. This special, part of Shark Week, tells how to survive these predators if you don't have an Amazon at your side. At 9, ''Sharks: Are They Hunting Us?'' reveals whether humans have become these predators' favorite cuisine.    8 P.M. (13, 49) LIVE FROM LINCOLN CENTER: MOSTLY MOZART FESTIVAL 2006 -- Louis Langrée (left) conducts a concert fit for a king, or at least a kingly composer, in this 40th-anniversary performance featuring two of Mozart's ''Coronation'' works: the Piano Concerto No. 26, with Garrick Ohlsson, and the Mass in C major, with Hei-Kyung Hong, Sarah Connolly, Matthew Polenzani, John Relyea and the Concert Chorale of New York. Neither work was written for royalty but rather anointed when they were played during the 1791 coronation festivities of Leopold II in Prague, after Mozart's death.    9 P.M. (Fox) SO YOU THINK YOU CAN DANCE -- Is blood thicker than sweat? In tonight's episode, the top six go for the gold, including Heidi Groskreutz and Benji Schwimmer, cousins and former swing-dance champions. But there can be only one winner.    10 P.M. (A&E) CRISS ANGEL MINDFREAK -- Who says you can't go home again? Tonight, Mr. Angel returns to his Long Island high school and plays a few tricks on some teachers without fear of detention.    10 P.M. (FX) 30 DAYS -- Chris Jobin, an American computer programmer who lost his employment to outsourcing, wants his job back. In this episode, he travels to India to see the effects of jobs from the United States on the country and attends seminars on perfecting American accents (above, with Mr. Jobin, center) -- and finds out why his already-perfect accent wasn't perfect enough.   KATHRYN SHATTUCK",https://www.nytimes.com/2006/08/02/arts/whats-on-tonight.html,"9 P.M. (TNT) NIGHTMARES AND DREAMSCAPES: FROM THE STORIES OF STEPHEN KING -- How does Mr. King sleep at night with his imagination running at such a clip? In ''Autopsy Room Four,'' Part 7 of this eight-episode horror series, Richard Thomas plays a...","9 P.M. (TNT) NIGHTMARES AND DREAMSCAPES: FROM THE STORIES OF STEPHEN KING -- How does Mr. King sleep at night with his imagination running at such a clip? In ""Autopsy Room Four,"" Part 7 of this eight-episode horror series, Richard Thomas plays a man about to witness his own autopsy after a snakebite paralyzes him; Greta Scacchi (above, with Mr. Thomas) is the doctor who -- finally -- arouses his senses. At 10, in ""You Know They Got a Hell of a Band,"" the series finale, Steven Weber and Kim Delaney portray a couple on a road trip who can't find their way out of town.",E,9,The New York Times,[],[],2006-08-02T05:00:00+0000,article,The Arts/Cultural Desk,Arts,,Schedule,nyt://article/5aad0d29-d9a9-5fa4-977e-33093ca21cd8,430,nyt://article/5aad0d29-d9a9-5fa4-977e-33093ca21cd8,WHAT'S ON TONIGHT,,,WHAT'S ON TONIGHT,,,,By Kathryn Shattuck,"[{'firstname': 'Kathryn', 'middlename': None, 'lastname': 'Shattuck', 'qualifier': None, 'title': None, 'role': 'reported', 'organization': '', 'rank': 1}]",
3," Attractions    Museums and Sites    AMERICAN MUSEUM OF NATURAL HISTORY, Central Park West and 79th Street. Through Jan. 15, ''Yellowstone to Yukon,'' an exhibition of more than 40 photographs by 11 photographers documenting the animals, vegetation and geology of the regions affected by one of the world's largest wildlife conservation initiatives. Through Jan. 7, ''Lizards & Snakes: Alive!,'' an exhibition with live examples of more than 25 species. Through Aug. 20, ''Darwin,'' an exhibition devoted to the naturalist Charles Darwin, which includes fossils and live creatures as well as a reconstruction of his study at Down House. Through Jan. 2, ''Voices From South of the Clouds,'' a display of photographs of life in the Yunnan Province in China, taken by villagers. Also on view: ''Vital Variety: A Visual Celebration of Invertebrate Biodiversity,'' an exhibition of 24 large-format color photographs by the entomologist Piotr Naskrecki. In the IMAX theater, through Labor Day, ''Journey Into Amazing Caves,'' a film that documents the collaboration of Nancy Aulenbach, a cave explorer, and Hazel Barton, a microbiologist. Timed tickets to ''Lizards & Snakes: Alive!'' and ''Darwin,'' which include museum admission, are $21; $16 for students and 60+; $12 for 12 and younger. IMAX tickets, which include museum admission, are $21; students and 60+, $16; children under 12, $12. Suggested museum admission: $14; students and 60+, $10.50; children, $8. Combination tickets, including museum and Rose Center admission and the Hayden Planetarium space show (''Cosmic Collisions''): $22; students and 60+, $16.50; 12 and younger, $13; under 2, free; admission that includes all activities: $30; $23 for students and 60+; $19 for those 12 and younger. The Rose Center is open until 8:45 p.m. for ''Starry Nights: Fridays Under the Sphere,'' with a cash bar, jazz and tapas, on the first Friday of every month; next Friday, the Ron Carter Quartet. Museum hours: daily, 10 a.m. to 5:45 p.m. (to 8:45 p.m. on Fridays); (212) 769-5100 or (212) 769-5200; amnh.org    INSTITUTO CERVANTES, 211 East 49th Street, Manhattan. Through Sept. 30, ''Correspondents in the Spanish Civil War, 1936-1939,'' an exhibition of original documents and newspaper accounts by Ernest Hemingway, Antoine de Saint-Exupéry, John Dos Passos, George Orwell, Martha Gellhorn and others. Tuesdays through Fridays, 12:30 to 6:30 p.m.; Saturdays, 10 a.m. to 1:30 p.m. Free. (212) 308-7720; www.cervantes.org.    MUSEUM OF THE CITY OF NEW YORK, 1120 Fifth Avenue, at 103rd Street. Through Oct. 12, ''The High Style of Dorothy Draper,'' a display of furniture, photographs and other items relating to the career of that noted interior decorator. Tomorrow at 2 p.m., ''The High Style of the Upper East Side,'' a walking tour that includes stops at apartment lobbies designed by Draper; $15; students and members, $10; reservations required: (212) 534-1672, Ext. 3393. Through Aug. 6, ''On the Couch: Cartoons From The New Yorker,'' psychotherapy-related cartoons from the magazine. Tuesdays through Sundays, 10 a.m. to 5 p.m. Suggested admission: $9; 62+ and students, $5; under 12, free; families, $20; Sundays, 10 a.m. to noon, free for all. (212) 534-1672.    NEW YORK PUBLIC LIBRARY, Wachenheim Gallery of the Humanities and Social Sciences Library, Fifth Avenue and 42nd Street. Through Aug. 5, the Declaration of Independence, handwritten by Thomas Jefferson. Tuesdays and Wednesdays, 11 a.m. to 7:30 p.m.; Thursdays through Saturdays, 10 a.m. to 6 p.m.; Sundays, 1 to 5 p.m. Free. (212) 869-8089.    Gardens    NEW YORK BOTANICAL GARDEN, Southern Boulevard and 200th Street, Bedford Park, the Bronx. Through Oct. 29, ''Chihuly at the New York Botanical Garden,'' an exhibition of glass sculpture by the artist Dale Chihuly. A film about Mr. Chihuly will be shown Fridays at 3 p.m. and Saturdays and Sundays at 1 and 3 p.m. Tomorrow and Sunday at 1:30 p.m., a walk through the cutting garden with a discussion of how best to cut and arrange flowers.Tuesdays through Sundays, 10 a.m. to 6 p.m. Garden grounds admission: $6; 62+, $3; students, $2; 2 to 12, $1; under 2, free. Combination ticket, including all admissions and a tram tour: $13; 62+ and students, $11; 2 to 12, $5; under 2, free. Tram tours daily, every 30 minutes. Conservatory admission: $5; students and 62+, $4; 2 to 12, $3; under 2, free. Grounds admission free on Wednesdays, and 10 a.m. to noon on Saturdays. Parking: $7; (718) 817-8700; nybg.org.    WAVE HILL, Independence Avenue and West 249th Street, Riverdale, the Bronx. Tomorrow and Sunday, 1 to 4 p.m., a family art project in making a solar-powered mobile. Sunday at 2 p.m., an artists' performance on the topic of garden improvement by the group Chadwicks Discovery. Tuesdays through Sundays, 9 a.m. to 4:30 p.m. $4; students and 65+, $2; under 6, free; Tuesdays, free all day; Saturdays, free 9 a.m. to noon; (718) 549-3200.    Events    New York City    BATTERY PARK CITY PARKS CONSERVANCY, Battery Park City, Lower Manhattan. Tonight at 6:30, ''Drumming Circles for All Ages,'' with djembe and conga drums, bells, shakers and sticks, featuring the drummer Mary Knysh. Free; (212) 267-9700; bpcparks.org.    'GOOD MORNING AMERICA' SUMMER CONCERT SERIES, Bryant Park, Avenue of the Americas, at 42nd Street. Today, 7 to 9 a.m., Huey Lewis and the News.    WASHINGTON SQUARE SUMMER FAIR,  Bleecker Street, between Broadway and Avenue of the Americas, Greenwich Village. Tomorrow, 11 a.m. to 6 p.m.    2006 SORRENTO CHEESE SUMMER IN LITTLE ITALY FESTIVAL, Mulberry Street, between Canal and Hester Streets. A free summerlong series of entertainment and other activities continues tomorrow at 2 p.m. with the Third Mario Lanza Vocal Competition featuring 14 tenors. Judges include Phil Ramone, the music producer. Sponsored by Sorrento Cheese and other businesses. (212) 302-0551; littleitalynyconline.org.    VANDERBILT Y.M.C.A. STREET FAIR, Second Avenue, between 42nd and 57th Streets, Manhattan. Tomorrow, 11 a.m. to 6 p.m.    PRESERVATION OF LIVES STREET FAIR, Christopher Street, between Greenwich and Seventh Avenues, West Village. Sunday, 11 a.m. to 6 p.m.    52ND ASSOCIATION JAZZ FESTIVAL, 52nd Street, from Seventh to Lexington Avenues. Sunday, 11 a.m. to 6 p.m.    HARLEM WEEK On Sunday, ''A Great Day in Harlem,'' at the Ulysses S. Grant National Memorial Park, West 122nd Street and Riverside Drive, with a Family Unity Day Cultural Festival at 1 p.m., followed by a fashion show at 5 and a performance at 6 featuring Ashford and Simpson, Michelle Williams of Destiny's Child, Nona Gaye and others. (212) 862-8477; harlemdiscover.com.    114TH PRECINCT CIVILIAN OBSERVATION PATROL FESTIVAL, Broadway, between Steinway and 47th Streets, Astoria, Queens. Sunday, 11 a.m. to 6 p.m.    PERUVIAN FESTIVAL, Flushing Meadows-Corona Park, Queens. Sunday, 10 a.m. to 6 p.m.    BORICUA FESTIVAL, Prospect Park, Ninth Street and Prospect Park West, Brooklyn. Tomorrow, noon to 9 p.m.    BORICUA DAY PARADE OF NEW YORK, Graham Avenue and Broadway, to Lindsay Park, East Williamsburg, Brooklyn. Sunday at 1:30 p.m.    'THE ACCORDION CAN KILL YOU,' Tenri Cultural Institute, 43 West 13th Street, Greenwich Village. An annual festival of daily workshops, discussions and performances. Through Sunday. Workshops are at 3 p.m., followed by concerts each night at 7. Sponsored by the American Accordionists' Association. $40 daily for all events; $20 daily for all workshops; $25 per concert; weekend pass, $110. (212) 876-0827.    'STARRY SKY,' World Financial Center Winter Garden, 220 Vesey Street, Lower Manhattan. An exhibition of more than 300 handmade kites by Buteo Huang, a Taiwanese designer. Daily, 6 a.m. to midnight. Through Aug. 19. Free. (212) 945-0505.    QUEENS JAZZ FESTIVAL, a free outdoor festival in the Quad of Queens College, Kissena Boulevard and 65th Avenue, Flushing. Appearing will be the Jon Faddis Quartet, with guests; Michael Philip Mossman and his ensemble; and Mayte Vicens, a flamenco dancer. Sunday, 3 to 9 p.m., rain or shine; the Jon Faddis Quartet will appear at 7:30 p.m. (718) 544-2996.    'WALKING MEDITATION IN THE GREENBELT,' led by a Buddhist monk from the Staten Island Buddhist Vihara. Meets Sunday at 2 p.m. on Staten Island in the parking lot of the Greenbelt Nature Center, 700 Rockland Avenue, at Brielle Avenue, Egbertville. Sponsored by the Jacques Marchais Museum. $10; students, $5. Reservations: (718) 987-3500.    SUMMER ON THE HUDSON 2006,  Riverside Park South, Pier 1, reachable from 68th or 72nd Streets, Manhattan. A free series of events. Sunday at 6 p.m., Kevin Kinsella, a reggae singer and songwriter. Information: 311.    HARLEM MEER PERFORMANCE FESTIVAL, Central Park, Charles A. Dana Discovery Center, Fifth Avenue at 110th Street. Free Sunday series of concerts. Sunday at 4 p.m., Zé Rui de Pina, a musician from the African republic of Cape Verde. Sponsored by the Central Park Conservancy; (212) 310-6600; centralparknyc.org.    SUMMERMUSIC 2006 Sunday, ''Two Irish Tenors,'' featuring Michael Brown and Neil Farrell at two locations: 2 p.m. at Van Cortlandt Park, Rockwood Drive Circle, Broadway and Mosholu Avenue, Riverdale, the Bronx (rain location, Amalgamated Houses, Vladeck Hall, Hillman Avenue and Van Cortlandt Park South); 4 p.m. at Fordham University, Keating Hall Auditorium, Southern Boulevard and Fordham Road, Bedford Park, the Bronx. Free. Presented by the Bronx Arts Ensemble and Assemblyman Jeffrey Dinowitz, a Democrat from the Bronx; (718) 601-7399.    SUMMER ART SHOW: 'FOOD FOR  A FEAST FOR THE EYES,' 499 Van Brunt Street, Red Hook, Brooklyn. Weekends through Aug. 20, 1 to 7 p.m. Presented by the Brooklyn Waterfront Artists Coalition; (718) 596-2506.    SUMMER SESSIONS Cooper-Hewitt National Design Museum, Arthur Ross Terrace and Garden, 2 East 91st Street, Manhattan. With dancing, D.J.'s and design every Friday through Sept. 8, 6 to 9 p.m. Appearing tonight, Scott Hardkiss. Free with admission, $12; $7, students and 65+; (212) 849-8349; cooperhewitt.org.    WATSON ADVENTURES Tomorrow at 5 p.m., the ''Starring Central Park Twilight Scavenger Hunt,'' focusing on locations used in movies and television shows. $20. Meeting place and other information: (877) 946-4868.    'BLESSED ARE THE MERCIFUL: CELEBRATING HENRY BERGH AND THE A.S.P.C.A.,' Green-Wood Cemetery Chapel, Fifth Avenue and 25th Street, Greenwood Heights, Brooklyn. Through Sunday, a tribute to the founder of the American Society for the Prevention of Cruelty to Animals that commemorates the 140th anniversary of the society, with an exhibition of diaries, vintage photographs and other items. 7 a.m. to 7 p.m. Free; (718) 768-7300.    Walking Tours    New York City    BROOKLYN CENTER FOR THE URBAN ENVIRONMENT Sunday at 11 a.m., ''Central Harlem -- With a Touch of Sugar Hill,'' with stops at sites associated with Alexander Hamilton and the composer W. C. Handy, meeting at St. Nicholas Park, St. Nicholas Avenue and 135th Street, Hamilton Heights. $11; members, $9; students, $8; (718) 788-8500, Ext. 208.    NYC DISCOVERY TOURS Tomorrow and Sunday at 2 p.m., ''Brooklyn Bridge and TriBeCa History and Tasting Tour,'' begins with a walk across the Brooklyn Bridge and continues along the streets of Lower Manhattan, with stops for noshing. $20, including food. Reservations and meeting place: (212) 465-3331.    'JEWISH LOWER EAST SIDE: THEN AND NOW' will focus on historical places of worship, including Kehila Kedosha Janina and Beth Hamedrash Hagodol, meeting Sunday at 11:30 a.m. at Beth Hamedrash Hagodol, 60 Norfolk Street. Sponsored by the Lower East Side Jewish Conservancy. $16; students, $14. (212) 374-4100.    GOTHAM WALK Tomorrow and Sunday at 11:45 a.m. and 2:15 p.m., ''TriBeCa Then and Now: An Overview Tour,'' a walk past an eclectic mix of more than 20 locations in the neighborhood. $10. Reservations and meeting place: (212) 629-1886.    NOSHWALKS offers tours that combine walking and eating. Tomorrow at 11:30 a.m., a tour of Bensonhurst, Brooklyn, meeting in Brooklyn at the Mona Lisa Cafe, 1476 86th Street. $33. (212) 222-2243.    I'LL TAKE MANHATTAN TOURS Tomorrow at 1 p.m., ''Enclaves of Greenwich Village'' features the former homes of Mark Twain and Edith Wharton, as well as a speakeasy; meeting on the southeast corner of 12th Street and Fifth Avenue. $15. (732) 270-5559.    BOWERY AND CANAL WALKING TOURS Today at 2 p.m., a walk devoted to the building and history of the Brooklyn Bridge, meeting in front of the Horace Greeley Statue in City Hall Park. $12; students, $10. (212) 979-8013.    HARLEM, YOUR WAY! Sunday at 10:15 a.m., ''Experience the Beauty of Harlem Gospel,'' meeting at 129 West 130th Street. $25. An optional meal follows; (212) 690-1687.    'THE HIDDEN CHARMS OF CHELSEA' meeting tomorrow at 1 p.m. at the General Theological Seminary, Ninth Avenue and 20th Street. Sponsored by Joyce Gold History Tours of New York. $12. (212) 242-5762.    HIGH ROCK CONCERT HIKE, a three-mile walk in Staten Island through the Greenbelt, ending with a free concert by the Staten Island Chamber Music Players in High Rock Park. Meets Sunday at the intersection of Richmond Road and Rockland Avenue; participants should take the 10:30 a.m. ferry to Staten Island and then the S53 bus to Clove and Richmond Roads. Co-sponsored by the Outdoors Club and the Urban Trail Conference. $3. (718) 720-1593.    FRIENDS OF HUDSON RIVER PARK  offers free tours of the West Village section of the park on Saturdays at 2 p.m. through Aug. 26, meeting at the foot of Pier 45 at the Hudson River and Christopher Street. Also, free catch-and-release fishing Tuesdays through Sundays, noon to 5 p.m., through August, from Pier 46, north of Christopher Street, and Pier 96, at 56th Street. Tours: (212) 757-0981; fishing: (212) 627-2020.    STREET SMARTS N.Y. Tomorrow at 2 p.m., ''From Pages to Pavement'' visits the scenes of seven famous novels from the Gaslight Era, meeting at the Washington Arch. $10. (212) 969-8262.    BIG ONION WALKING TOURS Tomorrow at 1 p.m., ''Gramercy Park and Union Square'' will cover the political past of Union Square and the exclusive residential area around Gramercy Park, meeting at the George Washington statue in Union Square at 14th Street. $15; 63+, $12; students and New-York Historical Society members, $10. Sunday at 1 p.m., ''The Multi-Ethnic Eating Tour,'' with stops on the Lower East Side, Chinatown and Little Italy, meeting on the southeast corner of Essex and Delancey Streets; $19; 63+, $16; students and New-York Historical Society members, $14. (212) 439-1090.    MUNICIPAL ART SOCIETY OF NEW YORK Tomorrow at 2 p.m., ''Greenpoint and Williamsburg Waterfront: The Farewell Tour'' visits an area that is being transformed from industrial center to a chic residential community, meeting at the Greenpoint Avenue subway station on the G train, at Manhattan Avenue. Sunday at 11 a.m., ''Canal Street Edge: From Bucolic to Frenetic'' includes stops at buildings dating to the 1800's, meeting at 280 Broadway, at Chambers Street, Lower Manhattan. Fee for each: $15; members, $12; (212) 439-1049.    SHOREWALKERS Sunday at 11 a.m., ''Coney Island and the Aquarium,'' with a stop for lunch in Little Russia, meeting at Nathan's, on Stillwell and Surf Avenues, Brooklyn. $3. (212) 874-1067.    CENTRAL PARK CONSERVANCY Free weekend tours of Central Park. Tomorrow at 11 a.m., ''Let the Games Begin: History of Sports in the Park,'' meeting at the Dairy, midpark at 65th Street. Sunday at noon, ''A Road Once Traveled'' examines the role of Central Park's terrain in the American Revolution and the War of 1812, meeting at the Charles A. Dana Discovery Center, Fifth Avenue and 110th Street; centralparknyc.org.    HISTORIC BROADWAY THEATER DISTRICT WALKING TOUR Tomorrow and Sunday at 10 a.m. $20. Sponsored by New York Curmudgeon Tours. Meeting place: (212) 629-8813 or (917) 568-0830.    SIDEWALK SURPRISES IN LINCOLN SQUARE Meets every Saturday at 11 a.m., through Nov. 11, inside Columbus Circle, 59th Street and Broadway. Sponsored by the Lincoln Square Business Improvement District. Free; (212) 581-3774.    METRO TOUR SERVICE Visits Brooklyn Heights, Fort Greene and Clinton Hill, Brooklyn, today through Sunday at 2 p.m., meeting in front of the Marriott, Adams and Tillary Streets, downtown Brooklyn. $25. (718) 789-0430.",https://www.nytimes.com/2006/07/28/arts/spare-times.html,"Attractions    Museums and Sites    AMERICAN MUSEUM OF NATURAL HISTORY, Central Park West and 79th Street. Through Jan. 15, ''Yellowstone to Yukon,'' an exhibition of more than 40 photographs by 11 photographers documenting the animals, vegetation...",Attractions,E,26,The New York Times,[],[],2006-07-28T05:00:00+0000,article,"Movies, Performing Arts/Weekend Desk",Arts,,Schedule,nyt://article/bf02edf1-c3e9-5d58-803c-bb63049de20d,2620,nyt://article/bf02edf1-c3e9-5d58-803c-bb63049de20d,Spare Times,,,Spare Times,,,,,[],
