,abstract,web_url,snippet,lead_paragraph,source,multimedia,keywords,pub_date,document_type,news_desk,section_name,subsection_name,type_of_material,_id,word_count,uri,headline_main,headline_kicker,headline_content_kicker,headline_print_headline,headline_name,headline_seo,headline_sub,byline_original,byline_person,byline_organization,print_section,print_page
0,"After weeks fighting in court to keep the source of its funds secret, the Arizona nonprofit group that had made an anonymous $11 million donation to two California ballot measure campaigns revealed the source of the money Monday. Sort of.",https://thecaucus.blogs.nytimes.com/2012/11/05/arizona-group-says-it-was-middle-man-for-donations-to-california-ballot-measures/,"After weeks fighting in court to keep the source of its funds secret, the Arizona nonprofit group that had made an anonymous $11 million donation to two California ballot measure campaigns revealed the source of the money Monday. Sort of.","LOS ANGELES — After weeks fighting in court to keep the source of its funds secret, the Arizona nonprofit group that last month made an anonymous $11 million donation to two California ballot measure campaigns revealed the source of the money Monday morning. Sort of. ",The New York Times,[],"[{'name': 'subject', 'value': 'Referendums', 'rank': 1, 'major': 'N'}, {'name': 'glocations', 'value': 'California', 'rank': 2, 'major': 'N'}]",2012-11-05T21:24:48+0000,article,,U.S.,Politics,News,nyt://article/f4f70487-09ff-5091-9468-1b5cc493446f,509,nyt://article/f4f70487-09ff-5091-9468-1b5cc493446f,Arizona Group Says It Was Middleman for Donations to California Ballot Measures,,,,,,,By Ian Lovett,"[{'firstname': 'Ian', 'middlename': None, 'lastname': 'Lovett', 'qualifier': None, 'title': None, 'role': 'reported', 'organization': '', 'rank': 1}]",,,
1,"The data collection practices of app makers are loosely regulated, but the European Union is working on proposals to get explicit consent from consumers to cull their personal information.",https://www.nytimes.com/2012/10/29/technology/mobile-apps-have-a-ravenous-ability-to-collect-personal-data.html,"The data collection practices of app makers are loosely regulated, but the European Union is working on proposals to get explicit consent from consumers to cull their personal information.","BERLIN — Angry Birds, the top-selling paid mobile app for the iPhone in the United States and Europe, has been downloaded more than a billion times by devoted game players around the world, who often spend hours slinging squawking fowl at groups of egg-stealing pigs.",The New York Times,[],"[{'name': 'subject', 'value': 'Regulation and Deregulation of Industry', 'rank': 1, 'major': 'N'}, {'name': 'subject', 'value': 'Privacy', 'rank': 2, 'major': 'N'}, {'name': 'organizations', 'value': 'European Commission', 'rank': 3, 'major': 'N'}, {'name': 'glocations', 'value': 'Europe', 'rank': 4, 'major': 'N'}, {'name': 'subject', 'value': 'Data-Mining and Database Marketing', 'rank': 5, 'major': 'N'}, {'name': 'subject', 'value': 'Mobile Applications', 'rank': 6, 'major': 'N'}, {'name': 'subject', 'value': 'ADVERTISING AND MARKETING', 'rank': 7, 'major': 'N'}]",2012-10-28T21:00:23+0000,article,Business,Technology,,News,nyt://article/2a0ab3ec-2690-5848-b33f-62b4b6fad119,843,nyt://article/2a0ab3ec-2690-5848-b33f-62b4b6fad119,Data-Gathering via Apps Presents a Gray Legal Area,,,Data-Gathering via Apps Presents a Gray Legal Area,,,,By Kevin J. O'Brien,"[{'firstname': 'Kevin', 'middlename': 'J.', 'lastname': ""O'Brien"", 'qualifier': None, 'title': None, 'role': 'reported', 'organization': '', 'rank': 1}]",,B,7
2,American politicians say some outrageous things about rape. But our policies toward rape victims can be even more insensitive.,https://www.nytimes.com/2012/10/28/opinion/sunday/kristof-Outrageous-Policies-Toward-Rape-Victims.html,American politicians say some outrageous things about rape. But our policies toward rape victims can be even more insensitive.,"THE silliness began when Todd Akin claimed during his Senate campaign in Missouri that in the case of “legitimate rape,” women “shut that whole thing down” to prevent pregnancy. Then, a few days ago, Richard Mourdock of Indiana seemed to blame God for such pregnancies, saying this was “something God intended to happen.” I think God should sue him for defamation.",The New York Times,"[{'rank': 0, 'subtype': 'xlarge', 'caption': None, 'credit': None, 'type': 'image', 'url': 'images/2018/04/03/opinion/nicholas-kristof/nicholas-kristof-articleLarge-v2.png', 'height': 300, 'width': 600, 'legacy': {'xlarge': 'images/2018/04/03/opinion/nicholas-kristof/nicholas-kristof-articleLarge-v2.png', 'xlargewidth': 600, 'xlargeheight': 300}, 'subType': 'xlarge', 'crop_name': 'articleLarge'}, {'rank': 0, 'subtype': 'popup', 'caption': None, 'credit': None, 'type': 'image', 'url': 'images/2018/04/03/opinion/nicholas-kristof/nicholas-kristof-popup-v2.png', 'height': 325, 'width': 650, 'legacy': {}, 'subType': 'popup', 'crop_name': 'popup'}, {'rank': 0, 'subtype': 'blog480', 'caption': None, 'credit': None, 'type': 'image', 'url': 'images/2018/04/03/opinion/nicholas-kristof/nicholas-kristof-blog480-v2.png', 'height': 240, 'width': 480, 'legacy': {}, 'subType': 'blog480', 'crop_name': 'blog480'}, {'rank': 0, 'subtype': 'blog533', 'caption': None, 'credit': None, 'type': 'image', 'url': 'images/2018/04/03/opinion/nicholas-kristof/nicholas-kristof-blog533-v2.png', 'height': 267, 'width': 533, 'legacy': {}, 'subType': 'blog533', 'crop_name': 'blog533'}, {'rank': 0, 'subtype': 'blog427', 'caption': None, 'credit': None, 'type': 'image', 'url': 'images/2018/04/03/opinion/nicholas-kristof/nicholas-kristof-blog427-v2.png', 'height': 214, 'width': 427, 'legacy': {}, 'subType': 'blog427', 'crop_name': 'blog427'}, {'rank': 0, 'subtype': 'tmagSF', 'caption': None, 'credit': None, 'type': 'image', 'url': 'images/2018/04/03/opinion/nicholas-kristof/nicholas-kristof-tmagSF-v2.png', 'height': 181, 'width': 362, 'legacy': {}, 'subType': 'tmagSF', 'crop_name': 'tmagSF'}, {'rank': 0, 'subtype': 'tmagArticle', 'caption': None, 'credit': None, 'type': 'image', 'url': 'images/2018/04/03/opinion/nicholas-kristof/nicholas-kristof-tmagArticle-v2.png', 'height': 296, 'width': 592, 'legacy': {}, 'subType': 'tmagArticle', 'crop_name': 'tmagArticle'}, {'rank': 0, 'subtype': 'slide', 'caption': None, 'credit': None, 'type': 'image', 'url': 'images/2018/04/03/opinion/nicholas-kristof/nicholas-kristof-slide-v2.png', 'height': 300, 'width': 600, 'legacy': {}, 'subType': 'slide', 'crop_name': 'slide'}, {'rank': 0, 'subtype': 'jumbo', 'caption': None, 'credit': None, 'type': 'image', 'url': 'images/2018/04/03/opinion/nicholas-kristof/nicholas-kristof-jumbo-v2.png', 'height': 512, 'width': 1024, 'legacy': {}, 'subType': 'jumbo', 'crop_name': 'jumbo'}, {'rank': 0, 'subtype': 'superJumbo', 'caption': None, 'credit': None, 'type': 'image', 'url': 'images/2018/04/03/opinion/nicholas-kristof/nicholas-kristof-superJumbo-v2.png', 'height': 1000, 'width': 2000, 'legacy': {}, 'subType': 'superJumbo', 'crop_name': 'superJumbo'}, {'rank': 0, 'subtype': 'blog225', 'caption': None, 'credit': None, 'type': 'image', 'url': 'images/2018/04/03/opinion/nicholas-kristof/nicholas-kristof-blog225-v2.png', 'height': 113, 'width': 225, 'legacy': {}, 'subType': 'blog225', 'crop_name': 'blog225'}, {'rank': 0, 'subtype': 'master1050', 'caption': None, 'credit': None, 'type': 'image', 'url': 'images/2018/04/03/opinion/nicholas-kristof/nicholas-kristof-master1050-v2.png', 'height': 525, 'width': 1050, 'legacy': {}, 'subType': 'master1050', 'crop_name': 'master1050'}, {'rank': 0, 'subtype': 'master675', 'caption': None, 'credit': None, 'type': 'image', 'url': 'images/2018/04/03/opinion/nicholas-kristof/nicholas-kristof-master675-v2.png', 'height': 338, 'width': 675, 'legacy': {}, 'subType': 'master675', 'crop_name': 'master675'}, {'rank': 0, 'subtype': 'master495', 'caption': None, 'credit': None, 'type': 'image', 'url': 'images/2018/04/03/opinion/nicholas-kristof/nicholas-kristof-master495-v2.png', 'height': 248, 'width': 495, 'legacy': {}, 'subType': 'master495', 'crop_name': 'master495'}, {'rank': 0, 'subtype': 'master180', 'caption': None, 'credit': None, 'type': 'image', 'url': 'images/2018/04/03/opinion/nicholas-kristof/nicholas-kristof-master180-v2.png', 'height': 90, 'width': 180, 'legacy': {}, 'subType': 'master180', 'crop_name': 'master180'}, {'rank': 0, 'subtype': 'master315', 'caption': None, 'credit': None, 'type': 'image', 'url': 'images/2018/04/03/opinion/nicholas-kristof/nicholas-kristof-master315-v2.png', 'height': 158, 'width': 315, 'legacy': {}, 'subType': 'master315', 'crop_name': 'master315'}, {'rank': 0, 'subtype': 'master768', 'caption': None, 'credit': None, 'type': 'image', 'url': 'images/2018/04/03/opinion/nicholas-kristof/nicholas-kristof-master768-v2.png', 'height': 384, 'width': 768, 'legacy': {}, 'subType': 'master768', 'crop_name': 'master768'}, {'rank': 0, 'subtype': 'thumbnail', 'caption': None, 'credit': None, 'type': 'image', 'url': 'images/2018/04/03/opinion/nicholas-kristof/nicholas-kristof-thumbStandard-v2.png', 'height': 75, 'width': 75, 'legacy': {'thumbnail': 'images/2018/04/03/opinion/nicholas-kristof/nicholas-kristof-thumbStandard-v2.png', 'thumbnailwidth': 75, 'thumbnailheight': 75}, 'subType': 'thumbnail', 'crop_name': 'thumbStandard'}, {'rank': 0, 'subtype': 'blogSmallThumb', 'caption': None, 'credit': None, 'type': 'image', 'url': 'images/2018/04/03/opinion/nicholas-kristof/nicholas-kristof-blogSmallThumb-v2.png', 'height': 50, 'width': 50, 'legacy': {}, 'subType': 'blogSmallThumb', 'crop_name': 'blogSmallThumb'}, {'rank': 0, 'subtype': 'thumbLarge', 'caption': None, 'credit': None, 'type': 'image', 'url': 'images/2018/04/03/opinion/nicholas-kristof/nicholas-kristof-thumbLarge-v2.png', 'height': 150, 'width': 150, 'legacy': {}, 'subType': 'thumbLarge', 'crop_name': 'thumbLarge'}, {'rank': 0, 'subtype': 'smallSquare168', 'caption': None, 'credit': None, 'type': 'image', 'url': 'images/2018/04/03/opinion/nicholas-kristof/nicholas-kristof-smallSquare168-v2.png', 'height': 168, 'width': 168, 'legacy': {}, 'subType': 'smallSquare168', 'crop_name': 'smallSquare168'}, {'rank': 0, 'subtype': 'smallSquare252', 'caption': None, 'credit': None, 'type': 'image', 'url': 'images/2018/04/03/opinion/nicholas-kristof/nicholas-kristof-smallSquare252-v2.png', 'height': 252, 'width': 252, 'legacy': {}, 'subType': 'smallSquare252', 'crop_name': 'smallSquare252'}, {'rank': 0, 'subtype': 'square320', 'caption': None, 'credit': None, 'type': 'image', 'url': 'images/2018/04/03/opinion/nicholas-kristof/nicholas-kristof-square320-v2.png', 'height': 320, 'width': 320, 'legacy': {}, 'subType': 'square320', 'crop_name': 'square320'}, {'rank': 0, 'subtype': 'moth', 'caption': None, 'credit': None, 'type': 'image', 'url': 'images/2018/04/03/opinion/nicholas-kristof/nicholas-kristof-moth-v2.png', 'height': 151, 'width': 151, 'legacy': {}, 'subType': 'moth', 'crop_name': 'moth'}, {'rank': 0, 'subtype': 'filmstrip', 'caption': None, 'credit': None, 'type': 'image', 'url': 'images/2018/04/03/opinion/nicholas-kristof/nicholas-kristof-filmstrip-v2.png', 'height': 190, 'width': 190, 'legacy': {}, 'subType': 'filmstrip', 'crop_name': 'filmstrip'}, {'rank': 0, 'subtype': 'square640', 'caption': None, 'credit': None, 'type': 'image', 'url': 'images/2018/04/03/opinion/nicholas-kristof/nicholas-kristof-square640-v2.png', 'height': 640, 'width': 640, 'legacy': {}, 'subType': 'square640', 'crop_name': 'square640'}, {'rank': 0, 'subtype': 'mediumSquare149', 'caption': None, 'credit': None, 'type': 'image', 'url': 'images/2018/04/03/opinion/nicholas-kristof/nicholas-kristof-mediumSquare149-v2.png', 'height': 149, 'width': 149, 'legacy': {}, 'subType': 'mediumSquare149', 'crop_name': 'mediumSquare149'}, {'rank': 0, 'subtype': 'sfSpan', 'caption': None, 'credit': None, 'type': 'image', 'url': 'images/2018/04/03/opinion/nicholas-kristof/nicholas-kristof-sfSpan-v2.png', 'height': 263, 'width': 395, 'legacy': {}, 'subType': 'sfSpan', 'crop_name': 'sfSpan'}, {'rank': 0, 'subtype': 'largeHorizontal375', 'caption': None, 'credit': None, 'type': 'image', 'url': 'images/2018/04/03/opinion/nicholas-kristof/nicholas-kristof-largeHorizontal375-v2.png', 'height': 250, 'width': 375, 'legacy': {}, 'subType': 'largeHorizontal375', 'crop_name': 'largeHorizontal375'}, {'rank': 0, 'subtype': 'largeHorizontalJumbo', 'caption': None, 'credit': None, 'type': 'image', 'url': 'images/2018/04/03/opinion/nicholas-kristof/nicholas-kristof-largeHorizontalJumbo-v2.png', 'height': 683, 'width': 1024, 'legacy': {}, 'subType': 'largeHorizontalJumbo', 'crop_name': 'largeHorizontalJumbo'}, {'rank': 0, 'subtype': 'horizontalMediumAt2X', 'caption': None, 'credit': None, 'type': 'image', 'url': 'images/2018/04/03/opinion/nicholas-kristof/nicholas-kristof-horizontalMediumAt2X-v2.png', 'height': 1000, 'width': 1500, 'legacy': {}, 'subType': 'horizontalMediumAt2X', 'crop_name': 'horizontalMediumAt2X'}, {'rank': 0, 'subtype': 'hpLarge', 'caption': None, 'credit': None, 'type': 'image', 'url': 'images/2018/04/03/opinion/nicholas-kristof/nicholas-kristof-hpLarge-v2.png', 'height': 287, 'width': 511, 'legacy': {}, 'subType': 'hpLarge', 'crop_name': 'hpLarge'}, {'rank': 0, 'subtype': 'largeWidescreen573', 'caption': None, 'credit': None, 'type': 'image', 'url': 'images/2018/04/03/opinion/nicholas-kristof/nicholas-kristof-largeWidescreen573-v2.png', 'height': 322, 'width': 573, 'legacy': {}, 'subType': 'largeWidescreen573', 'crop_name': 'largeWidescreen573'}, {'rank': 0, 'subtype': 'largeWidescreen1050', 'caption': None, 'credit': None, 'type': 'image', 'url': 'images/2018/04/03/opinion/nicholas-kristof/nicholas-kristof-largeWidescreen1050-v2.png', 'height': 591, 'width': 1050, 'legacy': {}, 'subType': 'largeWidescreen1050', 'crop_name': 'largeWidescreen1050'}, {'rank': 0, 'subtype': 'wide', 'caption': None, 'credit': None, 'type': 'image', 'url': 'images/2018/04/03/opinion/nicholas-kristof/nicholas-kristof-thumbWide-v2.png', 'height': 126, 'width': 190, 'legacy': {'widewidth': 190, 'wideheight': 126, 'wide': 'images/2018/04/03/opinion/nicholas-kristof/nicholas-kristof-thumbWide-v2.png'}, 'subType': 'wide', 'crop_name': 'thumbWide'}, {'rank': 0, 'subtype': 'videoThumb', 'caption': None, 'credit': None, 'type': 'image', 'url': 'images/2018/04/03/opinion/nicholas-kristof/nicholas-kristof-videoThumb-v2.png', 'height': 50, 'width': 75, 'legacy': {}, 'subType': 'videoThumb', 'crop_name': 'videoThumb'}, {'rank': 0, 'subtype': 'videoLarge', 'caption': None, 'credit': None, 'type': 'image', 'url': 'images/2018/04/03/opinion/nicholas-kristof/nicholas-kristof-videoLarge-v2.png', 'height': 507, 'width': 768, 'legacy': {}, 'subType': 'videoLarge', 'crop_name': 'videoLarge'}, {'rank': 0, 'subtype': 'mediumThreeByTwo210', 'caption': None, 'credit': None, 'type': 'image', 'url': 'images/2018/04/03/opinion/nicholas-kristof/nicholas-kristof-mediumThreeByTwo210-v2.png', 'height': 140, 'width': 210, 'legacy': {}, 'subType': 'mediumThreeByTwo210', 'crop_name': 'mediumThreeByTwo210'}, {'rank': 0, 'subtype': 'mediumThreeByTwo225', 'caption': None, 'credit': None, 'type': 'image', 'url': 'images/2018/04/03/opinion/nicholas-kristof/nicholas-kristof-mediumThreeByTwo225-v2.png', 'height': 150, 'width': 225, 'legacy': {}, 'subType': 'mediumThreeByTwo225', 'crop_name': 'mediumThreeByTwo225'}, {'rank': 0, 'subtype': 'mediumThreeByTwo440', 'caption': None, 'credit': None, 'type': 'image', 'url': 'images/2018/04/03/opinion/nicholas-kristof/nicholas-kristof-mediumThreeByTwo440-v2.png', 'height': 293, 'width': 440, 'legacy': {}, 'subType': 'mediumThreeByTwo440', 'crop_name': 'mediumThreeByTwo440'}, {'rank': 0, 'subtype': 'mediumThreeByTwo252', 'caption': None, 'credit': None, 'type': 'image', 'url': 'images/2018/04/03/opinion/nicholas-kristof/nicholas-kristof-mediumThreeByTwo252-v2.png', 'height': 168, 'width': 252, 'legacy': {}, 'subType': 'mediumThreeByTwo252', 'crop_name': 'mediumThreeByTwo252'}, {'rank': 0, 'subtype': 'mediumThreeByTwo378', 'caption': None, 'credit': None, 'type': 'image', 'url': 'images/2018/04/03/opinion/nicholas-kristof/nicholas-kristof-mediumThreeByTwo378-v2.png', 'height': 252, 'width': 378, 'legacy': {}, 'subType': 'mediumThreeByTwo378', 'crop_name': 'mediumThreeByTwo378'}, {'rank': 0, 'subtype': 'threeByTwoLargeAt2X', 'caption': None, 'credit': None, 'type': 'image', 'url': 'images/2018/04/03/opinion/nicholas-kristof/nicholas-kristof-threeByTwoLargeAt2X-v2.png', 'height': 1000, 'width': 1500, 'legacy': {}, 'subType': 'threeByTwoLargeAt2X', 'crop_name': 'threeByTwoLargeAt2X'}, {'rank': 0, 'subtype': 'threeByTwoMediumAt2X', 'caption': None, 'credit': None, 'type': 'image', 'url': 'images/2018/04/03/opinion/nicholas-kristof/nicholas-kristof-threeByTwoMediumAt2X-v2.png', 'height': 1000, 'width': 1500, 'legacy': {}, 'subType': 'threeByTwoMediumAt2X', 'crop_name': 'threeByTwoMediumAt2X'}, {'rank': 0, 'subtype': 'threeByTwoSmallAt2X', 'caption': None, 'credit': None, 'type': 'image', 'url': 'images/2018/04/03/opinion/nicholas-kristof/nicholas-kristof-threeByTwoSmallAt2X-v2.png', 'height': 400, 'width': 600, 'legacy': {}, 'subType': 'threeByTwoSmallAt2X', 'crop_name': 'threeByTwoSmallAt2X'}, {'rank': 0, 'subtype': 'articleInline', 'caption': None, 'credit': None, 'type': 'image', 'url': 'images/2018/04/03/opinion/nicholas-kristof/nicholas-kristof-articleInline-v2.png', 'height': 95, 'width': 190, 'legacy': {}, 'subType': 'articleInline', 'crop_name': 'articleInline'}, {'rank': 0, 'subtype': 'hpSmall', 'caption': None, 'credit': None, 'type': 'image', 'url': 'images/2018/04/03/opinion/nicholas-kristof/nicholas-kristof-hpSmall-v2.png', 'height': 82, 'width': 163, 'legacy': {}, 'subType': 'hpSmall', 'crop_name': 'hpSmall'}, {'rank': 0, 'subtype': 'blogSmallInline', 'caption': None, 'credit': None, 'type': 'image', 'url': 'images/2018/04/03/opinion/nicholas-kristof/nicholas-kristof-blogSmallInline-v2.png', 'height': 76, 'width': 151, 'legacy': {}, 'subType': 'blogSmallInline', 'crop_name': 'blogSmallInline'}, {'rank': 0, 'subtype': 'mediumFlexible177', 'caption': None, 'credit': None, 'type': 'image', 'url': 'images/2018/04/03/opinion/nicholas-kristof/nicholas-kristof-mediumFlexible177-v2.png', 'height': 89, 'width': 177, 'legacy': {}, 'subType': 'mediumFlexible177', 'crop_name': 'mediumFlexible177'}, {'rank': 0, 'subtype': 'videoSmall', 'caption': None, 'credit': None, 'type': 'image', 'url': 'images/2018/04/03/opinion/nicholas-kristof/nicholas-kristof-videoSmall-v2.png', 'height': 281, 'width': 500, 'legacy': {}, 'subType': 'videoSmall', 'crop_name': 'videoSmall'}, {'rank': 0, 'subtype': 'videoHpMedium', 'caption': None, 'credit': None, 'type': 'image', 'url': 'images/2018/04/03/opinion/nicholas-kristof/nicholas-kristof-videoHpMedium-v2.png', 'height': 211, 'width': 375, 'legacy': {}, 'subType': 'videoHpMedium', 'crop_name': 'videoHpMedium'}, {'rank': 0, 'subtype': 'videoSixteenByNine600', 'caption': None, 'credit': None, 'type': 'image', 'url': 'images/2018/04/03/opinion/nicholas-kristof/nicholas-kristof-videoSixteenByNine600-v2.png', 'height': 338, 'width': 600, 'legacy': {}, 'subType': 'videoSixteenByNine600', 'crop_name': 'videoSixteenByNine600'}, {'rank': 0, 'subtype': 'videoSixteenByNine540', 'caption': None, 'credit': None, 'type': 'image', 'url': 'images/2018/04/03/opinion/nicholas-kristof/nicholas-kristof-videoSixteenByNine540-v2.png', 'height': 304, 'width': 540, 'legacy': {}, 'subType': 'videoSixteenByNine540', 'crop_name': 'videoSixteenByNine540'}, {'rank': 0, 'subtype': 'videoSixteenByNine495', 'caption': None, 'credit': None, 'type': 'image', 'url': 'images/2018/04/03/opinion/nicholas-kristof/nicholas-kristof-videoSixteenByNine495-v2.png', 'height': 278, 'width': 495, 'legacy': {}, 'subType': 'videoSixteenByNine495', 'crop_name': 'videoSixteenByNine495'}, {'rank': 0, 'subtype': 'videoSixteenByNine390', 'caption': None, 'credit': None, 'type': 'image', 'url': 'images/2018/04/03/opinion/nicholas-kristof/nicholas-kristof-videoSixteenByNine390-v2.png', 'height': 219, 'width': 390, 'legacy': {}, 'subType': 'videoSixteenByNine390', 'crop_name': 'videoSixteenByNine390'}, {'rank': 0, 'subtype': 'videoSixteenByNine1050', 'caption': None, 'credit': None, 'type': 'image', 'url': 'images/2018/04/03/opinion/nicholas-kristof/nicholas-kristof-videoSixteenByNine1050-v2.png', 'height': 591, 'width': 1050, 'legacy': {}, 'subType': 'videoSixteenByNine1050', 'crop_name': 'videoSixteenByNine1050'}, {'rank': 0, 'subtype': 'videoSixteenByNine480', 'caption': None, 'credit': None, 'type': 'image', 'url': 'images/2018/04/03/opinion/nicholas-kristof/nicholas-kristof-videoSixteenByNine480-v2.png', 'height': 270, 'width': 480, 'legacy': {}, 'subType': 'videoSixteenByNine480', 'crop_name': 'videoSixteenByNine480'}, {'rank': 0, 'subtype': 'videoSixteenByNine310', 'caption': None, 'credit': None, 'type': 'image', 'url': 'images/2018/04/03/opinion/nicholas-kristof/nicholas-kristof-videoSixteenByNine310-v2.png', 'height': 174, 'width': 310, 'legacy': {}, 'subType': 'videoSixteenByNine310', 'crop_name': 'videoSixteenByNine310'}, {'rank': 0, 'subtype': 'videoSixteenByNine225', 'caption': None, 'credit': None, 'type': 'image', 'url': 'images/2018/04/03/opinion/nicholas-kristof/nicholas-kristof-videoSixteenByNine225-v2.png', 'height': 126, 'width': 225, 'legacy': {}, 'subType': 'videoSixteenByNine225', 'crop_name': 'videoSixteenByNine225'}, {'rank': 0, 'subtype': 'videoSixteenByNine96', 'caption': None, 'credit': None, 'type': 'image', 'url': 'images/2018/04/03/opinion/nicholas-kristof/nicholas-kristof-videoSixteenByNine96-v2.png', 'height': 54, 'width': 96, 'legacy': {}, 'subType': 'videoSixteenByNine96', 'crop_name': 'videoSixteenByNine96'}, {'rank': 0, 'subtype': 'videoSixteenByNine768', 'caption': None, 'credit': None, 'type': 'image', 'url': 'images/2018/04/03/opinion/nicholas-kristof/nicholas-kristof-videoSixteenByNine768-v2.png', 'height': 432, 'width': 768, 'legacy': {}, 'subType': 'videoSixteenByNine768', 'crop_name': 'videoSixteenByNine768'}, {'rank': 0, 'subtype': 'videoSixteenByNine150', 'caption': None, 'credit': None, 'type': 'image', 'url': 'images/2018/04/03/opinion/nicholas-kristof/nicholas-kristof-videoSixteenByNine150-v2.png', 'height': 84, 'width': 150, 'legacy': {}, 'subType': 'videoSixteenByNine150', 'crop_name': 'videoSixteenByNine150'}, {'rank': 0, 'subtype': 'videoSixteenByNineJumbo1600', 'caption': None, 'credit': None, 'type': 'image', 'url': 'images/2018/04/03/opinion/nicholas-kristof/nicholas-kristof-videoSixteenByNineJumbo1600-v2.png', 'height': 900, 'width': 1600, 'legacy': {}, 'subType': 'videoSixteenByNineJumbo1600', 'crop_name': 'videoSixteenByNineJumbo1600'}, {'rank': 0, 'subtype': 'miniMoth', 'caption': None, 'credit': None, 'type': 'image', 'url': 'images/2018/04/03/opinion/nicholas-kristof/nicholas-kristof-miniMoth-v2.png', 'height': 70, 'width': 151, 'legacy': {}, 'subType': 'miniMoth', 'crop_name': 'miniMoth'}, {'rank': 0, 'subtype': 'windowsTile336H', 'caption': None, 'credit': None, 'type': 'image', 'url': 'images/2018/04/03/opinion/nicholas-kristof/nicholas-kristof-windowsTile336H-v2.png', 'height': 336, 'width': 694, 'legacy': {}, 'subType': 'windowsTile336H', 'crop_name': 'windowsTile336H'}, {'rank': 0, 'subtype': 'videoFifteenBySeven1305', 'caption': None, 'credit': None, 'type': 'image', 'url': 'images/2018/04/03/opinion/nicholas-kristof/nicholas-kristof-videoFifteenBySeven1305-v2.png', 'height': 609, 'width': 1305, 'legacy': {}, 'subType': 'videoFifteenBySeven1305', 'crop_name': 'videoFifteenBySeven1305'}, {'rank': 0, 'subtype': 'facebookJumbo', 'caption': None, 'credit': None, 'type': 'image', 'url': 'images/2018/04/03/opinion/nicholas-kristof/nicholas-kristof-facebookJumbo-v2.png', 'height': 550, 'width': 1050, 'legacy': {}, 'subType': 'facebookJumbo', 'crop_name': 'facebookJumbo'}, {'rank': 0, 'subtype': 'watch308', 'caption': None, 'credit': None, 'type': 'image', 'url': 'images/2018/04/03/opinion/nicholas-kristof/nicholas-kristof-watch308-v2.png', 'height': 348, 'width': 312, 'legacy': {}, 'subType': 'watch308', 'crop_name': 'watch308'}, {'rank': 0, 'subtype': 'watch268', 'caption': None, 'credit': None, 'type': 'image', 'url': 'images/2018/04/03/opinion/nicholas-kristof/nicholas-kristof-watch268-v2.png', 'height': 304, 'width': 272, 'legacy': {}, 'subType': 'watch268', 'crop_name': 'watch268'}]","[{'name': 'subject', 'value': 'Women and Girls', 'rank': 1, 'major': 'N'}, {'name': 'subject', 'value': 'ABORTION', 'rank': 2, 'major': 'N'}, {'name': 'subject', 'value': 'Forensic Science', 'rank': 3, 'major': 'N'}, {'name': 'subject', 'value': 'Sex Crimes', 'rank': 4, 'major': 'N'}]",2012-10-27T20:12:09+0000,article,Editorial,Opinion,Sunday Review,Op-Ed,nyt://article/068f1003-316b-5a13-b438-ab4195d37821,831,nyt://article/068f1003-316b-5a13-b438-ab4195d37821,Want a Real Reason to Be Outraged?,Op-Ed Columnist,,Want a Real Reason to Be Outraged?,,,,By Nicholas Kristof,"[{'firstname': 'Nicholas', 'middlename': None, 'lastname': 'Kristof', 'qualifier': None, 'title': None, 'role': 'reported', 'organization': '', 'rank': 1}]",,SR,13
