,abstract,web_url,snippet,lead_paragraph,source,multimedia,keywords,pub_date,document_type,news_desk,section_name,subsection_name,type_of_material,_id,word_count,uri,headline_main,headline_kicker,headline_content_kicker,headline_print_headline,headline_name,headline_seo,headline_sub,byline_original,byline_person,byline_organization,print_section,print_page
0,"After steadily rising in popularity over the last several weeks, former New York City Mayor Michael Bloomberg appears to have surpassed U.S. Senator Elizabeth Warren among registered voters for the 2020 Democratic nomination, according to a Reuters/Ipsos national public opinion poll released on Thursday.",https://www.nytimes.com/reuters/2020/01/31/us/politics/30reuters-usa-election-democrats-poll.html,"After steadily rising in popularity over the last several weeks, former New York City Mayor Michael Bloomberg appears to have surpassed U.S. Senator Elizabeth Warren among registered voters for the 2020 Democratic nomination, according to a Reuter...","NEW YORK — After steadily rising in popularity over the last several weeks, former New York City Mayor Michael Bloomberg appears to have surpassed U.S. Senator Elizabeth Warren among registered voters for the 2020 Democratic nomination, according to a Reuters/Ipsos national public opinion poll released on Thursday.",Reuters,[],[],2020-01-31T12:52:15+0000,article,None,U.S.,Politics,News,nyt://article/b4e7c0ee-1057-5b7a-856b-c60b5667ec2f,275,nyt://article/b4e7c0ee-1057-5b7a-856b-c60b5667ec2f,Movin' on Up: Bloomberg Glides Past Warren to No.3 in Democratic Race-Reuters/Ipsos,,,Movin' on Up: Bloomberg Glides Past Warren to No.3 in Democratic Race-Reuters/Ipsos,,,,By Reuters,[],Reuters,,
1,"Democratic candidate Michael Bloomberg and U.S. President Donald Trump will promote anti-gun violence and economic milestones in  multimillion-dollar ads, in an effort to win over the 100 million Americans expected to watch the National Football League's Super Bowl LIV on Sunday. ",https://www.nytimes.com/reuters/2020/01/31/us/30reuters-football-nfl-superbowl-bloomberg.html,"Democratic candidate Michael Bloomberg and U.S. President Donald Trump will promote anti-gun violence and economic milestones in  multimillion-dollar ads, in an effort to win over the 100 million Americans expected to watch the National Football L...","NEW YORK/WAUKEE, Iowa — Democratic candidate Michael Bloomberg and U.S. President Donald Trump will promote anti-gun violence and economic milestones in multimillion-dollar ads, in an effort to win over the 100 million Americans expected to watch the National Football League's Super Bowl LIV on Sunday. ",Reuters,[],[],2020-01-31T12:43:13+0000,article,None,U.S.,,News,nyt://article/fc9b72b1-2416-5a3a-9247-c69ca58c1acf,592,nyt://article/fc9b72b1-2416-5a3a-9247-c69ca58c1acf,"Bloomberg Tackles Gun Violence, Trump Touts Victories in Super Bowl Ads",,,"Bloomberg Tackles Gun Violence, Trump Touts Victories in Super Bowl Ads",,,,By Reuters,[],Reuters,,
2,"After steadily rising in popularity over the last several weeks, former New York City Mayor Michael Bloomberg appears to have surpassed U.S. Senator Elizabeth Warren among registered voters for the 2020 Democratic nomination, according to a Reuters/Ipsos national public opinion poll released on Thursday.",https://www.nytimes.com/reuters/2020/01/31/us/30reuters-usa-election-democrats-poll.html,"After steadily rising in popularity over the last several weeks, former New York City Mayor Michael Bloomberg appears to have surpassed U.S. Senator Elizabeth Warren among registered voters for the 2020 Democratic nomination, according to a Reuter...","NEW YORK — After steadily rising in popularity over the last several weeks, former New York City Mayor Michael Bloomberg appears to have surpassed U.S. Senator Elizabeth Warren among registered voters for the 2020 Democratic nomination, according to a Reuters/Ipsos national public opinion poll released on Thursday.",Reuters,[],[],2020-01-31T10:22:38+0000,article,None,U.S.,,News,nyt://article/759858a4-2d82-525d-9028-c7a0a2e0ebee,275,nyt://article/759858a4-2d82-525d-9028-c7a0a2e0ebee,Movin' on Up: Bloomberg Glides Past Warren to No. 3 in Democratic Race-Reuters/Ipsos Poll,,,Movin' on Up: Bloomberg Glides Past Warren to No. 3 in Democratic Race-Reuters/Ipsos Poll,,,,By Reuters,[],Reuters,,
3,"Winning a party’s presidential nomination is like the children’s board game Chutes and Ladders spiced up with momentum, math and money.",https://www.nytimes.com/aponline/2020/01/31/us/politics/ap-us-election-2020-how-to-win.html,"Winning a party’s presidential nomination is like the children’s board game Chutes and Ladders spiced up with momentum, math and money.","WASHINGTON — Winning a party’s presidential nomination is like the children’s board game Chutes and Ladders spiced up with momentum, math and money.",AP,[],[],2020-01-31T06:57:27+0000,article,None,U.S.,Politics,News,nyt://article/67bc0d4e-4715-5dd6-af82-635304edf0eb,1039,nyt://article/67bc0d4e-4715-5dd6-af82-635304edf0eb,"The Delegate Game: Math, Timing and How to Win a Nomination",,,"The Delegate Game: Math, Timing and How to Win a Nomination",,,,By The Associated Press,[],The Associated Press,,
