,abstract,web_url,snippet,lead_paragraph,source,multimedia,keywords,pub_date,document_type,news_desk,section_name,type_of_material,_id,word_count,uri,headline_main,headline_kicker,headline_content_kicker,headline_print_headline,headline_name,headline_seo,headline_sub,byline_original,byline_person,byline_organization,subsection_name,print_section,print_page
0,Guest lineups for the Sunday news shows: ,https://www.nytimes.com/aponline/2020/02/14/arts/ap-us-news-shows.html,Guest lineups for the Sunday news shows: ,WASHINGTON — Guest lineups for the Sunday news shows: ,AP,[],[],2020-02-14T21:29:14+0000,article,None,Arts,News,nyt://article/4cae1b47-a912-5097-be15-d7aeb9ceed06,91,nyt://article/4cae1b47-a912-5097-be15-d7aeb9ceed06,Guest Lineups for the Sunday News Shows,,,Guest Lineups for the Sunday News Shows,,,,By The Associated Press,[],The Associated Press,,,
1,"A roundup of some of the most popular but completely untrue stories and visuals of the week. None of these are legit, even though they were shared widely on social media. The Associated Press checked them out. Here are the real facts:",https://www.nytimes.com/aponline/2020/02/14/us/ap-not-real-news.html,"A roundup of some of the most popular but completely untrue stories and visuals of the week. None of these are legit, even though they were shared widely on social media. The Associated Press checked them out. Here are the real facts:","A roundup of some of the most popular but completely untrue stories and visuals of the week. None of these are legit, even though they were shared widely on social media. The Associated Press checked them out. Here are the real facts:",AP,[],[],2020-02-14T21:20:26+0000,article,None,U.S.,News,nyt://article/1140f940-8904-57e9-b11c-0b49bc386b65,1153,nyt://article/1140f940-8904-57e9-b11c-0b49bc386b65,NOT REAL NEWS: A Look at What Didn't Happen This Week,,,NOT REAL NEWS: A Look at What Didn't Happen This Week,,,,By The Associated Press,[],The Associated Press,,,
2,"As the Democratic presidential race hurtles toward Nevada, candidates in the still-crowded field are jumping into their first test in a racially diverse state with solid union muscle and shaky plans for a presidential caucus. ",https://www.nytimes.com/aponline/2020/02/14/us/politics/ap-us-election-2020-nevada.html,"As the Democratic presidential race hurtles toward Nevada, candidates in the still-crowded field are jumping into their first test in a racially diverse state with solid union muscle and shaky plans for a presidential caucus. ","LAS VEGAS — As the Democratic presidential race hurtles toward Nevada, candidates in the still-crowded field are jumping into their first test in a racially diverse state with solid union muscle and shaky plans for a presidential caucus. ",AP,[],[],2020-02-14T18:02:11+0000,article,None,U.S.,News,nyt://article/92831bd6-97e3-56dd-8185-a32c062ec821,1233,nyt://article/92831bd6-97e3-56dd-8185-a32c062ec821,Diversity Test: 2020 Democrats Seek Their Fortunes in Nevada,,,Diversity Test: 2020 Democrats Seek Their Fortunes in Nevada,,,,By The Associated Press,[],The Associated Press,Politics,,
